aksonov/react-native-router-flux,eslint,2016-04-21T18:13:09Z,true. i'd say. submit a pr with the new .eslintrc and such (which i agree would be an awesome addition). but let aksonov do the big "reformat" commit.,positive
aksonov/react-native-router-flux,eslint,2016-04-24T21:21:43Z,fix some eslint errors. ✖ 1023 remaining problems (1011 errors. 12 warnings),negative
aksonov/react-native-router-flux,eslint,2016-04-25T07:23:58Z,is there any way to check prs before merge to comply with code style? i've added you as collaborator.,neutral
aksonov/react-native-router-flux,eslint,2016-04-25T08:16:55Z,revert "fix some eslint errors". reverts aksonov/react-native-router-flux#585,neutral
aksonov/react-native-router-flux,eslint,2016-04-25T13:29:20Z,charpeni is there any automatic tool to do all these changes (so i could do it by myself)? i'm about to commit now some improvements for navbar (with old eslint issues). so your changes will have conflict...,negative
aksonov/react-native-router-flux,eslint,2016-04-25T13:49:43Z,unfortunately. i do not believe that such tools exists.i think for a project moving as fast we should only fix one file at time and do a pull request with solid test coverage. don't worry with it. i will redo.,negative
aksonov/react-native-router-flux,eslint,2016-04-27T15:54:19Z,fix eslint errors in switch.js. also:- adds an eslint rule to allow console statements- fixes malformed json in `.babelrc`,neutral
aksonov/react-native-router-flux,eslint,2016-04-27T16:15:24Z,cleanup router.js. cleans up the eslint errors in `router.js`. previously. destructuring was being used to omit values from an object. which was creating unused reference errors. i've added lodash in order to use `omit` in place of the destructuring.,negative
aksonov/react-native-router-flux,eslint,2016-04-27T16:15:37Z,lgtm.,neutral
aksonov/react-native-router-flux,eslint,2016-04-27T16:24:16Z,this pr in general lgtm. this does add a dependency on `lodash/omit`. which i think is reasonable. but i want to allow someone else to comment on that as well.,neutral
aksonov/react-native-router-flux,eslint,2016-04-27T16:28:36Z,cleanup modal.js. fixes eslint errors in `modal.js`.,neutral
aksonov/react-native-router-flux,eslint,2016-04-27T16:33:12Z,for the group: an alternative is to disable the eslint rule for unused references on the line that uses destructuring to omit properties:``` js// eslint-disable-next-line no-unused-varsconst { children. style. scenes. reducer. createreducer. ...parentprops } = props;```,negative
aksonov/react-native-router-flux,eslint,2016-04-27T17:59:01Z,fix eslint errors in defaultrenderer.js,neutral
aksonov/react-native-router-flux,eslint,2016-04-27T18:21:21Z,maybe the render methods could be defined in the same order they are binded ?``` javascriptthis.rendercard = this.rendercard.bind(this);this.renderscene = this.renderscene.bind(this);this.renderheader = this.renderheader.bind(this);```,neutral
aksonov/react-native-router-flux,eslint,2016-04-27T18:24:09Z,cool with me. charpeni. updated.,positive
aksonov/react-native-router-flux,eslint,2016-04-27T19:25:09Z,why not try and mirror react-native's lodash dependency to avoid any actual additional requirements?,neutral
aksonov/react-native-router-flux,eslint,2016-04-27T20:17:34Z,fix eslint errors in state.js,neutral
aksonov/react-native-router-flux,eslint,2016-04-27T22:34:42Z,i suggest to have own stack of needed functions to avoid dependencies.`omit`. `pick`. `compare`move them to helpers/utils file and reuse in components.,negative
aksonov/react-native-router-flux,eslint,2016-04-27T22:53:52Z,mikefowler maybe we just use the proposed ignore comment + object-rest?```// eslint-disable-next-line no-unused-varsconst { children. style. scenes. reducer. createreducer. ...parentprops } = props;```this way the behavior is sure to be the same. and we have no question of additional dependencies?,neutral
aksonov/react-native-router-flux,eslint,2016-04-28T04:08:54Z,sounds good. y'all. i'll move this back to using rest properties.charpeni: good call. this isn't in our styleguide. we've been using them a bit internally since react native supports them. i'll move back to the approved way.,positive
aksonov/react-native-router-flux,eslint,2016-04-28T04:16:14Z,- removed lodash dependency in favor of rest properties.- pull proptypes out of static propertyfeel free to review again. y'all.,negative
aksonov/react-native-router-flux,eslint,2016-04-28T05:20:21Z,mikefowler looks good. could you merge with latest master and submit again (now it has conflicts) ?,positive
aksonov/react-native-router-flux,eslint,2016-04-28T13:25:12Z,pull request has been updated.,neutral
aksonov/react-native-router-flux,eslint,2016-04-28T14:22:38Z,aksonov. conflicts resolve. charpeni. addressed your comment as well. should be good to merge.,positive
aksonov/react-native-router-flux,eslint,2016-04-28T14:24:07Z,lgtm. good work !,positive
aksonov/react-native-router-flux,eslint,2016-04-29T14:15:14Z,fyi 12 eslint errors remaining.can you move 355c03c _fix navbar height for android_ to a different pr?,neutral
aksonov/react-native-router-flux,eslint,2016-04-29T18:58:09Z,aksonov before leaving can you give authorization to circleci for this repo ?  will do the config soon with eslint and unit tests.,neutral
aksonov/react-native-router-flux,eslint,2016-04-30T08:17:27Z,4 eslint errors remaining but i need help.,negative
aksonov/react-native-router-flux,eslint,2016-05-05T17:56:26Z,at a quick glance. this looks good. does this pass our new fancy eslint rules?,positive
aksonov/react-native-router-flux,eslint,2016-05-05T18:07:50Z,good job :)lgtm if you can tell us if it pass the eslint rules ? i will setup circleci really soon. until that we will trust you.,positive
aksonov/react-native-router-flux,eslint,2016-05-05T21:58:30Z,yes. it's pass the eslint rules ;),neutral
aksonov/react-native-router-flux,eslint,2016-05-06T00:14:59Z,fix eslint example/components/tabicon.js,neutral
aksonov/react-native-router-flux,eslint,2016-05-06T00:15:00Z,by analyzing the blame information on this pull request. we identified sarovin to be a potential reviewer,neutral
aksonov/react-native-router-flux,eslint,2016-05-06T00:16:07Z,fix eslint example/components/register.js,neutral
aksonov/react-native-router-flux,eslint,2016-05-06T15:42:43Z,fix eslint example/components/navigationdrawer.js,neutral
aksonov/react-native-router-flux,eslint,2016-05-06T15:42:43Z,by analyzing the blame information on this pull request. we identified froelund and sarovin to be potential reviewers,neutral
aksonov/react-native-router-flux,eslint,2016-05-06T16:27:43Z,fix eslint issues and add circle.yml,neutral
aksonov/react-native-router-flux,eslint,2016-05-06T16:27:44Z,by analyzing the blame information on this pull request. we identified sarovin. lelandrichardson and zidail to be potential reviewers,neutral
aksonov/react-native-router-flux,eslint,2016-05-07T21:09:02Z,lgtm,neutral
aksonov/react-native-router-flux,eslint,2016-05-09T12:02:16Z,probably they are caused by eslint formatting done for master branch....,neutral
aksonov/react-native-router-flux,eslint,2016-05-09T14:53:17Z,aksonov fixed and merged into master.1 eslint error remaining (except example folder). i will fix it.,neutral
aksonov/react-native-router-flux,eslint,2016-05-09T15:07:33Z,fix eslint src/navbar.js. related to #567,neutral
aksonov/react-native-router-flux,eslint,2016-05-09T15:07:34Z,by analyzing the blame information on this pull request. we identified sarovin. timzaak and froelund to be potential reviewers,neutral
aksonov/react-native-router-flux,eslint,2016-05-09T15:14:04Z,charpeni ops. sorry. enabled os x plan but it didn't run because it is paid! for open source! reverted back. could you submit another pr to run build again? maybe we must use travisci instead with os x support for free (we could build example project and run gui tests for it!),positive
aksonov/react-native-router-flux,eslint,2016-05-09T15:17:16Z,travisci is really slow. but i like your idea. maybe we could setup travisci only for os x build and keep circleci for eslint and mocha ?,positive
aksonov/react-native-router-flux,eslint,2016-05-09T15:21:43Z,ugh. circleci schedules new builds. and don't want to remove 'os x' ones. i'm removing it and re-adding the project again...,negative
aksonov/react-native-router-flux,eslint,2016-05-09T15:21:53Z,yes. we could try both,neutral
US-CBP/cbp-theme,standard,2016-12-06T17:05:29Z,input type file needs :focus style. as a developer. i want the input type of file to have the same focus as other buttons that highlights the element so that it will meet accessibility standards and is consistent with other elements.,neutral
npm/npm,standard,2014-07-23T22:21:24Z,`npm shrinkwrap` should be idempotent. reason: noisy diffs. potential nondeterminism.key order within the dependencies and other properties should have a stable ordering (i.e. be sorted). a useful implementation strategy would also involve centralizing all the calls to `json.stringify` so that we have a standard way of marshalling objects for external use.,neutral
npm/npm,standard,2014-07-26T00:47:06Z,i'm super aware of `npm-shrinkwrap` (pretty sure there's no way raynos would _not_ let us be aware of it). and i'll probably be stealing bits and pieces from it as i try to turn shrinkwrap into the feature it's supposed to be. thanks for the pointer!,positive
npm/npm,standard,2014-08-01T15:12:01Z,how about creating some kind of a standard changelog? many projects have that already. look for `history.md` files everywhere.,neutral
npm/npm,standard,2014-08-01T15:15:13Z,rlidwka that's what i described: > i think that including release metadata within the repo in a standard form. and maybe eventually exposing it via the web site. is enough of a next step. i completely agree that the current changelog is not enough (especially because updating it isn't integrated into the release process).,neutral
npm/npm,standard,2014-08-05T13:23:48Z,we run into this issue with ghost. we specify the engine & enginestrict parameters. but it never gets checked. this is because the standard way to install ghost is as a download. and npm is used to manage its dependencies rather than managing the ghost package itself (although we do publish to npm).,neutral
mochajs/mocha,mocha,2012-03-13T19:30:59Z,looks like `globals` is not a function of the `mocha` object anymore. i'm sorry for the `index.html` changes. but that's the output of homebrew's markdown from the `index.md` file. i've looked at the browser and the page looks as it is today.,negative
mochajs/mocha,mocha,2012-03-13T20:54:33Z,forum. can you please create a forum where people can ask questions about mocha?  a google group maybe?,neutral
mochajs/mocha,mocha,2012-03-13T23:56:01Z,probably not a bad idea i'll set something up when i have a min,negative
mochajs/mocha,mocha,2012-03-14T01:03:08Z,+1,neutral
mochajs/mocha,mocha,2012-03-14T13:18:25Z,looks like ff exposes the 'location" global variable between the jquery ready event and the window.onload event.  i.e. if i move mocha.run() from jquery.ready to window load the error goes away. (using ff 11)p.s. i also had a problem with a third party lib "syn.js" exposing a global which i used mocha.run().globals(['__synthtest']) to remove the error.  but what is interesting is that chrome reports it as a leaked global while firefox does not.  i think its also a timing issue of when globals are introduced.  i got rid of my global issues by doing the following:```$(window).load(function() {  return settimeout((function() {return mocha.run();}). 1);});`````````,negative
mochajs/mocha,mocha,2012-03-15T16:11:57Z,nagyv if you're executing other code in parallel and following that with a call to mocha's done() you may still have some races. it depends,neutral
mochajs/mocha,mocha,2012-03-16T15:33:25Z,this is the _only_ way they work in mocha. they're executed sequentially. perhaps you're calling done() too early? but that's the only way mocha operates,neutral
mochajs/mocha,mocha,2012-03-16T20:11:33Z,i hate jquery's xhr api haha. we can let people vote here but -1 from me. ultimately mocha is about being simple and crud-free. adding support for adhoc things like this takes away some of the elegance imo,positive
mochajs/mocha,mocha,2012-03-16T20:26:50Z,and that's an artifact of it being difficult to work with. that's not really something i want in mocha,neutral
mochajs/mocha,mocha,2012-03-16T20:28:58Z,i'd be up for that; i was just going to write a package that overrode `mocha.runnable.prototype.run`. which of course would be a bitch to maintain in the face of upstream changes since that method is so long.,negative
mochajs/mocha,mocha,2012-03-18T20:43:32Z,it seems to me that currently sinon.usefaketimers doen't work at all with mocha. in the sense of not even making it to timeout.the following code takes 5 minutes to run. without any errors.```beforeeach(function(){  this.clock = sinon.usefaketimers();});aftereach(function(){  this.clock.restore();});it('updates every 5 minutes'. function(done){  sinon.stub(statusapp.module('jobs').events. 'update'. function(){    statusapp.module('jobs').events.update.restore();    console.log('in');    done();  });  statusapp.module('jobs').events.last_run = new date().gettime();  this.timeout(302000);  this.clock.tick(300000);});```,neutral
mochajs/mocha,mocha,2012-03-18T20:50:01Z,it works. just not with my code :(this works fine:``` javascript  var mocha = require('mocha').  sinon = require('sinon');describe('test fake timer'. function(){  beforeeach(function(){    this.clock = sinon.usefaketimers();  });  aftereach(function(){    this.clock.restore();  });  it('should be fast'. function(done){    settimeout(function(){done();}. 300000);    this.timeout(500000);    this.clock.tick(20000000);  });});```,neutral
mochajs/mocha,mocha,2012-03-19T21:37:34Z,i absolutely love mocha's support for coffee-script!,positive
mochajs/mocha,mocha,2012-03-20T21:24:35Z,hmm i'll check that out in a minute. the error messages themselves are up to node core though that's not mocha,negative
mochajs/mocha,mocha,2012-03-21T21:05:46Z,joewhite yeah. i debated that when i was putting this together. since iced (in theory) is fully backward compatible. you're probably right. and re 2. yeah. right again.visionmedia i understand. in that case. what about a way to hook into mocha and provide custom compilers? maybe something like `--add-compiler extension:require_path`. that way i could do `--add-compiler iced:iced-coffee-script` and someone else could do `--add-compiler myext:./my_local_compiler`. would you accept a pr that does that?,negative
mochajs/mocha,mocha,2012-03-22T15:09:27Z,added teamcity reporter to exports (it had been left off). the teamcity reporter was left off of lib/reporters/index.js.  i added it there and to the built mocha.js file.,neutral
mochajs/mocha,mocha,2012-03-22T18:56:09Z,node.js: maximum callstack size exceeded. we are hitting an issue in our specs where. for some reason. we are getting 4k+ entries in the hooks array inside runnable.js. since this array is processed using recursion. this easily blows the cap off of node's callstack.this pull request uses the settimeout of zero technique to reset our callstack as we reach the callstack limit. as an initial pass. i've hardcoded 2000 as the max-allowed depth before resetting the callstack - but it would probably be good for this to be configurable in some way.on a side note. it does seem strange that we have so many entires in the hooks array. we do have about 880 specs and do tend to highly nest contexts using nested describes. many with associated beforeeach hooks. if it sounds strange that we'd have 4k+ hooks entries with that setup. please let me know.thanks! (and mocha friggin rocks by the way!),neutral
mochajs/mocha,mocha,2012-03-22T18:58:40Z,np! the "for some reason" part worries me a little though haha. i dont want to go changing things for some reason. are you guys looping and generating a ton of hooks?,positive
mochajs/mocha,mocha,2012-03-22T19:17:31Z,i still need to inspect the hooks entries to see what each one was.we aren't doing any spec generation. so i was certainly surprised tosee that there so many in the list.,neutral
mochajs/mocha,mocha,2012-03-22T19:28:04Z,yeah definitely sounds like a bug of some kind. you figure something out let me know,positive
mochajs/mocha,mocha,2012-03-23T01:44:31Z,can't change test directory. the documentation on the main page says that "by default mocha(1) will use the pattern ./test/*.js. so it's usually a good place to put your tests". which seems to imply that this pattern could be changed.  the documentation doesn't show any way to do this (shouldn't this be a command line option?) and the code that seems related to this area doesn't clarify much.,negative
mochajs/mocha,mocha,2012-03-23T04:21:35Z,actually. looks like this got merged in already in a slightly different form.this should work as of at least b57b53037246868846c366233ca5176e15c05ec9```mocha.setup({  ignoreleaks: true});```,neutral
mochajs/mocha,mocha,2012-03-23T12:00:51Z,--require does not work for coffee files. require('coffee-script') should be called before the line program.parse(process.argv); in _mocha to enable requiring of coffee-script files via --require.,neutral
mochajs/mocha,mocha,2012-03-23T14:47:42Z,i figured a way to do this without a code change -- just pass `--require coffee-script` before the other requires that need it and it works like a charm.sorry for the spam.,neutral
mochajs/mocha,mocha,2012-03-23T15:52:10Z,alright cool thanks :),positive
mochajs/mocha,mocha,2012-03-23T15:52:53Z,yup thanks hebo. unfortunately the new js api and the browser api are a bit different but i'll fix that up soon,positive
mochajs/mocha,mocha,2012-03-23T15:55:12Z,pass file(s): `mocha --reporter spec spec/{my.awesome}.js`. `mocha --ui tdd test/unit/*.js` etc,neutral
mochajs/mocha,mocha,2012-03-24T00:24:21Z,globals 'mocha' and 'describe' are also not working after this change.,neutral
mochajs/mocha,mocha,2012-03-24T15:13:45Z,fixing the browser based tests - '__dirname' was undefined. i tried running the browser based tests for mocha and received this error:```uncaught referenceerror: __dirname is not defined```on line 894 in mocha.js``` javascriptvar images = {    fail: __dirname + '/../images/error.png'```this pull request should fix all browser based tests.,negative
mochajs/mocha,mocha,2012-03-24T17:18:14Z,this would require that everyone using mocha has to define __dirname,neutral
mochajs/mocha,mocha,2012-03-24T17:34:57Z,we had another pr like this. i'll have to look into it a bit more but i'd like to avoid this if possible. iirc the vague "script error." is because of cross-origin script. are you hot-linking mocha from github?,negative
mochajs/mocha,mocha,2012-03-24T18:05:46Z,yup. makes sense! thanks!,positive
mochajs/mocha,mocha,2012-03-24T21:34:37Z,yes i was hot-linking mocha from github. using it locally gives me a fine error. maybe it should be removed from the documentation then... with a note talking about this issue.thanks for the response.,positive
mochajs/mocha,mocha,2012-03-26T16:03:14Z,:\makes mocha snail like in the browser,neutral
mochajs/mocha,mocha,2012-03-27T21:17:42Z,i think that as an experienced javascript developer it's easy to believe that some things are obvious even though they're not to someone new to javascript and mocha/should testing. for them the mocha docs"the --require option is useful for libraries such as should.js. so you may simply --require should instead of manually invoking require('should') within each test file."may make it seem as if you can just --require should and you'll be able to use it just as the docs of should says.i'm not sure. maybe you're right and it would just bloat the docs and it's better if the user figure it out themselves. or maybe a small change to the docs would help some people avoid the mistake.,neutral
mochajs/mocha,mocha,2012-03-27T21:42:54Z,added some more docs. i could go into detail about exposing globals for mocha blah blah but it would get a bit too much for that page,neutral
mochajs/mocha,mocha,2012-03-27T23:05:33Z,just a bump. is there any reason you haven't merged my commit above? i can break it out into its own pull request if you want. but it should be pretty trivial to cherry pick or just do by hand...,neutral
mochajs/mocha,mocha,2012-03-28T01:39:58Z,i dont recall growl failing on a require(). but failing on growl() maybe. i'll have to take a look at the lib again i cant remember where it fails. either way i dont want to console.log() though,negative
mochajs/mocha,mocha,2012-03-31T17:29:31Z,enoent is what you'll get if a user does `mocha test/foo.js` and foo.js doesn't exist. i dont want to ignore it,neutral
mochajs/mocha,mocha,2012-03-31T17:32:33Z,oh. gotcha. i was thinking in terms of running mocha without specifying a target file/dir at the command line.,neutral
mochajs/mocha,mocha,2012-03-31T21:08:16Z,segmentation faults. stderr and exit code. i'm using mocha to test a c++ addon for node.js. and sometimes the c++ side of things is causing segmentation faults.if usage of the addon is wrapped in a child proces. e.g. with `child_process.exec`. the segfault results in `"segmentation fault"` messages being sent to the child's `stderr` and the child's exit code is something other than `0` (e.g. `139` in my linux env).in the context of mocha. the messages to `stderr` are getting swallowed and the segfault results in the mocha processexiting with status code `0`.any thoughts on whether mocha could be adapted to pass on the messages to `stderr` and close with a non-zero exit code in the event of a segfault?,negative
mochajs/mocha,mocha,2012-04-04T16:01:34Z,ah i see.. you're wanting to meta-generate them from async stuff. i suppose we could have some mechanism to tell mocha to wait. though personally i think setup stuff like that might as well be sync (if possible),neutral
mochajs/mocha,mocha,2012-04-04T21:04:22Z,docs: sample code for globals ignore flag in browser is incorrect. in the "browser support" section of the docs. the sample code snippet says:mocha        .globals(['foo'. 'bar']) // acceptable globals        .run()but this doesn't actually work - acceptable globals are defined as part of mocha.setup(). there is no .globals() function as far as i can see,negative
mochajs/mocha,mocha,2012-04-04T21:18:16Z,this has changed a little. and will in the future to match the server-side js api,neutral
mochajs/mocha,mocha,2012-04-04T21:18:24Z,i'll update them soon,neutral
mochajs/mocha,mocha,2012-04-05T15:59:57Z,i dont think i want to expose the runner to the tests themselves unless there's a really compelling reason. right now you could do that with the runner returned from mocha.run(). maybe chuck the html in a property `this.html = html` in the test-case. we should have the context available. if not i can add that. `test.context` or something,negative
mochajs/mocha,mocha,2012-04-06T15:50:50Z,you can put them in the `mocha.opts` file if you want them for any `mocha(1)` call. to run one file just pass that one file to mocha,neutral
mochajs/mocha,mocha,2012-04-10T01:29:09Z,i'd like to help out with this. what did you have in mind: something like``` jsmocha.setup({  ui:'bdd'.  grep:'foobar'});mocha.run()```or more like``` jsmocha.grep('foobar').run()```,neutral
mochajs/mocha,mocha,2012-04-10T19:36:52Z,hmm still seems to jump a char at times. for example in mocha run `$ make test reporter=progress` you should see it,neutral
mochajs/mocha,mocha,2012-04-10T20:32:13Z,hmm. i can't reproduce it - the bar gets all the way across on mocha tests using that command - can you send more info on the char jump?,neutral
mochajs/mocha,mocha,2012-04-10T21:44:35Z,fix issue #325 (add better grep support to js api). fix issue #325 - when testing in the browser. the mocha object now has a grep() method which you can chain like so: mocha.grep('foo').run() - with shwaydogg,neutral
mochajs/mocha,mocha,2012-04-10T22:02:56Z,we should use the mocha prototype in ./lib/mocha.js. right now you can only pass a `grep:` option but it would be nice to have this there. allowing a regexp _or_ a string,neutral
mochajs/mocha,mocha,2012-04-10T23:26:24Z,ah i see - i had it in my head that this was an enhancement to browser test running only. but ya we should totally make this api available in node. etc.one question: it appears that in the browser tests you have that you're not actually instantiating a mocha object ... you're adding methods (specifically .run() and .setup()) _to_ the mocha constructor. and not using the mocha.prototype methods. what's the reason for that?related to that. should we keep the code we have in support/tail.js?,neutral
mochajs/mocha,mocha,2012-04-11T18:59:02Z,now in opera an error is thrown:global leak detected: statsthats exactly what visionmedia  said. mocha has a global leak :p,negative
bcoe/sandcastle,mocha,2013-07-03T15:34:23Z,switch micro-test to mocha. i far prefer mocha for unit testing at this point. we should move to this.,neutral
teerapap/grunt-protractor-runner,selenium,2014-03-05T06:02:00Z,i am having the same issue. running protractor directly works. but from grunt it does not.installing chromedriver package and pointing to it in grunt gets past this error. then it complains about no selenium. when i do the same for selenium as for chromedriver. it still complains but with a different error. that new error is the same one i get when i run protractor on its own with seleniumserverjar. chromedriver or seleniumaddress with any value (to get protractor working i had to leave these values blank).wish i could be of more help. only been using protractor for a couple of hours.,negative
google/closure-library,selenium,2015-07-30T16:28:53Z,i amended my commit to fix an issue with the name of the "postinstall" script that is responsible for installing selenium and chromedriver dependencies. s/post_install/postinstall,neutral
