webpack-contrib/sass-loader,mocha,2015-10-05T20:53:00Z,thanks. as i've never used mocha before :),positive
webpack-contrib/sass-loader,jshint,2015-10-26T23:28:30Z,updated:- remove order tests- fix understandable errors tests- disable jshint noempty for empty block in case of css file,negative
jprichardson/electron-mocha,mocha,2015-10-15T22:44:43Z,support `--compilers` arg. in order to support mocha compilers. the cli `--compilers` argument has been pulled to the `electron-mocha` front-end. which makes calls like `electron-mocha --compilers js:babel/register test/example.js` possible in case one has written tests in es6 for example.,negative
jprichardson/electron-mocha,mocha,2015-10-16T13:29:22Z,if you create a file. say `babel.js` that includes `require('babel-core/register')`. you could then call `electron-mocha --require ./babel.js test-file.js`.but i imagine that a lot of people are going to expect the mocha `--compilers` flag to work. so maybe i'll just accept this since it's not much code to maintain.,neutral
request/request,standard,2016-05-02T17:15:58Z,i like your spec! could maybe evolve into something similar like the promise standard. i already have multiple request implementations in my app because of the combination of libraries i use. with a standardised interface libraries could allow injecting the preferred request implementation.,positive
pixijs/pixi.js,jshint,2015-10-17T02:15:36Z,fixes jshint errors,neutral
dresende/node-orm2,mocha,2013-09-16T21:37:07Z,and thank you for the `it.only` code. i didn't know that about `mocha`. great feature! :),positive
dresende/node-orm2,mocha,2013-09-17T08:05:09Z,at first - thank you for good work of building orm for node. i hope it will become something like activerecord in ruby world.and of course. thank you for lighting fast fixing of the bug.about mocha - yes. it has its secrets. most of them are in manual though :),positive
pugjs/pug,mocha,2012-04-11T23:31:51Z,i am using winblowz. so i don't have make to hand.but i got mocha.  typing `mocha` from the jade directory seems to be giving me some tests.right now i am failing.  the body tag is acting like a text node.  i haven't figured out why yet.,negative
pugjs/pug,mocha,2012-04-13T13:31:52Z,actually the performance hit is maybe not so much.  at least when i run the tests in mocha. it gives (approximately. within the noise) the same time for `pretty` and `prettypretty`.  maybe not the best benchmark but indicative.edit: sorry. this is stupid. this is only the time to compile. not the time to render.,negative
uber/uber-ngen,jshint,2014-03-17T17:06:05Z,use .jshintignore. so we can just use .jshintignore. and then running jshint outside of npm (like say from editor integrators) gets it right too (tm).i briefly considered adding some generic symlink support along side your `directories` vs not (aka files. because like that's all there is right?) but decided not to.,neutral
uber/uber-ngen,jshint,2014-03-17T17:21:37Z,raynos can revert this if he really doesn't like it. ;),positive
Azure/autorest,standard,2015-08-28T14:55:30Z,perhaps any of the internal variables used in the generated code should have some naming prefix such as to not interfere with standard argument naming. perhaps. an underscore or some other prefix char to denote it's a generated variable.``` csharp// construct urlvar __url = new uri(...).tostring();```,neutral
airbnb/javascript,eslint,2015-05-22T18:07:13Z,create package eslint-config-airbnb. this is a sharable eslint config package. we could optionally just use our eslint config as the package `main` for `airbnb-style` but it'd be nicer for everyone if the eslint package had a cool name.solves for issue #349,positive
airbnb/javascript,eslint,2015-05-23T23:07:59Z,to make config searchable via [standalone npm packadge]( please. extend packadge.json keywords with `eslintconfig`:```  "keywords": [    "eslint".    "eslintconfig"    "config".    "airbnb".    "javascript".    "styleguide"  ].```,neutral
airbnb/javascript,eslint,2015-05-28T06:58:37Z,update .eslintrc. just a consistency thing. :),neutral
airbnb/javascript,eslint,2015-05-28T06:59:26Z,lol,positive
airbnb/javascript,eslint,2015-06-17T11:31:24Z,update(readme.md): added airbnb style .eslintrc link. i added the missing airbnb style .eslintrc link into the documentation file.,neutral
airbnb/javascript,eslint,2015-06-17T14:58:08Z,:+1: thanks for this!,positive
airbnb/javascript,eslint,2015-06-18T20:27:48Z,ok. sounds good. i will try to move react styleguide options from `eslint-config-airbnb` to `eslint-config-airbnb-react` next week. i'm also planning to do an audit of the `.eslintrc` to make sure it conforms with both the letter and the spirit of the styleguide.goatslacker hshoff should we have 3 separate eslintrcs? `eslint-config-airbnb`. `eslint-config-airbnb-es6`. `eslint-config-airbnb-react`? i would prefer not to split out the es6 rules since those are considered part of the core style guide. but i'm up for discussion on the matter. i would prefer to only maintain two. `eslint-config-airbnb` and `eslint-config-airbnb-react`.,negative
angular/angular-phonecat,karma,2013-05-20T20:17:41Z,looks like a local network or npm server error. please try again and if it doesn't work. try to debug your network. i bet that the whole npm doesn't work for you. not just installing karma.,negative
angular/angular-phonecat,karma,2013-05-21T18:19:21Z,wow! i did not know that shifting around branches can somehow also adjust tags in git? what sorcery is this! thank you! even doing `git checkout -f step-9` etc.. works with karma being used instead of testacular.,positive
pillarjs/send,standard,2015-07-08T11:56:37Z,it is by design. you'll notice your file system does the same thing. so having multiple slashes wouldn't result in a 404. as the file system would still find the file anyway.funny enough. expressjs.com does not even run on node.js or this library. so really. those examples demonstrate we are doing the standard thing.,negative
videojs/video.js,standard,2015-10-10T21:33:55Z,flash can only seek to keyframes in an mp4. so. if your mp4 has keyframes that are spaced far apart. you'll only be able to seek to only some parts of the video.if you are using standard options for videojs. then an mp4 will end up playing in html5 which can seek whereever.do you have a working example somewhere? though. it's probably best to get away from flvs nowdays :),positive
expressjs/express,mocha,2012-04-26T16:05:37Z,yeah. i can install coco. mocha. and coffee-script fine ( a few random libraries i thought of),positive
sequelize/sequelize,mocha,2012-09-29T06:52:13Z,thanks a lot :),positive
sequelize/sequelize,eslint,2016-05-29T08:04:41Z,alitaheri i'm already working on a refactor. finished 80%. changed everything to classes. arrow functions. let and const. also. i have a eslint ready for #5963. which has rules like `no-var` and `prefer-arrow-function`. so i will likely open that pr after the refactor.,negative
TryGhost/Ghost,mocha,2013-09-02T22:40:35Z,ah i think i was running the mocha command instead of validate. i'll fix it as soon as tomorrow-adam> on 2 sep 2013. at 23:31. hannah wolfe notificationsgithub.com wrote:> > this has a jslint error > > —> reply to this email directly or view it on github.,negative
cujojs/most,eslint,2015-03-03T23:23:07Z,interesting. thanks for the link.  it looks like they could be complimentary: eslint for warnings/errors and jscs for code style?,positive
cujojs/most,eslint,2015-03-04T21:10:12Z,yes. though there is some overlap in functionality.,neutral
ember-intl/ember-intl,eslint,2017-03-15T03:20:05Z,eslint prettier integration. title says it all,positive
ember-intl/ember-intl,eslint,2017-03-15T05:55:12Z,adding eslint & eslint-plugin-prettier,neutral
i18next/i18next,karma,2015-03-13T17:55:37Z,browserify cannot find express/jquery. using karma-browserify fails when trying to require i18next somewhere.the problem is that i18next does require('jquery') in a try/catch block but browserify obviously does not know about this and tries to find it.my workaournd was to use i18next-client (where at least express is not needed) and add jquery as a dependency in my project - not very beautiful,negative
angular/zone.js,selenium,2016-05-23T19:27:37Z,just bumping this bug ticket up. since my team is encountering this bug as well running our selenium tests. my teammate was able to switch to using a chrome driver. but would definitely appreciate a fix/patch for this!,positive
angular-fullstack/generator-angular-fullstack,sauce,2014-09-26T05:18:32Z,kingcody ok i just had to fix the credentials for sauce labs in the .travis.yml. travis wasn't building pull requests with sauce labs. for running the protractor tests. not sure why only one set of e2e tests was failing though. they all should have failed.,negative
elwayman02/ember-data-github,eslint,2017-02-25T00:37:31Z,i added one more clean up piece.,neutral
elwayman02/ember-data-github,eslint,2017-02-25T00:38:23Z,thanks for the review. i like the result much better and i had to learn a bit about another corner of the ember ecosystem.,positive
elwayman02/ember-data-github,eslint,2017-02-25T00:44:15Z,sg. go ahead and merge! you should have access now :),neutral
Hacker0x01/react-datepicker,karma,2014-09-10T09:56:57Z,added first jest test (including jest setup). we really need javascript tests for this component. and jest was the first toolkit that came to mind. i'll also try to workout a pull request for at least one other tool (maybe karma). so we can compare the pro's and con's.,neutral
Hacker0x01/react-datepicker,karma,2014-09-12T15:41:50Z,looks good. some questions inline. how do i run these tests locally. could you add that to the readme?,positive
Hacker0x01/react-datepicker,karma,2014-09-12T15:46:20Z,will add,neutral
Hacker0x01/react-datepicker,karma,2014-09-12T15:48:10Z,let's merge it back after that!,neutral
webpack/webpack,uglify,2017-03-06T18:35:24Z,can't see anything obviously wrong - seems like the same one-liner as `grunt-contrib-uglify`,negative
webpack/webpack,uglify,2017-03-08T10:53:53Z,i think the culprit is the uglifyjs plugin. i do not use the commonchunks but have the same issue. removing uglifyjs works. then a sourcemap is generated again. is there an option to run the sourcemap command before the uglifyjs?,neutral
webpack/webpack,uglify,2017-03-10T06:36:01Z,cansin what if you minify through an uglify loader instead of a plugin? that would solve the order issue. another way would be to hook into the process through a plugin and calculate a hash then perhaps. you can find a couple of third party plugins that do something like this already.,neutral
webpack/webpack,uglify,2017-03-24T12:43:51Z,do we already know why this is not working? is it because the default export exports everything. which means evaluating everything?even then. shouldn't side-effect-less functions then be removed by uglify?i just would like to understand how to write code so that unused exports without side-effects are not included in the final bundle…,neutral
acuminous/yadda,mocha,2014-08-26T13:19:34Z,false positives with new `mocha.steplevelplugin`. i have a request counter in place during testing and switching from the deprecated `mocha.asyncsteplevelplugin` to the newer `mocha.steplevelplugin` causes the request count to be off and correspondingly a bunch of false positive successful tests.with deprecated async plugin:```request counts:    "get /statements": 105total:  105---------------  286 passing (1s)  29 failing```with new plugin:```request counts:    "get /statements": 1total:  1---------------  314 passing (101ms)  1 failing```it appears after the first failed assertion all the rest have been skipped though marked passing. in this case it is the first scenario failing.based on a cursory glance at the code i'm guessing it might be related to the scoping of the `abort` variable. i'll hopefully have a chance to dig deeper but if someone has a quick fix that'd be great.,negative
acuminous/yadda,mocha,2014-08-26T13:53:28Z,hi brian.i think you're right - the abort variable should be scoped to the steps method. i'll fix up and release this evening. thanks for reporting and sorry for the trouble.steve,positive
acuminous/yadda,mocha,2014-08-26T22:19:01Z,i'm :thumbsup:. it works here. i wonder if it makes sense when aborting to do something similar to:`if (abort) return done(new error("aborted"));`or something similar to prevent the false positives. this kind of feels like the difference between a "pending" and a "skip" that some test frameworks provide but i've not yet figured out if that is possible here. either way avoiding the false positives would be an improvement i think.thanks for the quick turnaround again!,positive
prebid/Prebid.js,standard,2017-01-18T23:31:58Z,maintenance/refactor hb deal. ## type of change- [x] refactoring (no functional changes. no api changes)## description of changecontributed by snapwich changed the way hb_deal is handled in the code to behave more like a standard targeting key.## other informationshould fix #827 replaces #871,neutral
tjunnone/npm-check-updates,mocha,2014-09-07T16:06:25Z,only check/update selected packages. as an example. i'd like to do `npm-check-updates -u mocha should` to only update the `mocha` and `should` packages.  this doesn't appear to be possible.this might conflict with the fact that the first non-option argument is currently a `package.json` or a directory.  but really. how often do you want to run `npm-check-updates` outside of the current directory?,neutral
Automattic/mongoose,mocha,2012-11-11T15:17:02Z,thanks for reporting. will look into it on the plane today.on nov 8. 2012. at 2:36 pm. rschooley notificationsgithub.com wrote:> quick thought: the default timeout of a single test in mocha is 2 seconds. so if the timeout above worked it would call done prior to that limit.> > \> reply to this email directly or view it on github.,positive
speakeasyjs/speakeasy,standard,2016-01-27T06:45:30Z,mrose17. we actually decided to go with semistandard in the new release. really appreciate your pr though – thank you!,positive
vega/vega-lite,mocha,2015-02-01T19:57:43Z,console log message doesn’t show up in mocha. domoritz  there must be some missing config.   i am also curious why we use mocha directly here instead of karma. also. we’re using mocha here and jasmine in the other two ui project.   should we stick with one for consistency?,neutral
vega/vega-lite,mocha,2015-02-01T19:58:32Z,i don't know much about this. do whatever you think is best.,positive
vega/vega-lite,mocha,2015-02-01T22:51:25Z,i think i’ll stick with `mocha` here.  we don’t need karma here because we’re not testing ui or something that needs to run a browser during testing.  we might switch `vegalite-ui` / `facetedviz` to mocha instead of jasmine later.,neutral
angular/protractor,jasmine,2015-04-25T20:18:57Z,juliemr are there any patterns for waiting. ex: in `specdone`?,neutral
angular/protractor,jasmine,2015-04-25T20:47:08Z,for now i ended up using:``` jsafterall(function(done){    process.nexttick(done);});```,neutral
angular/protractor,jasmine,2015-04-29T12:40:45Z,please tell me how can i set default timeout for browser.wait function?i have in my conf.jsjasminenodeopts: {    defaulttimeoutinterval: 50000  }but it don't affect browser.wait function,negative
angular/protractor,jasmine,2015-04-29T21:06:14Z,this is not possible with the plugin framework. the problem is that plugins are agnostic to the test framework being used. so they do not emit test results in a way specific to jasmine-reporters.you can get all test and plugin results in json format using `resultjsonoutputfile` in the config. i'd suggest doing that. and then processing it in any way you need.,negative
angular/protractor,jasmine,2015-05-04T22:59:22Z,tokunbo eddywashere the problem with that hack is that it looks like a noop. if i saw that in a code base i was working on without any surrounding context. i would rip it out.,negative
angular/protractor,jasmine,2015-05-12T15:18:23Z,the latest commit from this ticket seems to be on production. but the url goes to 404 now.,neutral
angular/protractor,jasmine,2015-05-19T15:46:40Z,use a jasmine reporter.,neutral
angular/protractor,jasmine,2015-05-19T19:34:58Z,oh. sorry. i was thinking that it would be straight forward to install a custom jasmine reporter. so no new feature was needed.  now i see that i was wrong.,negative
angular/protractor,jasmine,2015-05-20T18:52:10Z,yes i am using jasmine only step 1 is example i mentioned here. i am thinking is there any way protractor can extend functionality to identify the failure based on annotation like step instead of parsing stacktrace . then identify the line number then find corresponding step for that failure like number,negative
angular/protractor,selenium,2014-04-22T14:47:54Z,> glepretre not really. i want to split up my tests across several machines so that i can get a quicker result. multicapabilities allows you to do that across browsers. but i want to split up my tests even if i'm just using one browser.+1 paolodm,negative
angular/protractor,selenium,2014-04-23T17:25:33Z,i think this is now a dupe of #569 - until that gets implemented. i would start up selenium using `webdriver-manager` once. and then concurrently run protractor against it with different configuration files pointing at the same `seleniumaddress`.,neutral
angular/protractor,selenium,2014-04-26T00:28:30Z,silence here for a while. so i'm assuming that the sad answer to the original question is no. no way to run without the java runtime. closing.,negative
angular/protractor,selenium,2014-05-15T13:35:00Z,selenium doesn't work on linux. execvp(): no such file or directoryseleniumprocess.pid: 26186events.js:72        throw er; // unhandled 'error' event              ^error: spawn enoent    at errnoexception (child_process.js:988:11)    at process.childprocess._handle.onexit (child_process.js:779:34),negative
angular/protractor,selenium,2014-05-15T15:33:48Z,sorry about that. the site was not running locally,negative
angular/protractor,selenium,2014-05-15T15:36:07Z,protractor is a little slower on linux. browser is not opened fast enough. and so the test fails. is there a general solution for this.,negative
angular/protractor,selenium,2014-05-16T23:07:07Z,hi.thanks for looking into this. i agree that the situation as it stands can be confusing. i think you're right that `get/first/last` would make more sense if they return elementfinders. i'm not sure about `map` and `each` - these imply "now i'm doing something with the elements". and i think it makes sense for them to be talking immediately to selenium. i'm also not quite sure what you mean by wrapping elements returned from `findelement` - once you've talked to selenium. you can't go back.,negative
angular/protractor,selenium,2014-05-17T02:28:24Z,sorry to be a little confusing on that.by wrapping i meant to make the interface consistent i.e. any element(or set of elements) returned(regardless of whether it is deferred or returned from selenium) via protractor layer always provides elementsfinder(or elementsfinderarray) interface.this wouldn't make sense if there needs to be a clear distinction from the finders that will defer the operations.,neutral
angular/protractor,selenium,2014-05-20T07:11:19Z,what is the syntax to specify `maxsessions`? is it documented yet?,neutral
angular/protractor,selenium,2014-05-20T17:21:36Z,this question might be better for stack overflow. where you could tag with selenium - it's a general selenium/webdriver setup question. not really anything specific to protractor.,neutral
angular/protractor,selenium,2014-05-20T18:45:31Z,sorry i misunderstood your issue; this particular feature isn't available yet. reopening,negative
visionmedia/superagent,sauce,2014-01-24T14:59:15Z,gjohnson you need to setup the sauce credentials as encrypted vars in .travis.yml for zuul to work against sauce on travis.,neutral
restify/plugins,mocha,2015-09-09T06:47:53Z,migrate to mocha. split out plugins. mapparams defaults to false. wip,neutral
restify/plugins,mocha,2015-09-10T05:48:42Z,yunong micahr plugins broken out! all functionality is intact. added more unit tests for queryparser and bodyparser. also made mapparams: false the default behavior.,negative
restify/plugins,mocha,2015-09-14T17:44:46Z,donutespresso looks good. if we're going this route. let's move all plugins out of server. even cors. it's fine for the server to pull it in as a dependency. also. when you're moving the files over to new repos. please save the git logs for the files so we're not starting anew.,positive
restify/plugins,mocha,2015-09-14T18:56:55Z,not sure what to do with cors - the tests require restify so pulling cors out would result in a circular dependency for tests (or we keep cors tests in core). we also have existing prs open against cors. the git history is complex. let me see what i can do.,negative
ember-cli/ember-cli-mocha,mocha,2016-02-26T15:22:56Z,ballpointpenguin did you actually test this at all? because i just found out that `removepackagesfromproject()` isn't even able to remove packages from `bower.json` and only targets `package.json`...,neutral
ember-cli/ember-cli-mocha,mocha,2016-03-01T08:26:58Z,turbo87 i did not. i looked at the code and it seemed obvious enough. i should have tested it.,neutral
admc/wd,selenium,2013-07-22T19:24:59Z,selenium ide formatter. it would be really cool if we had a formatter to export directly from the selenium ide to node.is this reasonably easy / has it been done yet?,positive
angular/angular-cli,uglify,2016-10-21T18:12:13Z,with webpack being blackboxed. it could potentially be swapped out for rollup or something else entirely in the future.  webpack just happens to be the _internal_ build engine that the developers decided upon at this point in time.  so using the cli or not using the cli solely based on webpack usage is probably not the best of ideas.  and realistically (or maybe ideally). you shouldn't know the difference if it was swapped out in the future.as to tree-shaking. rollup does seem to do a better job.  however. the uglifyjs method employed by webpack (which is currently used for cli production builds) seems to perform well enough.  combine that with the added infrastructure provided by webpack and the scale tips in its favor.  (atleast for now.),neutral
angular/angular-cli,uglify,2016-10-27T07:00:49Z,might be. but then the documentation needs to be updated."all builds make use of bundling. and using the --prod flag in ng build --prod or ng serve --prod will also make use of uglifying and tree-shaking functionality.",neutral
angular/angular-cli,uglify,2016-11-02T16:38:35Z,personally i think the most practical avenue is to always uglify/minify scripts. but there have been talks of having an alternative way of pulling in scripts in prod (e.g. from a cdn). that's definitely a feature for the future though.,neutral
angular/angular-cli,uglify,2016-11-03T06:57:50Z,production build without compression. is there a way to make a production build without compression. or at least without uglifying the code?,neutral
angular/angular-cli,uglify,2016-11-03T07:37:50Z,as far as i know `ng build` will build app without uglyfing and compression.,neutral
angular/angular-cli,uglify,2016-11-03T13:30:31Z,that will do a dev build so there will be other differences as well. for global stylesheet handling. you're going to get a js bundle instead of css.  output filenames will have no hashes.  probably some others as well.also. your builds will be significantly larger without the minification step.,neutral
angular/angular-cli,uglify,2016-11-03T23:10:58Z,basically i want the js bundled. but no uglifying on the index html or the css. grunt and gulp let me have full control over what is and isn't done. i wasn't sure if there was a way for me to control with angular cli does.,negative
angular/angular-cli,uglify,2016-11-04T00:37:10Z,the cli is meant to be an opinionated build system.   so if you're interested in full control. it's probably not what your looking for.in regards to what you want. index.html is not minified or compressed currently.  component css is bundled with their respective component's js.  global css will be combined and minified in production builds.  (in development builds they will be combined into a js bundle).,positive
angular/angular-cli,uglify,2016-11-04T17:50:52Z,what clydin said is very accurate. i can also say that as far as future plans are concerned. we aren't looking specifically at adding this toggle but it might happen if we end up giving more granular build control overall.,negative
angular/angular-cli,uglify,2016-11-09T14:29:30Z,you're right. webpack's tree-shaking in general would probably have a limited benefit in that situation.yes; there is plenty that could be improved:  rollup has better tree-shaking ability. closure in advanced mode has advantages over uglifyjs. etc.  these (or something akin) will most likely be integrated as the system moves forward.but personally. i think that outside of presentations and demos. super-optimizing the "hello world" scenario has limited utility overall.  real world applications won't benefit; they will be using multiple additional libraries and most likely leveraging a majority of es2015+'s capabilities.  and with current browser improvements. the polyfills can be incrementally dropped moving forward.,neutral
angular/angular-cli,uglify,2016-11-10T13:58:47Z,sourcemaps for production environment . is there a way to generate source maps for production? i have a bug that only reproduces after uglify/mangle,neutral
quailjs/quail,standard,2014-05-06T12:54:20Z,so. what happened with this? it doesn't appear to have been excised from the project dependencies.,neutral
