jshint/jshint,jshint,2012-03-19T21:16:32Z,based on gh-483 i'm going to assume you're using node-jshint and offer a solution that works for that.why not use a config file? you can set a `.jshintrc` file and specify which globals will be used in your project:```"predef": [  "mysingleton". "mvcframework4". "flowcontrolzjs"]```,neutral
jshint/jshint,jshint,2012-03-20T06:56:22Z,goatslacker - right. i'm using node-jshint. with your proposal. i'll have to declare all my functions this way. it's not practical. we're currently not using a namespace for our own functions. but rather defining them globally.,neutral
jshint/jshint,jshint,2012-03-20T11:15:13Z,as a workaround. you can use `/*jshint undef: false*/` after `"use strict";`,negative
jshint/jshint,jshint,2012-03-20T11:37:37Z,i worked around by editing jshint.js as described aboth. since both are on by default anyway. when user sets the to false he usually does not mean "i only want to surpress this for the non strict mode parts". as you shouldn't have much non-strict code anyway.,neutral
jshint/jshint,jshint,2012-03-20T11:38:40Z,goatslacker i think we have to switch the parser as fast as we can ;) (where style related and "functional" parts are clearly kept apart - and hopefully we find an easy way to separate all the tests from another. too)i also think we should emphasize the so true sentence from crockford: **it will definitely hurt your feelings** (its only purpose is to hurt your feelings)jslint and jshint are no parsers - they should warn if something is known as bad practice (at best with a quick example. why it is bad) - even if it's compilable..,positive
jshint/jshint,jshint,2012-03-20T11:42:28Z,wolfgangkluge - i'll append your statement with "ideally. it should be possible to turn off any specific warnings. using a global config file".it's ok that jshint/lint "hurt my feelings". but i should be able to control it.,negative
angular/angular.js,standard,2014-11-22T19:38:56Z,use standard event.preventdefault when available (event.returnvalue is deprecated) - #4557,neutral
angular/angular.js,standard,2014-11-22T21:38:04Z,clas look good. thanks!<!-- ok -->,positive
angular/angular.js,standard,2014-12-14T12:21:18Z,sjurba out of curiosity - what is the practical use-case you've got for this change? i'm aware of the ffoxos-specific args that we need to pass to the xhr's constructor but i wonder what are the non-standard properties that you've bumped into.i'm leaning towards proposing a more generic solution where there would be a dedicated service responsible for creating xhr instances but yeh. would like to understand all the use-cases first.,neutral
angular/angular.js,standard,2014-12-17T20:28:24Z,imo `.success` and `.error` were a bad bit of api design in the first place. this issue highlights a number of situations where developers get confused because they either expect `.success` and `.error` to work the same way as `.then` or vice versa.in a perfect world i would rather just ditch these `$http` specific "promises". instead we could encourage developers to use the standard `$q` promise api `.then` and `.catch`. there is very little benefit imo in working with explicit parameters over working with the response object.,negative
DefinitelyTyped/DefinitelyTyped,standard,2015-06-10T17:43:03Z,this one too. vvakame. added standard header to d.ts and test file. unorm-tests.ts. ready to merge? thanks!,positive
