firebase/backbonefire,karma,2014-07-12T22:36:39Z,cleaned up repo and added travis ci integration. - added travis ci integration- updated `readme`  - updated download instructions  - added contribution instructions- renamed src and dist files to `backfire.js`- updated name in `readme` to backfire (used to be backfire) to be  consistent with other bindings- cleaned up `package.json`- cleaned up `bower.json`- added change log- made it so that tests can be run via `grunt test`- added `release.sh` script to streamline release process- updated karma configuration file,neutral
firebase/backbonefire,karma,2014-07-12T22:41:47Z,alexwolfe - here is the backfire repo cleanup stuff and travis integration work. i'm going to add `backfire.js` and `backfire.min.js` to the cdn once this stuff gets merged in. i will keep the old `backbone-firebase.js` and `backbone-firebase.min.js` files on the cdn to not break existing apps. going forward. we will only put `backfire.*` on the cdn.katowulf - you may also be able to take a look at this and merge it in if it all looks good.,negative
firebase/backbonefire,karma,2014-07-14T18:12:28Z,jacobawenger nice work.,positive
firebase/backbonefire,karma,2014-07-19T00:51:46Z,alexwolfe - i know you're busy with docs stuff but reviewing this should only take ten minutes or so. thanks!,positive
firebase/backbonefire,karma,2014-07-27T21:40:40Z,alexwolfe - now that docs have launched. can you please review and merge in this pr? it should only take ten minutes or so.,positive
firebase/backbonefire,karma,2014-07-28T17:14:27Z,just one small comment otherwise ready to merge.,neutral
firebase/backbonefire,karma,2014-07-28T17:20:28Z,alexwolfe - good catch. this is ready to be merged now.,positive
firebase/backbonefire,karma,2014-07-28T17:33:25Z,you need to add me as a collaborator or i can't merge :),neutral
firebase/backbonefire,karma,2014-07-28T17:44:03Z,you've been added as an owner.,neutral
mochajs/mocha,mocha,2012-12-08T03:48:05Z,in case it helps. i took the time to document my use case in a video overview that outlines why i chose to test in the browser. and why asynchronous assertionerrors in mocha are important for my project:,neutral
mochajs/mocha,mocha,2012-12-08T12:23:07Z,:+1: for this feature. for exactly the same reason. i'd like to have some complex code that decides if a test should be skipped. and have the test output show a skip. not a pass. i'd be ok with calling `skip(); done();`regarding skip() magically getting out of the test case -- how about throwing an exception just like when an assertion fails?,negative
mochajs/mocha,mocha,2012-12-08T15:51:34Z,actually. i'm now :-1: for this. simpler to just change your test runner to use the tap reporter manually (plus use  instead). plus you might want to use a different reporter in the browser or log something else to the console,neutral
mochajs/mocha,mocha,2012-12-10T03:42:46Z,perhaps the ci thing is leaving us with a little bit of a red herring here (i think we use them in quite different ways).i think it presents a cleaner simpler abstraction to reporters and is advantageous because of that. and i think it would be nice to have the ability to run the reporters as separate command line apps and pipe data from the test runner to the reporters (e.g. for aggregating multiple tests or using non-mocha test frameworks with mocha reporters) and i can't see any way of doing that without simplifying the format to be json serializable.,positive
mochajs/mocha,mocha,2012-12-14T17:42:52Z,dmayo3 are you using mocha-phantomjs?,neutral
mochajs/mocha,mocha,2012-12-15T23:28:00Z,with mocha-phantomjs the codes runs in a browser environment but output goes to the console.,neutral
mochajs/mocha,mocha,2012-12-16T00:02:27Z,oh right. forgot about those people haha. i've never seen numbers but yeah i've seen that. i definitely dont want to inline a bunch of serialization or json stuff. this would be less gross if mocha were implemented with components right now but for now i'm find with just the regular tostring. they'll figure it out,negative
mochajs/mocha,mocha,2012-12-18T04:33:59Z,haha! ok ok. i won't pester you about it. i really just want mocha to support being passed a stream object for output. and having it default to standard out if none is given.i don't plan on this being built in to exclusively support grunt. i'll just toss you a reply here when i'm done and if you think it might help. i'm happy to issue a pull request. if you only use make in your exploits. then hats off. i'm not so fortunate... gyp is also json-ish like grunt. and actually i think msbuild and ant are both more intuitive with their xml based configs. probably scons is the only thing i really enjoyed building with. but it's a beast and slow compared to make or ninja.,positive
mochajs/mocha,mocha,2012-12-18T23:42:11Z,document difference between `mocha debug` and `mocha --debug`. visionmedia: it took me a while to figure out how to get mocha to run with node's built-in debugger client to run (vs node-inspector / webkit web inspector). so i thought this docs clarification might help others stumbling over the same thing.,neutral
mochajs/mocha,mocha,2012-12-19T15:36:11Z,seems i can't pass bail option with options to mocha constructor? i'm using grunt-simple-mocha and can pass options only via grunt config. because my test folder named "tests" and if i recall correctly mocha only loading mocha.opts from "test" folder.,negative
mochajs/mocha,mocha,2012-12-20T22:47:37Z,mocha doesn't have anything to do with the http lib sorry. you'll have to ask elsewhere if the request itself is failing. though keep in mind mocha exists when tests are complete. thus you would have to put this code in a `it(function(done){  request here. invoke done() once complete })`,negative
mochajs/mocha,mocha,2012-12-30T22:18:54Z,( and a corresponding v bump for mocha eventually would help :) ),positive
mochajs/mocha,mocha,2013-01-01T21:55:50Z,you'll have to step through with node's debugger or investigate the stack trace there. doesn't look related to mocha sorry! some sort of race condition in that lib,neutral
mochajs/mocha,mocha,2013-01-01T21:58:33Z,update mocha. that's really old,neutral
mochajs/mocha,mocha,2013-01-01T22:03:39Z,im open to suggestions on improving the output but i dont want to get all crazy with customization. it's easy to integrate new reporters with mocha so you can copy/paste it and go from there if you like,positive
mochajs/mocha,mocha,2013-01-01T22:12:19Z,added a `.bail()` method in f0b441c,neutral
mochajs/mocha,mocha,2013-01-01T22:31:43Z,davisford yea wouldn't surprise me. node itself doesn't publicly facilitate clearing the module cache. so anything we get "working" is a hack. another reason why i dont like watchers. but i wont have time to look into this for a bit,negative
mochajs/mocha,mocha,2013-01-01T22:53:44Z,i don't think the styles will be too much of a problem -- the mocha layout and css is already pretty well scoped. and the markup fairly minimal. i added it to a single page app with a white on dark layout which drove most of the changes.personally. i think the combination of this with testacular will be pretty powerful. by running the tests directly in the app. there's no barrier getting in the way trying to send events to a browser over websockets. for example. if a test fails. you have your app open in your browser with the state that the failure occurs so that it's easy to debug. you can also hook into your app. so listening for routing events. for example. which keeps the test lightweight and fast. and then you can run them through testacular to drive the browsers for continuous integration.,positive
mochajs/mocha,mocha,2013-01-02T08:11:19Z,i am having the same trouble. it's very difficult to get a breakpoint set inside a test. i've been trying to wade through the mocha source to try and get into a function that will let me set a breakpoint on my test. but i still haven't had any luck.i've tried setting a "debugger;" in my source. but it still does not get caught in time.+1 for chris rock's suggestion.,negative
mochajs/mocha,mocha,2013-01-02T21:33:15Z,i ran into the same problem. but worked around it by forking (oh no!) mocha and pasting the jsdiff code into the empty diff.js file. radamant is correct.,neutral
mochajs/mocha,mocha,2013-01-03T14:49:13Z,after digging in the code of both mocha and node. i implemented a simple workaround: it the way to go?may it be possible to automate it in a function call like `removeuncaughtexceptionhandler` in the mocha api?,neutral
mochajs/mocha,mocha,2013-01-06T10:44:12Z,expected/actual output is poor without color. example:<pre>% mocha --compilers coffee:coffee-script -c  ���������  ��� 1 of 3 tests failed:  1) filterdata should work for nested hashes:            actual expected            1 | {      2 |   "outer": {      3 |     "middle": "value"      4 |   }      5 | }{}</pre>in this very simple example you should be able to tell that there is a non-empty hash and an empty hash. looking at just this output you cannot tell which of the two is expected and which is actual.maybe you could do diff-style +/- when color is off.,neutral
dondi/GRNsight,eslint,2017-09-27T22:44:37Z,eslint runs inconsistently. we have discovered that eslint is reporting different results on different systems:- with ebachoura and yshin4. who are on windows 10. eslint reports errors as expected- with eileenchoe. who is on macos. eslint appears to run but does not report any errors- with travis. eslint is reporting a dependency error for a module that is listed as an eslint dependencywe need to resolve this so that everyone gets the right linting output.,negative
dondi/GRNsight,eslint,2017-09-27T22:44:52Z,dondi will try this on his development setup and report back.,neutral
dondi/GRNsight,eslint,2017-09-27T22:45:56Z,eileenchoe will check her eslint configurations to see if one might be unexpectedly interfering with another.,neutral
dondi/GRNsight,eslint,2017-09-28T17:18:05Z,dondi asked me to run some linting tests and the results are a bit odd.so i started on dondi's branch and i ran the linter and found no errors. i was surprised and i checked my own branch and found the same result. no linting errors.this was really weird because just a few days ago i ran the tests and got 321 linting errors. i realized that another thing that changed in the last few days was my bash application. i just switched to bash on ubuntu on windows. both of the "npm run lint"s were done in this bash on windows and they returned 0 linting errors. but when i switched back to git bash and ran the linter. there was 321 errors for both my branch and dondi's. hope this helps!,negative
dondi/GRNsight,eslint,2017-09-29T07:21:43Z,ebachoura as for the weird ubuntu bash behavior. try to re-pull that repo then re-checkout `dondi`. then report back when you can. thanks!,positive
dondi/GRNsight,eslint,2017-09-29T07:26:22Z,_coverage/_ has been added to the _.eslintignore_ list. for anyone trying this out. make sure to pull `dondi` again to make sure that you get this update.,neutral
dondi/GRNsight,eslint,2017-09-30T04:45:36Z,dondi running `npm run lint` on the `dondi` branch on my machine yields 322 errors. which is consistent with what you are getting and what travis is getting.,negative
dondi/GRNsight,eslint,2017-09-30T05:57:22Z,ok. thanks eileenchoe! so ebachoura and yshin4. let’s see if we can get consistency for you guys too. on the `dondi` branch. ebachoura. make sure that your repository on ubuntu bash is freshly pulled and on the `dondi` branch. yshin4. do the same on whatever command line you use regularly.we appear to be converging on 322 linting errors. once we’re all consistent. i can merge this with `beta`. to minimize conflicts. let’s temporarily accept these failed builds and merge `beta` into our working branches. one or more of us can do “lint-fix-only” commits on `beta`. which the others would then merge into their branches a little at a time.then we can all be _really_ happy when we go green again!,positive
dondi/GRNsight,eslint,2017-10-03T20:08:57Z,i pulled dondi branch and ran lint and i got 322 linting errors. so it looks like i am on board with eileen. dondi. and travis. yshin4 could you pull dondi's branch and then run lint and post how many errors you get.,negative
dondi/GRNsight,eslint,2017-10-03T21:18:09Z,i pulled dondi branch and linter gave me 322 errors as well.,negative
dondi/GRNsight,eslint,2017-10-04T00:53:40Z,also i just realized. ebachoura you might want to audit the original clone where you were seeing the discrepant numbers. you might have had lingering commits or other files that were skewing the results. it might be best to manually transfer any work that you knew you were doing into a fresh clone.,neutral
dondi/GRNsight,eslint,2017-10-04T19:05:50Z,ok. this has been merged with `beta`; no release for this one because it only affects how listing is checked. however. travis does report errors now so "linting-only" fixes will be desirable going forward. i’ll write up a new issue for that.,positive
dondi/GRNsight,eslint,2017-10-04T19:08:14Z,the follow-up issue is #538; also. now is a good time to pull and merge `beta` into our individual branches.,positive
dondi/GRNsight,eslint,2017-10-04T19:21:30Z,however. upon looking at the _edge-tests_ files that got added. i don’t see the one from her comment above. so yshin4 if you could please issue a pull request with that file. that would be great. make sure to merge `beta` because that has your updates plus the eslint changes.,positive
karma-runner/karma-sauce-launcher,sauce,2014-01-20T00:39:57Z,thanks johanneswuerbach !,positive
karma-runner/karma-sauce-launcher,karma,2014-01-20T23:30:00Z,concurrency issue. i'm not sure if this is the actual problem but here's what i have been running into:i have a free open source account on sauce labs running tests in 9 different browsers. but the max parallel tests i can run is 3 at a time. since karma waits for all browsers to connect before running the tests. it just gets 3 connected browsers and then sits there waiting. and since no tests are run. sauce labs doesn't spawn more browsers and sits there waiting too. the whole thing just gets stuck.is there anything i can do to get around this? thanks.,negative
karma-runner/karma-sauce-launcher,karma,2014-01-31T18:50:39Z,what is the state of that issue? some builds are failing as nothing responds.,negative
jantimon/html-webpack-plugin,jshint,2015-03-27T18:55:36Z,the cache buster is now optional.added jshint configuration.,neutral
micnews/react-jw-player,eslint,2017-10-04T14:45:24Z,hey danmakenoise - so sorry for the late response! everything outlined above sounds great. sounds like this component will load in the external js files and just keep a reference to the player no? one request - is it possible to use prettier with eslint config? i would be happy to help set that up.,positive
iurimatias/embark-framework,mocha,2016-08-27T19:57:25Z,unable to run tests in private network . pleaseeeeee help me fix this blocking issue. i have deployed a sample contract to a private blockchain. embark deploy privatenet works perfectly fine. when i run test. it fails with the following message. i guess. it is not able to find the blockchain and the account. i am running the command embark spec and embark spec privatenet.error outputd:\aaa\xxx\blockchain\installed\embark\firstcontract>embark specsecp256k1 bindings are not compiled. pure js implementation will be used.secp256k1 bindings are not compiled. pure js implementation will be used.conferenceprimary account address is : nulltrying to obtain conference address...    1) "before all" hook  0 passing (3s)  1 failing  1) conference "before all" hook:     error: the string "invalid address" was thrown. throw an error :)      at runner.fail (d:\aaa\xxx\blockchain\installed\embark\firstcontract\node_modules\mocha\lib\runner.js:226:11)      at runner.failhook (d:\aaa\xxx\blockchain\installed\embark\firstcontract\node_modules\mocha\lib\runner.js:262:8)      at d:\aaa\xxx\blockchain\installed\embark\firstcontract\node_modules\mocha\lib\runner.js:307:16      at done (d:\aaa\xxx\blockchain\installed\embark\firstcontract\node_modules\mocha\lib\runnable.js:287:5)      at hook.runnable.run (d:\aaa\xxx\blockchain\installed\embark\firstcontract\node_modules\mocha\lib\runnable.js:322:5)      at next (d:\aaa\xxx\blockchain\installed\embark\firstcontract\node_modules\mocha\lib\runner.js:298:10)      at immediate._onimmediate (d:\aaa\xxx\blockchain\installed\embark\firstcontract\node_modules\mocha\lib\runner.js:320:5),negative
iurimatias/embark-framework,mocha,2016-08-28T13:31:37Z,thanks a ton!!!!. i am unblocked and the simulator scenario works!!!!. i will fix my test cases now. **i have one more issue on which in need your help**. i really want to connect to the node that runs my contract (not the simulator) on the private network. the accounts there have enough ether. **what changes do i need to make**?,positive
iurimatias/embark-framework,mocha,2016-08-28T14:07:07Z,thank you!! it is working. i am able to test against the privatenet node. i would continue to use the simulator to test. it's a great tool.,positive
danvk/dygraphs,karma,2015-01-22T19:16:15Z,danvk kberg any movement on this?,neutral
danvk/dygraphs,karma,2015-01-22T23:41:09Z,sorry for the slow responses! i'll plan to take a look at it this week.,negative
chentsulin/electron-react-boilerplate,standard,2017-02-15T15:54:32Z,maybe the decision shouldn't be based off of one library that deviates from the standards ¯\\\_(ツ)\_/¯i'm sure they would welcome a pr to fix that incompatibility.,negative
pinterest/esprint,eslint,2017-05-23T00:27:08Z,add `esprint run` command. this pr adds an `esprint run` command. which just runs parallelized eslint without standing up a background server that watches for changes.,neutral
pinterest/esprint,eslint,2017-05-23T03:09:54Z,benchmark esprint performance vs. eslint. we should have a suite of benchmarks in place to have a baseline and keep track of perf regressions.,negative
pinterest/esprint,eslint,2017-05-24T22:02:13Z,update install script to handle file-linked eslint dependencies. as title. the dependency-install script would throw errors when running into `file:`-linked dependencies in the specified `package.json`. this patch runs `npm link` for those packages. so that we get the dependencies into esprint's `node_modules`,negative
redfin/react-server,eslint,2016-04-20T00:16:49Z,doug-wade - looks like some conflicts have crept in here.looks like there are also still a few non-leading tabs.,positive
redfin/react-server,eslint,2016-04-29T18:03:22Z,dooouuuugggg.....,neutral
redfin/react-server,eslint,2016-05-11T22:16:44Z,simple tests. more `eslint` and `nsp` coverage.,neutral
redfin/react-server,eslint,2016-05-11T22:38:50Z,this is just eslint/nsp.  merging.,neutral
redfin/react-server,eslint,2016-05-13T22:15:43Z,lidawang - sounds like your `gulp-eslint` is out of date.  try an `npm update` in your repo root.,neutral
phoenixframework/phoenix,mocha,2016-11-11T21:46:28Z,add socket.js tests. this pr adds a few mocha tests for the `socket` object in `phoenix.js`.i'm opening this pr as a potential starting point for building out a suite of unit tests for the javascript functionality provided by `phoenix.js`. though only just a few tests. there are already a few key decision points where i'm looking for feedback before i get too far.though `phoenix.js` touches a few browser apis. i decided to stick with the node.js context for the tests for simplicity. this means introducing a few libraries. e.g.. `jsdom`. `jsdom-global`. `mock-socket`. to mock out those dependencies. we could certainly run the tests in a browser-based runner. e.g.. karma. testem. etc.. instead (or do both!). though the approach i went with was consistent with the existing presence tests. looking for comments.i've only added a few tests to get a proof-of-concept going for the mocking approach. if we like this direction. let me know your thoughts on how to tackle remaining tests: merge small sets of tests as i go vs build out an entire suite in one pr. certainly. if you have any comments on the tests i've written so far. i'd be happy to address.another decision would be when to add the node tests to the travis build.finally. there's never enough love to go around. so thanks for all your hard work on phoenix!,negative
phoenixframework/phoenix,mocha,2016-11-14T18:21:41Z,this looks great! and we surely could use unit tests for proper client coverage. > i've only added a few tests to get a proof-of-concept going for the mocking approach. if we like this direction. let me know your thoughts on how to tackle remaining tests: merge small sets of tests as i go vs build out an entire suite in one pr.please continue with the tests. using this pr. and we can merge when we're in a more complete state. thanks so much!,positive
VisionistInc/jibe,mocha,2015-04-22T20:27:10Z,model tests. create mocha tests for:- [x] chat model- [x] author model- [x] room model,positive
jimhigson/oboe.js,jasmine,2016-11-10T01:03:54Z,can't run tests on clone. if i clone the library. run `npm install`. and then `npm test`. i get errors about not being able to launch phantom. i've played around with this and the only way i can get these to pass it to update some libraries. because of peer dependencies. this eventually gets me to the point of having to update to jasmine v2. which has a lot of breaking changes,negative
moment/moment,karma,2013-11-24T20:07:10Z,porting tests to mocha is still possible – just have to change the karma adapter. it would be great since mocha is designed to be run on both node and browser. and largely used and maintained._icambron i made you collaborator of my fork so that you can push on this banch to add your encrypted username and accesskey._,positive
moment/moment,karma,2013-12-06T07:26:57Z,this is incredible! thank you alexstrat. you posted excellent instructions. i was able to set up saucelabs. i did the necessary steps for travis (i guess we can test once this goes upstream).now about the changes you made to all tests: i'll see if we can do something saner here. probably make sure that nodeunit is exported global and then attach tests directly to it. so we wouldn't need a browser.js. we can also generate that but if we can avoid it -- better. about tests not working on ie8 -- i can also give it a try. the interface seems pretty straight forward. just like remote karma... what a gem :),positive
moment/moment,karma,2013-12-07T20:55:46Z,tests will run in three environments -- node. browser and karma. i prefer to engineer something (like use umd for tests too) that would work for all of them rather than hack around it for karma only.i can not commit to your branch. i can make a pr. let me first examine the umd hypothesis.,positive
moment/moment,karma,2013-12-07T21:16:04Z,ichernev i made you collaborator of my fork few weeks ago. you should then be able to commit on this branch.karma is not a "environnement": karma is a runner/launcher/reporter framework of the "browser environment".can you explain your umd solution further: i don't understand it.,neutral
moment/moment,karma,2013-12-07T21:21:28Z,umd is universal module definition -- something that works with amd. commonjs and browser globals. but now that i think more about it converting the tests to mocha would be a better idea.the way we currently run the tests in a browser (for momentjs.com) is we concatenate all test files. on the top we redefine require and exports. and at the bottom we use all defined tests (in exports) to launch nodeunit with them. there is also code to display broken tests and the like. i'm not sure if we want all that for the karma -- probably not.if we use mocha instead. all test will have the beautiful define / it construction. they'd just work in node. for the browser you include mocha lib at the top and you hook to relevant events (test case failed/passed) to display results. for karma you just use karma-mocha plugin. no hacks. clean and simple.,positive
react-boilerplate/react-boilerplate,eslint,2016-03-18T20:43:34Z,there is a new eslint rule i tried to adhere by. but while the idea is good the rule is quite annoying. i'll reevaluate soon. and then move the ones that shouldn't be in the containers folder anyway. i just haven't come around to updating that! thanks for the reminder!,positive
react-boilerplate/react-boilerplate,eslint,2016-03-19T23:13:47Z,awesome work. thanks so much! a few small nitpicks:- in line with the other configs. could you move the jscs config to the [`jscsconfig` variable]( in the `package.json`?- the `internals` folder should be linted- lets have a `lint:jscs` and a `lint:eslint` script which are combined in the `lint:js` script like so: `npm run lint:eslint && npm run lint:jscs`thanks so much again!,positive
react-boilerplate/react-boilerplate,eslint,2016-03-29T15:26:21Z,update: it seems like this is caused by linting errors in the .js files which cause the tests to fail (as they probably should). however the linting errors refer to the `internals/*` part of the app which shouldn't be touched. i've tried defining an `.eslintrc` file but ran into more errors with linting. is it possible to provide an `.eslintrc` file which specifies the rules in the project in order to prevent this from happening?,negative
react-boilerplate/react-boilerplate,eslint,2016-04-14T12:31:26Z,sorry. i've missed this tiny detail that the test command is targeting my global eslint installation instead of the local one. thanks for pointing that out. is it intentional that the commands target the global node packages? or is it a windows bug? i guess if your answer to the first question is no then the second answer is automatically yes and i will start figuring out how to get the local modules to run under windows instead.,negative
