jprichardson/electron-mocha,mocha,2016-06-28T06:47:00Z,i'm not sure what you're trying to do? source maps are meant for inspecting / reading compiled code. but not for running it -- electron-mocha would just run the compiled code so i don't see how source maps come into play here? having said that. they should work just like they do in chromium.,negative
jprichardson/electron-mocha,mocha,2016-06-28T09:07:56Z,ok. looks like this is general problem of mocha and bundlers. not specific to this project. will do more digging on the subject.,neutral
jprichardson/electron-mocha,mocha,2016-07-08T01:58:17Z,not working. or not what i think it is?. this code:```it('gets ready'. function(done) {  require('electron').app.once('ready'. done)})```when run with electron-mocha gives a mocha timeout error (`ensure the done() callback is being called in this test.`).is this expected?,neutral
jprichardson/electron-mocha,mocha,2016-07-08T09:57:21Z,yes that's to be expected: electron-mocha runs your tests in electron's main process. or. if you pass `--renderer` in a renderer process. in both cases. electron-mocha is responsible for starting and initializing electron. when your tests run. electron has already been initialized. so the `ready` event has fired before you start listening for it.,negative
jprichardson/electron-mocha,mocha,2016-07-08T17:16:29Z,cool. that makes some sense. this worked:```const {browserwindow} = require('electron')it('makes a window'. function (done) {  const options = { frame: false. height: 768. width: 1024. x: 0. y: 0. show: false }  const win = new browserwindow(options)   win.webcontents.once('did-stop-loading'. function () {    win.webcontents.savepage('out.html'. 'htmlonly'. done)  })  win.loadurl('')})```,positive
request/request,standard,2017-01-13T05:42:15Z,in what status there is an acceptance of this pull request? simov,neutral
request/request,standard,2017-02-03T17:58:04Z,hi.could a merge be considered ?thanks.,positive
pixijs/pixi.js,jshint,2016-06-28T21:09:58Z,build error. so i cloned the repo. installed dependencies with `npm install`. and built with gulp.> error: cannot find module 'jshint/src/cli'i solved it with:> npm install --save-dev jshint gulp-jshinti thought i should be opening an issue nevertheless.,negative
pixijs/pixi.js,jshint,2016-07-08T21:54:15Z,looks like we are missing a `jshint` dep. but gulp-jshint is there. feel free to put in a pr.,positive
pixijs/pixi.js,jshint,2016-07-10T03:47:17Z,ha. ok :),positive
pubkey/rxdb,karma,2017-06-03T10:14:26Z,add .travis.yml for travis ci. link in readme is already set to pubkey/rxdb. travis will run - all tests with node and karma- build for examples angular2 and vueon linux and node v.7 for every push and pull request.travis can be also set up to run tests of all examples. build processes for all other examples do not seem to work.,neutral
elastic/kibana,selenium,2015-09-02T16:26:06Z,planning in rough order:- [x] init config/basic test at `tests/functional`- [x] add to grunt test task- [x] spin up es on a different port- [x] spin up kibana on a different port. configured to use new es port- [x] import snapshot or bulk api to es instance- [x] grunt task for installing and starting selenium server,positive
atom/etch,standard,2016-03-08T16:31:52Z,> should update be required? or at least log a warning?when would we warn or throw an exception? maybe when a `componentwidget` is first created? i'm definitely open to either to prevent confusion.> does update take. more or less. the same form as the constructor: receiving properties and scheduling a render?it does. but i haven't thought about a way of unifying them that feels right to me. from the perspective of using a component. it seems the most straightforward to construct an object with properties and later call `update` with properties. we could require the constructor to not take arguments and instead also call `update` when initializing the object. but that feels awkward to me.if you want to implement a superclass in the package to experiment with some different patterns. that seems like it could be a good way to experiment with reducing boilerplate. you could implement the constructor and the `update` method in terms of hooks defined on subclasses and prescribe more about how properties are dealt with.if you want to be more react-like. your superclass constructor and `update` implementations could perform a basic comparison on a `props` hash on the component and call various hooks such as `shouldcomponentupdate`. `componentwillreceiveprops`. `componentwillupdate`. `componentdidupdate`. etc.i left this stuff out of etch because it didn't seem as fundamental as the basic idea of calling `render` and using the result to create or update a dom element. that felt like the essence of the problem and the rest felt more like advice around how to organize code. that said. maybe the props management pattern is standard enough to bake in a superclass for those that want to use it.what gives me pause is wondering where it stops. should we also model an internal `state` object with `setstate` etc? i'm much less enthusiastic about that because of the fact that state has been more complex than a simple hash of key value pairs in a lot of the code i've worked on in atom. the essential state of the editor is a product of multiple different indices tracking markers. syntax highlights. etc. it could never be boiled down into a `state` hash.maybe management of properties is different though. since they're more obviously always treated as a hash.,negative
dherault/serverless-offline,mocha,2016-10-23T18:30:08Z,unit testing infrastructure. included mocha as dev dependency and a few tests for the createlambdaproxycontext.this branch was created on top of the lambda-proxy-event.,neutral
dherault/serverless-offline,mocha,2016-10-24T00:15:43Z,wow. thanks for all the work.,positive
dherault/serverless-offline,mocha,2016-10-24T00:40:47Z,don't mention it.best way of making this plugin grow safely is to build a solid ground of tests.we can put them to run in a travis ci job.,positive
dherault/serverless-offline,mocha,2016-10-25T01:06:10Z,just added hapi integration testing.,neutral
dherault/serverless-offline,mocha,2016-10-27T10:24:37Z,enable handler mocks. not sure if you'll want this in but thought i'd offer it up just in case. i am using the plugin to do contract testing whereby the endpoints are spun up as part of a mocha test (by calling `start()`). these changes let me override the `require` of the handlers thereby enabling me to mock/stub dependencies - particularly those that do comms (i've been using `proxyquire` but you could use anything). anyway not sure if it would be useful to anyone else...,negative
dherault/serverless-offline,mocha,2016-10-30T13:21:33Z,leonardoalifraco. thanks a lot for this! it rocks and so do you.,positive
dherault/serverless-offline,mocha,2016-10-30T15:25:02Z,thanks jgrigg. even if this is a bit too specific. if more users want this. i'll reopen :+1:,positive
dherault/serverless-offline,mocha,2016-11-01T12:44:09Z,thanks!,positive
pugjs/pug,mocha,2013-01-09T19:45:49Z,we use mocha now.,neutral
pugjs/pug,mocha,2013-01-09T22:48:29Z,i'll fix this soon. but this can't be `auto-merged`. `npm prune` is not needed. and i'd like `npm test` to directly execute `mocha -r spec` so it works on windows as well as travis.,negative
pugjs/pug,mocha,2013-01-10T00:23:27Z,this would improve test coverage merge visionmedia ?,positive
pugjs/pug,mocha,2013-01-10T09:49:05Z,use local mocha instead of globally installed. this is not depend on globally installed `mocha`.,neutral
pugjs/pug,mocha,2013-01-10T09:52:02Z,if this idea is acceptable. i'll rebase my commits.,neutral
pugjs/pug,mocha,2013-01-10T10:54:23Z,npm does this automatically for you.  it's one of the advantages of using `scripts` instead of `make`.  the other advantage is cross platform support.,neutral
pugjs/pug,mocha,2013-01-10T12:31:42Z,i didn't know up to now. thanks :smile:,positive
pugjs/pug,mocha,2013-01-10T20:50:51Z,ah nice yeah the bdd ui would be nice. the filter tests were commented out since they were pretty volatile for a while but we should definitely get them working fine again,positive
pugjs/pug,mocha,2013-01-11T00:14:41Z,i rebased and sent another pr. #866,neutral
janl/mustache.js,eslint,2015-03-23T19:11:53Z,check out eslint. after trying all of 'em. that's where several projects i work on have ended up.,neutral
janl/mustache.js,eslint,2015-03-23T21:24:32Z,yeah eslint also does the trick.. anything other than quotes you had in mind dasilvacontin?although i feel most linters do the basic stuff equally well. some are more suiteable for specific things and custom styles.,neutral
janl/mustache.js,eslint,2015-03-23T23:06:47Z,glad you guys mentioned eslint. it's the one i had in mind. :)more things:`writer.prototype._rawvalue = function(token) {`vs`mustache.parse = function (template. tags) {`what are your thoughts about `standard`?,positive
paulmillr/chokidar,mocha,2014-11-26T08:30:11Z,windows: fs.watch() needs an error handler!. i noticed that the file watcher created in createfswatchinstance() is not getting an error handler. you need to add it though. otherwise errors while watching will bubble all the way up to the uncaught exception handler in node.a good test case to reproduce is having 2 folders. one with chokidar git repo and one with a small app that uses chokidar to watch the git repo folder. then just run the chokidar mocha tests while watching.eventually i am getting this:change c:\gitdevelopment\chokidar\test-fixtures\add.txtadd c:\gitdevelopment\chokidar\test-fixtures\add.txt{ [error: eperm. lstat 'c:\gitdevelopment\chokidar\test-fixtures']  errno: -4048.  code: 'eperm'.  path: 'c:\gitdevelopment\chokidar\test-fixtures' }unlinkdir c:\gitdevelopment\chokidar\test-fixturesadddir c:\gitdevelopment\chokidar\test-fixturesunlinkdir c:\gitdevelopment\chokidar\test-fixturesat this time chokidar is actually crashed and does not report changes anymore.,negative
paulmillr/chokidar,mocha,2014-11-26T14:17:32Z,hm you are right. i did not see this. however i think there is still a bug. if i set ignorepermissionerrors to true. i still see the error bubbling to my error handler. i would not expect this.,negative
paulmillr/chokidar,mocha,2014-11-28T19:11:13Z,thanks!,positive
Azure/autorest,standard,2016-06-01T18:52:58Z,as we move to standardize error messages. this will be needed to define where the message resides inside of the body.i think this also goes hand-in-hand with the work toward polymorphic discrimination based on error code (from the error body).,negative
tessel/t2-cli,coveralls,2016-09-12T17:54:21Z,i added coveralls in an effort to start doing code coverage checking. but never finished.,neutral
airbnb/javascript,eslint,2016-02-16T09:24:26Z,i'm going to close this for now - it would be inappropriate for a plugin or shared config not to have a software-level dependency on the thing it's configuring or plugging into.,neutral
airbnb/javascript,eslint,2016-02-20T18:00:07Z,eslint-react was published yesterday :),neutral
airbnb/javascript,eslint,2016-02-21T10:24:05Z,how to allow `console.log()` in .eslint?. how to allow `console.log()` in .eslint?i tried``` js"rules": {    "comma-dangle": 0.    "no-console": 2  }```but don't work.,neutral
airbnb/javascript,eslint,2016-02-21T10:33:54Z,thearabbit please read the `eslint` docs for more information.,neutral
airbnb/javascript,eslint,2016-02-22T00:44:39Z,personally i don't find it visually cluttering to have the rules present. nor the word "eslint" or "jscs" - and in fact i might be grepping through all "eslint" instances in the doc if i wanted to review things.,negative
airbnb/javascript,eslint,2016-02-22T19:38:40Z,> instead of typing out the whole url. the issue number can be referenced with just `[#748](airbnb/javascript#748)` - let's do that.> > for all the eslint rules. let's use named footnotes to link to them (the rule name is ideal) rather than typing the long urls inline (and likely duplicating them as well)added something like footnotes and linked to them and shortened the links to issues.,neutral
airbnb/javascript,eslint,2016-03-02T08:20:44Z,hi ljharb — thanks for the quick reply. upon further digging it looks like the issue might have been within `eslint` itself. since the airbnb code isn't referenced at all in the stack trace. super strange. sorry for the hassle!,positive
airbnb/javascript,eslint,2016-03-02T08:21:35Z,i'm going to close this for now. then - please feel free to link it to an eslint issue if one is filed,positive
airbnb/javascript,eslint,2016-03-03T17:50:24Z,according to the eslint docs. setting the "vars" option should still warn about unused local vars - it seems that error is correct. and that var is unused. meaning that line could be deleted and your program would work the same.,neutral
airbnb/javascript,eslint,2016-03-03T18:42:04Z,artptr it's for both. but `eslint` runs with node. and assumes your files are run with node. you should be using browserify or the like to wrap your files anyway such that nothing in your browser runs directly in the global scope.,neutral
airbnb/javascript,eslint,2016-03-03T18:48:26Z,right - this isn't a bug. because in 2016 everything should be run in a node context. and only after running through browserify/webpack should it be shipped to a browser.you're certainly free to override the env settings in your eslint config. however!,neutral
airbnb/javascript,eslint,2016-03-08T16:49:32Z,this might be an issue with `gulp-eslint` - what's your `npm ls` look like?,neutral
airbnb/javascript,eslint,2016-03-08T21:51:36Z,nvm. it's a eslint error.,negative
airbnb/javascript,eslint,2016-03-08T21:53:50Z,thanks. could you link to the issue on babel-eslint?,positive
airbnb/javascript,eslint,2016-03-08T23:13:10Z,i'm also getting this error using plain eslint. commenting out the 'no-labels' line from rules/best-practices.js suppresses the error as a temp workaround.,negative
airbnb/javascript,eslint,2016-03-09T19:54:45Z,you should reference the eslint rule (which in this case is also `react/jsx-no-bind`).,neutral
airbnb/javascript,eslint,2016-03-10T21:37:35Z,thanks - this isn't in the guide. so could we add a section about it that references the eslint rule?,neutral
airbnb/javascript,eslint,2016-03-11T10:10:04Z,object spread. are you using object spread? i had to add:``` js  "parseroptions": {      "ecmafeatures": {          "experimentalobjectrestspread": true      }  }```to my eslintrc to have it working. thanks,neutral
airbnb/javascript,eslint,2016-03-15T10:06:36Z,but we are using es7 static properties now. and eslint still complains about it!,negative
airbnb/javascript,eslint,2016-03-15T14:13:35Z,fix react/prefer-stateless-function link in eslint changelog. pretty straight forward as the headline already describes this pr.,positive
airbnb/javascript,eslint,2016-03-15T16:05:47Z,tomasz-szymanek that's something you'll need to enable in your own eslint config - feel free to file an issue on eslint's repo if you're having trouble. (you probably need the "babel-eslint" parser),neutral
airbnb/javascript,eslint,2016-03-16T12:25:28Z,i suggested solution in sibling issue #588. but will duplicate it here:i'm suggesting to eslint-config-airbnb in three packages:- `/base` will become `eslint-config-airbnb` with removed `/legacy` inside- `/legacy` will become `eslint-config-airbnb-legacy`- `eslint` will become `eslint-config-airbnb-react`. extended by `eslint-config-airbnb` with `eslint-plugin-react` in deps. (not sure eslint will pickup `eslint-plugin-react` from here. but it should)so every consumer will get proper amount of rules and deps,negative
airbnb/javascript,eslint,2016-03-16T17:18:37Z,`eslint-config-airbnb` will always contain react. since it will always reflect what airbnb uses.,neutral
airbnb/javascript,eslint,2016-03-16T20:47:14Z,ljharb thats fine. then just add `eslint-plugin-react` to deps.but please make reactjs-agnostic config for pure nodejs consumers and name it like `eslint-config-airbnb-base`.my case is that i'm developing pure commonjs modules and i would like to use airbnb config. but i dont need react specific rules and i believe i'm not alone,positive
airbnb/javascript,eslint,2016-03-16T20:57:50Z,ljharb thats great. not quite sure how that will work with eslint naming convention but if it will work out pls go ahead,positive
digitalbazaar/forge,mocha,2013-07-04T01:48:15Z,consolidate and write new tests using mocha. the tests in forge are lacking and split up using several different libraries (and custom code). they need to be unified and able to be run in both a browser and node.js. we should move all of the tests over to using mocha and write new tests.,neutral
okTurtles/dnschain,mocha,2015-02-04T06:30:14Z,this was merged into `mocha` which has been merged into `dev`. so closing this.,neutral
okTurtles/dnschain,mocha,2015-02-08T06:57:27Z,this is coming in `mocha` branch. will be pushed and merged into `dev` soon.,neutral
okTurtles/dnschain,mocha,2015-02-08T07:03:36Z,this is closed in `mocha` via 1ab44b1 and will be merged soon.,neutral
okTurtles/dnschain,mocha,2015-02-09T04:16:07Z,wemeetagain nevermind. i confirmed that's working (needed a small fix. done in `mocha`. so you don't need to worry about it).,neutral
angular/angular-phonecat,selenium,2015-04-15T16:25:34Z,tintin34 solution also worked for me.i ran `npm run update-webdriver` after and received:`selenium standalone is up to date.chromedriver is up to date.`,neutral
angular/angular-phonecat,karma,2014-03-08T21:26:41Z,thats great wayneseymour . in a repo that i've created for following the tutorial i implemented the e2e tests of the tutorial with protactor. here's the pr with the addition of protractor to the project: cirocosta/angular-tutorial-following#5 . it would be better if i had done everything with karma-ng-scenario before so that the diff would be better instead of having done only some steps with it and then changing to protactor.,positive
velesin/jasmine-jquery,jasmine,2013-07-14T09:20:47Z,what's the difference between this and `jasmine.getfixtures().fixturespath = 'my/new/path';.`?,neutral
velesin/jasmine-jquery,jasmine,2013-07-14T09:23:50Z,to be fair. i should have read the readme more thoroughly before sending this pull request. i missed the fact that i could do `jasmine.getfixtures().fixturespath = 'my/new/path';` ... but i think that the methods i added are still useful. if you look at the code. i added methods to modify the attributes of all types of fixtures.,negative
velesin/jasmine-jquery,jasmine,2013-07-14T10:06:46Z,no. this pr's no good. there's already `jasmine.getfixtures().fixturespath = ...`. so that solves the problem you had. but you added being able to set the containerid of html fixtures. but i don't think that's useful and nobody has ran into needing that yet so i'm closing this.,negative
velesin/jasmine-jquery,jasmine,2013-07-19T22:59:20Z,added tohaveselected matcher for determining if a jquery selector selects some given elements. i was writing some tests and noticed we have tocontain. which uses $.find under the hood. but this only checks for children in the selector. while i was trying to determine if a selector that selects many elements (via .add) selects a given element or not.hope i just needed to write the matcher and specs. let me know if anything looks out of place! and thank you for providing this great library for jasmine. :tada: :),positive
velesin/jasmine-jquery,jasmine,2013-07-25T22:03:42Z,thanks for the feedback! i implemented your suggested changes except for #2. because i am not sure i fully understand what you mean.in the test i create a few elements and select them in various ways. and then verify if a given selector or element is contained within those various selectors. to me. it looks like i am verifying it against only selectors and not elements. as none of them use array bracket notation or the get function to get or pass the underlying elements. which now that i look at it they should in addition.it may just be a communication problem and what i'm calling selectors is what you are calling elements? ultimately this matcher and tocontain just use .filter and .find under the hood. so they both should (by virtue of jquery). accept selectors or elements. totally down for whatever change. just want to make sure we're on the same page first. :),positive
velesin/jasmine-jquery,jasmine,2013-07-25T22:48:17Z,changed the name again because the name's too similar to the existing `tobeselected` so now it's `tobematchedby` which makes its intent clearer anyway.,neutral
velesin/jasmine-jquery,jasmine,2013-07-26T01:10:44Z,yes! perfect choice of name!! :+1:,positive
velesin/jasmine-jquery,jasmine,2013-07-26T12:35:56Z,thanks for the `jasmine.getfixtures().fixturespath = 'path';` tip. guys!,positive
velesin/jasmine-jquery,jasmine,2013-08-02T04:10:34Z,add support for jquery object equality. ### i would like to see support for testing the equality of jquery objects.currently. asking jasmine if two jquery objects are equal (through the function `jasmine.getenv().equals_(object1. object2)`) will fail even if those jquery objects are referencing the same dom element.this is annoying because it causes functions like `tohavebeencalledwith` to not work as expected when passing jquery objects as arguments.#### this pull request adds support for checking if two jquery objects are equal. as a result. functions like `tohavebeencalledwith` will work as expected when passed jquery objects.to be clear. a jquery object is typically something returned by `$('div')` for two jquery objects to be equal means that:- if objects with only one element are compared. both objects reference the same dom element. even if they have different selectors- if objects with many elements are compared. both objects reference the same set of elements. no more. no less,positive
ninjadev/nin,eslint,2016-11-09T21:22:31Z,switch jshint to eslint in frontend. eslint has more plugins (for angular for instance) and better es6 support than jshint,neutral
ninjadev/nin,eslint,2016-11-13T01:56:20Z,lint remaining backend files. the lint command in package.json is updated so that the eslint runs withbackend as cwd. this ensures that it loads the correct .eslintignoretemplates in the generate folder are ignored since they're not strictlypart of the backend. but templates for user projects.also. one lint error remains. but it's there because the feature isstill broken so i figured it serves as a nice reminder to fix thefeature.,negative
videojs/video.js,standard,2016-06-21T18:49:52Z,unfortunately. i'm unable to test this so cannot accept the changes. considering that google chrome will soon be disabling flash by default really soon. i don't think it's a huge loss.,negative
videojs/video.js,standard,2016-06-22T18:32:59Z,same issue. it happens when you use fastclick plugin or something like that (framework7 ect)so. the **solution is**: remove fastclick or just disable it on video container (better),positive
videojs/video.js,standard,2016-06-23T13:07:28Z,i wasn't using fastclick. and not having a fullscreen button wasn't an option for me. the way i ended up fixing it was making a slight tweak to video.js. the function vjs.player.prototype.requestfullscreen first checks if the browser supports fullscreen at the element level. and if not then checks if the native controls can go fullscreen. and then as a last ditch it stretches the video element to make it fullscreen. apparently on android it supports one of the first two conditions (i don't remember which. maybe both). but the fullscreen doesn't actually work. so. i removed the first two conditions. forcing it to stretch the video. and that worked like a charm. better still. it looks and works exactly the same on all platforms/browsers.,positive
videojs/video.js,standard,2016-06-23T14:53:47Z,the control bar is just a div element. you can modify it to  your hearts content using standard dom manipulation.,negative
babel/babel-loader,eslint,2016-09-07T15:51:03Z,that is an error from eslint. not from babel-loader. your linter config has likely not enabled support for es 6 modules.,neutral
babel/babel-loader,eslint,2016-09-07T15:57:51Z,it would be nice to have a eslint: babel: for errorsbut yeah since it has `1:2 error` it's definetely eslint,negative
jerairrest/react-chartjs-2,mocha,2016-11-19T15:16:18Z,rendering improvements. add lodash.isequal dependency and remove legacy codeadd mocha/enzyme/chai/sinon and remove jestadd spec and remove old spec,positive
prettier/prettier,eslint,2017-03-18T15:02:01Z,i realized class properties were missing their type annotation (it's incredibly how easy it is to miss such details when there are format changes as well) so this pr now also depends on eslint/typescript-eslint-parser#191,negative
prettier/prettier,eslint,2017-03-19T13:25:50Z,all prs to typescript-eslint-parser have now been merged and the tests are now passing!i am working on a new batch of tests but that will require some more prs upstream so i can delay those to another pr if you prefer.to help review i have avoided squashing the commits but when you feel fine i can do so. i would like to ask for ideas on a better commit message though :),positive
