angular/protractor,selenium,2014-09-26T14:24:42Z,protractor can't sync with the page after redirect. hello there.first. my tests were running smoothly before i finished refactoring the app no so long ago.now. i decided to update them and run again.and for some reason. after i submit the form. redirect to other page and then redirect back once again. protractor throws an error: ```error: error while waiting for protractor to sync with the page: {}"```but continues to perform tests regardless (:the strange thing is that he doesn't really wait for the sync. really. and the number of errors vary (but i haven't grasp the meaning behind this yet) between 1 or 2. despite the fact that i have a fair amount of redirects. not just two.sometimes instead of the regular unknown error i get```document unloaded while waiting for result```what baffles me is that the logic for redirects i wrote initially didn't change.if i remove all assertions about browser path. no errors are thrown.**bonus**after the tests are finished. another error pops up:```shutting down selenium standalone server.>> no "jasmine" targets found. warning: task "jasmine" failed. use --force to continue. aborted due to warnings.```,negative
angular/protractor,selenium,2014-09-30T07:01:01Z,yup i think rethinking the complete logic about using/starting seleniumserver and the direct option.because the current config for the seleniumaddress is also not that nice... (my opinion)i think the configuration/code can be easier.maybe more convention over configuration.if no seleniumaddress is set the driver without selenium is used.if set the seleniumaddress is used.and if people want a selenium server they can easy start it webdriver-manager start,neutral
angular/protractor,selenium,2014-10-03T22:42:49Z,hi folks.note that navigating to a data url at first is working as intended - tests should then redirect to your page. i think that these issues are something specific to your test setup since we are successfully running tests against chrome 36 on travis/saucelabs. could you share your configuration for how you're connecting to chromedriver (e.g. using `seleniumaddress`. `chromeonly`. etc?),positive
angular/protractor,selenium,2014-10-03T23:05:29Z,so if you're using gulp-protractor you aren't using webdriver-manager to start ie. correct? then you need to pass in that `-dwebdriver.ie.driver` in `config.seleniumargs`.i think everything else from the initial issue has been addressed. so i'm closing this.,neutral
angular/protractor,selenium,2014-10-10T10:32:41Z,beforedescribe function. hi guys!i've been looking around if there is such thing as a beforedescribe function (or any other way to register a function that is called before and after a describe is called).my use case is the following. i'm using shard un a selenium grid with about 15 machines and i want to print the ip address of the machine the test is running on. i have the code to do this and i could do it in each `it`function but sharding in protractor is done on a spec basis which is a better approximation than the `it`do you see any way to do this?thanks!,neutral
angular/protractor,selenium,2014-10-10T11:10:15Z,i've confirmed that this has worked out just fine!thanks guys for listening to me :),neutral
angular/protractor,selenium,2014-10-17T17:23:03Z,juliemr is not really that. basically running this from my pc works fine. the issue is when running under jenkins. how can we force protractor to log selenium issues ?,negative
SharePoint/PnP-JS-Core,uglify,2017-01-27T13:48:52Z,adrianchrobok if you take uglify out of the pipeline does it then again work? my question is that is this really a limitation with uglify not supporting es6. as noted in the thread i linked? if so there no actions for us to take. one solution would be to insert something like babel into your pipeline to ensure what uglify is getting is es5. which it can handle.,positive
tapjs/node-tap,mocha,2016-12-19T19:29:19Z,thanks for the explanation. that definitely makes sense. i believe that splitting the files is not always a solution though. e.g. you might have very few specs which take a very long time to run.i know the issue is closed. but i though of other way to do it and maybe the solution below would make you interested. basically `only` would be treated as syntax sugar for skipping all other tests.the idea is quite simple:- add a first pass test to see if any of the specs has `.only(` (simple regexp would probably be enough)- if it doesn't continue as usual- if it has then preprocess the test files with some simple static code analysis. e.g.input```javascriptvar t = require('tap')console.log('one')t.test('two'. function (t) {  console.log('two')  t.pass('this is fine')  t.end()})console.log('three')t.test.only('four'. function (t) {  console.log('four')  t.pass('also fine')  t.end()})```output```javascriptvar t = require('tap')console.log('one')t.test('two'. { skip: true }. function (t) {  console.log('two')  t.pass('this is fine')  t.end()})console.log('three')t.test('four'. function (t) {  console.log('four')  t.pass('also fine')  t.end()})```would this make any sense?,neutral
tapjs/node-tap,mocha,2016-12-19T19:38:32Z,emilos you can definitely write such a thing without making any changes to node-tap.  you don't need my permission. but you have my blessing :)i'd recommend _not_ using a regexp.  consider this program:```jsvar o = 'only't.test[o]('only run this'. fn)```,neutral
tapjs/node-tap,mocha,2016-12-19T19:44:49Z,haha. thanks. i'd probably ignore cases like that. the first pass test would simply check if it makes any sense to make the static code analysis that would check it properly :) - it would be expensive to do it for every test file. it was worth asking anyway. thanks for your time!,positive
tapjs/node-tap,mocha,2016-12-20T19:18:28Z,with tap. the general way to run a specific test. is to split that test out into a different test script.,neutral
jquense/yup,eslint,2017-03-28T18:20:37Z,possible to add an alternate style instead of '${val}' in message strings. i was just curious if there is any possibility of changing (or adding an alternate style to) the way inserted values are used in yup message strings. my linter complains to no end because `'${}'` is not a valid template string and is often times considered a bug. eslint expects `${}` to only be used in template strings. but with yup. using `${}` inside a normal string is standard practice. i understand changing or adding an alternate ability to a lib simply to appease a linter error is crazy. but its `eslint`/`standard` which is a very common linter and i am sure other people have this problem as well.just curious if anyone else has this issue and if adding an alternative style would be considered by the maintainer.,negative
balderdashy/sails,mocha,2012-12-23T12:56:39Z,this is nearly there- needs to be tested.  also. an option needs to be added to allow users to encapsulate even the reduced set of stuff that's being kept global.  this makes for more annoying. less readable app code. but it would be nice for people who care about this sort of thing (and automated testing suites that complain about this sort of thing. _cough_ mocha _cough_),positive
koding/kd,karma,2014-03-20T19:54:46Z,test automation. #### what does it do?adds [karma]() for automatically running tests locally (chrome and firefox) and remotely on saucelabs (chrome. firefox. ie9. ie10).also updates the parts of the gulp build that were causing trouble with karma (in particular slow builds using deprecated gulp-browserify plugin.)#### where should the reviewer start?readme.md and gulpfile.coffeeyou'll also need to `npm install` since there are new dev dependencies#### how should this be manually tested?take a look at additions to readme.md. then run karma locally and on sauce. if you can't get this up and running from the readme instructions is means that i have more work to do! and don't forget to nuke your node_modules directory before you `npm install` if you want to get rid of extraneous modules.,neutral
koding/kd,karma,2014-03-20T22:28:46Z,tests for kdbuttonbar component. #### what does it do?- another unit test example with stubbing and spying- cleans up some dead test code that's not being run- adds a gulp helper for running the test suite in "run" mode (as opposed to the default "watch" mode)#### where should the reviewer start?`buttonbar.test.coffee`#### how should this be manually tested?`gulp run karma`,negative
systemjs/systemjs,mocha,2016-08-04T11:08:55Z,thank you.ah ok i understand. then i have to do a``` jsconst mocha = new mocha({  ui: 'bdd'});mocha.run();```and everything works  but one little question: how do i import `describe` and `it` and so on? a `import { describe. it } from 'mocha'` does not work (`undefined`). if i write `describe` as before without imports (as globals) it complains that it can not find it.,negative
systemjs/systemjs,mocha,2016-08-04T11:57:08Z,hmm ok. that's not working as well   i tried a``` jsrunner.suite.emit('pre-require'. global. 'global-mocha-context'. runner);```but where does the variable `global` came from? my browser tells me that it can not find it (`global is not defined`).,negative
cerebral/cerebral,standard,2015-08-14T13:52:13Z,thanks for the input a-s-o. you definitely make a valid point!what we could do though is make the implementation flexible. but lock the api for the official packages. so if you create your own custom package you can use whatever mutation methods you want. but. the official cerebral-packages share a common mutation api to make it easy to change model-layer.so pstoica could build a custom immutable-js controller for the specific project or share on github. with mutation methods fitted for immutable-js. but the official `cerebral-immutable-js` project has the standard "set. push. pop" etc. methods.,neutral
cerebral/cerebral,standard,2015-08-14T16:09:15Z,hey all! definitely wanted the first feature as soon as i copied over the react helpers. i did need a custom `shouldcomponentupdate` using `immutable.is` since i decided to pass the immutable objects to components without serializing with `tojs` (useful when dealing with larger objects as props). so there could be some cross-cutting concerns between the model and view layers.for the second. it could be good to have a consistent mutation api for the official packages and leave room for custom hooks. on the other hand. if we already select and receive data differently in the view layer. maybe it's okay for hooks to vary officially.immutable has its own gotchas that you should probably be familiar with if you choose it. for example:- `immutable.map().set('a'. {b: 1})` will have the plain. mutable object in 'a'. `merge` will actually turn it into an `immutable.map`. if example cerebral code uses set with a plain object. i'm not sure if that code should be portable or if the adapter needs to call `fromjs` or something.- you might also have different function names and signatures between immutable methods and cerebral methods. for example. immutable's `setin` already takes a path. which might make cerebral's `set` confusing.- immutable has some mutators that take functions. these won't be serializable. but there should be a way to warn if you try to use them. however. `updatein` is the most generic way to update a path. and there could be a way to make that serializable. e.g. `state.updatein(['a'. 'b']. 'pop')` would call `.pop()` on the item at that path.would typechecking be the proper solution for mutation hooks. just like in `output`? i'm starting to think cerebral should focus on making mutations serializable/deterministic without worrying about standardizing them. if we do that. the cerebral controller could easily passthrough the defined hooks to the immutable methods.i can try to come up with more immutable vs standard cerebral differences later if that would help more.,neutral
brave/browser-laptop,codecov,2017-07-17T09:13:53Z,nejczdovc (sorry for delay)you can customize how codecov behaves:```yamlcodecov:  notify:    # after_n_builds: 1  # notify after n builds (default null)    # wait_for_ci: yes  # disable waiting for ci (default: yes)    require_ci_to_pass: no  # require ci to pass```,neutral
brigand/babel-plugin-flow-react-proptypes,eslint,2016-03-25T08:38:27Z,yeah. oh so maybe related to the fact that i use babel-eslint?,neutral
brigand/babel-plugin-flow-react-proptypes,eslint,2016-04-14T20:21:54Z,project cleanup:. just minor things:- require() -> import- var -> let/const- hoisted most of makeproptypesast- minor var name / spelling consistency changes- removed console.error() lines in favor of throwing a more detailed  error. console.error() unfortunately gets lost way up the terminal.- added eslintrc,negative
brigand/babel-plugin-flow-react-proptypes,eslint,2016-04-14T20:28:46Z,thanks! :-),positive
strongloop/microgateway,mocha,2016-10-12T18:17:45Z,cb - lgtm. i did not spend too much time trolling thru the mocha tests. please get approval from danbadt before merging to `develop`.,positive
dadi/api,standard,2016-04-08T06:11:47Z,publish fields as standard. ### expected behaviorbake in publish state. date. expires date. publisher as standard.,neutral
agershun/alasql,mocha,2015-04-17T09:13:18Z,tonight i will try to fix one of the found bugs. and describe a process. how i run the test. how i find the bug in the log file. how create new mocha test. and how fix it. hope. it will help us to make this process easy.thank you for the great work you have done!,positive
kybishop/ember-attacher,eslint,2017-08-26T23:59:33Z,chore(follow eslint with ember-suave),neutral
ember-cli/ember-cli-mocha,mocha,2016-08-11T19:40:06Z,remove "ember-qunit-notifications" from "bower.json". the `ember-cli-mocha` blueprint should remove the `ember-qunit-notifications` dependency from the `bower.json` file after it is installed. unfortunately there is no ember cli function for that. but it should be reasonably easy to implement.,neutral
ember-cli/ember-cli-mocha,mocha,2016-08-14T19:35:45Z,yup. seems like a duplicate to me.  i suppose the functionality should actually exist in `ember-mocha` instead.  i'll close this in favor of that issue. since we're looking for the same thing.,positive
electrode-io/electrode,uglify,2017-03-29T17:10:26Z,gulp build broken. very easy to reproduce on my machine :- generate an electrode project using ```yo electrode```- test various gulp commands. like ```gulp dev``` or ```gulp build``` : everything should work fine- delete the node_modules folder then regenerate it using ```npm install```- test now ```gulp build``` : the build will fail at the very end. on uglifyjs (error : ```gulpuglifyerror: unable to minify javascript```)- the consequence : the project cannot be build or rebuild using ```gulp build``` anymore. it is like "dead".it is not a little one but a very annoying one : it prevents me for example to build my electrode project in our wercker ci/cd pipeline. since i'm doing a ```npm install``` step to rebuild the node_module folder in wercker.yml.,negative
electrode-io/electrode,uglify,2017-04-04T17:57:56Z,we will take a look and update you,neutral
electrode-io/electrode,uglify,2017-04-05T21:38:20Z,looks like if you use the plugin `transform-runtime` you need to use the array syntax and do this: `["transform-runtime". { "polyfill": false }]`.  once i did that my minify worked fine.  just need to test to make sure it still works.,neutral
electrode-io/electrode,uglify,2017-04-06T17:50:04Z,hi cross311 : where are you facing this issue? during gulp build ?,neutral
electrode-io/electrode,uglify,2017-04-06T18:33:22Z,we did not face it until we started doing `export * from './some-file';`  the transform-runtime babel plugin creates the dist file with an `import` for a polyfill and uglify does not support import. animesh10,neutral
electrode-io/electrode,uglify,2017-04-06T18:44:06Z,animesh10 we did not experience it on initial download of the stuff. but everyone will run into it if they have index files where they export folders.,neutral
electrode-io/electrode,karma,2017-06-05T19:31:44Z,archetype-react-app: [minor][feat]chrome headless. deprecate phantomjs. use chrome headless.use phantomjs as default for users and adding chrome headless as an option.if the user specify the `enable_chrome_headless=true`. will use chrome headless for karma runner. otherwise loads phantomjs as default.,positive
electrode-io/electrode,karma,2017-06-05T23:06:39Z,.,neutral
electrode-io/electrode,karma,2017-06-12T21:57:43Z,please rebase to latest,neutral
electrode-io/electrode,karma,2017-06-14T00:47:05Z,electrode-archetype-react-app-dev: [patch][chore] allow webpack config to override test entry point. my goal here is to co-locate my test files with my components. something i thought was possible with electrode but it must have changed at some point.  my solution is to make the test entry file overridable via the webpack config. it's worked for my case. and gives me a ton of control over my testing environment which is very valuable to my project.  based on the naming of the webpack parital `test-entry.js` my assumption is that this was the intention of the webpack config file. but it doesn't look like it's being applied properly in the `karma.conf.js`.is there a reason that the test entry file is hard coded? this is quite limiting. but if there's an alternative way you'd suggest overriding the entry file i'd be interested to hear the approach.,negative
electrode-io/electrode,karma,2017-06-14T01:03:36Z,thanks for the pr.  yes. the change makes sense.  could you rebase to the latest please?,positive
electrode-io/electrode,karma,2017-06-14T01:54:14Z,pr updated with the latest from master,neutral
electrode-io/electrode,karma,2017-06-14T16:49:51Z,jchip do you know why the tests would fail for this. i'm struggling to get them running locally on master. i'm not sure why they're failing,negative
Polymer/polymer,eslint,2017-04-04T06:37:16Z,baocang try to put this line into your `.eslintrc.json` ```"root": true ```by default. eslint will look for configuration files in all parent folders up to the root directory. not sure if this is that case. but such a behavior can sometimes lead to unexpected results like this.,neutral
Polymer/polymer,eslint,2017-04-14T19:20:05Z,add eslint for jsdoc and fix issues,neutral
Polymer/polymer,eslint,2017-04-14T19:43:42Z,oeh fancy. til. nice linting :clap: :clap:,positive
angular/angular-cli,mocha,2016-01-28T20:10:08Z,i was playing with testem and noticed that mocha and other testing stuff is injected via cdns. so i thought angular2. rxjs and system could also be injected via cdns. if so. i believe we can do `ng new test-project --skip-npm` before running e2e tests. i don't know. maybe this is a bad idea.,negative
angular/angular-cli,uglify,2017-03-31T03:48:05Z,how to uglify when use 'ng build'. ### how to uglify when use 'ng build'i use ng build.the vendor.bundle.js size is 6m!which options i can use?,neutral
angular/angular-cli,uglify,2017-04-06T04:38:10Z,ishitatsuyuki  got it,neutral
lovell/sharp,standard,2016-07-09T00:08:59Z,lovell i tried a couple of methods of finding a pointer that is constant between the constructor and `handleokcallback`. and didn't find something that worked. in 4c7f339 i made the mistake of not passing the buffer by reference. but fixing this. it appears that the iterator object is actually declared on the stack (from the memory address) and differs between range loops while the buffer element is on the heap. i wasn't aware that that's how c++11 range loops worked -- so i learned something. in e2cda35. i expected going to a standard for loop over the length of the `std::vector`. and getting the address of the vector element to work. however. it seems the referenced object has been copied at some point. i realize there is some ambiguity about which vector is being referenced in the constructor due to the class member `savebuffers` having the same name as the constructor argument. but i changed the names and the pointers still differed. i'm not sure if this has to do with some obscure fact of a `local<object>` object. or copying `std::vector`s but i couldn't find a solution and i'm out of time for tonight. the most recent commit goes back to the `buffercontainer` method of filling the vector.i think this is going a little off topic from the boolean operator. can we merge this one. and then work out a better system for passing in buffers to be saved in a later commit?i would like to be able to reference this mechanism. whatever it is. in a future commit to pass buffers in for other operators that take images.,negative
cssinjs/jss,karma,2015-10-21T23:13:21Z,rewrite tests. - mocha + expect.js- karma + chrome- runnable html file- codeship- browserstack. see react-router,neutral
cssinjs/jss,karma,2015-11-12T16:58:58Z,done,neutral
twitter/cli-guide.js,jasmine,2015-05-26T04:07:53Z,travis ci integration. i would like to add travis ci for run jasmine test.,neutral
bbc/bbc-a11y,standard,2016-11-04T08:28:49Z,summarise coverage of each standard. it would be helpful to summarise what is covered wrt each standard. without having to dig into the cucumber scenarios. just something more terse.,positive
aksonov/react-native-router-flux,eslint,2016-09-30T12:14:28Z,alexicum thanks. could you fix eslint errors to pass circleci check?,positive
aksonov/react-native-router-flux,eslint,2016-09-30T14:17:50Z,aksonov fixed eslint errors. but tests failed: could you check what's wrong with them?,negative
photonstorm/phaser,jshint,2013-10-28T09:54:55Z,coding conventions and jshint. currently phaser's source code is a bit messy (imho) since there is no strict coding conventions. i will not dig into the source code to expose examples but here is some common issues:- line endings (some files contain crlf)- indentation (some files mix in tabs and spaces. variable tab lengths)- brackets position (same or next line)- etc...what about adding a linter such as codepainter or jshint to phaser's build in order to make the source code uniform between each files?,neutral
photonstorm/phaser,jshint,2013-10-28T10:02:17Z,:+1: +1 always worth doing,neutral
photonstorm/phaser,jshint,2013-10-28T10:11:55Z,eventually yes. but there are far more important things to be doing at the moment.,neutral
strongloop/strong-globalize,eslint,2016-01-06T04:57:43Z,you had trailing whitespace. but eslint doesn't check for that apparently. i thought it did. but yes. your eslint is fine.,positive
npm/npm,standard,2014-12-22T21:02:41Z,othiym23 i think having style standards would definitely be good and beneficial for future contributors and scaling. i look forward to seeing a discussion on such (i don't feel i should be apart of it since i have not contributed in any means to this project other than through usage of npm).  thank you for your input on this pr though.,neutral
npm/npm,standard,2015-01-03T22:38:22Z,i'd argue this should be opened again. at least for how the behaviour differs from windows for example. for what's essentially the same semantic (running global installs as admin).i have been using npm on windows for years. when i got my first macbook pro and installed node then tried to install my first global package i just halted.it should be standardized whether global packages are meant to be global within the same user profile (which makes most sense especially in hosted environments). or machine wide. this shouldn't change per os (or at least be documented in npm install or npm folders documentation sections).thanks a lot for reading this feedback. and for making npm in the first place.,negative
mishoo/UglifyJS2,uglify,2012-11-12T19:53:07Z,do the source map generated by uglify not work for you?,neutral
mishoo/UglifyJS2,uglify,2012-11-21T16:02:53Z,it might just work without `-f` actually. i've not tested.  it would be great if you could also deprecate the `uglify-js2` package in npm.  just run:```npm deprecate uglify-js2 "you can now install this using `npm install uglify-js -g`"```i would then suggest giving it about 6 months before unpublishing it completely:```npm unpublish uglify-js2```,positive
mishoo/UglifyJS2,uglify,2012-11-22T00:56:22Z,it just needs to be changed to `npm install uglify-js1 -g`,neutral
mishoo/UglifyJS2,uglify,2012-11-23T22:51:32Z,--wrap does not work without --export-all. output is:c:\webgl\node_modules\uglify-js\lib\ast.js:310                    to_export.foreach(function(sym){                              ^typeerror: cannot call method 'foreach' of undefined    at object.before (c:\webgl\node_modules\uglify-js\lib\ast.js:310:31)    at ast_node.transform (c:\webgl\node_modules\uglify-js\lib\transform.js:62:35)    at c:\webgl\node_modules\uglify-js\lib\transform.js:81:25    at doit (c:\webgl\node_modules\uglify-js\lib\utils.js:114:23)    at map (c:\webgl\node_modules\uglify-js\lib\utils.js:140:52)    at do_list (c:\webgl\node_modules\uglify-js\lib\transform.js:80:16)    at c:\webgl\node_modules\uglify-js\lib\transform.js:169:21    at ast_node.transform (c:\webgl\node_modules\uglify-js\lib\transform.js:66:21)    at c:\webgl\node_modules\uglify-js\lib\transform.js:173:43    at ast_node.transform (c:\webgl\node_modules\uglify-js\lib\transform.js:66:21),negative
mishoo/UglifyJS2,uglify,2012-11-25T17:04:32Z,food for thought. i upgraded to v2 on accident on an old project and wasted an hour because i was looking at examples from the v1 github page. luckily i read the readme closely and found the right thing to do. for an hour i had no idea why require("uglify-js").parser was returning nothing,negative
mishoo/UglifyJS2,uglify,2012-11-25T19:48:41Z,yeh. i think that argues in favour of merging the github repositories.  you could also provide helpful warning messages when people call methods from the old uglify-us.,positive
