bower/bower,mocha,2012-10-17T06:53:50Z,yeah i'm open to it for sure,neutral
bower/bower,mocha,2012-10-17T07:58:40Z,fat this is kind of easy to implement and i can tickle around and make a prstill should it be named devdependencies or optionaldependencies? see jamesarosen comment,neutral
bower/bower,mocha,2012-10-17T17:09:07Z,i see. i was not familiar with the optionaldependencies option in node.still i think we should give priority to devdependencies and implement optionaldependencies later on.,neutral
bower/bower,mocha,2012-11-06T07:09:06Z,+1,neutral
redux-saga/redux-saga,uglify,2017-06-15T16:43:30Z,what do u use to transpile generators? it doesnt look quite like the default `regenerator-runtime`. anyway - its not `redux-saga` issue but rather typescript compiler thing and should be reported there.dead code can be found in numerous places. in nearly every big framework like react and probably angular too - there are often different code paths for prod and dev builds and its a job for tools like uglify js to get rid of this (as its unreachable).,neutral
jprichardson/electron-mocha,mocha,2016-03-07T18:14:41Z,inukshuk thanks for the reference! i'll have a look. but at a quick glance i have the feeling this is not going to turn out well... i'm trying to add coverage for non-commonjs files to be tested in the renderer. and already had to hack electron-mocha to pass source files with globals.,negative
badunk/multer-s3,standard,2016-01-27T04:19:05Z,looks great!thanks for adding standard,neutral
serverless/serverless,eslint,2015-11-07T07:52:26Z,dev-dependencies included in packages. there are many dev modules such as eslint and gulp that have dozens of dependencies. listing each of them for each lambda in the excludes is not ideal.an `includepatterns` would help a lot. as would blob matching as opposed to regexp,neutral
serverless/serverless,eslint,2015-11-07T08:21:19Z,as a workaround. i'm using:``` "excludepatterns": [   "node_modules/(?!jaws-core-js|dotenv)[a-za-z-]+" ]```,neutral
serverless/serverless,eslint,2015-11-11T19:22:01Z,this is only a problem when turning off browserify.,neutral
airbnb/javascript,eslint,2015-10-30T16:04:15Z,eslint: fix `no-mixed-spaces-and-tabs` turn off. currently the way the rule is defined. mixing spaces and tabulations inindentation is allowed. however. the comments and documents seems to saythe opposite.this patchs turns the rule on so mixing spaces and tabs is not allowed.fixes: #539,neutral
airbnb/javascript,eslint,2015-11-03T16:37:22Z,why is babel-eslint required?. eslint supports all of es6 plus the experimental object rest/spread that react uses. is it possible to remove babel-eslint as a dependency? (it would make linting faster.),neutral
airbnb/javascript,eslint,2015-11-03T22:16:53Z,support for what?,neutral
airbnb/javascript,eslint,2015-11-03T22:23:43Z,> all of es6 plus the experimental object rest/spread that react uses,neutral
airbnb/javascript,eslint,2015-11-08T19:30:34Z,ljharb do airbnb not use e.g. es7 extensions at all?while eslint might cover all of es6. it doesn't seem to cover things like class properties and async/await (maybe just with arrow functions?) that people actually use.,neutral
airbnb/javascript,eslint,2015-11-08T20:27:15Z,taion no. airbnb does not use any es7 extensions at all - only things that are in the spec (stage 4 for post-es6 stuff).,neutral
airbnb/javascript,eslint,2015-11-08T21:02:44Z,fair enough. do you think an `airbnb/babel` would fit here?,neutral
airbnb/javascript,eslint,2015-11-09T00:47:02Z,since we don't use `babel-eslint` internally anymore. i'm not sure what the purpose would be - you can add it as a parser to your own `eslintrc` that extends our config. and you can define any rules you like in there?,neutral
airbnb/javascript,eslint,2015-11-09T01:14:12Z,that's what i ended up doing - same ruleset. just needed eslint to not choke on es7 features (they weren't getting linted in any particularly interesting way anyway).,negative
airbnb/javascript,eslint,2015-11-15T00:38:18Z,`npm install -g eslint` (note that --save and --save-dev don't apply to global installs),neutral
airbnb/javascript,eslint,2015-11-15T00:41:16Z,i did that already. same problemnpm install -g --save-dev eslint-config-airbnb babel-eslint eslint-plugin-react eslint,neutral
airbnb/javascript,eslint,2015-11-16T21:49:04Z,this seems like something eslint should be handling - `require.resolve` is something that generally shouldn't be done outside of bundling tools.,neutral
airbnb/javascript,eslint,2015-11-17T20:20:26Z,the tests of this repo itself pass (e.g. running `npm test` in `packages/eslint-config-airbnb`).,neutral
jashkenas/backbone,eslint,2015-06-24T15:43:25Z,> it's already set up. we could use eslint. like underscore. too though.yeah but we don't run it through ci and haven't updated it in a long time,neutral
kangax/fabric.js,jshint,2012-10-14T00:58:07Z,i commited the cleanup. now if you `npm install jshint` and then run `jshint src`. you can lint changes (patch. addition. etc.) against our ruleset before submitting. should make contribution and code reviews easier.,negative
chaijs/chai,mocha,2012-07-28T00:28:27Z,add check for dom objects in util.inspect().. serializing was very slow before the patch.visionmedia/mocha#525,neutral
chaijs/chai,mocha,2012-07-29T06:53:13Z,reduce test error output in node console. is it possible to reduce test output in node console?use case (i use chai.js with mocha.js): i have a huge object and expect it to have some property. if the property is not there. mocha spec reporter outputs in a console red error:expected {.. huge object on multiple screens... } to have proper ..huge error message. but i'd rather see just line about an error and some info that would allow to identify whats happens but not huge redundant output.,negative
chaijs/chai,mocha,2012-08-02T08:30:11Z,that would be great i believe.,positive
chaijs/chai,mocha,2012-08-07T05:02:50Z,made a few more tweaks to it. it will only kick in if the inspection string exceeds a length. might need tweaking in the future but its been incredibile helpful for now.,positive
velesin/jasmine-jquery,jasmine,2013-03-27T22:16:08Z,add tohavebeentriggeredonandwith jasmine helper. jquery's `trigger` method allows us to pass extra parameter as an object or array in addition to an event name.this pr adds `tohavebeentriggeredonandwith` function that checks if a given event is triggered on expected jquery object with expected extra parameter.,neutral
videojs/video.js,standard,2016-03-07T19:59:14Z,my initial thought was that i think this probably falls inline more with a plugin or custom implementation. not core. this feels pretty similar to the argument for showing the big play button and poster at the end of a video...not a bad idea at all. just not "core".that being said. this feels pretty standard these days for "custom" players. the only real argument against is that this isn't the video element's behavior. but it feels like we've strayed pretty far from that policy of late.,negative
videojs/video.js,standard,2016-03-07T21:54:06Z,any update on this pr? any eta?,neutral
videojs/video.js,standard,2016-03-08T21:51:14Z,yep. for testing i just copied the standard oceans track and called it chapters.,neutral
expressjs/express,mocha,2012-09-10T19:42:17Z,the boilerplate issue is more a problem of getting your own conventions together. which in itself is not a concern for such a framework. it's easy to have a local template. or a template you host on github etc. "newbies" would of course naturally have a more difficult time at this until they get used to the community and try out what they like (vows. nodeunit. mocha. mongoose etc). express isn't the right tool for just having generic crud sites up as quickly as possible. that's what rails / drupal and others are for. and in my opinion the rails structure is terrible. it's effectively anti-modularity,negative
SassDoc/sassdoc,coveralls,2016-08-16T20:23:07Z,coveralls u drunk?,neutral
docpad/docpad,standard,2013-11-09T16:03:31Z,i'd certainly want to get as much stuff from the docpad core into modules as as possible. though for plugins that's a different choice. let me explain.things like routing (and perhaps even growl notifications in hindsight) are part of a core experience of docpad. our default routing can be turned off by the setting `extendserver: false` in your docpad configuration file. allowing you to over-ride it with what you want. the same applied to growl notifications. by setting `growl: false`. you get no notifications.the issue with putting these things into plugins. is that then it means they are optional. and optional things means that they have to be installed. things like routing. are definitely part of the core experience one would expect. whereas things like eco rendering. contact forms. aren't part of a core experience.we should probably formally define what the core experience is somewhere. but that would be digressing for now. for now. let's define it as "sensible defaults".in terms of the architecture though. modularisation of the core makes a lot of sense. tightly integrated. well tested. swappable. re-usable. units of code. versus our big monolithic current structure. is clearly beneficial. however. a pluginfied core. not so much.i've been thinking about ways to abstract different parts. and it could work like this;- core experience  - docpad cli module  - docpad core module    - docpad generate module    - docpad plugin module    - docpad file model & collection module    - docpad block model & collection module  - docpad watching plugin  - docpad growl plugin- extra experience  - renderer plugins  - helper plugins  - importer plugins  - interface pluginsthis way. applications just wanting to use docpad as a rendering engine (a common. but incredibly underplayed use case of docpad) could be accomplished by a `npm install --save docpad-core`. whereas. the standard docpad experience we have now. would be the same `npm install docpad`i thought about having global plugins solve some of this problem. but that is another issue. with it's own precautions.-,negative
docpad/docpad,standard,2013-11-28T20:11:34Z,if i understand correctly. #404 is saying the opposite of what i'm suggesting here.  the primary goal behind the suggestion here is to have a standardized home for all resources that come with skeletons. so that we always know where to look for resources. effectively making the skeleton identical as far as resource taxonomy goes.from 50k feet the node community seems to be going through all the stages the java community went through before maven.  we have grunt. cake. etc. that give each project designer a great deal of flexibility in terms of project layout and processing.  so each time we checkout a new project. we have to come up to speed on the tasks for processing the project and the layout of various resources.  maven standardized this for java. and now almost all java projects use maven.,positive
Leaflet/Leaflet.draw,karma,2015-10-18T15:33:33Z,add contribution guidelines. add details to the readme on how to contribute to the project including:- installing and running `jake` for building the project```npm install jakenpm install jshintnpm install uglify-jsjake build```- installing `karma````npm install karmanpm install karma-phantomjs-launcher```- how to execute specs using `karma`?- what else do contributers need to know?,negative
FezVrasta/popper.js,sauce,2016-08-12T09:36:01Z,ok switched to saucelabs and it's much better! i've integrated the multi browser test on the `v1-dev` branch and it currently passes on edge and chrome. there are 5 failing tests on firefox that i'm investigating.gonna add safari soon.,negative
linkedin/dustjs,jasmine,2012-07-18T20:11:35Z,do we want to create a separate npm module for: core. helpers. and grammar. this would effectively decouple peg.js grammar changes from core dust and helpers?,neutral
linkedin/dustjs,jasmine,2012-07-18T22:15:43Z,grammar was part of core. so i would keep them together. helpers are just extensions ..,neutral
linkedin/dustjs,jasmine,2012-08-08T17:06:46Z,i am going to add the jasmine-test,neutral
angular-fullstack/generator-angular-fullstack,mocha,2014-02-13T21:44:28Z,added a branch for mocha tests.,neutral
angular-fullstack/generator-angular-fullstack,karma,2014-02-13T20:14:44Z,it looks like the generator-karma pull request was merged & closed. is this ready to go now?,neutral
angular-fullstack/generator-angular-fullstack,karma,2014-02-13T20:37:32Z,that'd be great. even if you want to put it in a github branch so we can see the general approach and start migrating (if necessary) our backend tests to that format.,positive
angular-fullstack/generator-angular-fullstack,karma,2014-02-17T02:38:32Z,+1 look forward to release.,neutral
Reactive-Extensions/RxJS,standard,2013-01-31T22:53:10Z,you mean having a function which returns a random number?  you could tackle the eagerness by using the rx.observable.defer method. or if it's a standard function. you could use the rx.observable.start method.,neutral
rwaldron/johnny-five,jshint,2016-01-29T01:02:08Z,will go and fix the jshint errors,neutral
webpack/webpack,standard,2016-03-25T19:53:07Z,it would be nice if there were standards support for a "weak reexport" that would say "i'm exporting this thing. but it doesn't need to be evaluated unless someone uses it".  this would not change the semantics of loading except that a loader _could_ use it as a signal to do more aggressive optimization.  nothing prevents loaders from evolving this on their own as a comment or annotation or external configuration. but if there's value to it then having it in the language instead of being loader-specific would be better for everyone.obviously. if a naive weak reexport targets a module with default side-effects then you might see inconsistent behavior. but i don't think that risk means that a well-structured library like `lodash-es` shouldn't have the option to declare its own safety.  in systemjs where all this happens in the browser. it's rather important that reexports _not_ be eagerly fetched. but there's no way to avoid that today without drilling down to the individual files (`import {x} from 'lodash-es/x'`) which is quite a bit less pleasant syntactically than plucking names out of a single lodash import (`import {x.y.z} from 'lodash-es'`).  webpack doesn't have to be as concerned with when/if the dependency gets fetched (not that reading hundreds of lodash modules that it doesn't need to is a great thing). but it still would benefit from a clear signal that it can exclude something from the bundle.,negative
webpack/webpack,uglify,2017-08-23T21:15:10Z,just tested with the beta uglify plugin and the issues seems to have gone away. will monitor a bit more before closing this.,neutral
webpack/webpack,uglify,2017-08-26T12:21:56Z,**this issue had no activity for at least half a year.**it's subject to automatic issue closing if there is no activity in the next 15 days.,neutral
webpack/webpack,uglify,2017-09-01T21:19:45Z,thank you so much for the report. would you be able to provide a minimal reproducible repo that we could use to bake into our tests and uglifyjs-webpack-plugin tests//cc d3viant0ne,positive
hellyeahllc/exim,eslint,2015-07-09T20:50:21Z,eslint tidy up. i thought some eslint might be nice for exim too. so i've hooked it into the build process.,positive
hellyeahllc/exim,eslint,2015-07-12T18:05:50Z,made the changes suggested... browserify externals seems to work ok too - though you might want to check that in production code....,neutral
hellyeahllc/exim,eslint,2015-07-13T06:02:03Z,awesome!,positive
acuminous/yadda,mocha,2015-02-15T10:00:00Z,i think changing your steplevelplugin initialisation line to``` jsyadda.plugins.mocha.steplevelplugin.init({container: global});```should do thie job,neutral
acuminous/yadda,karma,2015-09-23T06:47:08Z,nothing from my side. i haven't used karma and am not finding much time to investigate,neutral
acuminous/yadda,karma,2015-09-23T16:55:02Z,semblant is there any critical feature you are missing by disabling async for fetching the feature files? in my case. i think i either had to disable async or write some custom karma or yadda plugin. and the former option is the easiest the quickest. besides. i didn't miss much by doing so.,negative
acuminous/yadda,karma,2015-09-27T04:34:21Z,is there any interest in a pr to merge my project as an example to show how to use this with karma if using sync ajax to load the feature files is acceptable?,neutral
prebid/Prebid.js,standard,2017-06-12T13:50:03Z,some of the adapters support defining the referring url. documented or not. e.g. both rubicon and appnexus support passing bid.params.referrer from the adunit.perhaps you could check the code for the adapters you're using and try passing the referrer param for any that support it?instead of having to pass this in for each bidder. we should be able to add referrer to the standard bidrequest. it would still be up to the adapter to use it.,neutral
prebid/Prebid.js,standard,2017-06-15T02:21:17Z,mjacobsonny - is this the way we want users to be able to override the standard ad server keys in the long run? e.g. to set hb_deal_rubicon. we'd instruct the publisher to turn off enablesendallbids() and turn on alwaysusebid for all bidders. this seems counter-intuitive. questioning the meaning of enablesendallbids.,neutral
melonjs/melonJS,jasmine,2013-10-15T06:29:33Z,buffer-overflow i will then wait if you don't mind until a small update with the npm/jasmine update before merging this :p,neutral
melonjs/melonJS,jasmine,2013-10-20T22:25:45Z,also excited to see jasmine come in. i was actually thinking about it recently. the addition of unit tests to the code base.,positive
tjunnone/npm-check-updates,mocha,2015-02-10T14:30:21Z,yes. this is done. turns out the more complex gulp regex i provided doesn't work because of some bash escaping issues. it should be `npm-check-updates -f '/^(?!gulp-).*$/'`. i'll update the readme. thanks!,positive
tjunnone/npm-check-updates,mocha,2015-02-10T14:31:41Z,okay. thank you. ;),positive
nodejs/citgm,eslint,2015-10-30T22:10:17Z,lint: add linter and get project to pass ruleset. this commit adds eslint as a dev-dependency and a basic .eslintrcchanges were made across the entire project to have it pass the linter.,neutral
nodejs/citgm,eslint,2015-10-30T22:10:23Z,/cc jasnell,neutral
nodejs/citgm,eslint,2015-10-30T22:11:52Z,rubber stamp lgtm!,neutral
nodejs/citgm,eslint,2015-10-30T22:14:42Z,landed in 2a46931,neutral
babel/babylon,eslint,2016-05-05T17:18:58Z,please accept this pr. as i am running into the issue mentioned in eslint/eslint issue #6090,positive
san650/ember-cli-page-object,mocha,2016-07-22T16:01:50Z,thanks for reporting the error. i'll take a look at it.i don't use mocha with ember a lot. so i'm not too familiar with what changes when calling `before`. what happens if you call `visit('/foo')` from the `before` hook? does the ember test helper exists?,negative
Automattic/mongoose,eslint,2015-09-15T22:38:26Z,lint for spacing. used `eslint . --fix` to resolve the warnings automatically :smile:,positive
Automattic/mongoose,eslint,2015-09-16T17:46:16Z,can we make it so that `function() {}` is the accepted convention instead of `function () {}`. no space between function and `()`?,neutral
Automattic/mongoose,eslint,2015-09-16T18:01:51Z,vkarpov15 absolutely!updated the configuration and the code.,neutral
pouchdb/pouchdb,selenium,2013-06-21T18:17:26Z,travis has been disabled. i will be manually testing pr's and as time goes on automating the process bit by bit until we get back to a full ci setup (but with selenium on a dedicated box),neutral
lodash/lodash,uglify,2012-08-22T14:34:37Z,is there a reason you went with closure compiler over uglify. which can be managed with npm? it's the main thing adding size to the project.,neutral
lodash/lodash,uglify,2012-08-22T14:41:44Z,> is there a reason you went with closure compiler over uglify. which can be managed with npm? it's the main thing adding size to the project.yep. closure compiler has consistently produced smaller file sizes. i use a mixed minification approach where i do a pass with uglify. then one with closure compiler. then a hybrid of closure compiler+uglify (usually the smallest result). i don't rely on npm dependencies because i want lo-dash to work out-of-the-box from a github repo. npm. jamjs or wherever. why is file size really an issue?,neutral
angular/protractor,jasmine,2015-09-24T22:37:20Z,sjelin you are talking about jasmine but i use `chai.js`,neutral
angular/protractor,jasmine,2015-10-05T14:53:08Z,suggestions on a test framework/runner for angularjs protractor test with api tests . hi i am writing testcases to test a website built in angularjs .i want to test frontend as well as api endpoints . i am using protractor to test the angularjs based frontend  and have given a  try on frisby which is a rest api testing framework built on node.js and jasmine. can protractor suggest me a system /test framework / runner which would help me to manage the testsuites (group wise or dependency wise ) and run both protractor + frisby tests using the same cli,negative
angular/protractor,jasmine,2015-10-08T20:14:30Z,here's my use case:- we run our ui tests in parallel- if one of the tests errors. it should leave the window in the state it was when the error occurred. and continue on testing in a new window- a developer can review the failures and look at the state of the browser window to debug any failed testsi'm having trouble getting it to work exactly like i want.i got it to open a new window and continue running tests in it by using browser.forknewdriverinstance(). the only problem is that when protractor finishes running tests it closes all the windows. so there's no time to investigate. the other issue with this is that when running tests in parallel. they don't report any output until the whole process is finished. so i can't just "hang" the process until they are done.the other thing i tried is to call browser.pause() followed by process.exit(1). this successfully keeps the browser open after the process quits. but i can't run any more tests in the process after calling browser.pause(). so whatever tests followed an errored test will not get run.note that this is just for development machines. the build server would just take a screenshot of the current state and not try to keep the window open.,negative
angular/protractor,jasmine,2015-10-13T18:33:25Z,forgot to mention i am not using selenium. but connecting directly to the chrome drivers.let me know if you need any further info!```var htmlreporter = require('protractor-html-screenshot-reporter');exports.config = {    capabilities: { 'browsername': 'chrome' }.    directconnect: true.    allscriptstimeout: 25000.    jasminenodeopts: { showcolors: true }.    onprepare: function () {        var params = browser.params;        jasmine.getenv().addreporter(new htmlreporter({            basedirectory: params.results_folder. takescreenshotsonlyforfailedspecs: true        }));        browser.driver.manage().window().maximize();        ... some more app-specific code to log-in. shouldn't affect protractor at all ...    }}```,neutral
angular/protractor,jasmine,2015-10-14T19:29:20Z,i believe it has something to do with the jasmine team but i'm not totally sure,neutral
angular/protractor,jasmine,2015-10-15T17:06:31Z,```    var jasminereporters = require('jasmine-reporters');    jasmine.getenv().addreporter(new jasminereporters.junitxmlreporter({        consolidateall: true.        savepath: 'testresults'.        fileprefix: 'reportxmloutput'    }));```,neutral
angular/protractor,standard,2015-10-07T04:37:18Z,this is the way that the `optimist` package parses command line args. i agree that it's somewhat annoying. but i think it's better to go with the standard than implementing our own custom logic here. we can fix the cli help message though.,negative
angular/protractor,selenium,2014-09-19T16:06:33Z,yes.- run firefox with the `-p` option- create your specific profile. i named mine `selenium`- run firefox with this profile- make the changes you need in about:config- add this option in protractor configuration:``` javascriptseleniumargs: [ "-dwebdriver.firefox.profile=selenium" ].```this way. your new profile will be used to run your tests.,neutral
angular/protractor,selenium,2014-09-21T23:32:22Z,screenshot of entire browser screen not just the current viewport. i want to figure out a way to take a screenshot of the entire browser screen. and not just the part of the viewport that my scrolled screen is resting on ... during my e2e test.tools like snagit are useful when i perform such a task manually ... does anyone have suggestions on how to tie something like that into protractor/selenium e2e testing? or maybe this is already built-into protractor/selenium and you can share tips on how to invoke screenshots of the entire area?,neutral
angular/protractor,selenium,2014-09-21T23:35:52Z,for example. i see this in the api docs but i've no idea how to specify it as arguments or settings:```schedule a command to take a screenshot. the driver makes a best effort to return a screenshot of the following. in order of preference:entire pagecurrent windowvisible portion of the current framethe screenshot of the entire display containing the browser```,negative
angular/protractor,selenium,2014-09-22T23:15:21Z,as you saw from the bugs. this is working as intended. i don't know of a module that already does this. but others may comment.,neutral
