mishoo/UglifyJS2,uglify,2012-11-25T21:01:05Z,> you could also provide helpful warning messages when people call methods from the old uglify-usthis seems completely reasonable and easy to implement. would have saved me a fair amount of time if there were a helpful message printed or error thrown with the correct message when i called .parser,positive
mishoo/UglifyJS2,uglify,2012-11-28T16:24:56Z,i can't get it to work. after runningnpm install uglify-jswith no errors. as well as jbudone 's suggestion. i still get-bash: uglifyjs: command not found,negative
mishoo/UglifyJS2,uglify,2012-11-29T09:25:35Z,it's not absolutely required to pass `-`. for example this should work:``` shcat script.js | uglifyjs -cm```,neutral
mishoo/UglifyJS2,uglify,2012-11-29T10:06:28Z,ajkochanowicz jbudone execute `npm link` in the uglifyjs directory.,neutral
mishoo/UglifyJS2,uglify,2012-11-30T00:49:17Z,missing `continue`. ```$ cat t.jswhile (a) {  if (b) {    switch (true) {    case c():      d()    }    continue  }  f()}$ uglifyjs t.js -cbfor (;a; ) {    if (b) switch (!0) {      case c():        d();    }    f();}```,neutral
mishoo/UglifyJS2,uglify,2012-12-06T19:11:36Z,typeerror: property 'input' of object #<object> is not a function.... hi.i get the following error when trying to parse some js files:...node_modules\uglify-js\lib\parse.js:616s.token = s.input();typeerror: property 'input' of object #<object> is not a function,neutral
mochajs/mocha,mocha,2012-08-09T23:48:56Z,i would vote against tap personally. and just use json. _but_ either way this would be a nice feature because not only can we decouple but it makes outputting multiple reports (cov. markdown etc) in parallel really simple since you can just `tee` to a few pipes,negative
mochajs/mocha,mocha,2012-08-10T03:19:40Z,+1 for json format as it is easier to consume.,neutral
mochajs/mocha,mocha,2012-08-10T14:11:40Z,+1 for json. if you want tap you can just do `mocha --spec tap` which would load the `mocha-tap` reporter.  this could work a bit like consolidate where you have to install the relevant reporter in order to use it. but can then use it simply as `mocha --spec reporter`,neutral
mochajs/mocha,mocha,2012-08-10T18:54:37Z,another nice thing with this is that we could easily combine output. right now for example in express i have two make targets. `test-unit` and `test-acceptance`. and they output separate reports. that's not the end of the world but it would be nice to pipe these together and funnel into a single report,neutral
mochajs/mocha,mocha,2012-08-10T20:18:29Z,:+1: for me. running dozens of tests in separate processes. would love consolidated reporting for them.,positive
mochajs/mocha,mocha,2012-08-10T22:28:30Z,we basically just need a flag to tell mocha to defer. then you will manually do `mocha.run()` at some point,neutral
mochajs/mocha,mocha,2012-08-15T16:00:19Z,alright.  i just saw above where visionmedia said a merge was forthcoming. so i assumed that was still the case.  for a userland reporter like this. should it just be released as a standalone reporter npm module?  also. how does it plug in to mocha as an available reporter?  is this a built-in api?  i'm new to mocha...but i love me some jenkins graphs :),positive
mochajs/mocha,mocha,2012-08-15T16:04:31Z,via something like:```npm install junit-reportermocha --reporter junit-reporter```,neutral
mochajs/mocha,mocha,2012-08-15T16:05:47Z,surely that should be called junit-reporter-mocha or something?  but yeah. i get it.  i'll try to extract the reporter from this pull request for my personal use. but won't publish or anything because it's jon077's to publish :),neutral
mochajs/mocha,mocha,2012-08-15T16:09:06Z,doesn't have to have `-mocha` in the name. eventually (we have an issue open for this) we'd like to have all these reporters just consume the json stream. so then they're completely decoupled from mocha,neutral
mochajs/mocha,mocha,2012-08-18T16:55:48Z,hmm did you update mocha itself?,neutral
mochajs/mocha,mocha,2012-08-18T17:12:59Z,using mocha with require('mocha'). i'd like to use mocha this way:```var mocha = require( 'mocha' );// run tests in a specific path```but i haven't found any documentation about using mocha this way.i `console.log`'ed `require( 'mocha' )`. but i couldn't really see what was what.,neutral
mochajs/mocha,mocha,2012-08-18T20:55:06Z,indeed. docs are lacking :-)thanks for the link! i'll look into this. but it looks like good.about the doc. is there a way i can contribute?,positive
mochajs/mocha,mocha,2012-08-19T00:55:52Z,great! thanks man,positive
mochajs/mocha,mocha,2012-08-19T09:09:48Z,you're welcome! i didn't add this page to the wiki home page though. i thought you wanted to review it before doing that.,positive
mochajs/mocha,mocha,2012-08-19T17:52:47Z,meh yeah i'd rather keep stuff like that out of mocha personally. the mocking / stubbing stuff can easily be third-party,positive
mochajs/mocha,mocha,2012-08-22T09:56:23Z,mocha can't handle hanging code. if you monitor with:mocha --ui exports --reporter min --watchand the code hangs. mocha shows a confusing blank screenif you press ctrl-c (linux) the terminal is messed up (no cursor. weird colors)and mocha leaves behind a zombie process still running your buggy code.,neutral
mochajs/mocha,mocha,2012-08-22T16:09:38Z,yeah i'd like to have this too. at least as a default (so i can still get those callsites if it really is a mocha bug)+1,negative
mochajs/mocha,mocha,2012-08-22T17:22:30Z,have you tried using a mocha.opts file instead of command line params?  mocha.opts goes into your 'test' folder. text file with the following format:--reporter teamcity--ui bddfor command line options in teamcity. make sure you put just 'node_modules/.bin/mocha' as the 'command executable' and place the rest of '--ui bdd --reporter teamcity' as 'command parameters',neutral
mochajs/mocha,mocha,2012-08-22T21:41:44Z,polyfills are no good. that's not the right way to go with mocha. mocha shouldn't influence the env,neutral
mochajs/mocha,mocha,2012-08-23T10:31:21Z,makes the ui pluggable alongside reporters. see readme in tests. it's rather straightforward. need it for scones (bit like mocha-cakes but is a ui),positive
mochajs/mocha,mocha,2012-08-23T11:03:40Z,+1we often have to mock libraries that are required by requirejs and it adds a considerable amount of overhead to the tests. while we'll ideally find a way to optimize this. it's not a high priority and we honestly don't care that much if the tests run for 50-100 ms each. being able to suppress the warnings for these specific tests would be nice.,positive
mochajs/mocha,mocha,2012-08-24T17:47:38Z,not sure i follow. if there were no exceptions caught by mocha then it should just display them as passing,neutral
mochajs/mocha,mocha,2012-08-24T21:17:37Z,make mocha runnable in an iframe. for konacha. we'd love to be able to run mocha inside an iframe. andhave the report rendered in the top-level frame. here is anillustration: actually have this working in my konacha working copy. and it's reallycool and useful. but it needs just a little help from mocha's side towork. this commit makes two small changes:- make the root element for the html reporter parameterizable. (the  default is still #mocha.)- do not repeat the current path in the ?grep urls. it's redundant. and  it messes up the path with an iframe setup like we're trying to do.there are no functional changes on mocha's end.---please merge this? it'd be super-awesome!,positive
mochajs/mocha,mocha,2012-08-25T11:02:29Z,more generally. are you happy for the principles of the pull request? i do think that in the longer term it would be useful to have a way to get the current mocha instance from any code currently running. as it'd remove the need for a ui for anything that is happy dealing with the suite api itself. not sure if it is acceptable in js (globals are bad right?) but it'd remove the need for uis alltogether.,negative
mochajs/mocha,mocha,2012-08-26T15:52:02Z,so. we will not ever be able to test amd modules with mocha? i just started looking at mocha. and can't find how i can test my amd requirejs (coffee) code... it's frustrating when you think you have found the right tool. but then it doesn't support your configuration... require.js is the standard nowadays for the browser. we need mocha to support it +10,negative
mochajs/mocha,mocha,2012-08-27T09:15:59Z,handle require failures otherwise crashing mocha. on launch. when mocha loads the test files. the whole process crashes if there is a syntax error in any of the fileshere we prevent that by wrapping require in a try-catch. if the require throws an exception. a fake test called loadfail is created that throws the exception at a later time when mocha can handle it.such failure are then presented as any other test failuresawesomeness!this is the fix for #547,neutral
mochajs/mocha,mocha,2012-08-30T22:49:41Z,i'd hardly call require.js a standard at all. but i would like to add the ability for mocha to defer execution. mostly for the browser but that will help this case as well,neutral
mochajs/mocha,mocha,2012-09-01T22:46:57Z,not mocha,neutral
mochajs/mocha,mocha,2012-09-03T19:34:42Z,relay signals from the "_mocha" process to the main "mocha" bin. this makes is so that if your test case cases node to crash with a sigsegvor sigbus for example. than "mocha" will have a proper exit code (instead of 0).,neutral
mochajs/mocha,mocha,2012-09-05T03:49:39Z,yeah. same problem  here. not just  `mocha test/*.coffee` . `mocha test/` also fails.  seems the problem doesn't come from how \* is interpreted by mocha,negative
mochajs/mocha,mocha,2012-09-05T03:57:26Z,`mocha tests/*.js` is globbing. that's a shell feature not mocha,neutral
mochajs/mocha,mocha,2012-09-06T15:04:32Z,include a js file?. hi does mocha only supports module loading with node?can it be use just for testing a single js fileeg: ```human.js    that returns a  h = new human( name )test.js          it  'should return some names'. ->  h.name```,neutral
mochajs/mocha,mocha,2012-09-06T15:55:21Z,i dont understand the question,neutral
mochajs/mocha,mocha,2012-09-06T15:58:13Z,sorry. my own fault. didnt realise that chai need to be install within the test folder for it to work. was installed it globally,neutral
mochajs/mocha,mocha,2012-09-07T04:40:53Z,how to run requirejs modules with mocha tests in terminal. on a tutorial. just source the file and create a namespace and we can run mocha on that test file like so {tasklist. task} = require '../task'    but with requirejs. all the files are wrapped within define(['some script']. function('come callback') {} )how do i require and test the stuff within the define function of that module? inside the terminal,positive
dondi/GRNsight,mocha,2017-06-05T03:59:50Z,a partial solution to this is covered by #326. the automated client-side test generator that eileenchoe has written.  i'm going to label this with "backlog" and close for now.,neutral
teerapap/grunt-protractor-runner,selenium,2014-08-04T20:01:33Z,breaks protractor sharding. does the runner support protractor sharding?  i'm seeing a semi-frequent (50%+) instances where even with one "shard". the protractor tests fail to ever exit because they're detecting a remaining webdriver instance. even after logging that it was shutting down the remaining instanceshutting down selenium standalone server.[launcher] 1 instance(s) of webdriver still runningshutting down selenium standalone server.[launcher] 1 instance(s) of webdriver still runningplease let me know what additional information you'd need,negative
teerapap/grunt-protractor-runner,selenium,2014-08-07T14:53:13Z,hankduan says that a recent fix (#1167 for angular/protractor) could/should fix the sharding issue.  i'll have to wait until they merge it to master before i can renable sharding and validate it.,neutral
karma-runner/karma-sauce-launcher,sauce,2013-09-13T13:14:41Z,add a 'saucelabs' reporter to report pass/fail status.. add a new reporter to report pass/fail status for each browser on saucelabs (see #10) .to enable this. add 'saucelabs' to the reporters in the config file.the only change to the actual launcher is to expose the job id's and credentials to the reporter.,neutral
karma-runner/karma-sauce-launcher,karma,2013-10-02T00:14:05Z,slow shutdown. in several builds on travis i see the exit after "info [launcher.sauce]: shutting down sauce connect" takes 2-3 minutes. i'm not sure whether this is a karma or sauce connect launcher problem.do you have any idea? browsers used are ff 20 (win 8). ie 10 (win 8) and chrome (linux),negative
felixrieseberg/ember-electron,eslint,2017-02-23T15:14:47Z,i totally agree. and was planning to do this myself once i finish with #120. but am happy to see someone else do it as well :)i think we should use a nice simple `eslint:recommended` rule set. that's what ember uses. although it adds a couple more rules that i'm not sure we want to enable. also there will probably be some fiddling because of our node code.those are my thoughts.,neutral
AnalyticalGraphicsInc/cesium,eslint,2017-05-24T19:03:40Z,emackey i'm going to push webstorm config changes. is there anything we need to do for vscode here?  i know they have an eslint plugin.,neutral
AnalyticalGraphicsInc/cesium,eslint,2017-05-24T19:56:38Z,mramato i switched to vscode as well.  and yes. there's a eslint extension that should be mentioned instead of the jshint one.,neutral
AnalyticalGraphicsInc/cesium,eslint,2017-05-24T20:45:11Z,the eslint rule `"semi"` (missing semicolons) is not on by default.  the cesium repo passes with this rule enabled. should we explicitly enable it?i'm looking at vscode now.,neutral
AnalyticalGraphicsInc/cesium,eslint,2017-05-24T21:02:48Z,> the eslint rule "semi" (missing semicolons) is not on by default. the cesium repo passes with this rule enabled. should we explicitly enable it?i would think so.  we definitely want the eslint to match our old rules as close as possible.  good catch.  we'll have to keep an eye out for this kind of stuff even after merge to make sure we haven't missing anything.we'll also need to evaluate some brand new rules now that we have the capability (such as whitespace and formatting).  this will happen post merge of course.,positive
AnalyticalGraphicsInc/cesium,eslint,2017-05-24T21:53:16Z,i added `"semi"`. updated vscode and removed eclipse.mramato sandcastle still uses jshint at runtime to scan examples that are loaded into the browser.  this means the build is scanning them with eslint but the runtime displays them with jshint warnings.  not ideal but it may take some effort to replace the runtime system with eslint.  not sure if that needs to be in scope for this pr.,neutral
AnalyticalGraphicsInc/cesium,eslint,2017-05-24T22:33:30Z,mramato adding fix is essentially a "one line" and might look like:```jsgulp.task('eslint-fix'. ['build']. function() {    return gulp.src(eslintfiles)        .pipe(eslint({fix: true))        .pipe(eslint.format())        .pipe(gulp.dest('.'));});```i am not too familiar with this sort of thing using gulp streams (super easy with something like grunt). but it seems to me that the above will be somewhat annoying for a project of this scale. i apologize for bringing it up without testing (i assumed i could implement it as easy as i have done in other circumstances),positive
AnalyticalGraphicsInc/cesium,eslint,2017-05-25T20:44:37Z,thanks again jhwohlgemuth!  i submitted some minor tweaks but as soon as travis passes we'll merge this.i encourage everyone to check out eslint rules and think of anything code style or formatting-wise you would like us to enforce in cesium.  i already have my eye on trailing whitespace and blank lines; but i'm sure there's a ton more.,positive
AnalyticalGraphicsInc/cesium,eslint,2017-05-25T21:52:56Z,investigate eslint auto-fix. eslint has the ability to automatically fix problems.  at the very least we should add a manual gulp task for fixing problems.  if it's foolproof and fast. we can even consider it happening automatically at commit time.,positive
AnalyticalGraphicsInc/cesium,eslint,2017-05-26T13:30:10Z,fix eslint in 3d-tiles branch,neutral
AnalyticalGraphicsInc/cesium,eslint,2017-05-26T21:32:46Z,since the original intent of this pr was to fix the eslint errors in `3d-tiles` (which is currently broken). i'm going to merge it as-is.  we'll address the other two comments as part of the `3d-tiles` pr.thanks hpinkos!,negative
AnalyticalGraphicsInc/cesium,eslint,2017-06-09T17:57:40Z,bump.i'm not entirely sure how `peerdependencies` work. for example. if a user references `cesium/browser`. they need to have `eslint-plugin-html` installed. right?i've assumed that is the case and added it to `readme.md`. if i'm wrong let me know!,negative
AnalyticalGraphicsInc/cesium,eslint,2017-06-09T18:33:14Z,omh1280 i know we talked a little bit about that link offline. but always provide some contents to posts like that so other developers (or ourselves in the future) have the required context for it.  cesium is developed out in the open.also. i think the easy solution in this case is to run eslint via a child process instead of through gulp. then we can use the cache argument.  look at `generatedocumentation` in the gulpfile for an example.,neutral
AnalyticalGraphicsInc/cesium,eslint,2017-06-12T13:08:06Z,> i've assumed that is the case and added it to readme.md. if i'm wrong let me know!can't we just have `eslint-plugin-html` be a dependency of `eslint-config-cesium`?  i think that will work.,negative
AnalyticalGraphicsInc/cesium,eslint,2017-06-15T22:24:04Z,my pre-push idea is failed. `eslint --fix` causes some unstaged changes which blocks push. i added a new gulp task (eslint-fix) but i will replace it with eslint cli according to #5449 .i am still unsettled about pre-commit. after evaluting eslint cli with --cache i will decide.,negative
AnalyticalGraphicsInc/cesium,eslint,2017-06-15T22:56:35Z,mramato i put these in cesium's `.eslintrc.json`. should they go in the shareable config instead?,neutral
AnalyticalGraphicsInc/cesium,eslint,2017-06-19T15:24:05Z,lilleyse is writing up issues for any remaining task items that we agreed to do post merge.there are a bunch of `eslint` errors when merging master. so i'll fix them in this branch and then merge up.,negative
AnalyticalGraphicsInc/cesium,eslint,2017-06-19T17:14:21Z,thanks for looking into this ateshuseyin.  after some unrelated changes. running with `--fix` is as easy as running `npm run eslint --fix`.  i think running fix automatically is really worth it (since it can't fix everything) and most of the time devs will just manually fix one or two issues.i think where `--fix` comes in very useful is in adding new rules. which is a rare occurrence.long story short. i'm closing this issue.  thanks again ateshuseyin.,positive
AnalyticalGraphicsInc/cesium,eslint,2017-06-19T17:22:18Z,do you mean add a `/*eslint-disable no-implicit-globals*/` at the top of `speclist.js`? is there a way to disable `.gitignore` for one commit?,negative
AnalyticalGraphicsInc/cesium,eslint,2017-06-19T17:24:20Z,> do you mean add a /*eslint-disable no-implicit-globals*/ at the top of speclist.js? is there a way to disable .gitignore for one commit?sorry. i should have been more clear.  what i meant is to modify the `createspeclist` function in `gulpfile.js`. which is where `speclist.js` gets generated.,negative
AnalyticalGraphicsInc/cesium,eslint,2017-06-19T18:38:59Z,mramato can you prioritize this? the glob change means that the eslint tests aren't running on travis,neutral
AnalyticalGraphicsInc/cesium,eslint,2017-06-19T18:43:58Z,fix eslint glob. fix eslint glob issue. which prevented eslint from expanding globs and instead left it up to the os.mramato please merge soon!,positive
AnalyticalGraphicsInc/cesium,eslint,2017-06-19T18:46:48Z,thanks.looks like this worked on windows by not other systems (because of wildcard expansion). your change should work everywhere.,neutral
xtuple/xtuple-extensions,mocha,2013-08-02T18:48:19Z,updated tutorial per new mocha conventions,neutral
alfa-laboratory/arui-presets,eslint,2017-05-26T09:16:40Z,fix(babel): add default settings for transform-runtime-plugin.       transform-runtime     .      .     .     eslint  tslint.    `^`    ,neutral
alfa-laboratory/arui-presets,eslint,2017-05-26T09:19:31Z,heymdall     ?      ),neutral
alfa-laboratory/arui-presets,eslint,2017-05-26T09:56:25Z,       -    )    babel-jest  .  -   .  .  .        -  .,neutral
walmartlabs/eslint-config-defaults,eslint,2015-07-06T01:39:34Z,true. that makes sense. i just hope that there are enough complete config options that a typical eslintrc file only has a few lines in it. anyway. it's done and in develop. it'll go out when i finish the react plugin stuff this week.,positive
walmartlabs/eslint-config-defaults,eslint,2015-07-06T07:52:09Z,validate all configurations with eslint. along with #11 . we should import all configs individually with eslint to allow it to throw errors on anything incorrect for all files potentially importable directly.,neutral
walmartlabs/eslint-config-defaults,eslint,2015-07-06T07:57:46Z,replace lodash merge with actual `eslint`'s `util.mergeconfig` via `extends`.. there are some subtle differences with how eslint `extend`'s configs vs. a brute force `_.merge()`. (e.g.. `plugins` are special-cased and handled differently than normal keys).we should look to use eslint's first class `extends` + under-the-hood `mergeconfig`. especially once eslint comes in as a `devdependency` so that we don't accidentally queue up subtle merge bugs later (wherein composed configurations here would behave differently than library uses doing `extends` of the same underlying configs manually).,negative
walmartlabs/eslint-config-defaults,eslint,2015-07-28T18:46:59Z,bring config up to newest eslint and eslint-react,neutral
walmartlabs/eslint-config-defaults,eslint,2015-07-28T20:28:11Z,closed by 95eb4d612c748a2a503873a41bd3bef81810856b,neutral
react-boilerplate/react-boilerplate,eslint,2015-12-17T13:40:26Z,find and remove all eslint errors. there are a lot of `eslint` errors all around. should find and remove them.,negative
libp2p/js-libp2p-crypto,mocha,2017-01-20T18:19:31Z,there we go :) it should still be hitting all the same code paths in this module. since i'm only testing the marshal / unmarshal and generatekeypair functions from index.js.  everything else was just duplicating tests from the libp2p-crypto-secp256k1 module anyway. so no loss there.btw. i ended up not using rewire. since it wouldn't let me modify the `const keys` in index.js - instead i'm just modifying the object directly in the `before` and `after` for the test.  since mocha tests are run sequentially this seems safe enough. but i could switch to rewire and change `keys` to be `let` instead of `const` if you'd prefer.,negative
NetsBlox/NetsBlox,codeclimate,2017-06-06T09:35:00Z,can you check out the todo's caught by codeclimate?,neutral
tildeio/htmlbars,sauce,2014-06-20T16:09:39Z,nkgm we are! the first column on the trello board is for community todos. the most approachable are:- get the compiler tests (this repo) passing in all browsers. find out how far back we can push the compatibility with older browsers. (ie6?) maybe setup saucelabs.- build htmlbars template compiler tasks for the various build systems: broccoli. grunt. gulp. brunch. etc.,neutral
vvo/selenium-standalone,selenium,2014-03-10T16:00:15Z,starting selenium server fails with obscure error when java is not installed. when trying to run selenium before installing java the following output is generated when starting selenium:```> var selenium = require('selenium-standalone');> var server = selenium();> execvp(): no such file or directoryevents.js:72        throw er; // unhandled 'error' event              ^error: spawn enoent    at errnoexception (child_process.js:988:11)    at process.childprocess._handle.onexit (child_process.js:779:34)```after installing java on the machine the above code runs just fine. although it probably isn't feasible to install java from npm. a nice warning when trying to require or start selenium without java installed might be warranted.,negative
mozilla/scanjs,mocha,2014-03-20T11:39:09Z,we can check disable the current csp policy for tests without breakage. if we move the mocha.run. mocha.setup bits into a separate js file. closing this one out.,neutral
nathanboktae/mocha-phantomjs,mocha,2015-01-14T01:35:56Z,```phantomjs --remote-debugger-port=9000 lib/mocha-phantomjs.coffee <your tests> <reporter> <config as json>```,neutral
nathanboktae/mocha-phantomjs,mocha,2015-01-15T20:14:07Z,mocha-phantomjs runs in phantomjs. not node. also you're giving example code from something not `mocha-phantomjs` but i'm guessing some wrapper around it for a node.js build system like grunt or gulp. `config` is hydrated by code running in phantomjs from json passed in the command line.,neutral
nathanboktae/mocha-phantomjs,mocha,2015-01-17T20:04:24Z,add documentation for coverage. awesome package! i've been in javascript testing hell for the past week or so. long story short i wrote my first javascript package and i'm trying to get it hooked into travis and coveralls. i was able to use mocha from the cli but i couldn't cover anything that used jquery in my code. if i went to a browser based solution i couldn't run from the cli. enter mocha-phantomjs. it's exactly what i needed. i'm having trouble figuring out how i can hook into blanket or istanbul though to produce coverage info for coveralls. i'd like to lend a hand and help out here. i'm going to dig in and try and figure out how to incorporate them but i'd appreciate any advice if someone has already solved this problem.,negative
