jprichardson/electron-mocha,mocha,2015-12-14T15:30:30Z,seems like it was completely unrelated; just a mixup of the new ipc module names. fixed by #32 above.,neutral
jprichardson/electron-mocha,mocha,2015-12-15T09:23:12Z,going to pass on this now. may reconsider later. thanks for your interest.,positive
jprichardson/electron-mocha,mocha,2015-12-15T09:26:41Z,if it works. i'll accept it into `electron-mocha`.,neutral
actionhero/actionhero,standard,2016-04-01T18:44:35Z,are those spaces a eslint standard? cause i am pretty used to the one without the spaces hehe :),positive
atom/etch,standard,2015-08-14T16:22:01Z,the root tag name is available as the standard `tagname` property on the element itself. though it's capitalized. i do agree it's a bit of a bummer to have to repeat the tag name. but i'm not sure it's worth the complexity of adding a whole facility for this.,negative
serverless/serverless,istanbul,2015-12-15T13:35:26Z,test coverage with istanbul. run `npm run coverage` to get test coverage.,neutral
uber/uber-ngen,jshint,2014-05-14T02:27:28Z,apply jshint fix. cc sh1mmer jcorbin,neutral
uber/uber-ngen,jshint,2014-05-14T21:09:15Z,dont ignore jshintrc. oops. cc sh1mmer jcorbin,neutral
airbnb/javascript,eslint,2015-07-22T04:34:51Z,mocha tests: missing function expression name. (func-names). when writing mocha tests. it is not possible to use fat arrow functions because we sometimes need to use the `this` keyword to change the test's timeout for example.``` javascriptdescribe('some description'. function () {  before('blabla'. function () {    this.timeout(10000);    return somepromise();  });});```this results in the following eslint error:```missing function expression name. (func-names)```i was wondering what was the guidelines for this case. naming the functions is out of the question as it would add a lot of noise.,negative
airbnb/javascript,eslint,2015-07-22T04:36:38Z,would `function blahblah() {` really add that much noise?,neutral
airbnb/javascript,eslint,2015-07-22T05:53:04Z,i just don't really see the point for mocha tests and it goes against the dry principle. e.g.```javascript    it('should return status 200'. function shouldreturnstatus200() {      expect(self.res.status).to.equal(200);    });```anyways. i added `func-names: 0` to my `tests/.eslintrc`.,negative
airbnb/javascript,eslint,2015-07-22T05:57:35Z,another alternative. that would be less sweeping. is adding `/* eslint-disable func-names */ to your`describe` block. which would disable it just for that scope.,negative
airbnb/javascript,eslint,2015-07-22T11:01:47Z,ok thanks.,positive
airbnb/javascript,eslint,2015-07-22T14:24:27Z,nkbt oh i see. so it's likely just a bug with eslint.,neutral
airbnb/javascript,eslint,2015-07-23T16:46:59Z,unused variables when destructuring?. i just wrote this code:``` javascript  dirtyproperties() {    return this._getproperties()      .filter(([ prop ]) => prop.isdirty())      .map(([ _. propname ]) => propname);  }```and eslint threw a `no-unused-vars` error because of the `_` variable. is this against the airbnb style guide? i feel like using _ to ignore the first destructured variable should be pretty well understood and not using destructuring would make the code more verboe.,negative
airbnb/javascript,eslint,2015-07-25T16:48:48Z,ooops. i just realized i can do `[ . propname ]`.,neutral
airbnb/javascript,eslint,2015-07-29T11:17:49Z,i was planning on creating a related issue regarding infrequent bumps too after i had woken up. so funny to see this just created. lots of changes have been made. most significant is probably the react guidelines to `.eslintrc` and updated rules such as `comma-dangle`. is it possible to publish a new `eslint-config-airbnb` package with the updated rules? it would be very much appreciated.,positive
airbnb/javascript,eslint,2015-07-31T01:04:10Z,dependencies removed,neutral
airbnb/javascript,eslint,2015-08-02T17:40:08Z,can i use eslint-config-airbnb without eslint-plugin-react?. i am not using react. so it would be better for me to just install eslint.is it possible to move the jsx related configs to a separated file?,neutral
airbnb/javascript,eslint,2015-08-05T01:28:58Z,sorry. i do not know that react/jsx-no-undef can cover no-undef. it works when i call eslint directly but not when i use gulp-eslint. thank you anyway.,negative
airbnb/javascript,eslint,2015-08-05T17:45:16Z,mention eslint-config-airbnb. actually. if we want to make the thing more convenient. we could go as far as saying:``````before using our `.eslintrc` install these dependencies:```shnpm install --save-dev eslint-config-airbnb eslint babel-eslint eslint-plugin-react`````````i want to leave the decision up to you though.,neutral
airbnb/javascript,eslint,2015-08-05T18:05:10Z,i agree about adding instruction on how to install. use. and update style guide using npm. but adding `eslint-config-airbnb` as a dependancy of `.eslintrc` looks wrong (or it should be added somewhere that .eslint should contain  `{ "extends": "airbnb" }`),negative
airbnb/javascript,eslint,2015-08-06T10:08:58Z,very nice. thanks for the heads-up!,positive
airbnb/javascript,eslint,2015-08-06T20:50:09Z,+1  we use `extends: "airbnb"` and would like `"indent": [2. 2. {"switchcase": 1}]` to be in `eslint-config-airbnb`.,neutral
airbnb/javascript,eslint,2015-08-08T14:51:09Z,simplify eslint config package.. this patch moves `.eslintrc` contents into `index.js` directly.this allows us to drop external dependencies and using javascriptcomments instead of not valid json.,neutral
airbnb/javascript,eslint,2015-08-09T00:20:49Z,:+1:,neutral
airbnb/javascript,eslint,2015-08-09T05:57:31Z,you still have to manually add the package to your `package.json` - try `npm install --save eslint-config-airbnb`,neutral
airbnb/javascript,eslint,2015-08-09T06:25:13Z,thanks for the fast reply!i tried `npm install --save eslint-config-airbnb` as well with the same result. i did add it to the package.json. it's on line 11 under dev dependencies (also tried under reg. deps.) the module is also in node_modules.any other ideas?,positive
airbnb/javascript,eslint,2015-08-11T18:37:09Z,i can also vouch that having `react/jsx-no-undef` turned on is not sufficient for `no-undef` to trigger in `gulp-eslint` or in an ide such as webstorm. at least it's easy to add that rule to the `.eslintrc` that's extending `airbnb`.,neutral
airbnb/javascript,eslint,2015-08-13T20:36:42Z,lgtm,neutral
airbnb/javascript,eslint,2015-08-13T20:37:16Z,i was mostly worried about preserving the file location inside our package for whatever reason,negative
airbnb/javascript,eslint,2015-08-13T23:13:54Z,same here. without `no-undef` referencing a variable that does not exist (e.g. typo) is not caught by eslint.,neutral
airbnb/javascript,eslint,2015-08-15T12:52:22Z,perfect.,positive
angular/angular-phonecat,karma,2013-08-09T00:56:50Z,update karma.conf.js. switched to current karma module.exports config syntax.,neutral
angular/angular-phonecat,karma,2013-08-09T01:00:22Z,merged switch to current karma module.exports config syntax.,neutral
velesin/jasmine-jquery,jasmine,2013-01-13T14:46:06Z,thanks.  i read the blog post.  the download page does seem a bit redundant.  seems like it would be hard for owners to remember to update each time. etc.the new code is great.  i wrote something i'm calling jasmine-jquery-$ that allows you to mock jquery's $.  you can add spy's that get applied in the future when the code under test calls e.g. $('happy').  this allows you to mock things like $(window).height() and $(document).scrolltop(). etc.  i needed it to test the endless page feature of the site i'm working on now.its pretty primitive right now.  i'll send you an email when i make a repository.  i thought you might be interested in merging it in with your code.,negative
videojs/video.js,standard,2015-11-17T23:19:22Z,we've decided on the style. so. going to close this. we still need to actually set up standard and lint to follow this style but those are separate.,neutral
videojs/video.js,standard,2015-12-10T05:17:06Z,gkatsev thanks for writing back. yes i am giving all players a unique id and also triggering this function for them all. and my all players are working as well. but my all players are initializing at once. means they are not id dependent. after my first player is initialize. i see console messages for all others like below:videojs: warn: player "566909b393faa" is already initialised. options will not be applied.videojs: warn: player "566909b39267c" is already initialised. options will not be applied.videojs: warn: player "566909b39589e" is already initialised. options will not be applied.videojs: warn: player "566909b396bf2" is already initialised. options will not be applied.this could only mean that plugin instead of initializing a single player when an id is passed to it. it is initializing all the players at once. right? so if i want a few of other player work differently it won't allow me to do so and give me above message.i had an another thing in my mind. if there is any way to know if specific id player is already initialize then destroy it and reinitialize with my need. q. can we check if player is already initialized? (check by id or selector supplied in player initialization)or i'll use a separate function for all other players but this is not a standard procedure to follow.i haven't used fiddle until now. i'll check how it work.,negative
fergiemcdowall/search-index,standard,2016-01-26T17:03:14Z,:+1:,neutral
fergiemcdowall/search-index,standard,2016-01-29T23:54:13Z,this is fantastic! but fyi it was an api breaking change and probably should have been a minor bump instead of bugfix bump.,positive
fergiemcdowall/search-index,standard,2016-01-30T05:19:07Z,yes. it probably should have been,neutral
sequelize/sequelize,eslint,2016-08-06T19:53:56Z,anything that i should change or can this be merged?,neutral
sequelize/sequelize,eslint,2016-08-08T06:47:59Z,thanks for pinging felixfbecker  ;),positive
TryGhost/Ghost,mocha,2013-10-22T14:59:46Z,15 seconds is a looooong time! the tests run super fast for me when run locally on my mac or windows machines. on vagrant they take a lot longer. i think it's all to do with the environment and load. travis fails a lot some times and then is fine other times.we do have to run all of the tests in travis. but we could still split out the db-reliant tests from everything else in terms of folder structure and 2 different tasks. it would provide some benefits in terms of clarity - that it is an integration test timing out not a unit test etc. and making running the tests when dev'ing easier.can certainly be a separate issue to this one though - i'm gonna merge this :),positive
TryGhost/Ghost,mocha,2013-10-26T22:24:17Z,deedubs looks like a solid option.i also know that endangeredmassa has a project he's been working on that _as i recall_ allows you to use mocha-style syntax on top of selenium. but execute your tests in a synchronous fashion. since i think the majority of our issues are due to time outs. synchronous functional testing might be a dream come true for us. that's not to mention the fact that our unit tests are done in mocha as well.all in all the easier it is to write and maintain the functional tests the better. we may need to evaluate several options before we can really resolve this.,positive
TryGhost/Ghost,mocha,2013-10-27T10:06:38Z,there is also a library that allows for using mocha and should style syntax with casperjs.i'm in two minds - one the one hand using webdriverjs would open up some more possibilities for us. it's more mature and works with things like appium. on the other hand. i really love the casperjs project. and want to support it - plus it has such an epic name ;). perhaps it would be worth asking n1k0 to wade in here and see if he can point out any ways we're using casperjs incorrectly?i don't think it's the framework that's necessarily at fault in the problem i reported. just a test which is intermittently failing in various ways. and i think we'll get that with any js test framework.,positive
TryGhost/Ghost,mocha,2013-11-13T04:19:19Z,robconery i know who you are. i'm a big fan of this developers life and your [presentation laced with daft punk and mocha]( is what turned me on to being a node developer after 7 years of c#.  :beer:but. let's be clear. it's not _us_ making a requirement that people do something extra. that's azure.  also. if people don't want to make a web.config. they can make a single line server.js like you did.  i don't think that's an internal detail for us. it's a very specific hosting platforms oddity.i feel like this is a slippery slope; a server.js here. a procfile over here. a shinynewplatform.bison over here.  why should hosting platforms dictate what code goes in our repo?,negative
anvilresearch/webcrypto,mocha,2016-12-21T19:33:35Z,add mocha do devdeps. currently missing. `npm test` errors post fresh install,negative
anvilresearch/webcrypto,mocha,2016-12-21T19:34:59Z,also add `chai` to devdeps. and `jsdoc`.,neutral
anvilresearch/webcrypto,mocha,2016-12-22T21:00:18Z,fixed. closing.,neutral
simplabs/ember-simple-auth,eslint,2017-03-02T08:59:56Z,marcoow the main issue is that eslint plugins can not depend on other eslint plugins. the (hopefully temporary) "solution" for that is using an ember cli blueprint to install those other eslint plugins (ember. qunit. mocha) into the host app/addon.this leads to the current situation where greenkeeper would like to bump `eslint-plugin-ember`. but our `eslint-config-simplabs` is not yet compatible with that change. i guess the best solution for that is adding the eslint plugins to the greenkeeper ignore list.,neutral
simplabs/ember-simple-auth,eslint,2017-03-02T09:48:48Z,turbo87: i guess we could do something similiar to the way we test fastboot in `eslint-config-simplabs` (create an actual app. install `eslint-config-simplabs` which in turn installs the eslint dependencies and the lint that and make sure there are no findings or so)?,neutral
simplabs/ember-simple-auth,eslint,2017-03-02T09:56:50Z,we would have identified this error in `eslint-config-simplabs`.,negative
webpack/webpack,standard,2015-12-22T17:47:25Z,ah. i was testing on the small scale and made an example based on that and it looks like the output changed more than i expected it to when i tweaked something. i was taking a look at webpack because i was thinking it was the cause of trusktr's "similar problems" above. but now i'm not sure.my concern essentially came down to seeing```return __webpack_imported_module_0__b__ && typeof __webpack_imported_module_0__b__ === 'object' &&        'default' in __webpack_imported_module_0__b__ ? __webpack_imported_module_0__b__['default'] : __webpack_imported_module_0__b__;```in the general case of circular dependencies. there isn't a guarantee that the `default` key will exist at the point where this function is called. because the default export may not have been assigned yet.  it looks like webpack strips out that logic based on the module being imported though. so it actually isn't present in the example i posted. that said. it does seem dangerous to me since it'll fail in the circular case. what is the motivation for checking `'default' in` in that context if it isn't for es6 modules? it seems like that would be a breaking behavior for standard commonjs.sokra there are a few other es6 module things i want to file that i noticed when checking this. but i don't want to file them if they are still in the works. do you still have more to add. or should i assume they are stable as-is and file a few more bugs?,negative
webpack/webpack,standard,2016-01-03T21:54:08Z,let's clear up some responsibilities in webpack:- parsing: parser plugin  - result: one or multiple subclasses of `dependency` were added to the module- resolving: `modulefactory` + `compilation`  - result: `module` property on the `dependency` is set to the resolved module- emitting: `dependencytemplate`  - result: some cool replacements in the module source were madeso you have to do the following:- create a parser plugin that looks from your `__uniter_require_once__` calls.  - don't try to resolve anything here  - create an instance of `uniterrequestoncedependency` and add it to the module- in the `compilation` hook  - register `uniterrequestoncedependency` with the `normalmodulefactory` to the standard resolving kicks in  - register `uniterrequestoncedependency` with the `uniterrequestoncedependencytemplate`- in `uniterrequestoncedependencytemplate`  - replace the statement with your code. using only `__webpack_require__` which is the internal require function. which takes a module id. i. e. `delete __webpack_require__.c[id]; var xyz = __webpack_require__(id)`> but. from within the dependency. how could i get a module id?the from the `dependencytemplate` you can access the module id with `dep.module.id` where `dep` is the dependency.> i could just use localmodule`localmodule` is something completely different only used for amd. don't use it.> but. where and how? parser plugins seem sync. the resolver most likely will be async.don't do resolving in the parser plugin. you should do in in a modulefactory. or extend the standard module factory with a resolver plugin.> so what is the best place to put such an async resolver?in a resolver plugin or in a `modulefactory`---i'm not sure if i understand the `use` part correctly. but here is how i understand it:it's just like a `require` but with a different resolution algorithm.you could just write you own `modulefactory` and register it with the `usedependency`. in this modulefactory you implement the resolving algorithm and return a new `normalmodule`.---you may need to know which classes a module defines to generate the correct require statement. here you can use the `this.state.module.meta` object from a parser plugin to store meta information about the module (i.e. the defined classes). in a `dependencytemplate` you can access these meta data via `dep.module.meta` and use it somehow.,negative
webpack/webpack,standard,2016-01-04T03:14:16Z,common and vendor chunk example. i recently came across a scenario where i wanted webpack to create an explicit vendor bundle. a bundle with all code common to our entry points. and a bundle for each entry point. i knew it was possible but there were no examples close to what we needed. after a lot of trial and error i finally figured out a way to do it and i wanted to share. this example shows how i was able to do it using the `commonschunkplugin`.if this example isn't quite up to standards. please let me know and i'll be happy to fix any issues. or. if a very similar example already exists. i can close this as well.thanks for the awesome tool. :+1:,negative
webpack/webpack,standard,2016-01-08T10:08:07Z,good as well.but is this really necessary? it's possible to give automatically a standard file name for example `stdin` (as they do in `node-sass`) and use `context` option for path so my first example would resolve to this path: ``` js__dirname + "/app" + "/stdin"```,neutral
webpack/webpack,uglify,2017-05-29T04:11:01Z,i'm guessing this might improve tree shaking if you have a module importedthat is then used depending on a build flag - being in the same scope givesuglify a chance to remove it.,neutral
webpack/webpack,uglify,2017-05-30T17:20:16Z,some tools (babili) are better at removing dead code than others (uglify) but i don't see why it's called "tree shaking".,negative
acuminous/yadda,karma,2015-06-25T00:54:29Z,thank you so much for the quick response!i think i can just let karma ignore those `.feature` files and instead use webpack to require those files. i'll then tell webpack to not parse any of the `.feature` files. after that i can get the feature files as plain texts. and to make them usable. i might need to write my own `featurefileparser` to not use `fs` which should be simple enough. does that sound like a viable plan?edit (just as i'm writing this message i discovered something):it appears `filesearch` which is required by `featurefilesearch` is the only thing i need to "shim" after writing my own `featurefileparser` because it uses `fs.existssync`.this whole custom rewriting thing is bearable if it works. but please please let me know if there's an easier way assuming that i can already acquire the feature files in plain text.thanks!,negative
acuminous/yadda,karma,2015-06-25T16:22:45Z,thank you so much for the detailed answer!!i realized that i misunderstood the webpack context thing in that it doesn't give me the text file. but only gives me a path to the bundled file like this `/_karma_webpack_//[hash].feature`. instead of using webpack. i should have used karma to include the feature files. anyway. i'll create a sample project and submit a pr once i figure it out.thanks again :),negative
prebid/Prebid.js,standard,2017-03-21T18:25:56Z,> however. they should probably do some form of "last call" perhaps by using something similar to setimmediate to allow all other ajax handlers that have already responded to also register their bids before the auction is closed.i agree. this is what we should do. it looks like `settimeout(fn. 0);` approximates the same behavior as `setimmediate` since it's non-standard. along with `postmessage` so there should be a way to do this. sounds like a fun pr :),neutral
prebid/Prebid.js,standard,2017-03-29T07:33:32Z,an alternative could be to use  as well. might yield smaller amount of changes,neutral
prebid/Prebid.js,standard,2017-04-05T20:39:08Z,snapwich do we lose the ability to use `class` it will work with this pattern (+ babel)?,neutral
prebid/Prebid.js,standard,2017-04-05T20:54:13Z,since each of the modules would be compiled with babel. you could still use the `class` keyword.,neutral
prebid/Prebid.js,karma,2017-03-09T21:42:46Z,it's possible karma doesn't work on ubuntu. not sure.,neutral
arose/ngl,standard,2016-10-10T19:02:41Z,with #61 done. polymers are correctly recognised for standard pdb. mmcif. mmtf files.pending now. is support for recognising polymer chains in other files types (gro. psf. mol2) and non standard pdb. mmcif. mmtf files that lack polymer/entity annotation.,positive
tjunnone/npm-check-updates,mocha,2014-11-28T15:30:28Z,+1,neutral
Automattic/mongoose,mocha,2013-01-13T20:39:01Z,here is another option... i use nodemon. this ensures that the process is restarted each time the test runs:$ nodemon --exec "mocha -r min" test,neutral
vega/vega-lite,istanbul,2015-11-13T23:58:30Z,typescript refactor . - [x] setup ts with istanbul code coverage - [x] describe the schema in ts- [x] enable more tslint rules (and fix issues)  - [ ] replace `var` with `let` and `const`,neutral
vega/vega-lite,istanbul,2015-11-14T00:05:57Z,- [x] rename `schemautil.merge` => `mergedeep` ?,neutral
vega/vega-lite,istanbul,2015-11-14T00:07:16Z,- [x] refactor `vl.ts` — there should be a better way to declare `vl` namespace,neutral
vega/vega-lite,istanbul,2015-11-14T06:34:18Z,- [x] missing source map for the compiled file,neutral
vega/vega-lite,istanbul,2015-11-14T17:32:50Z,- [x] `schema.test.ts` and `validate.test.ts` still use `require` style import. which is inconsistent,negative
vega/vega-lite,istanbul,2015-11-14T18:26:51Z,- [x] add compiling individual files to the watch?,neutral
pouchdb/pouchdb,jshint,2013-03-22T23:28:49Z,just crawling through utils got me to the function comparerevs which is never used,neutral
pouchdb/pouchdb,jshint,2013-03-27T09:28:19Z,(#467) - make all adapters pass jshint and start testing in ci,neutral
pouchdb/pouchdb,jshint,2013-03-28T21:46:15Z,maybe that would be useful to have sth like: `grunt test` which does `grunt jshint` and then `grunt node-qunit`. i always forget to run jshint.,positive
pouchdb/pouchdb,jshint,2013-03-29T15:31:10Z,you need to add initdbpair to the globals. linting is causing this to fail. you can test with ```$ grunt jshint```and instead of closing / opening the pr. while you are on the branch you can```.... make changes$ git add files$ git commit --amend$ git push --force origin mybranch```,neutral
pouchdb/pouchdb,jshint,2013-03-30T14:32:14Z,switch global jshint definitions with .jshintrc. so i can share them with my editor,neutral
pouchdb/pouchdb,istanbul,2014-12-19T19:11:29Z,(the reason i need to confirm manually is that we can't be 100% sure that the number of revisions is enough to trigger the stack overflow. because it's depend on memory and stuff. we would need istanbul or something to be really sure.),neutral
vlucas/frisby,jasmine,2013-04-19T18:04:25Z,i believe this is a problem with the verbose terminal reporter in jasmine-node.  it gets the list of tests when execution starts and reports the success status of this list.  the problem is that this list does not contain the 'nested' tests as they haven't been created yet.   the simple terminal reporter does handle this better.,negative
emailjs/emailjs-imap-client,standard,2017-04-10T11:51:21Z,andris9 i see that the only binarytype supported by emailjs-tcp-socket is 'arraybuffer' so the currently supported runtimes can stay. also. i think it would be good to port the source code to a newer es-standard with a build step that creates the umd header and ports to es5 (or whatever the minimum level has to be).thanks for the tip about wild duck. will keep an eye on it.,positive
angular/protractor,jasmine,2015-06-22T17:05:35Z,i think you can this. ``` jsjasmine.getenv().addreporter(new function() {    this.specdone = function(result) {      if (result.failedexpectations.length > 0) {       // test failure action goes here     }   };  });```,negative
angular/protractor,jasmine,2015-06-25T18:07:29Z,without looking into the code. i believe specs should execute in order. however. this is not the contract behavior. and you should never depend on it. you're much better off doing the summary either in a jasmine reporter. or in a oncleanup script.,neutral
