angular/protractor,jasmine,2015-06-30T06:02:14Z,great. thanks for the explanation and apologies for not paying enough attention to the change log!,positive
angular/protractor,jasmine,2015-06-30T06:06:11Z,one common thought i've had as i've stumbled into every protractor and jasmine oddity - it'd be really great if there could be more warnings in the output. rather than relying on users reviewing every piece of documentation.the issue with the documentation is it's often doesn't address all of the issues you face in the detail you need. so you end up in stackexchange or a blog that was only posted a few months ago. and you try to use their examples to make things work. except in this example they don't work anymore."warning: using browser.wait without a explicit timeout. see https:// for more info..." could have saved an hour or two.thanks anyway - appreciated :),positive
angular/protractor,jasmine,2015-07-07T17:06:54Z,there's a limited amount we can do with that.  most of the output comes from tools like jasmine.,neutral
angular/protractor,jasmine,2015-07-08T03:36:56Z,sjelin thanks for your update. could you help give some code sample to explain how to use teardown to keep the process alive? i want to see if this workaround is suitable for my e2e application.,positive
angular/protractor,jasmine,2015-07-08T12:25:27Z,nishakchaudhari  : i started using protractor and jasmine 2 and i am also facing the same issue. any work around for this??,neutral
angular/protractor,jasmine,2015-07-08T20:36:11Z,ease for asserts with same setup. hello.i understand that protractor is trying to reduce state bleed (like jasmine) by having a fresh case-run for each `it`. that's cool. i'm just curious if there is (or could be) some way for the discerning tester to specify something like "these `it`s have the same setup. and i am confident they don't mutate state".the benefit being. then protractor could just cluster the asserts and run them all after a single state-setup. rather than navigating from the beginning of the application each time (which can be expensive if the area under test is deeply nested in the application).cheers,positive
angular/protractor,jasmine,2015-07-08T21:23:53Z,not sure what you're talking about exactly.  what state is being reset by protractor between `it` blocks?  it shouldn't be restarting the browser or anything by default.,neutral
angular/protractor,jasmine,2015-07-08T21:29:47Z,difference / benefits using browser.setlocation ? . hi . currently running in some random test failures using protractor+jasmine+angular.i was able to resolve issue using **browser.setlocation**  beforeeach test for cases like page redirected during the test run.  instead of just **browser.driver.get** and after **browser.sleep();**wanted to know more about different  and usage of  the browser.setlocation ( it seems like all the page objects are loaded and saved during test). i found this on protractor api page. the code example will be good enough.,positive
angular/protractor,jasmine,2015-07-09T00:07:13Z,interesting. i'm talking about the state that's setup in `beforeeach` blocks. so. for example i might have:```...describe('when i\'m at the last page of the app'. function() {  beforeeach(function () {    lastpage.gethere();  });  it('has the correct page title'. function () {    expect(...)...  });  it('has expected data'. function () {    expect(...)...  });});```if i know that neither of the `it`s mutates state. and that `lastpage.gethere()` takes a long time to run. i would rather it (`lastpage.gethere();`) not be run twice.does that make sense?,negative
angular/protractor,jasmine,2015-07-09T00:14:08Z,perhaps my run is not properly configured. but the test cases would be run like:> beforeeach -> first it> beforeeach -> second itit would be nice if i could (like jasmine's `beforeall`) run them like:> beforeeach -> first it -> second it,positive
angular/protractor,jasmine,2015-07-09T00:19:36Z,good point i meant `browser.get` but still everything wasn't synced. adding `browser.setlocation` and `browser.waitforangular()`; resolved it. thank you.,positive
angular/protractor,jasmine,2015-07-09T19:48:48Z,jkmurthy ksraja it seems that the jasminereports listed is actually the export of the require function.e.g.. `var jasminereporters = require('jasmine-reporters');`,neutral
angular/protractor,jasmine,2015-07-13T19:27:55Z,:+1: on the count() - thanks juliemr,positive
angular/protractor,jasmine,2015-07-14T15:43:23Z,not totally sure what you're asking.  you can do `jasmine.getenv().addreporter(reporter);` inside your spec file without any difficulty.  #### re: backstoryit's not _exactly_ that the lost common denominator was chosen - more like the plugin api is still relatively new and we've been adding features one at a time as people have asked for them.  but yes. the fact that protractor supports many frameworks does hold us back.,negative
angular/protractor,standard,2015-07-04T23:58:44Z,e.g. i would suggest instead of suggesting:```$('input[type="file"]') .....```to suggest:```angular.element(document.queryselector('input[type="file"]')) .....```the latter is more standard. atop of angular and more important not require jquery,neutral
angular/protractor,selenium,2014-06-23T17:16:17Z,penfold wzup thank you both of you. the solution is indeed starting a standalone selenium server and configuring the protractor-conf.js file. i managed to run protractor too this way. thanks again.,positive
angular/protractor,selenium,2014-06-23T17:37:02Z,sounds like it's an external selenium bug then. labeling...,negative
angular/protractor,selenium,2014-06-25T12:57:37Z,my main reason: protractor is promoted as 'angular' e2e. i came in from generic webtesting (selenium/webdriver.io) and now have to relearn a new syntax.i understand there is a style choice in  language. i happen to prefer the more terse style from webdriver.io . it's less coding centric. more q/a orientedmy 2c,neutral
angular/protractor,selenium,2014-06-25T20:21:43Z,ah ok. i see the issue. the problem is that `selenium-webdriver/testing` only wraps the global functions (`global.it`) once. at the point when it is required. then it reuses them. but mocha has actually changed the underlying `global.it` by the second suite.,neutral
angular/protractor,selenium,2014-06-25T22:29:58Z,feat: accept promises in the configuration. change hosteddriverprovider to optionally accept a promise for the seleniumaddress,positive
angular/protractor,selenium,2014-06-25T22:34:05Z,:thumbsup:,neutral
angular/protractor,selenium,2014-06-25T22:37:25Z,:+1: everything else is promised. why not this. it would allow users to have custom logic to grab selenium instances.,negative
angular/protractor,selenium,2014-06-25T23:48:02Z,juliemr just signed it.,neutral
angular/protractor,selenium,2014-06-26T16:51:43Z,gettext() not working for title element. i'm getting the empty string back from a gettext() call.  i've got this in my index.html:```<title ng-bind="pagetitle"></title>```this is in my controller:```$scope.pagetitle = "banana";```this is in my protractor test:```var pagetitle = element(by.binding('pagetitle'));expect(pagetitle.gettext()).tobe('banana');```the page title is displayed correctly in the browser. even when selenium pops up a window for the test. but my test always fails saying "expected '' to be 'banana'".  nobody wants their empty strings to be bananas. just their bananas.  i'm aware that gettext() doesn't work with input elements. but this is a title element.  thanks!,negative
angular/protractor,selenium,2014-06-26T16:54:32Z,i've also tried this approach. to see if it was a laziness issue:```element(by.binding('pagetitle')).gettext().then(function (title) {  expect(title).tobe('banana');});```,neutral
angular/protractor,selenium,2014-06-26T17:50:01Z,title isn't a visible element to the user. so webdriver doesn't return it as having text. you probably want`browser.gettitle()`,neutral
angular/protractor,selenium,2014-06-26T18:49:02Z,oh i see. so webdriver's not delivering the content that way?  that explains why it wouldn't work (although it seems odd. because the title is shown by most browsers).  thanks for the suggestions though. they've got me on my way.,neutral
angular/protractor,selenium,2014-06-27T06:10:03Z,juliemr. when you say uris should work. are you suggesting that something like the following should work through a remote selenium server?```    var fileinput = section.element(by.css('input[type="file"]'));    var uri = '//some-random-image-domain/found-on-the-web.png';    fileinput.sendkeys(uri);```i am having no luck with this.,positive
angular/protractor,selenium,2014-06-27T13:36:09Z,fix typo in cli.js: seleium > selenium. fixed a typo in the cli.js where selenium was written as seleium.just noticed and thought i create a pull request.cheers,neutral
angular/protractor,selenium,2014-06-27T16:57:51Z,same issue. running on a mac env with phantom via a selenium hub. the ignoresynchronization fixes it for me,neutral
angular/protractor,selenium,2014-06-27T18:45:07Z,i'm curious how the team is starting chromedriver with python based tests. since this issue doesn't seem specific to protractor versus other methods of using selenium. unfortunately. my only suggestions are to keep watching that chromedriver issue.,neutral
angular/protractor,selenium,2014-07-01T00:11:23Z,can this also cover 'capabilities' and 'multicapabilities'? i have a proxy server that runs async and it's unable to assign a port number to the config as it happens after the module.exports go out.,neutral
angular/protractor,selenium,2014-07-02T15:38:36Z,personalife yes. i think that's a good idea.,positive
angular/protractor,selenium,2014-07-02T19:09:07Z,the changes i contributed to sam's pr allows all config values to accept a promise rather than just seleniumaddress.,positive
angular/protractor,selenium,2014-07-03T04:45:14Z,the current script allows me to download both the selenium-server-standalone and iedriverserver binaries. however. i am unable to get the chromedriver binary through the webdriver manager. all three links should use the same protocol.my company has very strict cert rules which deny untrusted connections. take this with a grain of salt. but as i understand node's http client passes it's ca and strict-ssl config options onto the tls layer. after switching to the request module i am no longer able to supply dreadful options like strictssl = false.,negative
angular/protractor,selenium,2014-07-03T05:06:55Z,i think this issue is selenium driver's.,neutral
angular/protractor,selenium,2014-07-07T20:04:11Z,feat(protractor): add support for promises in configs. change driverproviders/hosted to resolve promise valuesin configuration to allow async jobs in setup.  primarily.this would be for a network call to acquire a selenium hostor to start a proxy server.,positive
angular/protractor,selenium,2014-07-07T23:58:54Z,would love to have this feature in please as we'd love to be able to dynamically assign hosts and proxy servers into the config.,positive
angular/protractor,selenium,2014-07-08T18:40:57Z,could someone take a look at this?,neutral
angular/protractor,selenium,2014-07-08T18:50:18Z,thanks. merged as b2b43b1c92f632eeefd51b96c18afec79ccc4fe5,positive
angular/protractor,selenium,2014-07-11T20:00:32Z,it usually happen when you try to update under vpn.get off the vpn and delete node_modules/protractor/selemium directorythen try to run the command again.,neutral
angular/protractor,selenium,2014-07-11T20:32:31Z,that's weird. the variable `seleniumprocess` is defined in the line above that. it almost seems as if the node script is corrupted. can you try updating protractor and try again?,negative
angular/protractor,selenium,2014-07-13T14:00:48Z,thanks for reply juliemr. i think don't have issue starting java from command line as i launched selenium jar manually from command line - i also attached the screen shot (2nd screen shot).,positive
angular/protractor,selenium,2014-07-14T09:54:36Z,hi.   i am new to selenium. i working with menu. need to click sub menu using selenium webdriver. could anyone help with tat :(,neutral
angular/protractor,karma,2015-05-19T16:28:33Z,great thread. helped a lot. thought i had an issue - but don't. cannot find a way to delete :) keep up the good work.,positive
katspaugh/wavesurfer.js,karma,2016-10-25T16:50:13Z,thijstriemstra. i figured this was the case. i spent a couple hours trying to hack in the media blob data. but it sounds like even if i got that working i would have hit the unsupported problem you hit.my initial advice would be to move towards using karma and running the tests in an actual browser. i don't know if that works on ci environment like travis though.,negative
katspaugh/wavesurfer.js,karma,2016-10-25T21:05:20Z,thijstriemstra / katspaugh please refer to #849 for an example of in-browser testing with karma,neutral
tapjs/node-tap,mocha,2016-10-04T17:03:38Z,focused specs. is it possible to run one spec only? i had a look at the docs but didn't find any info about it. `jasmine` has a concept of focused specs `fit`. mocha provides an `only` method. i like tap much and such feature would make my work easier in some cases.i can have a look at it and create a pr if it's in scope of the project.,neutral
rlidwka/sinopia,mocha,2013-12-11T13:02:09Z,> correct test starter to return appropriate exit codesorry. but your code doesn't do this. instead. you set an environment to be `testres=mocha` and run `-r list --ui exports ./tests.js ./no_proxy.js` command which would fail of course.> however yapm test run freaks out unnecessarily given that it's a testwhat do you mean by "freaks out"?,negative
meanjs/mean,coveralls,2016-01-10T18:51:49Z,sure no prob... did we ever reach a consensus on whether or not to include `imagemin` in the build task? i hear what rhutchison is saying about it being opinionated... i could go either way... some projects won't really need imagemin...aside from the coveralls issues. imagemin is ready to go and supports jpg. png. gif and svg. will send a fix later today,negative
meanjs/mean,coveralls,2016-01-11T16:05:26Z,yeah sorry i should have mentioned.... i had to merge master in order to get the coveralls tests to pass... it was failing due to missing test coverage.,negative
videojs/videojs-contrib-hls,standard,2015-06-16T20:36:35Z,add the native source handler pattern. the hls tech should be a source handler itself but until that transition is complete. have it mimic the behavior of the flash and html techs. create a fallback "native" source handler that will apply the standard behavior when invoked to handle a source. use player.hls.src_ to detect whether a source is loaded in fillbuffer so that the async nature of currentsrc doesn't delay segment fetching.,negative
videojs/videojs-contrib-hls,standard,2015-06-16T21:27:13Z,lgtm :toilet:,neutral
pouchdb/express-pouchdb,mocha,2014-03-20T20:54:22Z,so we dont stringify error objects. thats just overriding tostring because for some reason mocha wasnt being nice about printing them. checking .error === true should always work for detecting errorswe changed our errors to be more javascript compatible than identical to couchdb. being identical to couch isnt a goal in itself. just being able to make sure users get compatable errors when using couchdb as a backend or idb etc,negative
brightcove/videojs-errors,standard,2015-04-24T22:04:27Z,`data-video-id` is not a standard attribute. what problem is this pr trying to address?,negative
nodegit/nodegit,mocha,2013-10-09T22:31:41Z,also. when you run tests. why does glob run twice?? mine only runs once:```192:node-fsplusgit nkallen$ mocha -g glob  ․  1 passing (197ms)```,neutral
ember-cli/ember-cli-mocha,mocha,2016-05-12T13:15:12Z,(would probably be good to. at some point. implement a similar helper for ember-cli-mocha),neutral
ember-cli/ember-cli-mocha,mocha,2016-05-18T11:24:34Z,the instructions 404'd :-(,neutral
ember-cli/ember-cli-mocha,mocha,2016-05-19T13:03:34Z,ok. i added the registry hack:```  aftereach(() => {    // tear down    application.registry.unregister('session:main');    application.registry.unregister('session-store:test');    destroyapp(application);    server.shutdown();  });```but. now i'm also getting the ```typeerror: app.testhelpers.wait is not a function```problem.:-(does this mean that the test helpers aren't being loaded properly?i think there is something funky with acceptance testing and mocha right now. :-\any ideas?,negative
electrode-io/electrode,karma,2017-03-08T01:14:25Z,add karma-intl-shim to the karma config of electrode-archetype-react-app-dev. the `karma-intl-shim` is already imported into the electrode-archetype-react-app-dev package. but not actually applied to the karma config. if there's a way to configure this from my project. i'd love to know. but as it stands it looks like the karma config isn't configurable unless i write a new gulp task. is that correct?for easy searching. here's the error that i received from phantomjs when i tried to run tests with localized components: `invariant violation: [react intl] the `intl` apis must be available in the runtime. and do not appear to be built-in. an `intl` polyfill should be loaded.`,negative
electrode-io/electrode,karma,2017-03-08T16:49:28Z,allow user settings for karma config,neutral
admc/wd,mocha,2013-03-01T18:50:34Z,i'm just running mocha with  test/local/window-frame-test.js and i'm seeing the window sizing tests pass on chrome and firefox.on mar 1. 2013. at 9:48 am. meanwhilemedia notificationsgithub.com wrote:> jlipps. can you tell me what browser you were using when the tests were passing?> > —> reply to this email directly or view it on github.,negative
angular/angular-cli,uglify,2016-12-21T09:15:13Z,hey!you can use --no-sourcemap ;),neutral
angular/angular-cli,uglify,2016-12-21T19:19:36Z,closing this as obsolete.,negative
angular/angular-cli,uglify,2016-12-29T18:57:51Z,closing as `--no-sourcemap` is now available.,neutral
angular/angular-cli,uglify,2017-01-05T09:37:17Z,specify options to uglify via angular-cli. is there any ways to specify uglify options via angular-cli ? uglify strips class names which is not acceptable for me because im relying on class names in my code.,neutral
angular/angular-cli,uglify,2017-01-05T09:45:23Z,from what i see in `webpack-build-production` there is no way to specify custom options. process of building apps for different environments can be pretty dynamic depend depend on use case. i hope angular-cli will cover all such scenarios in the future. otherwise there is small point in using it. also i think having all options in a single angular-cli.json cant cover all cases. despite my personal favorite of simplicity. because build process is non trivial sometimes. and should be and angular-cli should be flexible,positive
angular/angular-cli,uglify,2017-01-16T16:19:06Z,since #3963 the default has changed. no source maps by default. enable them with `--sourcemap`,neutral
gcanti/tcomb-form-native,eslint,2015-06-17T09:33:37Z,port some features from tcomb-form. - **new feature**  - getcomponent api fix #19  - get access to the native input contained in tcomb-form-native's    component fix #24- **breaking change**  - inputs refactoring. this affects how to build custom inputs #12- **internal**  - textbox is no more a controlled input #26  - add eslint,neutral
SebastianM/angular-google-maps,karma,2016-02-07T18:13:25Z,chore(gulp): add karma integration. closes #83,negative
SebastianM/angular-google-maps,karma,2016-02-07T20:36:14Z,landed as 46f866a0c18dcb10405a7682ff3fcf2eed1c6c25,neutral
Project-OSRM/osrm-backend,standard,2017-05-26T18:11:15Z,a little bit of research revealed that while it's not defined by a standard. no c++ compilers use the return type as part of the mangled symbol name.  it generally doesn't make any sense to do so anyway. because it would indicate support for  ambiguous function overloading.we should be abi and source-code safe to change the return type of these externally visible functions.  i'll go ahead and implement that. and document the return codes.,negative
npm/npm,standard,2014-09-17T08:00:02Z,- improved "outdated" command to update remote tarballs when the remote content changes. hi.we are working with some remote tarballs. referred using its direct http/https url in the dependency/devdependencies list.we found that npm caches the content of that tarball using the url as unique key.this is absolutely fine for "tagged" release that never changes. however if we want to support a snapshot-like based deployment (in our continous-integration environment). we would like to release "-snapshot" remote tarballs. where a ci build machine pushes new content in that tarballs at each build.simply using "npm cache clean " doesn't work. since the command cleans the local cache. but not the "node_modules" local folder.so i've tried to enhance npm with the minimum set of changes. in order to make the "outdated" command to actively check the remote repos.changes:- the local 'package.json' is enriched with a new property (_remote) containing some useful information about the get response headers (currently etag and modification date). with the original url as well.- added new file 'check-remote-tarballs' with the logic to issue a head request- added new file 'remote-options' with the logic to issue the head request with the right headers. in order to stimulate the http 304 (not modified) response.as a side note. i've found that the "add-remote-tarball" actually uses the npm registry api to issue the get command for a remote tarball. is that intended? the npm registry module adds logic to support registry authentication. ca. session. etc... that are actually useless if the remote tarball is on a non-registry machine.in addition. we needed to patch our iis server to server .tgz files with the non-standard mime type "application/x-tar" (explicitly required by npm registry module).the added head support cannot use the npm registry module (unless we add the head support there). so i've directly used the 'request' dependency.thank you for this great tool!luciano,neutral
npm/npm,standard,2014-10-03T03:55:40Z,(keeping in mind that npm has a slightly different interpretation of prerelease metadata than the standard. even with `semver4`.),neutral
npm/npm,standard,2014-10-03T06:38:14Z,(i should point out that i don't think this point is beyond argument; i'm just trying to capture the rationale for why npm handles it the way it does. which is in accordance with how isaacs interprets the semver standard.),negative
npm/npm,standard,2014-10-03T19:55:34Z,> should we add a dependency to npm-registry-client for that pr?my plan is for the cli not to be doing any network access directly; everything will go through `npm-registry-client` or other external modules. as such. npm itself isn't going to add any new functionality that talks directly to the network. this could be a new command in `npm-registry-client`. or you could create a new module (`http-file-status`?) to encapsulate this functionality and integrate it into `npm outdated` for tarball checking.> about iis and .tgz mime-type. i know that there should be one standard. however imo the tool should try to work seamlessly on the majority of installations. register an additional mime-type "application/x-compressed" should be not disruptive for the tool...it sounds like iis is actually in the minority here. as i understand it. the conventional way to serve compressed tar files is with a `content-type` of `application/x-tar` and a `content-encoding` of `deflate` / `gzip` – that is. the compressedness of the content is independent from its content type. (the wikipedia page i linked to above goes into this in more detail. albeit not in the most straightforward way.)>  i've introduced the etag support too (see proposed remote-options.js module). we could discard the time approach at all. actually bower seems to correctly use etag already.etags are the most web-friendly way to check the freshness of a package. and what i think everyone at npm would recommend you use.,negative
npm/npm,standard,2014-10-03T21:58:29Z,closing as resolved / abandoned. i think timoxley is right. and this is about as standardized as the javascript ecosystem is going to get.,positive
npm/npm,standard,2014-10-06T09:05:55Z,ok. so if you are ok going with head check in npm-registry-client i'll open a pr there with the bare head request api. and then create a new module with the etag logic there.i'll check the current bower implementation for that and see if we can avoid duplicates.thank you. luciano,neutral
mishoo/UglifyJS2,uglify,2012-09-08T20:36:19Z,using uglifyjs2 for dummies. dear mishoo. thank you for great work.i'm trying to minimize my javascript code and want to use uglifyjs2 but i couldn't make it.i read "play with it" secon in readme text but i didn't get how will i run "tmp/test-node.js script.js" ??i downloaded repository added an html file and added script tags inside page. but i couldn't find even to how to start.i would be happy if you can tell me how to run this script. just like telling to a dummy.thank you,positive
mishoo/UglifyJS2,uglify,2012-09-08T21:10:21Z,node.js! that's adeuqate for a start.thank you very much.,neutral
testem/testem,jshint,2015-03-17T21:41:09Z,feature: configure testem in package.json. it's (sorta?) becoming a pattern that package.json can be used to configure a tool rather than having a plethora of tool-specific config files.examples: browserify. testling. and jshint all allow configuration via a tool-specific key in package.json. (`browser`. `testling` and `jshint` respectively).it would be cool if testem's configuration could be supplied via a `testem` property in package.json. instead of `testem.json/js`,positive
mochajs/mocha,mocha,2012-05-14T18:02:32Z,any updates? stoked to be able to use this from mocha.js without the separate library.,neutral
