Modernizr/Modernizr,sauce,2014-03-04T01:11:38Z,dhimil still getting timeout issues. opera mobile always timesout and this time opera desktop v19 timed out too.,neutral
Modernizr/Modernizr,sauce,2014-03-04T01:12:12Z,gah. have i written shit code again? i’ll have a look.,neutral
Modernizr/Modernizr,sauce,2014-03-04T02:13:18Z,and another. which addresses test failures in browsers which don’t support css columns… (e.g. ie9),positive
Modernizr/Modernizr,sauce,2014-03-04T11:27:45Z,this is actually all passing for some reason browserstack kicks off two automation tasks. the commit hash for my last commit in browserstack ran all browsers and passed fine. the other hash failed in ie10 because it looks like jquery failed to load for some reason.also i tried and failed to squash this. probably because i had to rebase from master a few times. stucox. patrickkettner you're welcome to try.otherwise i'd say we're good to merge.,positive
Modernizr/Modernizr,sauce,2014-03-04T11:28:55Z,stucox patrickkettner you both have access to browserstack and can see the automation that has been running if you haven't looked already.,neutral
Modernizr/Modernizr,sauce,2014-03-04T17:07:17Z,updated. dhimil,neutral
Modernizr/Modernizr,sauce,2014-03-04T22:01:56Z,sweet so that passed on your commit patrickkettner we should be good to merge now.,positive
Modernizr/Modernizr,sauce,2014-03-05T06:37:48Z,awesome! good to see test pass! meanwhile we were able to fix the android issue (except the kindle devices). can you add them and lets see the results.,positive
Modernizr/Modernizr,sauce,2014-03-05T06:42:52Z,i am unable to find a way to set proxy on kindle devices to make the local testing work. lets start with other device emulators.,neutral
Modernizr/Modernizr,sauce,2014-03-05T07:49:51Z,ryanseddon looking into it.,neutral
Modernizr/Modernizr,sauce,2014-03-05T08:34:35Z,this would most likely be a comment for the browserstack-runner. but it would be great to have colorized output (or some kind of visual emphasis on important information) on the travis output. makes it a lot easier to scan for failure,positive
Modernizr/Modernizr,sauce,2014-03-05T08:39:41Z,would you like an issue to be opened up on browserstack-runner for tracking?,neutral
Modernizr/Modernizr,sauce,2014-03-05T10:30:47Z,patrickkettner yep fair enough. are you concerned with the commit history on this? i can always kill this branch and do a clean one. famous last words.,negative
Modernizr/Modernizr,sauce,2014-03-05T10:35:33Z,its pretty messy at the moment. but i haven't tried to rebase it yet. if you think that it would be best to just open a new pr when this is good to go. i'd be fine with that too,positive
Modernizr/Modernizr,sauce,2014-03-05T23:33:59Z,yeah i might open a new one when the tests run consistently so as not to merge in this crazy commit history.,negative
Modernizr/Modernizr,sauce,2014-03-11T05:20:13Z,dhimil seems iphone 5s running ios7 is crashing and timing out.,neutral
mhkeller/indian-ocean,standard,2015-09-14T13:55:20Z,i think passing options as an object would be better than extra arguments for the reasons you state. and it's a pretty standard way of doing this.,positive
mhkeller/indian-ocean,standard,2015-09-14T15:11:05Z,ya i think this'll become a breaking change but a good idea. > le sep 14. 2015 à 22:55. eric brelsford notificationsgithub.com a écrit :> > i think passing options as an object would be better than extra arguments for the reasons you state. and it's a pretty standard way of doing this.> > —> reply to this email directly or view it on github.,positive
svgdotjs/svg.js,sauce,2017-06-28T16:51:20Z,hmm.. one concern though is not with the actually pr but with the failing test. according to the travis log the issue is that sauce_username and sauce_access_key is not provided but both are defined as environmental variables on the travis settings page.dylanlacey did our credentials change over at sauce labs?,negative
walmartlabs/eslint-config-defaults,eslint,2016-03-04T07:31:27Z,lkrnac since this resolves some issues for me. i've published your pr as `divmain/eslint-config-defaults`.  looks like there are some other requirements that baer has in mind for full eslint v2 compatibility. so i'll unpublish as soon as #69 is closed.,positive
react-boilerplate/react-boilerplate,mocha,2016-02-29T09:47:40Z,i tried do it yesterday.faced problem with karma (or mocha?). it's crashed on import es2015 modules.i cannot understand where and when test task executes during build task. and how fix it.also i think that if we switch tests to ava problem will be eliminated.,neutral
react-boilerplate/react-boilerplate,eslint,2016-07-25T10:50:33Z,got it working. i had to:- remove ngrok from package.json (does not install properly on windows)- run:```npm cache cleannpm installnpm install eslint -gnpm run setup```the 'installing dependencies...' part of the setup seems to do nothing on windows. the node_modules directory is empty after this completes.,negative
react-boilerplate/react-boilerplate,eslint,2016-08-01T08:51:01Z,ideally set up .editorconfig to use same formatting as expected by eslint. if not possible at least set webstorm formatter to use same formatting as expected by eslint.at least i've found eslint --fix parameter. which fixes these formatting issues.,neutral
react-boilerplate/react-boilerplate,eslint,2016-08-01T12:29:30Z,> ideally set up .editorconfig to use same formatting as expected by eslint.oh no. i thought we had that! is our editorconfig out of sync with the eslint config?,neutral
react-boilerplate/react-boilerplate,eslint,2016-08-03T07:52:05Z,yeah. that's because if you don't have actions/reducers/… the store won't be used in the route and eslint will throw an "unused variable" error… :confused:,neutral
react-boilerplate/react-boilerplate,eslint,2016-08-03T16:38:11Z,> yeah. that's because if you don't have actions/reducers/… the store won't be used in the route and eslint will throw an "unused variable" error… mxstbr that's understandable. but having generator configured code that crashes feels like a bug to me. if automating 100% workable code generation is not practical. imo. at the very least the code should work as generated and code comments should describe what's going on.if you agree. i'll open an issue on it. can't promise that i have time to fix it any time soon though  as for this pr. i see no reason not to merge.,negative
react-boilerplate/react-boilerplate,eslint,2016-08-08T07:36:16Z,i think we need to fix the `eslint-import-plugin` with our `resolve` settings of webpack. would you mind looking into that?,neutral
react-boilerplate/react-boilerplate,eslint,2016-08-08T14:50:56Z,mxstbr i really would love too. but i'm not sure if i understand correctly.so.  i guess i need to config `eslint-import-plugin`. but there is no any of `eslint config file` at all.shall i create a new one?,negative
react-boilerplate/react-boilerplate,eslint,2016-08-10T06:33:17Z,mnemanja if eslint has a plugin for your editor/ide lint runs automatically and you see errors in real-time as you type. it uses the eslint configuration from the `react-boilerplate` project. there's nothing for you to configure beyond setting up your editor for eslint support.for example. i'm running atom with `linter`. `linter-eslint` and `linter-stylelint` packages. i get lint errors reported as i type or paste code in .js and .css files.,negative
react-boilerplate/react-boilerplate,eslint,2016-08-10T20:19:26Z,i was able to fix this issue by changing the lint:eslint script to "eslint --ignore-path .gitignore --ignore-pattern internals/scripts || true".  if the eslint command results in an error. the "|| true" part will run. returning true (e.g.. non-error) to npm.,positive
react-boilerplate/react-boilerplate,eslint,2016-08-14T04:32:31Z,will need to be merged with #862 before it will pass ci. there is a problem with eslint and friends present in the current dependency tree (before #862).,neutral
Esri/esri-leaflet,standard,2015-09-14T06:52:52Z,our company publishes web mapping services of taiwan only rather than a global scale.if there's no standard for cases like this. we would have different origins using services from different sources.,positive
apache/zeppelin,selenium,2016-04-26T13:52:00Z,r-kamath build fails with ```failed tests:   sparkparagraphit.testsqlspark:169 paragraph from sparkparagraphit of testsqlspark result: expected: "age job marital education balance\n30 unemployed married primary 1.787"     but: was "age\njob\nmarital\neducation\nbalance\n30 unemployed married primary 1787\nage\njob\nmarital\neducation\nbalance"```looks like this require selenium test update.,negative
assaf/zombie,standard,2014-06-12T07:29:33Z,well. that only works if you control the html you're reading which in my case isn't true. i suspect zombie should follow the "be strict with what you do. be lenient with what you require" approach to standards.,neutral
yeoman/generator,coveralls,2013-12-29T01:06:46Z,couple of comments:- i usually define all of my paths as variables just to keep things dry between tasks.- i would move the coveralls stuff into another function or package- the mocha stuff can probably be its own task as well (trigger with `.run('mocha'. cb)`),neutral
yeoman/generator,coveralls,2013-12-30T02:58:43Z,sboudrias the coveralls stuff kinda feel like it should be a node module or gulp thing.,neutral
yeoman/generator,istanbul,2013-12-28T02:09:39Z,yeah. i saw this one yesterday. i tested the rules against our code base and some weren't applying cleanly on top of the actual code base. so i edited pieces of it in the grunt branch. i'll bring them over the gulp ones and try the lastest one on mocha.there's no istanbul (coverage at all?) plugin for gulp as of yet. but i really like how they're written. i'll probably take a stab at it in the next few days.,negative
MithrilJS/mithril.js,eslint,2017-04-09T06:13:45Z,isiahmeadows interesting. `npm run lint` isn't complaining about that. i removed a bunch manually but didn't even notice the rest because i'm 100% a semicolons required guy.why doesn't `.eslintrc.js` have```js"semi": ["error"."never"].```in it?,negative
feross/buffer,sauce,2014-12-24T03:27:00Z,i tried running the tests in local browsers but not at sauce. lemme try that real quick.,neutral
feross/buffer,sauce,2014-12-24T03:52:20Z,this seems to be working for me in sauce. with tape they just seem to run impossibly slow there...,neutral
feross/buffer,sauce,2014-12-24T08:58:46Z,if you get sauce labs remote testing set up properly. you should (in theory) be able to test that things are working properly before pushing to master. it's been a bit flaky for me tonight though :(if it's helpful to get the tests passing. feel free to push to master for now.,positive
feross/buffer,sauce,2014-12-24T19:46:18Z,makes sense - i will make sure to run those beforehand next time. i ran out of sauce minutes pretty quick tho... do i need a paid plan or maybe i can test by pushing to a non-master branch here?,positive
feross/buffer,sauce,2014-12-24T22:11:54Z,jessetane you have to make an open sauce account:  and then you get unlimited testing.,neutral
feross/buffer,sauce,2014-12-30T05:28:40Z,i create a sauce labs account for each project since even with an open source account you only get a limited number of sub-accounts. like two or something.but i only need to do this because i want to show a unique badge on each module's readme. for running zuul locally. you can just use one account for everything.,positive
datproject/dat,standard,2015-08-17T10:27:27Z,hey. thanks for opening this pr. i think this is a great suggestion. and linked data is super important!i'm hesitant to put any specific standards into dat. because then we'd have to support all of them. if people wanted to use `id` as the key they could do `--key=id`. is there a reason why the `-k id` interface isn't serving well? too much? often forgotten?at one point. we were thinking about putting a `dat add` function that would be a little more 'magic' to walk one through a data import. here. we could imagine a series of prompts -- one of them could try to auto-detect the unique key and ask you which column based upon that. i can imagine these kinds of higher-level features going into that.,positive
KyleAMathews/typography.js,standard,2017-01-12T05:47:57Z,ensure standard ligatures are enabled,neutral
OpenZeppelin/zeppelin-solidity,coveralls,2017-07-24T19:40:35Z,remove coveralls token. the token was supposed to be secret. testing things out in this pr to see if coverall's check works without it.,neutral
cfpb/capital-framework,uglify,2017-11-08T15:38:31Z,update dependences and build. ## changes- updates build gulp tasks to es6 syntax.- replaces uglifier with `uglifyjs-webpack-plugin` to match cfgov-refresh configuration.- updates `babel-preset-env`. `deepmerge`. `finalhandler`. `run-sequence`. `serve-static`. `sinon`. `wcag`. `webpack`.## testing- `gulp build && gulp test` should pass.,neutral
duereg/gulp-coffee-istanbul,istanbul,2015-02-17T17:41:56Z,that's pretty standard... you don't check in node_modules. and on doing an npm install. it will install the modules for you. just try `npm install gulp-coffee-istanbul` and that should install all the files you need. hope this helps!,positive
vvo/selenium-standalone,selenium,2014-11-18T20:47:01Z,i really don't know. maybe it's your proxy settings? also please use the latest selenium-standalone,positive
vvo/selenium-standalone,selenium,2014-12-03T11:41:23Z,well according to selenium it's a feature.,neutral
nathanboktae/mocha-phantomjs,mocha,2015-09-09T04:59:39Z,oh. i see. now i use `mochaphantomjs.run()` and all work right! thank you! i read this tip. but totally forgot where to use it :smile:,positive
nathanboktae/mocha-phantomjs,mocha,2015-09-09T05:13:33Z,good to hear :) and good to hear my work to remove that need will be an improvement - the goal of `mocha-phantomjs` is that it just builds on your vanilla testing work. and that was the one thing not conforming to that.,positive
nathanboktae/mocha-phantomjs,mocha,2015-09-17T11:16:56Z,+1 would be nice to have. sometimes you just want to quick spin up tests without having to dig into build scripts.,positive
nathanboktae/mocha-phantomjs,mocha,2015-09-17T16:02:24Z,i can see that. one thing to note is that `mocha-phantomjs` can't know about what files you need to watch. but the same thing is true for browser sync that i've been using a lot lately. and i just pass it a glob of files to watch.,negative
nathanboktae/mocha-phantomjs,mocha,2015-09-21T07:38:46Z,closing as i think this is a bad idea. if you're fighting phantomjs this much you should test in real browsers (try firefox + xvbf. perhaps with slimerjs or karma). also `mocha-phantomjs` supports phantomjs 2 if you bring your own binary via `-p`.,positive
nathanboktae/mocha-phantomjs,mocha,2015-09-21T07:41:22Z,closing as this is a bad idea since we can't aggregate the tests results in a meaningful way. it's much better to have one test runner and use the grep option (`-g`). otherwise like i mentioned above. this is just `find . -name "*.test.html" -exec mocha-phantomjs {} \;` which you can do yourself if you wish.,negative
nathanboktae/mocha-phantomjs,mocha,2015-09-23T05:06:46Z,uses `require.resolve` to get the realpath of mocha-phantomjs-core.js. to fixes #204,neutral
nathanboktae/mocha-phantomjs,mocha,2015-09-30T00:49:19Z,sorry reading your post a bit more. i see you're trying to come up with a workaround. i think this is out of the scope of `mocha-phantomjs`'s responsibility. for example. you could change that dirty to monkey patch all `error#stack` to polyfill source map support and include it with your tests just as all users of phantomjs have to polyfill various other stuff. like `mutationobserver`. `promise`. etc.,negative
marionettejs/backbone.marionette,mocha,2014-09-13T03:31:15Z,helper function that reliably verifies if a given function is a view "class" (or view constructor). if we want to proceed with the suggestions given in issue #1846. this helper function is the first step. but i think it is quite useful by itself.it would allow us to have dynamic view classes (the view class would be obtained at run-time). the first place to use this would be in collectionview. but i see it being useful in other parts of marionette. unfortunately i don't have experience with mocha to write a tests. hope that will change shortly.,positive
marionettejs/backbone.marionette,mocha,2014-09-13T03:41:49Z,i was just thinking we would include this in the collectionview class. is there any reason to abstract it into a helper? also. would we want analogous methods for model. collection. object...etc.?,neutral
marionettejs/backbone.marionette,mocha,2014-09-13T04:06:45Z,i see this functionality (choose the view to be used at runtime) being useful in other parts of marionette. for instance. to implement reusable component classes. i do pass view classes in those kind of classes. along with a region instance. as for analogous methods. yeah. we would need to have them for models and collections if this ends up being replicated for them. as for the rest. underscore provides utilities to check the kind of object.,neutral
marionettejs/backbone.marionette,sauce,2016-12-20T05:52:35Z,hmm i don't know why it is failing on the main repo and not my fork... only thing that is really different is sauce failed on my box because i don't have the username/password on my travis.. anyhow.. check out travis on my link above.. we can get that to work.. i think as a poc this should be ok..,negative
marionettejs/backbone.marionette,coveralls,2014-09-01T04:19:44Z,resolved by #1795,neutral
marionettejs/backbone.marionette,coveralls,2014-09-10T15:48:18Z,:thumbsup: thanks james. this is a huge win! first the specrunner will be much easer to use. second. coveralls just got a whole lot better!,positive
marionettejs/backbone.marionette,coveralls,2014-09-10T17:14:55Z,resolved by #1853,neutral
nteract/nteract,eslint,2016-07-25T17:45:13Z,> yea i was trying to say that that's wrong. it prints out to the terminal just fine.it does indeed! however. our linting config explicitly forbids the use of `console.log`. causing travis to return a big ugly ❌. the options to get around this include:- using `console.warn`- using `console.error`- popping up a dialog box using native electron apis- using `eslint disable line`however. all use of `console` should likely be forbidden in the main process as you can only see this when launching nteract from the command line (my comment will make more sense when you're using the built app).,negative
nteract/nteract,eslint,2016-08-13T19:26:33Z,ohhhh. this issue is related to the fact that it's not upgrading the config _and_ eslint at the same time.,neutral
nteract/nteract,eslint,2016-08-13T19:27:29Z,bump eslint and eslint-config-airbnb. resolution to #589,neutral
nteract/nteract,eslint,2016-08-13T19:33:15Z,thanks jdfreder!,positive
nteract/nteract,codecov,2016-06-14T23:31:45Z,good catch codecov!,positive
nteract/nteract,codecov,2016-06-24T13:55:56Z,rely on codecov bash instead of codecov-node. in support of #533,neutral
fullcalendar/fullcalendar,karma,2016-09-29T01:59:07Z,yes! these docs are written for the main fullcalendar project. but it's a similar setup for scheduler (except with coffeescript). also. the gulp task names are different (would be `gulp karma` instead of `gulp test`),neutral
HospitalRun/hospitalrun-frontend,snyk,2016-07-07T19:41:09Z,soarez thanks for the pr.  the tests were failing because of an issue with snyk.  once i addressed that there was a small jscs error where there were unused declarations app/admin/workflow/route.js.  i manually made the fix and merged your pr.  thanks again!,positive
appium/appium,selenium,2014-07-16T11:28:27Z,how to run appium pointing some other machine. i am running appium on my mac machine where i have mentioned server address of my windows machine which is in same lan. i doing this because i am having selenium scripts written in vsts on my machine. i am having iphone connected to my mac machine and i want to run the scripts on the iphone. when i am starting my appium server i am getting error as "the address is not available". anybody can help me how to get it resolved.,negative
appium/appium,selenium,2014-07-18T10:19:40Z,can you please suggest me what are the jars files need to be used for appium using selenium driver,neutral
appium/appium,selenium,2014-07-19T06:44:47Z,hi moizjv i have included appium.jar n also selenium.jar after including appium.jar click function s working but sendkeys were not working,neutral
appium/appium,selenium,2014-07-23T11:29:42Z,ios: org.openqa.selenium.sessionnotcreatedexception: a new session could not be created. (original error: no app set; either start appium with --app or use 'app' cap) . i will to use installed application on ios device and i don't want to use "app" property at all. so. i set up desired capabilities properties for "bundleid" and "udid" and ignore "app" - i got this exception message for ios."org.openqa.selenium.sessionnotcreatedexception: a new session could not be created. (original error: no app set; either start appium with --app or use 'app' cap) (warning: the server did not provide any stacktrace information)"but. the same works  fine. if we set up same properties for appium gui and ignore app property.,neutral
appium/appium,selenium,2014-07-25T18:19:55Z,you can also just use the bundle id as the value of the app capability instead of using the bundleid capability,neutral
appium/appium,selenium,2014-07-30T07:35:50Z,you should use actions class in selenium.,neutral
appium/appium,selenium,2014-07-30T22:35:14Z,please advise on how to obtain `reproducible steps (with just using selendroid / not appium)` per request from selenium team.also. i don't see why you're closing this issue. as an appium user. i shouldn't be expected to know how it works under the hood (whether it's selendroid or uiautomator). from my point of view. there issue is with appium - selendroid is an implementation detail.,neutral
appium/appium,selenium,2014-08-05T06:26:45Z,configuring selenium grid in windows for appium remote execution. my requirement:i have selendroid script in one windows machine and appium server and android device connected in another windows machine.i am trying to achieve remote execution .could you please brief me the steps.thanks,positive
appium/appium,selenium,2014-08-05T18:38:06Z,sorry. the issue tracker isn't a place to share instruction steps. please ask in the forums,positive
appium/appium,selenium,2014-08-14T05:14:27Z,i am getting error message saying chromedriver.exe is not a valid win32 application.i guess i need to replace chromedriver file.but from  where i get 32bit chrome driver file.bec in selenium site we have common driver file for both 32bit and 64bit.please suggest me what action i need to take.system details :windows 7 32bitthanks.,negative
appium/appium,selenium,2014-08-15T11:56:31Z,hi.what code did u exactly write for performing touch gestures in android . please let me know,positive
appium/appium,sauce,2014-05-17T20:30:33Z,update ruby sample code. updated the ruby sample code.`android_on_sauce.rb` works locally and fails on sauce. the sauce failure isn't new. it's not clear why sauce is unable to run this test.,negative
appium/appium,sauce,2014-05-18T01:36:57Z,`android_on_sauce.rb` not working on sauce is a known issue. it's not clear why sauce can't run this test.,neutral
appium/appium,sauce,2014-05-19T16:32:31Z,dylanlacey if there are no objections. i'm looking to merge this soon.,negative
appium/appium,sauce,2014-05-20T07:59:20Z,lgtm.,neutral
appium/appium,sauce,2014-05-20T08:00:03Z,does it still fail to run on sauce?,negative
appium/appium,sauce,2014-06-03T19:15:44Z,seems like this issue is on saucelabs only? if still an issue. can you contact [support](,positive
appium/appium,mocha,2014-08-04T23:50:47Z,fix handling of keystore creation. put the keystore management code in a `before` block. so as to stop abusing mocha. and make sure keystore is created before we try to use it in a test.,negative
sendgrid/sendgrid-nodejs,mocha,2013-05-28T22:05:54Z,publish normally. not shrinkwrap. for some reason you published using shrinkwrap and included all the devdependencies. i definitely don't need mocha in my production app.,neutral
sendgrid/sendgrid-nodejs,mocha,2013-05-30T12:57:14Z,fixed the issue where shrinkwrap had the devdependencies in it.  still keeping the shrinkwrap though.  i've been burned by `nodemailer`'s non-strict dependency management one too many times to remove it.  more details on why in issue #39happy to hear an argument against it though.,negative
jhipster/generator-jhipster,eslint,2016-07-10T03:55:10Z,fix eslint errors in gulp files. fix eslint errors in gulp files,neutral
jhipster/generator-jhipster,eslint,2016-07-11T12:21:58Z,vivekmore can you do the pr for the angular2 branch's client-2 as well?,neutral
jhipster/generator-jhipster,eslint,2016-07-11T15:19:41Z,absolutely,neutral
jhipster/generator-jhipster,eslint,2016-07-11T17:15:17Z,fix eslint errors in gulp files. fix eslint errors in gulp files- client folder- client-2 folder,neutral
jhipster/generator-jhipster,eslint,2016-07-12T02:25:12Z,lgtm :),neutral
niklasvh/html2canvas,mocha,2014-12-22T13:37:31Z,thanks for the pull request!there are a few issues in the pr:- all changes should be made in the source files. (reside under `src/`)- all draw related issues should reside under an implementation of a `renderer`. which would be `canvasrenderer` in this case. the `nodeparser` does not rely on an implementation of `canvas` to be available. and it could be used to render onto a webgl context. or just a serialized json list of draw commands.- some (mocha) unit tests for the generation of list items would be nice,neutral
