liferay/alloy-editor,karma,2015-03-25T12:55:50Z,remove singlerun config from karma.js,neutral
liferay/alloy-editor,karma,2015-03-25T12:56:23Z,just started reviewing :) <br><br>:octocat: _sent from [gh]()._,positive
liferay/alloy-editor,karma,2015-03-25T12:57:26Z,thank you. pull request merged! <br><br>:octocat: _sent from [gh]()._,neutral
pubnub/chat-engine,codacy,2017-11-15T17:44:22Z,added codacy badges,neutral
redux-saga/redux-saga,eslint,2017-10-07T11:42:08Z,ok. so one need to be careful when dealing with sparse arrays - empty indices are non-enumerable and `deepequal` uses `object.keys` under the hood. therefore we cannot simply compare explicit undefined with the implicit one in sparse array.personally i think that just suppressing eslint warning is enough and no more trickery should be added to that test.it has also an interesting side-effect for our use case - returned array (if not destructured) remains sparse. so it potentially could surprise someone. but until somebody reports this with some valid use case why he/she would like to have it non-sparse. i dont consider this much of a problem.thanks for patience and the pr. gonna merge this in a moment.,neutral
webpack-contrib/sass-loader,eslint,2017-02-15T13:57:07Z,that would be awesome. could you create a pr?  just create a directory called `examples` (thus it will be ignored by npm as configured in the `.npmignore`). please also setup eslint for the examples directory.,positive
ramda/ramda,mocha,2014-09-02T17:21:35Z,i'm glad to see that old stuff go!  that was one of the first things i did on this library. just trying to get the mocha asserts to work in the browser so that we could get the same tests to run both client and server.  i never expected it to last.  (but i also never wanted to revisit it!)  thanks!,positive
ramda/ramda,mocha,2014-09-06T17:33:50Z,example updates and fixes. hi all.i just recently stumbled on this whole "functional programming" thing and shortly after that stumbled on ramda. seems really neat!i noticed an error or two in the examples. one thing lead to another. and i ended up writing a mocha test to compile and run all the examples. i went through and tried to get them all in working order. i changed some around slightly but mostly just little syntax fixes.this commit only includes my fixes to the examples. if you would like me to add the mocha test that compiles and runs the examples as well. let me know and i will issue a separate pull request. thanks!,positive
ramda/ramda,mocha,2014-09-06T18:01:49Z,this is fantastic. kedashoe!> if you would like me to add the mocha test that compiles and runs the examples as well. let me know and i will issue a separate pull request.i would _love_ to see this. :),positive
ramda/ramda,mocha,2014-09-06T18:43:46Z,this looks good to me. apart from the notes davidchambers and i made on it. thanks for doing all this work!,positive
ramda/ramda,mocha,2014-09-06T21:51:50Z,commit updated with suggestions,neutral
ramda/ramda,mocha,2014-09-06T22:08:35Z,lgtm!,neutral
ramda/ramda,mocha,2014-09-07T00:28:15Z,agreed. looks good. thanks,positive
ramda/ramda,mocha,2014-09-07T01:59:38Z,this is great stuff!  thank you very much!i'd also love to see your mocha test to run the examples. but as you can see in the comments to #338. i'm sceptical about overloading the use of comments.  (note. however. that i'm sceptical enough that i don't particularly like using them both to annotate the code for its developers and to generate api documentation; that's a battle i've long lost.)  so i'd love to see this. but am not guaranteeing that i would actually want to use it.,negative
ramda/ramda,mocha,2014-09-07T04:40:59Z,sounds good. i won't have a ton of time the rest of the weekend but should have it up monday or tuesday (need to clean it up at least _a little_. i figured i may as well use this little exercise as a way to start learning this stuff.. you all can have a good laugh at my functional programming :),negative
ramda/ramda,mocha,2014-09-09T04:24:27Z,mocha test to compile and run ramda.js examples. alright. here is my frankenstein imperative/functional mocha test for the examples. there was really no hope i could write anything properly functional in a couple days so i just got what i had written to pass the lint checker and here it is.basic idea:- parse the function comments (and function declarations for mocha it() descriptions)- extract example. parse example so we can test the //=> 'eg' as assertions- inject our executable example source as a function in ramda (so that we can also run internal function examples)- run our example function. see what happensif you want to see all the assertions being run. you can just add `console.log(msg);` to `assertpairequal` (maybe grunt option for more verbose?),negative
ramda/ramda,mocha,2014-09-09T05:58:34Z,did you consider using jsdoc programmatically (or falling back to esprima) to access the examples without resorting to gnarly regular expressions?,neutral
ramda/ramda,mocha,2014-09-09T13:39:38Z,i won't have time to look over the code until this evening.  but i'm looking forward to it.you should know. though. that it's failing the travis build -- it just seems to be hanging.  i haven't investigated any further.,negative
ramda/ramda,mocha,2014-09-13T22:27:39Z,nicely done!i'm still not sure i'm a believer (doubts described in #338). but this in nice work. and as it's so unobtrusive. it seems well worth including for now.,negative
ramda/ramda,sauce,2014-11-14T11:42:09Z,_concat appears to be the secret sauce to alot of the function implementations. as a side note. i would be very interested to know if ramda provides a r object toarray() function?  i am still pulling in lodash frequently. just for this one function facility. looking at the implementation of concat. part of that could be pulled out and exposed as toarray?,negative
ramda/ramda,sauce,2014-11-14T16:19:38Z,can fix that problem by moving ie8-shim.js after ramda.js in index.html and aliasing `window.ramda = window.r`. but then it is failing silently after that for some reason.,negative
ramda/ramda,sauce,2014-11-14T16:41:43Z,thanks. buzzdecafe! i was planning to spend some time debugging this issue in a vm over the weekend. but it appears you beat me to it. i look forward to seeing what changes were required as i had difficulty reasoning about the problem.,negative
ramda/ramda,sauce,2014-11-14T16:54:37Z,this appears to solve the es3 problem. i am hoping it knocks off the android problem as well.,positive
ramda/ramda,sauce,2014-11-14T21:38:07Z,> [c]an you look into that?yes. i'll have time to do so during the weekend.,neutral
ramda/ramda,sauce,2014-11-14T21:41:27Z,btw. `unapply` used json in its tests--which is not defined in ie7 :stuck_out_tongue_winking_eye:,neutral
ramda/ramda,sauce,2014-11-14T22:04:51Z,d'oh! i didn't think of that.,neutral
ramda/ramda,sauce,2014-11-17T10:49:52Z,i attempted to `git bisect` my way to the problem commit. but `grunt sauce` has stopped cooperating (it's now hanging after printing `22 / 22 tests started`). i'll try again another time.it would be nice if sauce gave us a log of some sort. knowing that something is failing but not knowing _how_ it is failing is not particularly helpful.,negative
ramda/ramda,sauce,2014-11-17T12:19:44Z,i feel your pain. i have found it difficult to test sauce locally because of frequent timeouts. were you able to make any progress? i expect it is something to do with reporting to mocha. so i'm hoping it's a simple fix once we isolate where to work. and isn't it _really early in the morning_ there?,negative
ramda/ramda,sauce,2014-11-17T14:09:43Z,created "badsauce" branch for testing.,neutral
ramda/ramda,sauce,2014-11-17T16:33:18Z,> [i]sn't it _really early in the morning_ there?it was. rather. i had a lot of code to write in one weekend. i hope to open a substantial ramda pr today. :),positive
ramda/ramda,sauce,2014-11-18T14:35:28Z,hey! android tests all just started passing--did someone change something?,positive
ramda/ramda,sauce,2014-11-18T15:05:24Z,closing this one. since sauce seems happy now. weeeeeeeeeee,positive
ramda/ramda,sauce,2014-11-18T22:22:43Z,:tada:,neutral
ramda/ramda,sauce,2014-11-19T00:23:34Z,next time the sauce tests break :volcano:,neutral
ramda/ramda,sauce,2014-11-19T14:35:41Z,dare i ask: did you try this in sauce? if so let's merge it,neutral
ramda/ramda,sauce,2014-11-25T22:28:48Z,let's keep an eye on the sauce tests please. all are now failing. not sure who did it. but pretty sure it wasn't me . . .,negative
ramda/ramda,sauce,2014-11-25T23:09:03Z,davidchambers buzzdecafe - it is almost certain to relate to this merge. it is now 8 am here in tokyo. so i am heading out the door for work right now - will try to get some time around lunch here (next 4-5 hours) to try and work out what has happened. apologies. but as i have indicated above. unless there is away to test sauce locally. it did look like it was going to be a blind merge.,negative
ramda/ramda,sauce,2014-11-26T22:18:27Z,this looks very much like the same error we are seeing in sauce.,positive
ramda/ramda,sauce,2014-11-26T22:46:34Z,sauce passed on my local machine. so feeling good.,positive
ramda/ramda,sauce,2014-12-05T17:41:28Z,generate html test runner. need this for saucelabs. which is once again broken. should be able to browserify.,negative
ramda/ramda,sauce,2014-12-05T22:46:55Z,mostly fixes broken sauce. yet again.. still fails for ie < 9 :scream:,negative
ramda/ramda,sauce,2014-12-05T23:02:08Z,is it necessary to commit **test/bundle.js**?,neutral
ramda/ramda,sauce,2014-12-05T23:09:11Z,it is if you wanna look at the html test runner without running `grunt test`,neutral
ramda/ramda,sauce,2014-12-05T23:15:18Z,that sounds like an edge case we needn't support. the most likely reason to run the tests is to test _changes_. i imagine.,positive
ramda/ramda,sauce,2014-12-05T23:16:57Z,i disagree. it can be quite useful to run the test suite from rawgithub.com,positive
ramda/ramda,sauce,2014-12-05T23:23:22Z,> it can be quite useful to run the test suite from rawgithub.comah. i see. that option hadn't occurred to me.,positive
ramda/ramda,sauce,2014-12-06T16:22:54Z,#655,neutral
pixijs/pixi.js,eslint,2016-12-08T00:09:25Z,for the `hasownproperty` thing. you can put `// eslint-disable-next-line no-prototype-builtins` on the line above it - interactionmanager created and owns the object in question. so we can be pretty sure that it has the `hasownproperty` method.,positive
pixijs/pixi.js,eslint,2016-12-16T18:55:25Z,i've add the parameter  in `apply` of filter.js . but eslint failed. because it doesn't be used.,negative
dresende/node-orm2,mocha,2014-10-22T14:51:52Z,cache clear documentation. for many use cases. the orm module cache needs to be manually cleared.this is useful in cases where you are bootstrapping mocha tests and need isolation. or are pooling resources on a server.this can be done by calling orm.singleton.clear().can someone update the documentation to reflect this?,positive
actionhero/actionhero,istanbul,2015-01-08T21:49:42Z,any idea why this might break istanbul? for some reason it just hangs when writing coverage,neutral
reactjs/react-docgen,eslint,2016-08-18T20:12:19Z,fix intersection and union flow types. this is basically #97 but without throwing an error.i also enabled to eslint rules to detect undefined and unused variables.closes #97,neutral
reactjs/react-docgen,eslint,2016-08-18T22:13:25Z,thanks for that! i added two comments which i guess don't show in here because the branch got deleted. but they should be visible when you click on "files".,positive
softlayer/sl-ember-test-helpers,eslint,2015-10-08T15:36:47Z,upgrade sl-eslint dependency. and update any files as necessary to comply with new rules.,neutral
Zarel/Pokemon-Showdown,mocha,2015-04-26T23:59:54Z,i built a mocha test to automate set generations for lower-tier (ru/nu/pu) pokemon as if it were a rain team. and the only pokemon that came up with bad sets in my first run (i only had each pokemon generate one set for now) were pyroar. lilligant. every mono-fire pokemon (rejected under rain automatically anyways) and pokemon that ended up with sunny day (which also get rejected). there might be more that i missed. of course.i think it's best if i took the pokemon that have the worst sets under sun/rain and hardcode them out as well.,negative
serverless/serverless,mocha,2016-11-04T08:02:49Z,ac360 wouldn't this be a problem for loading devdependencies like mocha as npm expects them to be in a local node_modules folder? so when i want to execute the mocha binary will it be found?just tested it by installing mocha in a parent npm folder (and looked into the docs) and it seems like npm is then only loading dependencies in the node_modules folder in the same directory?to optimise your dependencies and remove dev dependencies you can also use `npm prune --production` which will remove all dev dependencies from your node_modules folder.or is this only for additional plugins for users? because i think the impact of only having support for plugins in other node_modules folders will be pretty minimal.,positive
serverless/serverless,mocha,2016-11-06T13:20:40Z,lardee i went with -f since it is the option used also by `deploy function` (and `serverless-mocha-plugin` command invoke test). this can be easily changed if `-n` is preferred.,neutral
serverless/serverless,mocha,2016-11-06T16:30:52Z,usage of sinon and mocha toolings for tests. # this is a feature proposal## descriptionour current test codebase could be improved so that we e.g. use sinon sandboxes (rather than restoring our stubs by hand) or mocha helpers (e.g. to fake a "waiting 5 seconds" command).this also means that we should use `beforeeach` and `aftereach` more wisely for independent test setups and cleanups.,neutral
serverless/serverless,mocha,2016-11-06T19:50:11Z,make test discovery automatic. closes #1337 (maybe)## how did you implement it:uses globs to match instead of the require() files.i did not implement the random ordering. that's a much bigger problem to tackle and the linked issue in mocha has not made much traction yet.## how can we verify it:`npm test` hits the same number of tests (563 at the time of writing this) before and after these changes.## todos:- [x] write tests- [x] write documentation- [x] fix linting errors- [x] make sure code coverage hasn't dropped- [x] provide verification config/commands/resources- [x] change ready for review message below***is this ready for review?:*** yes,neutral
serverless/serverless,mocha,2016-11-06T20:34:04Z,then coverage decrease is because the 'require files' weren't being ignored from coverage ;),neutral
serverless/serverless,eslint,2016-06-28T22:11:17Z,i had the same problem.the problem was that **some dependencies were not included in the distribution directory**.i solved the thing by updating my `excludepatterns`.``` json"custom": {  "excludepatterns": [    ".git".    "node_modules/eslint"  ].}.```to``` json"custom": {  "excludepatterns": [    ".git/".    "node_modules/eslint"  ].}.```indeed patterns do not seems to work as we could expect: `".git"` was preventing the dist to include `github` folder and `github.js` file.is it a bug ? maybe `excludepatterns` should require to define patterns in a more restrictive way.though in the building step. when creating `_serverless_handler.handler`. if something check that function dependencies exist in the dist folder. it **should return an explicit error** when some are missing.,neutral
serverless/serverless,coveralls,2016-11-08T11:57:20Z,eahefnawy. the last build seems to fail in a weird way on coveralls... it looks like a glitch... can you have a look at it?,negative
serverless/serverless,coveralls,2016-11-08T15:43:02Z,kbariotis lmammino thanks a lot. this is g2m. i'll just ignore the coveralls glitch and merge ☺️,positive
xodio/xod,mocha,2018-01-12T15:50:50Z,> move universal func-test’s from xod-client-electron to xod-client. rewrite them with puppeteer.this part is done in #1015,neutral
valor-software/ngx-bootstrap,codecov,2016-07-19T14:01:30Z,fix(ci): upload test coverage report to codecov,neutral
NativeScript/nativescript-imagepicker,sauce,2018-02-02T13:10:46Z,fix tests to work for both sauce labs emulators,neutral
Azure/autorest,standard,2016-09-28T23:56:50Z,hi yugangw-msft. are you able to confirm whether the response body returned by the webapp api conforms to the standard clouderror?for example. i see that the c# implementation has details as a list of clouderror objects. where as in the response details has a list of key value pairs. only one of which is an "errorentity".,neutral
airbnb/javascript,eslint,2016-06-15T17:18:27Z,it looks like you have `repos/spa-admin.eslintrc`. but your actual project is `repos/spa-admin/`. you want an `.eslintrc` in every project with "root" set to `true`. so that the project-specific config is not affected by a config file higher in the directory tree.,neutral
airbnb/javascript,eslint,2016-06-16T06:28:18Z,there's already an eslint rule in our config that prevents dupes. so there's no need for a human to ever worry about that anymore.,neutral
airbnb/javascript,eslint,2016-06-18T15:40:11Z,thanks! the test failures are due to an eslint bug. so i'll merge through it.,negative
airbnb/javascript,eslint,2016-06-20T18:18:09Z,they are intentionally false. because you should not be importing anything except `dependencies` in your app. in your test directory. you'd probably want an `.eslintrc` file that enables `devdependencies`.`optionaldependencies` and the requisite lazy loading are an antipattern anyways. so if you need that in your project. it's appropriate to override it in your own project.i'll be enabling this rule soon as well.,neutral
airbnb/javascript,eslint,2016-06-25T00:14:14Z,constant conditions in generators. currently eslint warns user if constant condition like `while (true) {}` is used. which is pretty understandable most of the times. although it could be really useful when used inside of generators. for example in sagas. i think generators should be an exception to this rule?,positive
airbnb/javascript,eslint,2016-06-25T00:31:50Z,this style guide discourages any use of generators. for any purpose.,neutral
airbnb/javascript,eslint,2016-06-27T18:15:30Z,i assume if you remove "extends airbnb" that it no longer errors out?if so. this sounds like an eslint bug itself. not an issue with our config plugin. can you file it there?,negative
airbnb/javascript,eslint,2016-06-28T07:12:03Z,yes. the transform would go in whatever runs babel. you need to add a root `"parser": "babel-eslint"` as well.this isn't the proper venue for this kind of help tho - please feel free to join babel's slack. or our gitter channel. or freenode on irc.,neutral
airbnb/javascript,eslint,2016-07-06T01:11:50Z,>  in your test directory. you'd probably want an .eslintrc file that enables devdependencies.will be helpful if mentioned in the document.,neutral
airbnb/javascript,eslint,2016-07-06T21:22:16Z,i also think that it could be better if not all rules to be like errors. my point is following: i'm using eslint in atom to see if i have any errors in my code and also i use webpack with eslint-loader and noerrorsplugin. so when there is any eslint error in my code - it does not compiling. which is good. because it saves a lot of time when it detects an error that makes unable for my code to run. but the thing is that sometimes when developing i need to insert console.log. or i need to quickly add an element to array to test something (and sometimes i'm doing it too quickly and not adding comma in the end of a line) and in this case webpack will just not compile my code because eslint tells that there are errors. but from my point of view they are more likely warnings. not errors. because code will work. but it will be just not perfect at this point.i think that it would be much better if all critical rules which can detect places that can break something to be like errors. but for other ones that are more like stylistic - everything that is not good to commit. but that will work - to have warning level. so it will more like informative. btw. for ci systems you can set --max-warnings 0 flag for eslint and it will fail build even if there are any warnings detected. so it is possible setup it correctly when building project. but it is not so usable for development in some cases. what i'm doing right now is just redefining some rules in my local .eslintrc. setting some rules to warning instead of error,negative
airbnb/javascript,eslint,2016-07-08T18:01:17Z,`guard-for-in` just requires any conditional check - often it false-negatives on places where people aren't checking "own property". precisely to allow the use case you mean.if eslint added a more specific way to block for-in loops or an easier way to override it. i'd be all for that - but imo the annoyance of overriding it for a small handful of edge cases is worth the benefit of never having to see a for-in loop anywhere else :-),neutral
airbnb/javascript,eslint,2016-07-09T18:24:12Z,the main reason for me submitting this pull request is that the latest documentation for eslint rules all use the string enums rather than numbers.,neutral
paulmillr/es6-shim,mocha,2013-10-11T15:51:53Z,phantomjs is just a headless webkit.  that probably adds minimal value. above the node tests (since both are v8-based).  it would be better to use something which could actually test against mozilla. ie. etc.  testling seems to do that (but it's slow and a bit flakey).,positive
jashkenas/backbone,karma,2015-04-29T07:08:28Z,formatted changes for consistency karma.conf.js. removed period from line 1 to be consistent with rest of file.changed first letter of the first word on lines 1. 2. 42 and 46 to be consistent with rest of file.,neutral
chaijs/chai,sauce,2013-11-30T18:12:20Z,looks like they all passed. never used saucelabs before! i am impressed :),positive
chaijs/chai,karma,2013-11-26T07:19:21Z,logicalparadox it seems that travis is affected by this as well. prs #211 and #214 fail with `.bin/karma: no such file or directory`.,negative
chaijs/chai,karma,2013-11-26T14:37:48Z,there was an issue with karma stable that caused sauce-labs browser tests to timeout. prs don't invoke the full suite. did you run the sauce labs tests using local credentials?,negative
chaijs/chai,karma,2013-11-27T08:22:16Z,i have tried sauce labs with both karma stable and canary. they both seem to work fine but they are slow on my machine: i have killed both runs after ~10 minutes. canary seemed to be able to get further in the list of browsers than stable. however i would be careful in interpreting this as an issue with karma stable.to continue using karma canary you should add `karma-cli` dependency. as that's the place where `.bin/karma` has been moved to. however you are trading build stability for sauce labs support. is it really worth it?,negative
chaijs/chai,karma,2013-11-27T16:34:25Z,given the issue we have experienced with karma. can you please rebase this pr with master to force a proper ci run. thanks!,positive
jxnblk/rebass,standard,2016-05-10T05:53:03Z,justingreenberg jxnblk as per justingreenberg 's solution above. why can't the prop name be ref rather than baseref or am i missing something?also when can we expect a fix for this? are there concerns?,negative
jxnblk/rebass,standard,2016-05-10T19:02:20Z,i don't think it's wise for this library to implement some solution for `ref`s outside of react.  the 2 solutions i see are making form elements class components (as originally suggested) or add a higher-order component that wraps the stateless component in a class component.,neutral
jxnblk/rebass,standard,2016-05-10T19:26:26Z,phated the proposed solution above just provides a hook for `ref` on the base component... > the 2 solutions i see are making form elements class components (as originally suggested) or add a higher-order component that wraps the stateless component in a class component.can you provide some code or a demo? since all rebass components are wrapped in stateless function component (base hoc). afaik there is no other way to implement this functionality,neutral
jxnblk/rebass,standard,2016-05-10T19:37:45Z,theseyi renaming ref to `baseref` prevents namespace conflicts and keeps the ref provider explicitly outside react's component api,neutral
jxnblk/rebass,standard,2016-05-22T00:56:03Z,justingreenberg shouldn't it be that case that if the proposed solution is just a 'hook for `ref`' (which i'm interpreting as a proxy). then it should be the same name and just fall through to the react component?,neutral
velesin/jasmine-jquery,jasmine,2013-12-06T16:22:27Z,just curious. what's the present eta on this?  i have a zepto-based project that i'm currently having to do some ugly hacks to get working with jasmine-jquery.  i'd love to see _official_ zepto support at some point! :smile:,negative
ninjadev/nin,eslint,2017-03-13T19:05:50Z,add .eslintrc to project. this continues our standard of good project defaults.,neutral
ninjadev/nin,eslint,2017-03-14T20:26:18Z,add nin global variables to default project eslint,neutral
Modernizr/grunt-modernizr,uglify,2013-07-11T18:09:59Z,does the build complete if uglify is disabled?,neutral
videojs/video.js,sauce,2014-08-02T00:18:33Z,disable saucelabs until we figure it out,neutral
videojs/video.js,sauce,2014-08-02T00:28:42Z,failed because of a previous pr that was merge without tests run on it. apparently travis decided to skip that one.,neutral
videojs/video.js,sauce,2014-08-05T17:22:13Z,ha. thanks! this probably worked in our favor last week when we were having sauce labs testing issues. :),positive
expressjs/express,mocha,2013-05-03T16:43:28Z,visionmedia thanks. i'll look into it.on the same computer. i'm able to run an express app and mocha test it without incident. maybe there's a config option that helps.,positive
