pubnub/chat-engine,codacy,2018-01-03T22:24:08Z,put these into travis secretsgit config --global user.email "github-ops-codacypubnub.com"git config --global user.name "pubnub bot",neutral
shouldjs/should.js,mocha,2015-01-27T19:59:25Z,assertion.add should defineproperty with configurable: true. without it. running mocha in continous mode (mocha -w) always fails with typeerror: cannot redefine property: on a defined custom assertion (when assertion is defined in separate file that is included with require on nodejs),neutral
jprichardson/electron-mocha,mocha,2016-11-15T02:24:10Z,stevenvachon do you know if there is a way we can run these tests in an electron browserwindow? i am injecting some scripts into a browserwindow and need a way to test those.,neutral
jprichardson/electron-mocha,mocha,2016-11-19T01:12:58Z,allow renderer process testing in electron-mocha. i couldn't find an easy way to unit test renderer process using electron mocha. is this available on electron-mocha? if so can anyone point me how this can be done?thanks.nischaljprichardson inukshuk,neutral
jprichardson/electron-mocha,mocha,2016-11-19T07:21:42Z,either i misunderstood your question. or you're looking for `electron-mocha --renderer` :) it's well documented in the readme.,positive
jprichardson/electron-mocha,mocha,2016-11-19T19:57:41Z,szwacz oh my bad! must have missed that one. i am actually using gulp-electron-mocha to run my tests. is there a programmatic way i could run this by using gulp-electron-mocha?,negative
jprichardson/electron-mocha,mocha,2016-11-19T23:37:27Z,my apologies for not reading the documentation. i added `renderer: true` as one of the options in gulp-electron-mocha and i am now able to test some of the functions that run in the renderer process. thanks to szwacz for pointing it out.,positive
jprichardson/electron-mocha,mocha,2016-11-20T10:02:54Z,assert not caught in async tests. the following async tests run fine directly in mocha. whereas the error from the second test is not caught when running in electron-mocha instead:````jsvar assert = require('assert');describe('tests'. function(){it('test 1'. function(done){settimeout(function(){assert.ok(true);done();}. 100);});it('test 2'. function(done){settimeout(function(){assert.ok(false);done();}. 100);});});````,negative
jprichardson/electron-mocha,mocha,2016-11-22T19:53:09Z,> do you think it's ok to remove the handler? (mocha also listens for uncaught errors and matches them to the current test)yep. if mocha does this. i think it's redundant if we do as well.,neutral
jprichardson/electron-mocha,mocha,2016-11-22T20:10:49Z,ok cool -- i'll try to fix this then (and will probably get rid of the handler in the process).,neutral
jprichardson/electron-mocha,mocha,2016-11-23T11:07:20Z,added more details to the readme.,neutral
ramda/ramda,eslint,2016-04-04T04:37:17Z,eslint config: allow unused args. so that `function(a. b) { return a + 1; }` is allowed.,neutral
ramda/ramda,eslint,2016-04-04T17:20:05Z,> so that `function(a. b) { return a + 1; }` is allowed.where do we want this?  tests?,neutral
ramda/ramda,eslint,2016-04-04T17:24:44Z,it's coming.,neutral
ramda/ramda,eslint,2016-04-06T13:15:57Z,ok. but note that the first one could be replaced by ``` jsreduceby(inc. 0);```and the second one should not trigger this error. since it uses a parameter later in the order than the unused one.,neutral
request/request,standard,2017-07-08T00:51:18Z,i was trying to do something similar and found the nonstandard `requeststreaminstance.abort()` to work for this purpose.,neutral
request/request,eslint,2015-01-26T21:27:06Z,yeah. let's ignore it and get rid of the `clean` script.  we shouldn't need to put it in `.eslintignore` because we explicitly specify which paths are to be linted. right?,negative
request/request,eslint,2015-01-27T06:53:03Z,added coverage to .npmignore (it was already in .gitignore). removed clean script.you are right. we do specify paths explicitly for eslint. so no worries there.,positive
request/request,coveralls,2015-04-11T12:48:13Z,fix coveralls. added 3 test fixes that was causing the coveralls build to fail (check out the comments).coveralls is now using the github's status api to report the coverage status (instead of using comments) so this will make the merge status bar color change based on the coverage results. just like any other build error do. decrease in coverage will be considered a warning. click on the _show all checks_ button below.,positive
pixijs/pixi.js,eslint,2017-01-05T08:37:24Z,spriterenderer - fix eslint max-len usage,neutral
actionhero/actionhero,standard,2017-03-24T16:40:39Z,crrobinson14 plugin that overwrites the standard function. not very good solutions.,neutral
lukasoppermann/html5sortable,coveralls,2015-07-24T21:08:21Z,currently it fails due to coveralls being in `read only`.,negative
dnajs/dna.js,jshint,2017-11-28T21:52:35Z,jshint the spec files. issue #55,neutral
angular-ui/ui-utils,karma,2013-07-26T08:12:49Z,sorry. this is not a problem with angular-ui. only with the installation instructions in your readme section. the command npm -g install grunt-cli karma bowerfails due to some dependencies related to karma and its plugins. the installation of these is never completed.,neutral
elastic/kibana,mocha,2015-02-09T15:53:40Z,dont works for me:"grunt dev > > local npm module "grunt-contrib-jade" not found. is it installed?> > local npm module "grunt-mocha" not found. is it installed?> > local npm module "grunt-replace" not found. is it installed?running "dev" taskwarning: task "jade" not found. use --force to continue.aborted due to warnings."and:"grunt test build> > local npm module "grunt-contrib-jade" not found. is it installed?> > local npm module "grunt-mocha" not found. is it installed?> > local npm module "grunt-replace" not found. is it installed?running "test" taskwarning: task "jade" not found. use --force to continue.aborted due to warnings."i think i wait for the next beta....,negative
elastic/kibana,selenium,2016-02-11T17:33:31Z,code looks to be functionally correct. but its target seems way too broad. currently this would blow away my intellij project files. vim swap files. functional test screenshots. selenium installation. etc. the list is too long to manually pass in with `--ignore` every time (which didn't work with the npm script. i had to run grunt manually to get --ignore to work). we could add more files to the default ignore list. but the files that exist in a project directory are largely going to be dependent on that developer's environment. what if we created a whitelist instead? something like node_modules. build. target. optimize/*. (maybe esvm)?,negative
ngageoint/geopackage-js,istanbul,2018-05-12T16:17:38Z,add browserify-istanbul dev dependency.. partial fix for #113,neutral
serverless/serverless,mocha,2016-11-16T10:07:14Z,dougmoscrop thank you!  you're rock and rolling!   unfortunately i have to close this pr as the refactoring in #2716 will add that as well  anyway. thank you for all the stuff you've done here and in the past and keep up the great work,positive
serverless/serverless,eslint,2016-07-15T00:59:45Z,flomotlik certainly,neutral
serverless/serverless,eslint,2016-07-15T16:37:09Z,great. we'll be sharing more info about the future of serverless over the next weeks. please feel free to jump in anywhere you like and where it makes sense for you in terms of feedback or code. happy to have you!,positive
benderjs/benderjs,mocha,2014-12-17T12:50:47Z,ok. this is a problem with `benderjs-mocha` plugin - i'll recreate the issue there.,neutral
Azure/autorest,standard,2016-10-21T21:30:15Z,linter complains that description is not present there is a summary defined. we say to partners that summary and description are the same thing and we ask them to add any of those. but linter always complain that description is not present. moreover msdn documentation is generated from description fields. we should define one standard both in linter and cr feedbacks.,negative
Azure/autorest,standard,2016-11-03T21:36:27Z,fearthecowboy given that `x-nullable` is (or will soon be?) a thing. imo it would be better to use it to control these client language-binding decisions. rather than overloading the semantics of standard swagger elements too much.,neutral
tessel/t2-cli,coveralls,2017-01-19T21:36:43Z,i think something is wrong with coveralls 0_o,negative
airbnb/javascript,eslint,2016-07-15T18:14:33Z,capitalize all comments in eslint react.js,neutral
airbnb/javascript,eslint,2016-07-15T18:29:12Z,i don't think we need to be that pedantic about comments. but sure. why not.,neutral
airbnb/javascript,eslint,2016-07-21T17:07:01Z,alex1990 the default is for the entire project. which is to only allow dependencies. the proper solution is to make a `.eslintrc` in your "test" folder. that overrides the rule to allow devdependencies also.,neutral
airbnb/javascript,eslint,2016-07-21T17:17:11Z,okay. so i must create two `.eslintrc` files.,neutral
airbnb/javascript,eslint,2016-07-21T21:16:18Z,no matter what. you'll have to use eslint v2 with eslint-config-airbnb. until #936 is resolved.,positive
airbnb/javascript,eslint,2016-07-25T19:24:17Z,sure – i brought this up because these weren't explicitly set to `false` in the config. which seemed like a potential oversight. and because eslint-config-fbjs was disabling this rule because they wanted to use this pattern.,negative
airbnb/javascript,eslint,2016-07-27T05:25:13Z,great. that seems to work fine for me as well. let's update it to use that - both here and in `eslint-config-airbnb-base`,positive
airbnb/javascript,eslint,2016-07-27T05:37:53Z,jglover update in-place please :-) it would also be ideal to use git locally and rebase it down to one commit. rather than using the web ui. (also. it still needs to update the `eslint-config-airbnb-base` readme),positive
airbnb/javascript,eslint,2016-07-27T10:22:47Z,updated readme for eslint-config-airbnb & eslint-config-airbnb-base. relates to #970 added subshell to usage commands and converted samples to the three backtick markdown syntax with language specifier for highlighting. this fixes an issue where zsh (and potentially other shells) don't execute the commands properly because of a missing semicolon after variable declaration.had to change some of the wording because if you embed a code block under a numbered list item without text on the same line as the number. markdown gets upset and drops the list formatting.,neutral
airbnb/javascript,eslint,2016-07-27T15:38:47Z,thanks!,positive
airbnb/javascript,eslint,2016-08-02T08:18:32Z,can you provide the output of `npm install` and your linter command? is that command correctly an `npm run-script`. or are you incorrectly running a global `eslint`?,neutral
airbnb/javascript,eslint,2016-08-02T08:34:48Z,thank you for the awesome response time ljharb. it was atom / atom linter / linter-eslint returning the error. i was using an older globally installed eslint package. when i disabled "use global eslint installation" everything works fine,positive
airbnb/javascript,eslint,2016-08-03T17:30:09Z,how to use either extends airbnb and mocha in eslint . i'm new to eslintmy eslintrc.js> `module.exports = {`> `"extends": "airbnb".`> `"installedeslint": true.`> `"plugins": ["react". "mocha"]`> `};`question:when i try to lint a mocha unit test file. it shows 'describe' is not defined. (no-undef)it seems like mocha plugin doesn't works.mocha plugin should add all of the mocha testing global variables.if i remove `"extends": "airbnb"` . then it will be fine.how can i use both or just  prevent it to lint mocha testing filesthank you. regard,neutral
airbnb/javascript,eslint,2016-08-03T17:38:39Z,if you want mocha globals pre-defined. you need `"env": { "mocha": true }` somewhere in your eslint config. adding the mocha plugin just provides rules that can be enabled - it doesn't set any configuration. i'm assuming the mocha plugin documentation should tell you how to add your own config.,neutral
airbnb/javascript,eslint,2016-08-06T00:06:01Z,amilajack i'm sure `eslint` would appreciate a bug report if you could figure out on which code that's erroring out.lukebennett since this guide does not yet recommend using `async`/`await`. nor generators. i don't think it's worth mentioning just yet. since `async/await` is now stage 4. hopefully `eslint` will support it soon - at which point. this incompatibility will go away.,negative
airbnb/javascript,eslint,2016-08-06T21:14:35Z,which package - `eslint-config-airbnb`. or `eslint-config-airbnb-base`?,neutral
airbnb/javascript,eslint,2016-08-12T05:40:52Z,yes. updating the base config is correct. please prefix your commit with `[eslint config] [base] [breaking]` if you can :-)i'm not sure which section would be more appropriate. but we can bikeshed that on the pr :-),neutral
airbnb/javascript,eslint,2016-08-12T21:57:58Z,the usual cause of this error is that your editor is using the global eslint instead of the local one - although the stack trace doesn't seem to indicate that.you may want to update to the latest eslint. eslint-config-airbnb. and eslint-plugin-react. but i'm not sure why your error is happening.,negative
chaijs/chai,mocha,2013-04-25T11:02:19Z,ie / object doesn't support property or method 'class'. i'm using chai-jquery with chaijs & mocha.works well in most browsers. chrome (linux & win). firefox (linux & win). opera(win) but in ie10. it shows this error:```typeerror: object doesn't support property or method 'class'```for this    expect($el).not.to.have.class('xyz'),neutral
chaijs/chai,mocha,2013-05-07T19:17:32Z,i'm also having this problem on ie10 :(,negative
chaijs/chai,mocha,2013-05-07T19:28:18Z,this is a chai-jquery issue; closing.,neutral
jdan/cleaver,jshint,2014-03-31T07:04:23Z,oops. did not notice jshint in npm test.,neutral
guidone/node-red-contrib-chatbot,mocha,2017-06-27T22:25:33Z,fabianoleittes hi. i'm fine and thanks for using red bot.yes. i accept pull requests. redbot is still a work in progress so it's welcome a bit of coordination to avoid duplication of works.i generally use telegram for the development. it's easier to setup. this is also the reason many features for messenger are yet not implemented.yes i've tests. i use **mocha**. to test locally `npm test` and i lint the code before pushing it with `npm run lint`.nodes are generally very simple. all the code for the specific platform are in /lib/* and chatbot-*-receiver.js nodes.the general rule of thumb with nodered is that a node should do the minimum. don't let a node do a task that can be done with two nodes. the more granular are the nodes the easier is to compose the flows.i don't have a public roadmap yet. i'll open a wiki page in the next few days. for sure it includes facebook cards and buttons. slack support. email support and of course payment support.,negative
velesin/jasmine-jquery,jasmine,2013-12-18T15:11:04Z,there's no timeline. i may kill this. there are too many things missing or different in zepto from jquery,neutral
velesin/jasmine-jquery,jasmine,2014-01-07T20:32:26Z,would be great to see this patch in. do we know when this might happen? /cc peeja travisjeffery,positive
velesin/jasmine-jquery,jasmine,2014-01-08T19:36:19Z,thanks. really appreciate it!,positive
velesin/jasmine-jquery,jasmine,2014-01-08T19:48:05Z,awesome travisjeffery! looking forward to seeing it happen!,positive
webrtc/samples,selenium,2015-10-19T15:32:48Z,btw: i can't see what's wrong with _selenium-webdriver/_base.js_. i.e. why travis gives `syntaxerror: unexpected token )` after `vm.` on line 104?,negative
videojs/video.js,standard,2016-11-16T15:42:43Z,i vote to kill it. i don't think it's documented. and it's not a standard attribute.,negative
fergiemcdowall/search-index,standard,2017-01-11T16:46:29Z,ah yes. i wonder- does it make more sense to use `offset` and `pagesize` in `categorize`? since `categorize` now takes a standard query object. it would make things more consistent,neutral
solid/node-solid-server,standard,2016-05-10T21:43:53Z,updating to standard 7,neutral
solid/node-solid-server,standard,2016-05-10T21:44:26Z,see #340,neutral
mongoosastic/mongoosastic,eslint,2015-12-19T11:17:00Z,this contains lots and lots of changes not related to the feature. i can't review all of that and find out which ones are style changes and feature changes. could you minimize the changes just to the feature and only that?for example: - don't update dependencies. only the ones you need. - don't change travis.yml- don't deactivate any eslint rules- don't change style or indentation nor reformat any object literal. - squash all commits into only those are not bad. just doesn't belong to this specific pr. you can send them with new prs. the more specific the pr. the better.,negative
valor-software/ng2-tree,karma,2017-04-27T21:05:32Z,malliswarikulala what is `tree-root`? and `angular-tree-component` is not from this project,neutral
prettier/prettier,codecov,2017-11-05T06:00:12Z,not sure why codecov is saying coverage decreased. didn't touch any source code.,negative
prettier/prettier,eslint,2017-08-17T09:52:12Z,this seems to be very much a semicolon vs no semicolon debate. and as suchi'd suggest it be a configurable option.  i work on dozens of projects withvarious teams. each with their own unique eslint config... and it'd begreat to use prettier among all of them. without imposing a huge rewrite toevery codebase to drop wrapped parens around a single arg.  the issueitself filed here has had the most feedback i've seen in such a long time.so many people have voiced their opinions. many probably first time githubusers.bottom line - **do you want a huge userbase using a fork of this project**(that has no reasonable belief to be secure or maintained) because youwon't add a few lines of code to configure it optionally?quite bizarre if you ask me.,positive
prettier/prettier,eslint,2017-08-20T12:53:01Z,lydell sorry for noise i put the issue in wrong project. it is related with eslint and prettier integration.,positive
prettier/prettier,eslint,2017-08-23T02:52:20Z,basically using both `eslint-plugin-script-tags` and `eslint-plugin-prettier` together will yield the exact result that you're looking for. you should be able to test using the branch of that pull request.,neutral
prettier/prettier,eslint,2017-08-23T02:53:42Z,i've already tested `eslint-plugin-script-tags` + `eslint-plugin-prettier` and linting works. just eslint's auto-fix mode doesn't come into play like it does with normal `.js` files. that pull request turns on `--fix` mode for "processor" plugins (f.e. `eslint-plugin-script-tags`). which will make `eslint-plugin-prettier`'s fixes automatically apply.,neutral
prettier/prettier,eslint,2017-08-23T02:56:26Z,trusktr. this is nice! though i wish we did not had to rely on `eslint --fix` to "prettierize" vue files..,positive
prettier/prettier,eslint,2017-08-23T16:49:18Z,i considered that it might be ambiguous but eslint warns with `no-extra-semi`.,negative
prettier/prettier,eslint,2017-08-23T16:49:58Z,well. you should turn off that eslint rule :),neutral
prettier/prettier,eslint,2017-08-24T11:58:27Z,oh! you right. i probably missed it.i solve it using:```js/* eslint prettier/prettier: ["error". { trailingcomma: "es6" }] */```,negative
prettier/prettier,eslint,2017-08-27T03:00:02Z,i totally understand. the downside is that after prettier reformats xode. eslint can no longer throw on that formatting. i could run eslint both before and after prettier. with a different config for the first round to catch the possible-error formats. but that increases the time it takes.,positive
prettier/prettier,eslint,2017-08-29T07:16:21Z,but is it reasonable? if so. that would break both eslint and tslint checking.,neutral
prettier/prettier,eslint,2017-09-03T20:23:26Z,trusktr i tried your solution and it doesn't seem to work for me. eslint complains about line-breaks that an auto-fix don't solve. also. all the rules of `eslint-plugin-vue`that should be triggered in `template`are simply ignored.i would very much like an update on this issue and any pointer to where to start in order to help.,negative
prettier/prettier,eslint,2017-09-08T06:49:48Z,cc the eslint-plugin-prettier folks: not-an-aardvark zertosh,neutral
prettier/prettier,eslint,2017-09-08T19:01:04Z,azz mitermayer vjeux don't you think we should keep this flexible for compatibility with eslint-plugin-prettier's pragma option allowing arbitrary strings?i definitely see the advantage of keeping this to a known value so in the future option-values can be applied. i'm still worried about the existing adoption of eslint-plugin-prettier's arbitrary pragmas though.,negative
prettier/prettier,eslint,2017-09-10T02:13:46Z,i don't suppose there's a way to force prettier to format according to eslint configurations without having to place `// prettier-ignore` inside my code?,negative
prettier/prettier,eslint,2017-09-12T10:22:00Z,i guess this could also be solved in a general way by using one of those automatic git hook installers adding a "run `npm install`/`yarn` if package.json or package-lock.json/yarn.lock has changed after `git pull`". that would also protect against `eslint --fix` resulting in the same issue.,negative
prettier/prettier,eslint,2017-09-12T13:58:40Z,lydell thanks for the update. i'm new to prettier but having the option `eslintintegration: true` makes me expect prettier would respect any rules defined in the project specific .eslintrc? is that not the case?,positive
prettier/prettier,eslint,2017-09-12T21:53:14Z,i'd love to see this implemented as well. you can technically achieve this with `eslint --fix` and `comma-style: ['warn'. 'first']` but i'd rather not see warnings in eslint for something that can be cleaned up with prettier.,positive
prettier/prettier,eslint,2017-09-13T14:14:06Z,`eslintintegration: true` is a `prettier-vscode` setting to use `prettier-eslint` instead of `prettier`.,positive
docpad/docpad,standard,2014-09-04T20:51:49Z,i agree with dinomike on the gulp idea. if we can make a module for this it would be great. i did consider this a couple of times in the past.i guess it's just all about making sure it's modular so then we can do this properly without having to re-write a big part of docpad. just need to replace a module (or several).and i also agree that going with javascript is just a good idea. while coffeescript is awesome. not every js dev knows coffeescript. but every cs dev knows javascript (or they should for their debugging).also i don't like whitespace significant languages because of how they look (gonna bring the flame with that one if i say it in hacker news or something similar). loli say go with plain js. at this point in time it is still the standard.,negative
ocombe/ocLazyLoad,karma,2015-02-18T08:42:26Z,hmm yes that might be a problem. is it possible to have a small test case somewhere?,neutral
ocombe/ocLazyLoad,karma,2015-03-03T19:20:16Z,for testing with jasmine or karma you really don't need oclazyload in my opinion. i applaud oliver's efforts here but just don't load oclazyload when you are testing. problem solved. i'd rather have o concentrate on keeping this module working with the latest angular builds. just my 2 cents...,negative
ocombe/ocLazyLoad,karma,2015-03-05T11:18:41Z,great. thanks.  will check,positive
sequelize/sequelize,jasmine,2013-06-18T21:00:04Z,it looks like some jasmine tests are failing due to the different timezone format that moment uses vs. the previous manual formatting. the moment format better matches postgres' internal format; i'll update the tests and amend the pull.,neutral
sequelize/sequelize,jasmine,2013-06-19T20:39:32Z,uhh guys. are we still using jasmine? i was under the impression that we're not :/,neutral
sequelize/sequelize,jasmine,2013-06-21T20:04:43Z,note: there is a commented out test in jasmine dao-factory spec that should be able to run once a pr for this is submitted,neutral
sequelize/sequelize,jasmine,2013-06-24T22:03:44Z,please update the jasmine tests :),positive
sequelize/sequelize,jasmine,2013-06-25T08:37:46Z,woops. stupid me. we really need to migrate away from jasmine soon so i don't forget to run half the tests :d,negative
sequelize/sequelize,jasmine,2013-07-09T00:48:56Z,wait. why are we **not** updating timestamp(s) on updateattributes? :/ (according to jasmine),neutral
sequelize/sequelize,eslint,2017-08-07T03:21:40Z,working on this i noticed sequelize eslint rules can benefit from a few extra rules.it might be useful to extend the  "eslint:recommended" rules which protect against using duplicate keys in objects and reassigning values to const among other things (those are the two i noticed that were missing).also i used the complexity rule to calculate the cyclic complexity of the methods ( but i'm not sure if this is as important as the other rules),positive
sequelize/sequelize,jshint,2016-05-21T07:15:44Z,my tests failed with docker before i did not include mocha and jshint installations globaly.. ### description of changemy tests failed with docker before i did not include mocha and jshint installations globaly.,negative
sequelize/sequelize,jshint,2016-05-22T16:54:57Z,hmm. weird - all commands in the package.json file use `node_modules/.bin/` to reference the files - which specific command was failing?,negative
sequelize/sequelize,jshint,2016-05-22T17:20:57Z,try `npm run jshint` :),neutral
sequelize/sequelize,jshint,2016-05-22T17:21:13Z,hmm but that's what docker does,neutral
sequelize/sequelize,jshint,2016-05-22T17:35:15Z,ok... i see now where problem lies. you have to npm install localy. before doing docker tests.but then i do not see any reason for rows in dockerfile:```copy package.json /run npm install```,negative
sequelize/sequelize,jshint,2016-05-22T17:39:25Z,imho before any tests docker inside should do npm install it'self. that way you have clean test inside docker.,neutral
