angular/protractor,selenium,2015-06-29T19:45:24Z,nope. it never makes it past the first getcurrenturl.in the console i am getting an error. maybe that will help```c:\projects\si\presentations\site\node_modules\protractor\node_modules\selenium-webdriver\lib\webdriver\promise.js:1877      var result = fn();                   ^typeerror: undefined is not a function```,negative
angular/protractor,selenium,2015-06-30T14:45:26Z,it does not hang. it just fails the test "navigates - fail" and gives me an error like before```c:\projects\salesindicator\presentations\site\node_modules\protractor\node_modules\selenium-webdriver\lib\webdriver\promise.js:1877      var result = fn();```that being said. i played around with it some more and it looks like it is not waiting for angular to finish before failing the tests. in the console i will see a bunch of failures. but in the browser the pages are way behind and still loading.did something change in v2 that would cause protractor to not wait until angular has loaded?,negative
angular/protractor,selenium,2015-06-30T17:15:17Z,the stack trace probably won't be very useful since there isn't actually a file which is running. the errors would just be from protractor/selenium-webdriver modules. would those be useful to you? could you describe a situation and what you would like to see?,neutral
angular/protractor,selenium,2015-07-05T21:04:59Z,hi there. i ran into the same issue. how about adding something like elementnottobecovered? that way the functionality would be easily available without creating inconsistencies :-),positive
angular/protractor,selenium,2015-07-07T18:46:35Z,hankduan thoughts on dbartholomae's suggestion?,neutral
angular/protractor,selenium,2015-07-07T22:13:12Z,maheswaranunni  and conceptdeluxe thank you so much for this. solved my problem in 2 minutes.,positive
angular/protractor,selenium,2015-07-10T05:10:58Z,jimmynavio  good going :) :+1:,positive
angular/protractor,sauce,2014-05-06T15:24:08Z,added line to print out webdriver session id. added line to print out webdriver session id for sauce connect to use. this lets bamboo or jenkins show test results in their own page avoiding the need of logging into sauce lab to view the results.,neutral
angular/protractor,sauce,2014-05-07T20:37:14Z,test(travis): added travis_retry for testonsauce.sh. `travis_retry` checks the return code of a command. in this case **testonsauce.sh**. retrying up to 3 times if the return code is non-zero.this will help avoid false positives errored builds due to unrelated timing issues with sauce labs.,positive
appium/appium-uiautomator2-driver,mocha,2017-10-12T00:25:20Z,refactor to use admc/wd and testobject tests. * refactored all the tests to use admc/wd so that we can use remote appium servers (specifically testobject)* run a mocha script before tests that. when testobject_tests variable is set. overrides 'wd' and points the server to testobject servers to run remotely* added several endpoints to no_proxy that should have been there* added an appveyor.yml for future testobject ci (want to do it on appveyor instead of travis because it will lighten the travis load and we don't need a linux or mac box. windows is fine),positive
cozy/cozy-ui,standard,2017-07-04T07:30:40Z,i added two little fixes:- update `standard` (js linter) script in `package.json` ;- lint javascript filesare we cool?,positive
ripple/ripple-lib,eslint,2015-06-12T16:28:39Z,remove iou_suffix from orderbookutils.js and clean up serializedtypes.js. - remove iou_suffix from orderbookutils.js- change serialize function in serializedtypes.js (line 412) to accept values as well as amounts- clean up serializedtypes.js so it follows eslint rules,neutral
ripple/ripple-lib,eslint,2015-06-23T17:07:13Z,this is still "work in progress". maybe we should close this pull request until it's ready?,neutral
ripple/ripple-lib,eslint,2015-06-25T17:23:56Z,decouple the amount class from math performed on values. - remove iou_suffix from orderbookutils.js by using the correct currency and counterparty when available - create new values class that performs math without using the amount class - change serialize function in serializedtypes.js to accept values as well as amounts- clean up serializedtypes.js so it follows eslint rules,positive
ripple/ripple-lib,eslint,2015-06-26T21:41:10Z,looks like eslint didn't run. i'm not sure what happened. do you know?,negative
ripple/ripple-lib,eslint,2015-07-02T10:45:28Z,update eslint,neutral
ripple/ripple-lib,eslint,2015-07-02T10:55:09Z,looks like eslint didn't run?,neutral
ripple/ripple-lib,eslint,2015-07-02T10:55:40Z,oh. guess there's nothing to run against. heh,negative
ripple/ripple-lib,eslint,2015-07-02T10:56:27Z,if we're mad keen we could ssh in i guess and run `npm run-script lint` :) ?  may as well just run it locally,positive
ripple/ripple-lib,eslint,2015-07-02T10:56:37Z,ye,neutral
ripple/ripple-lib,eslint,2015-07-02T11:31:38Z,use parser: babel-eslint which supports facebook flow. fixes #395,neutral
ripple/ripple-lib,eslint,2015-07-02T11:50:46Z,clark800,neutral
ripple/ripple-lib,eslint,2015-07-02T17:13:41Z,madeline and i were planning on making this change too. lgtm,neutral
ripple/ripple-lib,eslint,2015-07-03T12:39:00Z,i don't think babel-eslint is quite working as intended,neutral
ripple/ripple-lib,eslint,2015-07-06T16:45:11Z,updated once again:- in the amount class. this._value now stores an iou or xrp value- in iou and xrp value. this._value is now private- out bn implementation is now hidden (i removed the exposed bn constants in the amount class),positive
ripple/ripple-lib,eslint,2015-07-06T17:15:08Z,the issue above is that babel-eslint doesn't understand flow's comment syntax. one way to address this is to inline the type annotations. though there is probably a better option.,neutral
ripple/ripple-lib,eslint,2015-07-07T16:49:45Z,integrated clark800 's comments to make value.js an abstract base class and other fixes. let me know how it looks!,neutral
ripple/ripple-lib,eslint,2015-07-08T00:22:52Z,updated once again,neutral
ripple/ripple-lib,eslint,2015-07-08T17:34:13Z,updated to include the newest round of comments,neutral
ripple/ripple-lib,eslint,2015-07-08T18:54:36Z,updated with the two small fixes,neutral
ripple/ripple-lib,eslint,2015-07-08T19:13:38Z,lgtm!!,neutral
erming/shout,eslint,2016-02-07T10:51:29Z,package.json: lint all .js files. this makes the linting process less prone to miss new (or evenexisting) files. ignoring specific file paths is delegated to the.eslintignore file in the root directory.i just noticed this. not sure why i had explicitly set files to lint to begin with..,neutral
erming/shout,eslint,2016-02-07T11:30:52Z,are there no new errors thrown up? because this will lint the libraries.,neutral
erming/shout,eslint,2016-02-07T11:32:56Z,> because this will lint the libraries.which libraries?,neutral
erming/shout,eslint,2016-02-07T18:51:47Z,williamboman /node_modules/*,neutral
erming/shout,eslint,2016-02-07T18:53:02Z,maxleiter eslint skips `node_modules` and `bower_components` by default. i don't even think you can override that. like. at all :p.,positive
erming/shout,eslint,2016-02-07T19:09:15Z,yeah. i means client/libsdidn't notice you had them ignored already. looks good then. it shouldn't change anything for now. i think. but it's a good change to make.,positive
erming/shout,eslint,2016-02-07T22:15:16Z,:+1: from me,neutral
tapjs/node-tap,coveralls,2015-08-20T15:46:12Z,bucaran coverage support was added when this issue was closed. there's even a section in the readme for it. including specific support for coveralls.io.,positive
benbria/coffee-coverage,mocha,2015-08-20T20:54:04Z,did you ever get this working. btw?,neutral
benbria/coffee-coverage,mocha,2015-08-20T21:14:08Z,nope. i've got it working with other projects. but not with this one :cry:,negative
balderdashy/sails,mocha,2013-09-20T21:47:41Z,i think the `mocha.opts` file under the `test` directory has been taking care of this.  looking back through previous pull requests. all the tests have been running on travis.,neutral
balderdashy/sails,mocha,2013-09-20T21:57:56Z,`mocha.opts` doesn't include a test pattern in master. travis does run them for development though. next time development is merged into master i expect it will bring the testing situation into parity across both branches.,neutral
skulpt/skulpt,jshint,2014-11-03T15:42:32Z,leszekswirski awesome to get the exec limit from the compiled code! the first part however i don't completely understand. :smile: do you use that to yield a process to the ui "thread"?you  left a vim swapfile in there you. and jshint nags about creating a function in a loop. i tried calling the settimeout with a var_args array like `settimeout(handleresponse. 0. [r.resume]);` but the closure compiler doesn't like that. and it also changes `this` and i don't know if that bad. the tests pass.,negative
skulpt/skulpt,jshint,2014-11-03T15:51:18Z,albertjan oops. thought i'd got rid of all the swap files (stupidly did a `git add .` at one point).scheduling resuming with `settimeout(.... 0)` essentially pushes the resuming onto the back of the ui event queue. and so allows other things in the queue (like ui events or other scheduled functions) to run first. it's basically a cooperative multithreading "do something else if you want to" operation.the jshint warning is stupid (since i return directly after creating the function). but i'll add a workaround.one issue with conditional codegen of the exec limit is that there is currently an interface for setting an exec limit in `sys`. which won't actually function if the exec limit wasn't previously defined. since setting the exec limit in python seems odd to me anyway. i don't think this is a big deal. and actually i'd be in favour of removing that functionality entirely. but i didn't want to make a backwards incompatible change like that here.,negative
css/csso,mocha,2014-01-11T15:07:38Z,sorry about that. we're in the process of getting new maintainer.hope it'll be much faster soon.,neutral
ModuleLoader/es-module-loader,mocha,2015-04-16T15:51:47Z,guybedford can we run the mocha tests in the browser?,neutral
twbs/bootstrap,sauce,2014-04-12T18:40:40Z,safari fluid layout bug means a column falls 1-2 pixel short of it's correct width.. this bug only appears in safari on os x as far as i can tell. chrome. firefox and ie 9/10 are ok. on this fluid layout  the right coloured columns. fall 1-2 pixels short of the full column width. resizing the browser width slowly shows that the pixel gap closed to full column width every now and again. there must be some sort of rounding on column width that is producing this effect.,negative
twbs/bootstrap,sauce,2014-04-13T05:38:54Z,thanks chris i hadn't seen that in the documentation. you help much appreciated.,positive
keystonejs/keystone,mocha,2014-08-21T09:43:22Z,unique fields aren't unique after list.model.collection.drop(). _this isn't a keystonejs' issue. it's just something about mongoose (or maybe mongodb) that you should be aware of._after a `list.model.collection.drop()` all data and indexes are gone and. for a short period of time. you can insert duplicated `unique: true` fields without any errors or warnings.i've discovered this running mocha tests. i dropped and redid the collections after every test and then uniqueness tests (trying to register/update users with an existing email. username) failed. _but_ only when they were in the middle of other tests. running alone they were fine.i was able to query a `find` with an unique field and i've receive two and three results. after some ~~mad~~ research i've found that the issue came from the `drop`. now i have replaced `list.model.collection.drop()` with `list.model.remove()`. more inefficient but safe in terms of model integrity.i haven't got the time to go really deep into it yet but i hope it helps someone._if it's a well known issue and i've forgot how to search on google properly. my apologies._,negative
keystonejs/keystone,mocha,2014-08-22T10:08:56Z,this sort of thing is really valuable. there are some other things i know of as well (jossmac found one earlier today with regards to mongodb indexes not being dropped)i think we should add a "tips & gotchas" section to the site that everyone can contribute to - will leave this open until then so we don't lose it.,positive
agershun/alasql,mocha,2016-01-09T08:38:46Z,please. use:``` js   if(typeof exports != 'object') {...}```instead of:``` js   if(window) {...}```try to run `mocha .` in node.js now :),neutral
agershun/alasql,mocha,2016-01-10T08:31:26Z,:+1: now if you run `mocha .` it opens the browser with empty page. how to eliminate this?,negative
yeoman/generator-karma,mocha,2013-06-18T11:47:13Z,updated to latest generator and mocha,neutral
yeoman/generator-karma,mocha,2013-06-20T00:40:27Z,is included in pr #25,neutral
yeoman/generator-karma,karma,2013-06-06T21:01:14Z,also occurs when i unlink generator-karma and do npm install -g generator-karma,neutral
yeoman/generator-karma,karma,2013-06-22T10:28:32Z,unable to register generator-karma/app/index.js (error: arguments to path.join must be strings),neutral
yeoman/generator-karma,karma,2013-06-24T23:11:49Z,update karma-e2e.conf with proxy and url root. add options (commented out) for adding in proxy and urlroot,neutral
yeoman/generator-karma,karma,2013-07-02T14:10:53Z,+1 for including this,neutral
jquery/jquery-migrate,coveralls,2016-05-17T01:05:54Z,coverage really didn't decrease. coveralls doesn't see the tests that happen in the iframe.,negative
ember-cli/ember-cli-mocha,mocha,2017-04-26T09:44:17Z,taheilo there are a few issues with your code examples above:- in the first snippet instead of returning a new `promise` instance you can just `return currentsession().authenticate(...).then(...)` without the need for the `resolve()` call. if the second assertion fails you would otherwise have a `promise` that is never resolved. but also never rejected because `reject()` is not called anywhere.- in the second snippet you're mixing the `done` callback. ember's async `andthen()` helpers and the `promise` returned from the `authenticate()` method. i'd suggest to remove the `done()` and `return` the `authenticate()` result from the `andthen()` function. then it should hopefully work.as this doesn't seem to be an issue with `ember-cli-mocha` itself i'm closing this issue for now.,negative
bitpay/bitcore,mocha,2014-08-06T13:29:52Z,code: ackmocha: 3157 passing (7s)browser: passes: 3129,neutral
bitpay/bitcore,mocha,2014-08-06T13:56:02Z,code: ack. i would add a test for a specific message and a specific key. asserting that the result is a specific signature.mocha: 3164 passing (5s)index.html: passes: 3136,neutral
bitpay/bitcore,mocha,2014-08-11T20:07:09Z,mocha: 3164 passing (5s)index.html: passes: 3136code review: ack.,neutral
bitpay/bitcore,mocha,2014-08-12T16:17:37Z,mocha: 3178 passing (5s)index.html: passes: 3150ack. good work!,positive
qunitjs/qunit,eslint,2017-01-06T01:15:56Z,there's nothing here breaking. fixing a bug or introducing a new feature. everything is just using some new language features. i like this pr and don't think it's needed. it will open a discussion for us to discuss a potential style guide.> do we need to do refactoring separately (like this pr) or should we let it happen over time? i tend to think letting it happen over time will tend towards it not happening at all.i'll solve this problem in a couple minutes.> is there an es6 style guide for jquery? if not. we should define eslint rules for things like let vs const as they come up.not that i am aware of. but i believe it's a nice opportunity for us to see if we want to define our own. defining our own specific eslint rules. even if it's the same - or almost - of the jquery rules. is inevitable.,positive
paritytech/parity,mocha,2017-02-11T00:13:43Z,just stumbled upon this same issue.  i have a bunch of contract tests using mocha which submit multiple transactions in rapid succession.  i have to force it to wait 2 seconds between each tx which is frustrating.i agree with checking for pending tx's and then seal again.,negative
resin-io/resin-sdk,karma,2017-08-10T19:35:58Z,i'm ok with the idea but indeed you need to keep resin-config-karma ignored as the very least,neutral
admc/wd,selenium,2014-09-15T03:19:17Z,fix/add package.json keywords for discoverability. might help others find this project quicker. for a long time i thought the only two options were selenium-webdriver and webdriverio.,neutral
admc/wd,sauce,2013-05-24T08:17:55Z,new sauce widget with browser matrix. showing what browsers were used to run a test with status,neutral
needim/noty,standard,2017-07-11T21:48:20Z,yeah. but it means another network request for very small file. maybe we can separate later if we have more themes.,neutral
angular/angular-cli,uglify,2017-12-30T16:38:20Z,filipesilva. please. add this possibility to specify uglify options,positive
cssinjs/jss,codecov,2016-09-02T08:44:02Z,setup codecov. current setup of codecov.io isn't working ...,neutral
onsip/SIP.js,eslint,2018-02-20T20:46:04Z,> i am uncomfortable with the `.gitattributes` change. i think it may cause adverse side effects particularly on the release branch with minified javascript. based on my reading. it appears the correct solution is to set the attributes locally in your dev environment.i assume you mean by setting `core.autocrlf` but that is a global git configuration flag. not a per-repository one.> in terms of the copy files. can you provide some evidence that this is a generally accepted approach?i cannot. i just looked around for other people experiencing the same problems with unix specific commands and environment variable interpolation and determined what their solution was.,negative
onsip/SIP.js,eslint,2018-02-20T20:53:52Z,> i am uncomfortable with the .gitattributes change. i think it may cause adverse side effects particularly on the release branch with minified javascript.if this is something that i can assist with testing. i am more than willing.,negative
onsip/SIP.js,eslint,2018-02-22T21:19:06Z,hi seanbright.while we appreciate the effort to make this work. we are not going to take this pr. you can clone the repo with `--config core.autocrlf=input` which will fix the crlf issue. additionally. you can compile sip.js using git bash on windows without adding further dev dependencies to our repo.we looked at other (bigger) projects on github to see what they were doing in regards to these things cross platform and they are not addressing it in this matter. as far as i can tell the recommended solutions are to clone with the config flag or change your core git config. as for the cp. the recommended solutions is to use git bash.,neutral
onsip/SIP.js,eslint,2018-02-22T21:30:38Z,hey egreenmachine.was there anything done on your side to see if the `.gitattributes` change would actually have any negative impact on your release process or are you just assuming that it would?> as for the cp. the recommended solutions is to use git bash.recommended by whom?,neutral
onsip/SIP.js,eslint,2018-02-22T21:47:24Z,we did not do any testing to see if the change would have a negative impact. my assumption currently is that there would be little to no impact. but it is not something that we need to do. the issue is really outside the scope of this project.it is a generally recommended approach for getting a unix like shell on pc. similar to the crlf issue. we believe that getting `cp` to work on a system is outside the scope of this project.,negative
onsip/SIP.js,eslint,2018-02-22T22:14:28Z,i tested the `--config core.autocrlf=input` flag on clone and that seemed to do the trick. the bug about using the `cp` command instead of a webpack plugin will just have to remain outstanding.> the issue is really outside the scope of this project.i am not sure that i consider build failures on non-unixy platforms "out of scope" for a project that assembles a handful of smaller text files into one larger text file - especially considering that every component of your build toolchain supports cross platform development. we'll just have to agree to disagree.,negative
aksonov/react-native-router-flux,eslint,2017-07-07T01:30:55Z,brunsy was closed to adjust the code to pass by eslint constraints.,neutral
mostjs/core,mocha,2017-05-05T12:02:16Z,feat(witharrayvalues): add witharrayvalues and ziparrayvalues. ### summarythis adds `witharrayvalues` and `ziparrayvalues` for mapping values from an array onto a stream.  in the case of `witharrayvalues`. for each event. the stream provides the time component. and the array provides the value component.  similarly for `ziparrayvalues`. except it accepts a function to compute the value component from the array value and incoming event value.### other changes- run flow on the whole test dir.  it will only check files with `flow` at the top. which for now. is only the new `witharrayvalues-test.js`.  but. i like the idea of using unit tests also to check types.  feedback welcome    - note that to do this. i had to give flow visibility into the top-level `node_modules` folder. since lerna is hoisting common dependencies (such as `mocha` and `briancavalier/assert`) to the top level.### todo:- [ ] deprecate `fromarray` and `fromiterable`,negative
mostjs/core,mocha,2017-05-06T13:09:03Z,i really like having the tests type checked :+1:,positive
RubenVerborgh/N3.js,eslint,2017-01-07T21:12:30Z,travis hates my lack of adherence to linting - but eslint hated my code :(,negative
RubenVerborgh/N3.js,eslint,2017-01-11T17:14:47Z,i was thinking particularly about how strict mode turns some errors that are normally silent (and therefore hard to chase down) into hard-errors. i'm pretty sure i lost an hour (or more) to exactly this when i was implementing the store api extension? can't fix that without a time-machine though! ;)i suspect part of the reason you've not seen the need is that you may be more familiar with javascript than i am - another reason is that you have your eslint settings quite strict. already catching a bunch of stuff that strict mode disallows.but i notice this change caused failed builds on travis and appveyor?,negative
photonstorm/phaser,jshint,2014-07-15T11:38:57Z,thanks for your pr - you did it correctly too! right branch. jshint passed. etc. so many people do it wrong :)but i'm afraid i'm quite worried about implementing the change. the thought of generating a brand new point object _every single time_ you call `camera.position` seems incredibly inefficient to me. sorry. i like the idea. but we're going to need to find a different way to implement it.,negative
photonstorm/phaser,jshint,2014-07-15T15:23:13Z,added: .editorconfig file to help with jshint issues. added: grunt-notify to send growl/notification center notifications on jshint issues,neutral
npm/npm,standard,2015-09-11T17:15:22Z,the question i'm asking is one layer up. if i'm using node-pre-gyp. and i want the user invoking `npm install` to be able to specify the value of `--target_arch` in my package. is there a convention for doing that? or does every package invent their own convention?,negative
npm/npm,standard,2015-09-12T23:18:53Z,i don't think there's a convention for that.i think people generally advise that the consumer of your package should run `npm install` on the target architecture.in the situations where that's not possible (eg. bundling for later deployment onto devices or networkless deployments...) people do. as you suspect. have to roll their own.,neutral
npm/npm,standard,2015-09-14T18:59:53Z,ok. thanks!,positive
npm/npm,standard,2015-09-19T04:10:42Z,why introduce another parser do to weird. non-standard command linkage using `and` instead of using json how people would expect it? and why not make it an optional thing. similar to how `repository` works? if it's a string. it's one command. if it's an array. it's multiple commands that are run in succession so long as they exit with `0`.i was actually kind of surprised npm doesn't do this by default; as discussed in sindresorhus/xo-init#6. `&&` has its downfalls. further. being dogmatic about it. while realistically `&&` is pretty reliable. it shouldn't be expected to work on every platform. always.as stated in the aforementioned issue. manipulating the `package.json` data automatically now becomes a hassle because we have to _guess_ (never good) the format of the command string; does it contain a `;` at the end? does it already have some weird postfix operator that will cause unintended side-effects with `&&`?it's a hack at best. and bad design at worst. in my opinion. array scripts should be _possible_. maybe unnecessary a lot of the time. but for those who wish to be 100% compatible. the option should still be there - without some weird. intermediate language - the json way.,negative
npm/npm,standard,2015-10-07T22:49:03Z,refactor all the code dealing with module/package names. the recent change to `read-package-tree` to set `package.name` if it wasn't already set had broader fallout than i'd originally realized. this pr includes a refactoring of all of the places unguarded uses of `package.name` existed to use a set of standardized and tested functions.,negative
npm/npm,standard,2015-10-08T00:09:39Z,:sheep:,neutral
mishoo/UglifyJS2,uglify,2013-08-20T09:26:01Z,(function(){ }())  converted to  !function(){ }(). a some module has a dependency dot.jsafter successive execution of commands browserify and uglifyjs this module does not work in firefox browser onlythis line of the dot.js```(function(){ return this || (0.eval)('this'); }()).dot = dot```was transformed to```!function() {this ||(0.eval)("this")}().dot=dot```(i will give all files to reproduce if need),neutral
