TryGhost/Ghost,mocha,2014-10-18T17:57:22Z,i'm wondering if it might be time to consider switching away from using casperjs and phantomjs for these tests. at the very least. i'm tempted to use the mocha-casperjs modules to try to make the format of our functional tests more consistent with the rest of the test suite.i am wondering if it wouldn't be better to use selenium webdriver. as long term it'd give us more flexibility.still casperjs does support running tests against phantomjs and slimerjs. i am also aware that there is a major rewrite of phantomjs (phantomjs 2) in progress. so perhaps we should just sit tight. still i'm not loving the 10minute slowdown of the tests or the random crashing.,positive
swagger-api/swagger-ui,eslint,2017-06-20T18:43:58Z,i actually had trouble importing the module with webpack. it complained that the brackets () are not expected where they are. my guess is that it's a strict eslint rule that disallows arrow functions for compatibility reasons - so yeah - blame it on ie ;-),negative
swagger-api/swagger-ui,eslint,2017-06-28T17:30:22Z,also note that ci is failing - looks like your update to eslint caused it to become more strict. it was probably the react eslint preset. it's good that we updated it. but we need to get it passing again.i'd like to see the code fixes for that in a separate pr. we can merge that pr. then merge master into this pr. which should clear the way for ci to run normally here.,positive
ariatemplates/hashspace,karma,2014-04-25T09:14:26Z,> then. we just have to take care to define properly the entry point of the package int the package's definition (package.json).this would pose a problem for non-node tools we are using (common.js pre-processor for karma and noder) as afaik those don't "understand" `package.json` entries.we are in a kind of more complex situation here as we are trying to make those dependencies work both in node as well in a browser....,neutral
nightwatchjs/nightwatch,jshint,2014-07-13T10:18:22Z,update linted files and fix some jshint issues. add `tests/*.js` to list of _linted_ files and fix it's issues.,neutral
formly-js/angular-formly,karma,2015-04-17T03:33:09Z,coveralls.io integration. this provides the necessary configuration via karma to publish coverage results to coveralls.io (pending some environment config by kentcdodds for coveralls.io authentication).  in addition. a new test coverage badge is being added to the readme.  fixes #78,neutral
formly-js/angular-formly,karma,2015-04-17T05:07:56Z,looking at the report it's actually only reporting on the index.test.js file which contains all of angular. api-check. and angular-mocks. as well as angular-formly... do you know of any way to make the coverage plugin leverage sourcemaps or something to make sure that 1) we're only reporting coverage for angular-formly files and 2) it reports coverage for the specific files. not just the entry file?,neutral
formly-js/angular-formly,karma,2015-04-17T05:29:52Z,i'll take a peek at this and circle back!,neutral
FezVrasta/popper.js,karma,2017-04-26T06:32:36Z,> would you like to add a test for node in a separated pr maybe?can do. which test runner would you like me to use? mocha. ada. tape? because currently everything seems to be run in karma. which has all those globals.,neutral
tejacques/crosstab,sauce,2015-06-24T05:36:24Z,i'm actually in the process of testing this now. just need to run it over saucelabs and it should be good to go. eta pushes to npm tomorrow.,positive
angular/zone.js,jasmine,2017-03-19T13:36:25Z,fix(jasmine): modify jasmine test ifenvsupports message. add jasmine spec ifenvsupport message,neutral
angular/zone.js,sauce,2015-06-01T05:04:35Z,we need to fix the issue with ie first - which is s real bug in the lib before we can merge - not delete - the pr. to be clear this is no related to sauce but a bug that wasn't tested before,neutral
adamgruber/mochawesome,mocha,2015-05-15T15:49:21Z,this is more a question than an issue. how do i set the report title that shows on to of the html page?right now it seems that reportname is really the name of the html page that will be outputted. for example if i put reportname='index'. it outputs index.htmlbut the title of the report on the actual page seem to always be the name of the root directory (i loko at your code and actually that is how you are getting the reporttitle)could you kindly update that to use reporttitle if specified with the reportoptions?that way we can do simply:mocha({        reporter: 'mochawesome'.        reporteroptions: {          reportdir: reportdir.          reportname: reportname.              reporttitle: reporttitle        }    }thank you so much for your greta work with this package!damiano,positive
adamgruber/mochawesome,mocha,2015-05-16T01:23:14Z,i think this is a valid option and worth adding.,neutral
adamgruber/mochawesome,mocha,2015-05-18T19:33:32Z,thank you.,positive
adamgruber/mochawesome,mocha,2015-05-21T13:37:04Z,maybe i am doing it wrong. let's say you want to try to reach a page on a browser : www.dev.mysite.com/runtest/. with your node server you want to run the test programmatically and then display the result on this page.(and you don't mind waiting for the test to complete does not have to be live) since it is async. the probleme is you cannot just return the html file because you don't really know when it will be done writing in the file(html.css.js). so i was thinking promise or a callback when everything is done so i can return the html file knowing its complete.it's only a proof of concept but look :var html =templates.mochawesome(obj);                savetofile(stringify(obj. null. 2). config.reportjsonfile. function() {});                savetofile(html. config.reporthtmlfile. function() {                    console.log('\n[' + chalk.gray('mochawesome') + '] report saved to ' + config.reporthtmlfile + '\n\n');                    options.reporteroptions.callbackaftersave();                });i know it isn't clean code and fail proof because callbackaftersave() could be empty and race condition ... and it doesn't follow the logic of config and your param but it kinda work. it calls my function when its done writing the html. now i can safely return it.,negative
adamgruber/mochawesome,mocha,2015-05-22T19:19:59Z,the report gets saved to the `mochawesome-reports` directory which contains everything you need for offline viewing.,positive
adamgruber/mochawesome,mocha,2015-05-22T19:25:35Z,so you're hitting a website that triggers the tests to run and you want the mochawesome report to display on that website when the tests are done? i'm not so sure this is a common use case. the tests themselves could take awhile to run leaving you to have a blank browser window while they run. it seems a better solution would be to employ a build server like jenkins to run your tests and then notify when they are complete. the build jobs can be configured to save the html report to a box somewhere when done and email out a link to the page. we have a similar setup where i work.,neutral
adamgruber/mochawesome,mocha,2015-05-26T13:11:47Z,html reports problem. i am trying to run my mocha test cases and reporting output with mochawesome but i endup with a error 137 passing (184ms)24 pendingfatal error: call_and_retry_last allocation failed - process out of memoryaborted (core dumped)mochawesome-reports folder is generated and inside it i have css  fontsjsfolders but html reports are not generated.could you please suggest  me the solution i have tried spec.dot and various other reporter they are running perfectly over the stdout but i want html reports.,negative
joeybaker/generator-iojs,eslint,2015-05-19T03:01:17Z,convert eslint to a shareable config. for abstraction!,neutral
Hacker0x01/react-datepicker,karma,2015-10-29T13:38:48Z,update karma-sauce-launcher,neutral
Hacker0x01/react-datepicker,eslint,2018-03-08T22:40:05Z,martijnrusschen flow is a lot like a linter. in that it doesn't affect the runtime behavior at all. but it does require more annotations than eslint. they can be in comments. but it's prettier when they're not. transpiling flow is as simple as removing the annotations. which we already seem to have babel configured to do.the way we're using it at work. we have webpack configured to run flow. but it continues even if flow finds errors. (so you'll see the type errors but they don't get in the way of running the code.) on our ci server. we do reject changes that fail to typecheck. though initially we didn't.another advantage of flow over typescript. is that react uses flow. so our users are more likely to be familiar with it.i added #1307 as a simple example.,negative
linkedin/hopscotch,jasmine,2015-04-08T18:22:03Z,looks good to me. barring any objections. i'll pull this in by eod.,negative
sass/node-sass,jshint,2014-04-23T08:43:57Z,btw the lint script doesn't really make a lot of sense to have; it's just one line which executes jshint. if you plan to add more stuff later. then i guess it makes sense.,negative
webpack/webpack,standard,2016-12-20T23:33:26Z,that would definitely help! but still -- it seems like webpack has _many_ features that could benefit users if they only knew to use them. when the time comes. thanks to sections like `optimization` in your docs. they discover them and turn them on. this seems no different. js runs in so many different environments. all with different perf standards / requirements. default warnings seem most helpful when you can be totally certain that your assumption is global.,positive
webpack/webpack,standard,2016-12-23T12:41:03Z,posix defines:* standard output = for writing conventional output* standard error = for writing diagnostic outputprogress is a diagnostic output so it belongs to standard error.,negative
webpack/webpack,standard,2017-01-02T12:35:16Z,> should be squashed imo otherwise lgtmyes. for sure (good catch chicoxyzzy ). we shouldn't add broken commits inside master branch. i don't know for now if we are not using squash as standard. but if not it's a good idea add it.,negative
webpack/webpack,standard,2017-01-04T12:26:50Z,thelarkinn. i added some tests for `chunk` class. but i don't have all context about the scenarios and standards that we are using in webpack repository. i found different styles inside the test files and there's nothing talking about it on `test/readme.md`. i don't know if you guys are aware of it or what you are doing to improve this. so i don't know if makes sense create an issue to handle this or if we have some work in progress.,negative
webpack/webpack,uglify,2018-05-02T11:43:15Z,looks like stale issue. close due stale. feel free to open new issue if somebody faces with this problem in `webpack3` and `webpack4`. also i use latest uglify plugin and using long term cache and all works fine. maybe problem can be in other plugins. thanks,positive
webpack/webpack,uglify,2018-05-08T20:41:24Z,maximaximum expected behavoiour. webpack don't remove legal comment (copyright. licenses and etc). we should respect other developers. you can configure uglify plugin in `minimizer` option and set `comments: false`. thanks!,positive
webpack/webpack,uglify,2018-05-19T07:40:41Z,my guess was wrong. it's not caused by the worker pool in the uglifyjs-plugin...,negative
webpack/webpack,uglify,2018-05-19T07:49:58Z,i’ve also observed timeout failures on stat test cases but they seem to be gone the day uglify was disabled.,neutral
webpack/webpack,uglify,2018-05-21T16:49:05Z,kzc i found that if i build blacksonic's example with webpack 4 using awesome-typescript-loader and `plugins: [new uglifyjsplugin({ uglifyoptions: { compress: { passes: 3 } } })]`. unused classes can be tree-shaked.is this an expected behavior?if yes. does this mean one does not need to use a string-replace plugin to tree-shake unused classes from typescript code as mhegazy noted if they specify `{ compress: { passes: 3 } }`?,neutral
webpack/webpack,uglify,2018-05-22T15:19:43Z,> it is likely that uglify-js can drop unused side-effect-free class iifes even if they are not annotated with `/*__pure__*/`.i was mistaken. it only worked in trivial cases. you still need to replace the comment text.,negative
webpack/webpack,uglify,2018-05-25T17:23:19Z,txiaocao installing uglifyjs-webpack-plugin from npm worked for me. it seems that the docs are wrong about the supposed existence of `webpack.optimize.uglifyjsplugin`.my config:`const uglifyplugin = require("uglifyjs-webpack-plugin");`...`plugins: [    new uglifyplugin({      uglifyoptions: {        output: {          comments: false        }      }    })  ].`,negative
stealjs/steal,sauce,2017-03-22T17:05:53Z,make it so that saucelabs runs all of the individual test pages. we have tests spread out over multiple entry-point test pages. currently saucelabs only runs test/test.html. which means some tests (such as the npm tests) are omitted from running in ci.,neutral
stealjs/steal,sauce,2017-03-27T20:50:34Z,closed by #1128,neutral
stealjs/steal,sauce,2017-04-12T21:32:43Z,use test-saucelabs package,neutral
stealjs/steal,sauce,2017-04-12T23:08:21Z,:d,neutral
clappr/clappr,karma,2014-12-22T02:53:13Z,hi rheber. i needed to expose events on karma configuration (d9626a9b0b8cbdd5b665c85ac46e90147b87675a) in order to fix the tests. anyway. thank you for the pull request!,positive
acuminous/yadda,mocha,2015-10-25T17:34:55Z,thanks. xeladotbe. that fixes the issue. i am surprised that calling the same mocha function from different locations changes its behavior. does mocha understand the context in which the function is being called?,neutral
sidorares/node-mysql2,eslint,2016-08-18T23:35:05Z,chalker did you use some custom script or eslint to log this? i'd like to add test rule so that it's not accidentally introduced in the future,negative
sidorares/node-mysql2,eslint,2016-08-18T23:36:09Z,sidorares no. i don't have an eslint rule for that. sorry. and am not aware of any. it would be super-awesome if you would find one. though =).,positive
prebid/Prebid.js,standard,2018-03-06T21:22:46Z,this issue has been automatically marked as stale because it has not had recent activity. it will be closed if no further activity occurs. thank you for your contributions.,positive
prebid/Prebid.js,standard,2018-03-08T02:13:23Z,code looks good.  i'm a bit puzzled by the build failure for standard/object-curly-even-spacing since when i run lint locally on the pr. it passses,negative
prebid/Prebid.js,standard,2018-03-16T16:09:13Z,hi jsnellbaker. thanks for taking the time to look over the code. we appreciate it. all your suggestions are very sensible. and i agree it is good to bring this code up-to-date with regards to es6 standards. i certainly prefer it myself.i have pushed the fixes and changes so let me know if all is as expected.,positive
prebid/Prebid.js,standard,2018-03-20T22:27:15Z,well in the standard banner workflow when we set keys we mark the bids as used but that doesn't work great for video because we don't get a callback letting us know the bid won.i like the idea of a clearing api though. open to a pr for that.,positive
CenterForOpenScience/ember-osf,coveralls,2017-06-15T14:25:34Z,brianjgeiger merge conflicts are gone. tests passing. coveralls a little unhappy about skipping test,negative
clarkie/dynogels,eslint,2016-09-30T09:01:28Z,i'm a little confused why you'd need to call `createtables` if you know the tables exist. i have an application config setting that allows us to trigger table creation based off a flag or environment variable:```function maybecreatetables(config. callback) {  if (config.createtables) {    console.log('creating tables...'); // eslint-disable-line    return dynogels.createtables(callback);  }  return callback();}```if i've misunderstood the question then please let me know. thanks,negative
babel/babylon,codecov,2016-10-15T16:04:43Z,count babel tests towards babylon code coverage. as we're already running babel's tests in ci to detect any integration issues early. we can also use them to meaningfully bump up babylon's test coverage. by doing this with an instrumented build of babylon and using codecov's automatic report merging feature.in practice this currently helps us cover things like `do` expressions and the `::` operator which are conspicuously uncovered in the current `master`. obviously for new features the ideal still is to add covering tests from the get-go.(also. file this under "workarounds we can retire if babylon is ever merged back into the babel monorepo" ),neutral
babel/babylon,eslint,2017-01-24T13:24:47Z,danez > it maybe even easier to adjust the typescript parser to have an option to output babel-compatible astso `ts + typescript-eslint-parser` is already a way to effectively take typescript source code and produce an estree ast.if i understand correctly. the work currently being done on babel + estree is around babel _outputting_ estree. but if it were possible to for babel to also consume estree as an option. then we potentially have a lot of the moving parts already...i don't yet know enough about babel to know how that relates to hzoo task list  in the description above,neutral
babel/babylon,eslint,2017-01-24T13:30:13Z,jameshenry nearly.the work that is currently done is to have an option (or plugin) that enables babylon (the parser of babel) to output estree. this is so that other tools like eslint. react-docgen. basically everything that consumes estree asts to be able to drop in babylon and be able to support every spec that babylon supports.afaik there are no plans to use the estree mode within babel. as the changes that were made to the estree format are all valuable additions/changes and make it way easier to write plugins in babel. it would be nice to contribute them back to estree. but they don't allow/want any breaking change.,neutral
babel/babylon,eslint,2017-01-24T13:31:42Z,danez the intention of the issue/discussion earlier was that i thought we could possibly have a `ts` plugin like with flow/jsx? and that the babel team wouldn't be the ones maintaining/creating it. but it would be like flow in that the flow team can make prs etc.and yes jameshenry already has done separate work via `typescript-eslint-parser` which uses the ts parser -> estree. this issue was about getting babylon itself to parse ts but maybe that's unnecessary?>  and instead focus more on making it more easy to extend.not sure what we can do there yet?,neutral
react-materialize/react-materialize,karma,2016-03-04T01:52:47Z,i pushed my commits.if i do not change the `karma.conf.js` file. when i run `npm test`. it will throw:``` shellreferenceerror: can't find variable: $```or``` shelltypeerror: 'undefined' is not a function (evaluating '$(this.refs.__select__).material_select()')```,negative
pouchdb/pouchdb,eslint,2016-05-23T20:49:09Z,not sure if moving 'my' submodules of express-pouchdb is a good idea. as they have separate test suites. more chances of travis breaking down accidentally (e.g. due to upstream bugs in mocha/eslint/babel etc.). and its runtime would increase too (although only marginally).but anyway. we can figure that out later. the order nolanlawson names sounds like a good start.,negative
pouchdb/pouchdb,eslint,2016-06-01T09:33:45Z,so the tests failed with a minor eslint. i pointed it out in the comments. i had a few small comments about the code style but otherwise its looking great. hopefully get a green run with that semi colon and i think it will be good to land,positive
pouchdb/pouchdb,uglify,2014-08-16T04:47:05Z,rebased,neutral
pouchdb/pouchdb,uglify,2014-08-17T17:48:04Z,nah sorry missed the issue. yeh im leaning towards -1 on this. i know it doesnt have a huge downside. but theres a cost both in download and more complexity with each additional dependency and i would rather be getting rid of them. especially for the sake of 500bytes. we can report the size differences to the original projects and hopefully end up with the benefit and no extra depscalvinmetcalf wanna cast the vote?,negative
pouchdb/pouchdb,uglify,2014-08-17T18:19:19Z,fair enough. pouchdb has gotten a little big around the waistline. though. we should try to find ways to slim it down.,neutral
pouchdb/pouchdb,mocha,2014-06-12T20:45:14Z,unfortunately it looks like this won't work. because mocha is not equipped to run in node-webkit.  it assumes it's in node (or something). which results in:```uncaught node.js error rangeerror: maximum call stack size exceeded    at window.require (eval at undefined. <anonymous>:1:26)    at window.require (eval at undefined. <anonymous>:1:112)    at window.require (eval at undefined. <anonymous>:1:112)    at window.require (eval at undefined. <anonymous>:1:112)    at window.require (eval at undefined. <anonymous>:1:112)    at window.require (eval at undefined. <anonymous>:1:112)    at window.require (eval at undefined. <anonymous>:1:112)    at window.require (eval at undefined. <anonymous>:1:112)    at window.require (eval at undefined. <anonymous>:1:112)    at window.require (eval at undefined. <anonymous>:1:112)```plus ```uncaught referenceerror: require is not defined```,negative
pouchdb/pouchdb,selenium,2014-04-06T17:53:19Z,this is a script that needs to run locally. and not just a browser one (we dont only test in the browser). i expect its mostly something that just checkout out a repo. does a build and runs a test incrementally```./bin/backfill-performance.sh git-sha```just giving a heads up in case you go for a different architecture. at the least it shouldnt be limited to the browser. and it should run a clean profile in the browser each time (which we get for free with using selenium tests),neutral
pouchdb/pouchdb,jshint,2014-03-18T11:07:46Z,ok. installed linux. fixed a jshint issue. now all tests seem to pass.,neutral
pouchdb/pouchdb,jshint,2014-03-18T20:43:18Z,just in case you didn't know. you can also put it in your global .gitignore.  i've done that myself; i found it's also a good habit since it forces me to put project config elsewhere (e.g. jshintrc).,positive
pouchdb/pouchdb,jshint,2014-03-18T23:02:10Z,yo. minor jshint fix needed here. but yay less code,positive
pouchdb/pouchdb,jshint,2014-03-18T23:31:47Z,so jshint checks indentation based on the line before it. the real error is that the previous line should be at 3 not 5,negative
pouchdb/pouchdb,jshint,2014-03-18T23:45:48Z,yup. daleharvey . you are right. i'm not testing it right. it took two different issues to screw me up here.#1 - the jshint website doesn't check for indenting errors#2 - when i switched branches locally in git it turned out that it was still applying changes that weren't in master. once i ran reset it was all good and i got the same error.thank you! by running the test yourself you proved i had screwed up which made finding the problem much easier.,negative
pouchdb/pouchdb,jshint,2014-04-04T03:08:13Z,results are in the browser. cleaned up a bit about the location of the files. added jshinting,neutral
pouchdb/pouchdb,jshint,2014-04-07T17:35:48Z,you should be able to put in jshint exceptions. like `/* jshint maxlen: false /*` in a comment above them,neutral
pouchdb/pouchdb,jshint,2014-04-07T17:53:56Z,ok. added the comment to just those lines. and added in the maxlen: 80 option into the .jshintrc file.,neutral
pouchdb/pouchdb,jshint,2014-04-14T00:49:57Z,d'oh. forgot to jshint. should be green now.,neutral
vlucas/frisby,jasmine,2014-05-01T19:01:58Z,if you make this work. i will certainly link to it from the frisby website - in my view. it's just another test runner as an alternative to `jasmine-node`.,neutral
angular/protractor,jasmine,2016-06-18T07:25:01Z,"restartbrowserbetweeneachtest: true" with jasmine 2 restart browser extra one more time . when i am using "restartbrowserbetweeneachtest: true" in conf with jasmine 2. having two "it" in spec then it restart the browser 3 times but i want 2 time only as their are 2 "it". how to resolve that problem.??,positive
angular/protractor,jasmine,2016-06-21T18:38:04Z,hi all. we are using jasmine-reporters for generating both html as well as xml reports. however we have written a custom dot net console application to take the xml reports generated and write it back to microsoft test manager. if i try to invoke a console application within the it block of a spec file it invokes fine. however when we try to invoke the console application from oncomplete event(as xml reports would be generated by now) in conf.js it is not invoking at all. kindly advise.,neutral
angular/protractor,jasmine,2016-07-11T07:06:19Z,shankscriptthat's great. thanks a lot.and i think addjasminenodeopts: {defaulttimeoutinterval: 60000}.  is neccessary too.,positive
angular/protractor,jasmine,2016-07-14T17:15:05Z,can we make the wait plugin easily available/default in some way? assigning sjelin since you've got background here.,neutral
angular/protractor,selenium,2015-06-22T10:24:55Z,when i run webdriver-manager start. after an update which processes successfully. i get this error:c:\users\developer>webdriver-manager startseleniumprocess.pid: undefinedevents.js:85      throw er; // unhandled 'error' event            ^error: spawn cmd enoent    at exports._errnoexception (util.js:746:11)    at process.childprocess._handle.onexit (child_process.js:1053:32)    at child_process.js:1144:20    at process._tickcallback (node.js:355:11)    at function.module.runmain (module.js:503:11)    at startup (node.js:129:16)    at node.js:814:3,negative
angular/protractor,selenium,2015-06-26T22:52:50Z,reported reduced case here: seleniumhq/selenium#715,neutral
angular/protractor,selenium,2015-06-29T17:56:01Z,definitely looks like a selenium or angular bug to me,negative
