datproject/dat,standard,2015-09-10T00:37:45Z,dun4n we use js standard style which only restricts usage of unnecessary semicolons  in the case of for vs foreach there are performance differences that sometimes necessitate usage of one over the other.in this case perf doesn't matter. so theres no functional difference between for vs foreach here. in the future we would appreciate contributions that address an open issue. you can always open a new discussion issue if you have questions about style etc.,positive
datproject/dat,standard,2015-09-10T01:08:21Z,i'm sorry to have wasted your time (btw. i didn't know standardjs.com),negative
camunda/camunda-modeler,eslint,2018-05-13T16:17:42Z,my current design idea has been: use eslint preprossor plugin to convert the bpmn file into bpmn-moodle js and the. pass that js into eslint rules.,neutral
senecajs/seneca-mysql-store,coveralls,2016-05-19T11:06:52Z,added coveralls,neutral
senecajs/seneca-mysql-store,coveralls,2016-05-19T11:46:00Z,lgtm,neutral
GoogleCloudPlatform/cloud-trace-nodejs,mocha,2017-09-07T22:45:57Z,convert the trace agent to typescript (part 1). this change adds a new `gulp`-based build system for the trace agent. and does a superficial refactor of the code to work with this new build system.i've separated this change into a few commits. each of which should be completely self-contained. i'd recommend looking at each commit separately (almost all new code is in the first commit). here's a description of what each commit does:## `build: add typescript build files`this commit adds `tsconfig.json` and `gulpfile.js`. and amends other files to reflect build system changes.i've written a new set of gulp tasks to exhaustively cover compilation. as well as all the ci functionality we had before:* unit tests (`gulp test`)* coverage reporting for unit tests (`gulp coverage`) (todo(kjin): verify this in ci)* system tests (`gulp system-test`)* linting (`gulp lint`)there are a lot of "helper" tasks -- the general rule being that `x.y` is a helper task for `x`.i also added a `test.single` task. which runs a mocha test in the same process as gulp. this should be useful for debugging.notably. there is a `--dev` flag that compilation-related tasks consume. this relaxes `tsconfig` compilation options. as files receive types in the next pr. this flag will go away.## `refactor: add convert-to-ts`adds a script as described below.## `refactor: run convert-to-ts`this commit is the result of running the `convert-to-ts` helper module. it's a purely mechanical operation which:* renames source and test files to have the `.ts` extension* removes `.js` from module requires* adds `export default {}` to the bottom of each renamed file (as `tsc` mistakes them for scripts otherwise)## `src: src changes`this commit sums up the minimum changes in `src` needed to make `gulp compile --dev` compile source files without any errors.## `test: test changes`this commit sums up the minimum changes in `test` needed to make `gulp test --dev` pass all unit tests.## `revert: remove convert-to-ts`this commit does exactly what it describes.,negative
GoogleCloudPlatform/cloud-trace-nodejs,mocha,2017-09-11T23:39:47Z,ofrobots i'm going to move all build stuff out of the `gulpfile` and into a `scripts/` directory. which will get transpiled along with `src` and `test`. `gts` works for tasks such as lint/format checking and cleaning. but there are still things i would like to see as js (ts) scripts. such as installing fixtures.on a semi-related note. `index.ts` and `config.ts` currently reside outside `src`. i'm going to move them in `src`... ofrobots matthewloring let me know if you have any objections.,negative
GoogleCloudPlatform/cloud-trace-nodejs,mocha,2017-09-13T21:19:54Z,i've added/changed some commits:`build: remove gulpfile` added`build: add new build scripts` added (build scripts in ts)`test: test changes` changed (to make `npm run compile` pass without errors)googlecloudplatform/node-team ptal,negative
rwjblue/ember-lifeline,eslint,2018-04-16T16:22:06Z,set is a good improvement. i prefer using this.mytask rather than “mytask” as eslint will find typos. could an eslint rule be added to prohibit anonymous functions in throttletask which would be the main danger here?,positive
tildeio/htmlbars,sauce,2015-03-23T19:34:11Z,updated sauce addon. bundle start / stop commandsthanks rwjblue for the suggestion.,neutral
tildeio/htmlbars,sauce,2015-03-23T19:45:58Z,thank you!,positive
TryGhost/Ignition,eslint,2017-10-04T18:23:50Z,additionally we should study the eslint plugin architecture as they have been successful with theirs.,positive
OpenZeppelin/zeppelin-solidity,coveralls,2017-08-22T01:20:26Z,removed coveralls script from package.json. - no `scripts/coveralls.sh` anymore. ✅,neutral
OpenZeppelin/zeppelin-solidity,coveralls,2017-08-22T23:46:45Z,thanks sot528!,positive
cfpb/capital-framework,uglify,2017-12-12T22:39:26Z,updates deps. ## changes- updates `gulp-qunit`. `qunit`. `sinon`. `uglifyjs-webpack-plugin`. `webpack `## testing- `npm install && npm run build && npm test && gulp test:unit`,neutral
cfpb/capital-framework,uglify,2017-12-14T15:44:39Z,update dependencies. ## changes- updates `jsdom` and `uglifyjs-webpack-plugin`## testing- `npm install && npm run build && npm test && gulp test:unit`,neutral
matrix-org/matrix-react-sdk,standard,2017-05-18T22:30:34Z,dtygel - thanks for putting this together :)  we're thinking about putting a generic postmessage interface into riot in the near future (cc rxl881). which this can form the basis of!however. it's going to be critical to future-proof the api a bit.  can i suggest that the `action` field is namespaced to `im.vector.login` and `im.vector.logout` or similar. to avoid it clashing with other possible methods we add in future?  once standardised. these would become `m.login`. `m.logout` (yes. we're considering defining a postmessage api for matrix clients as an appendix of the matrix spec(!)),negative
matrix-org/matrix-react-sdk,eslint,2017-04-25T21:04:48Z,fix user settings store. conform to eslintbut more importantly. respect defaultvalues for getlocalsetting and getsyncedsetting,positive
matrix-org/matrix-react-sdk,eslint,2017-04-29T16:48:35Z,tidy up src/components/structures/* (conform eslint). ignore (for now)exploiting travis,neutral
zurb/foundation-sites,karma,2014-02-20T23:12:57Z,hey eprothro. sorry i missed your question earlier.  grunt is used during the build process to compile the distribution. run the tests. etc.  travisci calls `grunt travis` to run the tests.  you can do the same. or you can run `grunt karma:dev` to run with some real browsers. as well.you can install everything by doing an `npm install` and `bower install`.,negative
vvo/selenium-standalone,selenium,2014-12-21T01:57:05Z,i had this same problem. solved it by adding a sleep() instruction in order to wait for the programmatically launched server to start up. every time i used the start-selenium console command i was waiting long enough.,negative
vvo/selenium-standalone,selenium,2015-01-02T05:25:51Z,rdepena i do not understand. what other url would you use to download selenium or chrome driver for example?selenium-standalone already supports setting a proxy for download (just set the proxy on your system or set env variables).,neutral
vvo/selenium-standalone,selenium,2015-01-02T10:55:00Z,callback notifying when selenium is ready to use,neutral
vvo/selenium-standalone,selenium,2015-01-02T10:57:36Z,wasnt particularly certain about whether it should maintain the var server = selenium() api as well as the callback one. i would get rid of the sync api as i always end up needing to go async at some point,neutral
nathanboktae/mocha-phantomjs,mocha,2015-10-12T16:33:20Z,nathanboktae following on from resource loading. is requirejs supported? i seem to have a problem with mocha not being initialised when running from the cli. but working fine in a browser.,negative
nathanboktae/mocha-phantomjs,mocha,2015-10-14T15:55:00Z,if the download bugs you. use `mocha-phantomjs-core` yourself directly.,neutral
nathanboktae/mocha-phantomjs,mocha,2015-10-22T23:35:13Z,see nathanboktae/mocha-phantomjs-core#9 for require.js stuff and comment there if you have questions. it should be fine though if you aren't using require.js to load mocha (but even then. you should get a different error.,positive
nathanboktae/mocha-phantomjs,mocha,2015-10-24T04:16:59Z,ah. the issue is actually nathanboktae/mocha-phantomjs-core#12. sorry about that.but do what it says and call `window.initmochaphantomjs()` before calling `mocha.setup` or other setup functions```window.initmochaphantomjs && window.initmochaphantomjs()mocha.setup('bdd') // or whatever. mocha.ui('tdd'). mocha.slow(). etc etc...```,neutral
nathanboktae/mocha-phantomjs,mocha,2015-11-01T04:02:10Z,phantomjs terminated with signal sigsegv. when i run "mocha-phantomjs -r dot /test/file.html"，it catch "phantomjs terminated with signal sigsegv". what caused this error？,neutral
mccormicka/Mockgoose,mocha,2015-07-29T10:56:37Z,aroman i just run into the same problem in the past few days. i am using jasmine for my tests. and for some tests i needed mongoose mocked while for others i needed the real thing. here is how i solved it: for the tests that i required mongoose mocked. i did the mocking in the `beforeall()`block and then i cleared the require cache for mongoose in the `afterall()` block. this way. when the next test is coming. mongoose is required again. and it's returned unmocked. like this:```describe('my_test' function() {    var mockgoose = require('mockgoose');    var mongoose;    beforeall(function() {        var mongoose = require('mongoose');        mockgoose(mongoose);    });    afterall(function() {        delete require.cache[require.resolve('mongoose')];    });    it('my first spec'. function() {        ...    });});```,negative
typicode/husky,standard,2017-04-22T07:38:25Z,why is your lint script returning 0? it will always pass in that case. you're basically throwing away the error code from standard. unless i am misunderstanding some aspect of shell scripting. which is very possible.,negative
typicode/husky,standard,2017-05-05T22:19:19Z,nevermind! i just had removed another precommit lib (`precommit-hook`) and had to remove all hooks `rm -f .git/hooks/*` and run `yarn add husky --dev --force` again. now all works fine!,positive
marionettejs/backbone.marionette,mocha,2014-09-13T18:53:14Z,is this really necessary? seems like `_.isfunction` and documentation gives you more than doing this kind of strict type checking.,negative
marionettejs/backbone.marionette,mocha,2014-09-13T20:52:03Z,yeah. i agree with thejameskyle. i don't think we need to pollute our helpers with li'l things like this. gonna close for now. thanks. though. paulovieira!,positive
marionettejs/backbone.marionette,mocha,2014-09-16T01:58:58Z,> is this really necessary? it is necessary for any property that accepts a class as the value (to have the alternative function-that-returns-a-class form). currently this happens in `collectionview` only. but would be useful for user-defined classes.for people new to backbone/marionette it is not obvious how to do this kind of verification. the previous issues where this subject has been discussed prove it. thus it makes sense to bring this into the codebase. imo.thanks anyway for considering it!,positive
auth0/lock,sauce,2016-07-19T13:32:36Z,temp split browser tests. for some reason. we can't run test for more than 3 browsers in saucelabs. we can run ie tests individually until we find a better solution. (couldn't find a way to give the zuul cmd more than one browser or an alternative .zuul.yml config file).,neutral
nteract/nteract,eslint,2016-08-16T01:38:45Z,bump eslint-plugin-jsx-a11y for peer dep,neutral
nteract/nteract,eslint,2016-08-16T03:38:32Z,woot :cactus:,neutral
nteract/nteract,eslint,2016-08-26T03:20:54Z,evergreen programming. bumped deps. added a eslintrc escape hatch for until we refactor a little bit.,neutral
nteract/nteract,eslint,2016-08-27T22:24:18Z,bump more deps. yay. came to bump spawnteract. noticed we could do with an `eslint` bump.,neutral
nteract/nteract,eslint,2016-08-28T21:48:49Z,^^ that's mostly addressing linting (function repeated. fix path to messaging. remove unused imports. put eslint config back).,neutral
jira-node/node-jira-client,eslint,2016-04-18T16:32:00Z,change from eslint-config-exchange-solutions to eslint-config-airbnb,neutral
jira-node/node-jira-client,eslint,2016-04-18T17:02:40Z,:shipit:,neutral
jira-node/node-jira-client,eslint,2016-04-28T14:28:12Z,my first question for you is. where are your unit tests?we also use editorconfig and eslint to ensure that the code is styled in a manner that is easily read and that it is consistent.  from you command line. you can run `npm run lint` to get a detailed output of any issues after running `npm install`.once you add the appropriate tests to the `/test/jira-tests.js` file (and ensure they pass with `npm run test` command). please squash your commits to one commit.  i will review this pull request again and if it's all good i will have no trouble bringing this in and getting it released for you.  my apologies. i had meant to get a contribution guide written up last week for this repo. but i haven't had the time.,negative
walmartlabs/eslint-config-walmart,eslint,2016-08-23T16:54:14Z,this project is just a set of json files and as such having large packages like eslint as a peer ep isn't a good fit. if this package were to be an actual linter or lint runner that might be a consideration.,neutral
walmartlabs/eslint-config-walmart,eslint,2016-08-24T19:00:18Z,tested using `eslint3` and works with no adjustments.,neutral
hoodiehq/hoodie,sauce,2014-03-03T11:18:05Z,looks good tho. just checking with the build to see why it's error'ing again.. probably down to saucelabs..,negative
hoodiehq/hoodie,karma,2013-10-30T12:04:30Z,testing: make coverage thingy optional. i'd like to run `node node_modules/karma/bin/karma start --no-single-run` without the coverage thingy minifying all the script files.,neutral
hoodiehq/hoodie,karma,2013-11-06T20:17:56Z,karma saucelabs. run karma build against multiple browsers on saucelabs.,neutral
vector-im/riot-web,standard,2016-11-15T11:31:19Z,elopio: that's not our standard stylesheet. are you using a custom userstyle?,neutral
vector-im/riot-web,standard,2016-11-18T09:56:10Z,ah right. actually i see the misalignment too. and the non-standard colours are probably coming from your room. will add it to the list to investigate.,neutral
vector-im/riot-web,eslint,2017-04-22T01:43:18Z,hm. by switching forward slashes for backwards slashes. doesn't this break things on unix in favour of working on windows?  or is there some voodoo happening to make it work on unix too that i'm missing?also. i'm not keen on some of the formatting changes here (or mixing them together with the functional bit of the commit) - the long lines have been deliberately broken up in places for aesthetic clarity.  (or has eslint bullied you into this?),negative
appium/appium,selenium,2014-08-19T17:00:13Z,perfect. thanks imurchie now "getcontexthandles()" returned: [native_app. webview_com.example.testecontext]but when i try to change the context "driver.context(contextname);" an exception occurs```org.openqa.selenium.webdriverexception: an unknown server-side error occurred while processing the command. (original error: did not get session redirect from chromedriver) (warning: the server did not provide any stacktrace information)```,neutral
appium/appium,selenium,2014-08-26T21:21:34Z,did you try using the built-in selenium client alert methods? fwiw. autoacceptalerts only works on ios. not android.,neutral
appium/appium,selenium,2014-09-10T06:49:15Z,how to scroll down a window in android native application using web driver command.. hi...i am trying to use java script scroll command to scroll the page while automating android mobile native application to scroll the window dowm .but i am getting error message :org.openqa.selenium.webdriverexception: not yet implemented. please help us:  you please tell me how to scroll down in android mobile native application using appium and selenium webdriver command.,negative
appium/appium,selenium,2014-09-10T14:45:44Z,appium shuts down as page load is not released. hi.i'm trying to execute test scripts on mobile chrome using appium in a hybrid selenium web driver framework. while doing so. encountered an error.some pages are not getting loaded fully during execution. this leads to following exception once after the 'newcommandtimeout' time limit it attained and appium shuts down .org.openqa.selenium.webdriverexception: an unknown server-side error occurred while processing the command. (warning: the server did not provide any stacktrace information)didn't get a new command in 180 secs. shutting down appiumplease provide solution for this.,negative
appium/appium,sauce,2014-06-24T13:42:14Z,also after testing on real device this code works fine. it only seems to be a problem when run on  a local emulator or  a saucelab's emulator,positive
jhipster/generator-jhipster,eslint,2016-07-24T20:40:24Z,fix eslint error. fix eslint error in social.state.js and social.state.ts,negative
jhipster/generator-jhipster,eslint,2016-07-24T20:41:16Z,fix eslint error. fix eslint error in social.state.js,negative
jhipster/generator-jhipster,karma,2017-04-23T17:33:02Z,and did you try what is being said. running:    npm run lint && karma start src/test/javascript/karma.conf.jsthis might be a karma test issue,neutral
jashkenas/underscore,eslint,2014-08-27T16:42:24Z,eslint is being a pain but tests pass. merging.,negative
marko-js/marko-widgets,karma,2015-04-07T04:44:57Z,karma-optimizer integration with marko-widgets,neutral
marko-js/marko-widgets,karma,2015-04-15T14:50:39Z,thanks for the pull request. pranavjha. as we discussed offline. it appears that karma is not really a good fit for _this_ project since it doesn't provide a very clean way to test pages rendered on the server. we're going to stick with mocha-phantomjs for now for this project. but i think karma-optimizer could be a great fit for testing web applications. thanks again!,positive
agda/agda-stdlib,standard,2018-03-18T17:38:37Z,what would a user of the standard library want to use them for?,neutral
agda/agda-stdlib,standard,2018-04-04T16:53:35Z,i was thinking about it for the last couple days. and i hope i got a better picture of this.i think it might not be the problem of this library (though it's indeed very nice if unsafe code can be extracted to submodules in the previously mentioned way). i do agree that it's going to be much better of. if the compiler can check the safety of every function. like matthewdaggitt suggested. one of the very important aspects of being able to do so. is to make tactics more realizable. since tactics are macros and based on yet another bunch of postulates. there is no way if a program is written by tactics and can be safe. however. the program built by tactics itself can be entirely safe; while on the other hand. one can indeed embed unsafe code via tactics as well.from that aspect. i believe adding such functionalities to the compiler will help largely to eliminate boring mechanical programming in agda. and that also means that it's more on what the compiler does. instead of what this particular library looks like.,positive
agda/agda-stdlib,standard,2018-04-05T08:49:46Z,> as per gallais' suggestion i generalized the if-dec-{true.false} lemmas and called them diag and antidiag respectively. since they now don't mention fin. i've moved them to relation.nullary.decidable. as it turns out. they're pretty similar to the fromwitness family of functions that is already there. but it would be enough hassle to make use of those that i think it's still worth including my new definitions.you probably won't need any of these proofs if you use patten matching directly in the definition of `swap`:``` agdaswap : ∀ {n} → fin n → fin n → fin n → fin nswap i j k with k ≟ i... | yes _ = j... | no  _ with k ≟ j...   | yes _ = i...   | no  _ = k```this form is much more in keeping with the style of the standard library as it preserves type information (the library tries to avoid `bool` where possible as it requires all sorts of the lemmas like `diag` and `antidiag` to recover the type information),negative
agda/agda-stdlib,standard,2018-04-11T12:46:26Z,agreed. these would be useful. i agree with the mailing list and jacquescarette though. they should be called `icong` and `icong₂`. drphil feel free to open a pull request. for when you do. just a friendly note that the standard library puts arrows at the end rather than the start of lines.,positive
agda/agda-stdlib,standard,2018-04-12T14:46:32Z,`--safe` + `--ignore-interfaces` is pretty reliable,positive
agda/agda-stdlib,standard,2018-04-12T15:08:16Z,on thu. apr 12. 2018 at 07:46:35am -0700. g. allais wrote:> `--safe` + `--ignore-interfaces` is pretty reliableexcept that it cannot be resumed easily if there is a crashbefore completion(most likely due to starting agda with insufficient heap space. which will in turn quite likely be due to hardware constraints...).admittadly. this should not be a problem for the standard library.but in general. removing all .agdai files is safer.,negative
agda/agda-stdlib,standard,2018-04-13T09:18:15Z,> i'm rapidly coming to the opinion that the `--safe` option currently doesn't provide anything much in the way of guarantees (either in-file or at the command line)the `--safe` feature was originally implemented by someone who is no longer contributing to agda. and it seems as if no regular developer is eager to maintain it. fixing the documented bugs related to `--safe` requires some work. but i think it should be doable for someone who is not intimately familiar with the internals of agda. contributions are welcome.,positive
agda/agda-stdlib,standard,2018-04-13T10:54:19Z,> there's also the question of using list-style foldr and foldl rather than the vec-style onesas in you think we should the vec-style ones as well? i've also been thinking of standardising the `folds`. i'll open an issue to discuss it.,neutral
agda/agda-stdlib,standard,2018-04-13T11:24:47Z,>>i'm rapidly coming to the opinion that the --safe option currently doesn't provide anything much in the way of guarantees (either in-file or at the command line)>> fixing the documented bugs related to --safe requires some work. but i think it should be doable for someone who is not intimately familiar with the internals of agda. contributions are welcome.while i would love to. i feel i already spend far too much of my time of my phd on internet routing protocols playing around with agda! sorry. i realise that my original comment perhaps came off as a complaint. it wasn't meant to be.,positive
agda/agda-stdlib,standard,2018-04-14T23:33:48Z,> disadvantages: performance gets even worse.i am astonished by the performance part. might i ask how important performance is. and how many people are relying on it? sorry about my ignorance...what about irrelevance? i've not seen the description in official doc. but from my understanding. this should be the secrete magic to tame the tradeoff between complex proof flow and performance. is it not?,negative
webdriverio/wdio-allure-reporter,mocha,2016-09-26T03:54:17Z,just-boris it is not just cucumber. i face same the issue which is reported above in mocha framework also,neutral
webdriverio/wdio-allure-reporter,mocha,2016-09-26T08:38:56Z,anarwal that's true.so. if you have example. how to reproduce this issue using mocha framework. welcome to #29 that issue will be focused on fixing integration with mocha.,neutral
linkeddata/rdflib.js,mocha,2017-04-07T16:28:22Z,this should do ```{  "extends": "standard".  "env": {    "mocha": true  }.  "globals": {    "tabulator": true.    "components": true  }.  "rules": {    "array-bracket-spacing": [      "error".      "always"    ].    "camelcase": "off".    "no-unused-vars": "warn"  }}```,neutral
linkeddata/rdflib.js,mocha,2017-04-07T16:52:35Z,the mocha env part and the warnings about the globals are handled in the standard: globals section of `package.json`.in the case of `testhelper.kb.statementsmatching(undefined. undefined. lit).should.not.be.undefined` considered unused -- which part of it does it complain about being unused? we're widely using chai with standard across most our libs. and hasn't been a problem. to enforcing array spacing. or silencing unused warnings.,neutral
jshint/jshint,jshint,2013-04-16T22:13:17Z,jshint crashes on `return throw new error()`. obviously `return throw new error()` is an illegal js statement. however. jshint fails to pick up on it. and fails to check the file as a result.to reproduce. simply run jshint against this file:```var func = function(){    return throw new error();}```,negative
jshint/jshint,jshint,2013-04-16T22:58:30Z,thanks niggler. and sorry. i still don't like tabs and tend to forget to set them up when editing jshint :-),positive
jshint/jshint,jshint,2013-04-17T18:12:43Z,there's already `jshint --verbose` that shows warning codes. could you re-do this pr for jslint_xml reporter only. please?,positive
jshint/jshint,jshint,2013-04-18T21:26:16Z,any chance of a release including this?,neutral
jshint/jshint,jshint,2013-04-24T16:43:20Z,here's a smaller test case:``` js/* jshint devel:false */console.log("foo");```when putting that in `a.js`. executing `./jshint a.js` unexpectedly does not result in an error.,negative
jshint/jshint,jshint,2013-04-24T18:06:55Z,...and the reason was that i had a `.jshintrc` higher up in the hierarchy which included `"node": true`.,neutral
jshint/jshint,jshint,2013-04-24T20:02:40Z,have you tried linting individual files? it's quite possible there's a particular file which jshint has trouble dealing with.,neutral
