lindell/JsBarcode,coveralls,2016-08-04T15:18:21Z,this will probably not be node before es6 import / export comes to node since coverage on compiled code isn't what i want.,neutral
redux-saga/redux-saga,eslint,2018-01-05T10:39:29Z,you'd have to share a repository with the issue reproduced to get help. unfortunately i'm not familiar with `eslint-plugin-import` that much.,negative
webpack-contrib/sass-loader,eslint,2017-05-24T09:35:43Z,namespace: package name update. how about update the package name to webpack-sass-loader? at the moment. the webpack plugins/loaders namespace isn't very consistent. in comparison. babel. eslint. react. redux all have the namespace in a consistent convention. helping make the dependency tree clean.,neutral
webpack-contrib/sass-loader,eslint,2017-06-06T20:58:40Z,chore(package): update dependencies. exclude `eslint-plugin-*`. because in `webpack-default` we have own plugins and configuration.,negative
webpack-contrib/sass-loader,eslint,2017-06-06T23:15:47Z,michael-ciniawsky can we merge and release patch. no access :smile:,positive
infernojs/inferno,eslint,2017-06-06T22:10:12Z,use prettier . close #949 and cover the codebase to use prettier. i've loosened the `tslint` config and removed `eslint` as they are now handled by prettier itself for style. we were only using `eslint` for tests since our main source is written in typescript so it didn't seem much point for the added complexity.,positive
infernojs/inferno,eslint,2017-06-10T19:40:17Z,closing this for now.,neutral
infernojs/inferno,eslint,2017-06-12T21:09:26Z,activate prettier. close #949 and cover the codebase to use prettier.i've loosened the tslint config and removed eslint as they are now handled by prettier itself for style. we were only using eslint for tests since our main source is written in typescript so it didn't seem much point for the added complexity.,positive
ramda/ramda,eslint,2016-05-31T00:36:08Z,quick update: i tried updating to latest and am running into a problem with eslint not recognizing 'arraybuffer'. 'int8array'. and 'promise' and throwing a `no-undef` error when linting. i'm digging in to see if i can figure out why and get it passing.,negative
request/request,eslint,2015-03-20T10:35:16Z,this pr is looking good to me. we can think about enabling some of the `eslint` options later. the only thing that i'll suggest is to rebase all commits into one. as they are too small to have any meaning on its own.,neutral
request/request,eslint,2015-04-10T08:23:28Z,that's great. i'm only not too sure about the `space-before-function-paren` rule.if you run (without the tests)```node node_modules/.bin/eslint lib/ *.js```with `"space-before-function-paren": [2. "never"]` you get 99 warningswith `"space-before-function-paren": [2. "aways"]` you get 41 warningsso it turns out that there are more occurrences using space. of course without the tests. but they were largely refactored by one person at some point.so i'm for keeping the things as they are for now regarding this rule.,neutral
request/request,karma,2015-06-04T12:47:57Z,webpack karma config. this adds a configuration for webpack as a reference to anyone using it over browserify since it requires some special configuration to work. there is a todo task here to make the tests run with both webpack and browserify configs in series. but that will take some work as the current test setup won't allow that easily. for now. having this example will help others to figure out how to get request working with webpack.,positive
request/request,coveralls,2015-05-17T17:24:02Z,nylen that's the thing. there is some weird logic in coveralls that you have to be the one initially added the project to be able to delete it. also your login token will be used for calls to the github api. not mine. so without you re-authenticating it won't work.,neutral
request/request,coveralls,2015-05-17T17:32:24Z,hmm.. want me to delete the repo from coveralls and see if that helps?,neutral
request/request,coveralls,2015-05-20T17:39:15Z,a few minor fixes:. - moved `removerefererheader` to the appropriate section of the options docs- pass `options` to the redirect's module `onrequest` method. as it makes it more obvious from where these options are coming from (the extending of the request object in the ctor is a bit unexpected to say the least)- attached the `debug` function to the request's prototype to make it accessible to the modules through the request instance<br>  this also fixes the `request.debug` call in the `har` module. which obviously is not covered by the tests atm. or rather it should be obvious if coveralls was actually working ..,neutral
pixijs/pixi.js,jshint,2017-01-16T13:29:16Z,friksel thanks for the issue. i ran the built code generated with all those excludes and it ran fine in chrome/firefox. also. browserified and/or minified code is not intended to be run through jshint. color-coding in the editor like sublime will typically have issues with minified js files because of the underlying regular expressions used to create the colorization. i'm using sublime text 3 and only half the code is colorized correctly. from my experience. this is not unusual.,positive
reactjs/react-docgen,eslint,2016-11-22T23:38:33Z,i wonder if going the route of eslint and having pluggable parsers is the right way. it's too bad we can't just have one,negative
angular-ui/ui-utils,karma,2013-09-27T21:51:31Z,updated karma + config. tested and works.,neutral
angular-ui/ui-utils,karma,2013-09-27T21:53:33Z,looks good - thank you.,positive
angular-ui/ui-utils,karma,2013-09-27T21:58:58Z,wow. that was quick!,positive
angular-ui/ui-utils,karma,2013-09-27T21:59:44Z,clean commit and clean message makes for quick merges :),neutral
elastic/kibana,selenium,2016-03-15T23:02:25Z,it does not currently have selenium tests. correct. we're working on it. leedr any idea how that looks right now?,neutral
serverless/serverless,eslint,2016-09-25T13:31:28Z,yes they should.. it's the difference between```npm install -g eslinteslint .```(which is running eslint directly because global node module bin is in your path)and```npm install eslint(add script "lint: eslint ." to package json)npm run lint```(which is npm running a script where local node module bin is put in to your path.)when any npm script execution returns a nonzero status code (e.g. linting failed) npm prints that debug info.,neutral
serverless/serverless,eslint,2016-09-26T15:34:28Z,mocha supports a `mocha.opts` file within a directory that houses the test where you can specify various opts. maybe it would be cleaner to revert a bit back to your regular eslint style. and just deal with timeouts that way. (so move integration_test.js to /integration/...) and add a mocha.opts file there that specifies a timeout for all integration tests of 10s or whatever?edit: sorry. these are not in integration_test... i forgot.,negative
serverless/serverless,eslint,2016-09-30T02:38:18Z,allow to provide a default value for plugin options. i believe it would be useful to allow a default value for plugin options.``` jsoptions: {  mode: {    // eslint-disable-next-line max-len    usage: 'specifies the mode: "local". "remote". "both"'.    shortcut: 'm'.    default: 'remote'  }.}.```this has two benefits:- a default is not hidden in code- the help command can provide this information on the help command & hints,positive
metarhia/metasync,eslint,2017-09-07T01:00:05Z,i've taken another look. and yeah. `handle-callback-err` failures are legitimate. but all of them are in tests. not in the library code itself. i'd say land this as-is. and then remove `"handle-callback-err": "off"` from `.eslintrc.json` and add `test.notok(error. 'operation must not return an error');` where necessary as a separate commit.,negative
janl/mustache.js,eslint,2015-10-15T09:06:57Z,linting cli tool & fixing its current style issues. ensure the same code style on the cli tool. as we do on the main file `./mustache.js`.also minor .eslintrc change to be able to use `process.exit()`. instead of having to `throw new error()` to exit the process.,neutral
janl/mustache.js,eslint,2015-10-15T10:08:51Z,cool. thanks! :rocket:,positive
Palindrom/Palindrom,sauce,2017-10-03T07:52:38Z,>i thought that only palindromdom really needs wct and seleniumyou're right. >  palindrom itself should be testable in node without a browser and selenium.it is 100% testable```shnpm run test```runs perfectly. if you want to test the whole thing you can use:```shnpm run test-sauce```so i would say this issue is done.,positive
valor-software/ngx-bootstrap,karma,2016-07-19T13:47:18Z,fix(build): change src path for karma,neutral
tessel/t2-cli,coveralls,2017-03-25T18:14:12Z,rwaldron can you help me read the coveralls report? i can't tell what it doesn't like about this pr,negative
tessel/t2-cli,coveralls,2017-03-27T18:40:24Z,frijol i'm having trouble understanding why `nyc` and coveralls (the website) are reporting different numbers than what i see locally :|,negative
airbnb/javascript,eslint,2016-09-15T08:25:21Z,`echo 'const foo =`foo${bar}`;' | eslint --stdin --no-eslintrc --rule prefer-template:2 --rule quotes:2 --parser-options '{ecmaversion:6}'` has no errors (with latest eslint),neutral
airbnb/javascript,eslint,2016-09-15T16:31:00Z,perhaps your atom is set to use the global eslint? you basically want to completely uninstall eslint globally. and configure atom to look at your local one.,neutral
airbnb/javascript,eslint,2016-09-19T01:41:44Z,higher order functions and the arrow-parens rule. the `arrow-parens` rule requiring parentheses for blocks and no parentheses for one-liners takes no account of higher order functions.i find it downright bizarre that i should be required to write code like the following:``` jsreturn next => (action) => {  // etc};```i don't know whether this is a config issue or an eslint issue.,negative
airbnb/javascript,eslint,2016-09-19T01:47:58Z,this is definitely our config and our styleguide. a function with one arg that's using implicit return must omit the parens; any function using explicit return must include the parens. (one-liner versus blocks isn't the issue),neutral
airbnb/javascript,eslint,2016-09-19T01:50:50Z,i don't understand why you've closed this. do you really think it makes sense to write higher order functions in this fashion?,neutral
airbnb/javascript,eslint,2016-09-19T02:01:59Z,when you switch from implicit to explicit return in that chain. the parens help visually break apart the implicit part of the chain from the explicit part of the chain.in addition. very importantly. it takes something that is developer choice (whether to omit or include the one-arg parens) and legislates it. so that there's only one correct way to write it for a given codebase.this is the style we use inside airbnb - you're more than welcome to override any part of our config in your own eslintrc. or to fork the guide and make whichever changes you like.,neutral
airbnb/javascript,eslint,2016-09-19T02:19:40Z,for what it's worth. i'm not taking issue with either no parens for one line one arg functions or required parens for block body functions; i simply find the inconsistency jarring for higher order functions. obviously you don't agree. so i'll leave the complaint there.> this is the style we use inside airbnb - you're more than welcome to override any part of our config in your own eslintrc. or to fork the guide and make whichever changes you like.i realise this. but i hate fragmentation. so i prefer to avoid overrides. hence i'll bring to your attention anything i see as anomalies. in this case what i thought was a bug turns out not to be.,negative
airbnb/javascript,eslint,2016-09-19T02:35:52Z,just so i understand your preference - you'd prefer that the one-arg paren either be always required or always forbidden?,neutral
airbnb/javascript,eslint,2016-09-19T03:04:13Z,i'm saying where there is a block body all the parentheses should be required. since it's not a true one-liner. i.e. `(x) => (y) => (z) => { … }`,positive
airbnb/javascript,eslint,2016-09-19T03:06:14Z,it's not about being a one-liner tho - single-arg implicit return can be on multiple lines too. depending on what it's returning. it sounds like you want a special rule for when the single-arg of an arrow function is chained with other one-arg arrow functions - which is a scenario that eslint doesn't yet cover.,neutral
airbnb/javascript,eslint,2016-09-20T08:39:44Z,did you update `eslint`. as well as all the peer dependencies? specifically. you should use the `npm install` shell command in the readme.what's `npm ls` output?,neutral
airbnb/javascript,eslint,2016-09-20T09:12:01Z,yes. i reinstall gulp-eslint. it works now.thanks. ljharb,neutral
airbnb/javascript,eslint,2016-09-20T16:50:06Z,this is now waiting on a release of `eslint-plugin-import`.,neutral
airbnb/javascript,eslint,2016-09-24T16:13:11Z,upgrading eslint is the solution to the op as well.,neutral
airbnb/javascript,eslint,2016-09-25T03:36:51Z,steida thanks - for the prop types ones. please file bugs on eslint-plugin-react if you find you still need the overrides. for the no-class-assign one. it seems like you could do `const inneremail = class email { … }` and then `const focusedemail = focus(inneremail. 'focus');` etc?,positive
airbnb/javascript,eslint,2016-09-26T03:28:39Z,peterhb999 do you have a global eslint? i think by default atom runs the global one. not the local one? `npm uninstall -g eslint` to be sure.,neutral
airbnb/javascript,eslint,2016-09-26T03:29:10Z,you may not have updated `eslint-plugin-import` - can you use the install command in the readme of the package. so that all the proper peer deps are installed?,neutral
airbnb/javascript,eslint,2016-09-26T16:07:11Z,i'd argue that accepting duplicate import paths when one is `import type` and another is just `import` should probably be filed as a corner case with the import eslint plugin. seems like a valid use case to me.,negative
airbnb/javascript,eslint,2016-09-26T17:46:44Z,relekang lencioni lelandrichardson since `no-duplicate-imports` is an eslint core rule. they'd need to support flow in order to detect that corner case. i think it would make more sense for flow to allow you to combine `import type`s and `import`s all into one statement.,neutral
airbnb/javascript,eslint,2016-09-29T07:58:13Z,how are you running eslint? are you sure you're running a local one. not a global one?,neutral
airbnb/javascript,eslint,2016-09-30T00:38:50Z,are you sure you are not using a global install? try `npm uninstall -g eslint`,neutral
airbnb/javascript,eslint,2016-09-30T05:21:40Z,ljharb using `eslint` as a `devdependencies` within my application. configured it to run with `atom` editor and show warnings on save. i do have a `gulp` lint task. but the issue i see is thrown by the editor itself.```gulp.task('lint-jsx'. () =>  gulp.src(files.jsx.concat(ignorelist))    .pipe(eslint())    .pipe(eslint.format())    .pipe(eslint.failaftererror()));```,neutral
airbnb/javascript,eslint,2016-09-30T05:39:15Z,hozefaj the only thing i've seen with atom is either mistakenly using a global eslint. or. not restarting atom after updating node modules. beyond that. unless you can reproduce the error on the command line directly. i'd file a bug with atom.,negative
airbnb/javascript,eslint,2016-09-30T05:40:50Z,yes. i think that's a section we need to add - and since trailing function commas are now supported by eslint. we'd require those as well.in other words. a section that simultaneously discourages long function signatures/calls. but describes the proper way to indent them multiline with trailing commas. would be a welcome pr.,positive
airbnb/javascript,eslint,2016-10-02T18:05:25Z,james075 if you are still having issues please file a bug on `linter-eslint`. i'm _guessing_ that it is pulling the wrong `eslint` instance for some reason but that's a problem that should be diagnosed over there as it has nothing to do with this project :wink:.,negative
airbnb/javascript,eslint,2016-10-02T21:37:46Z,noahleigh yes. that's a good point - the dom is one of the places that makes it very hard to avoid mutation (which is part of why we use react at airbnb). for cases like these. i'd use an eslint override comment: `// eslint-disable-line no-param-reassign`,negative
airbnb/javascript,eslint,2016-10-04T05:36:09Z,caisah of which dependencies? the only thing we're out of date on (via semver ranges) is eslint-plugin-import. and #1101 is open to handle that in the next semver-major of eslint-config-airbnb-base.,neutral
airbnb/javascript,eslint,2016-10-05T15:35:58Z,yep. as of last week. they're now stage 3,neutral
airbnb/javascript,eslint,2016-10-05T15:56:53Z,ljharb sorry i searched for "eslint-plugin-import 2" in the issues,neutral
airbnb/javascript,eslint,2016-10-05T16:47:16Z,everyone still needs to use a transpiler right now to use them though. is the reason they've been added is because they're more of a certainty now and the spec is less likely to change. (sorry. not up to speed on the stage process),neutral
airbnb/javascript,eslint,2016-10-05T17:14:04Z,silverlight513 yes. the guide assumes you're using babel. and encourages it (and the linter config requires it implicitly).yes. in stage 3. features only change in response to browser feedback about implementation feasibility or web compatibility. and this one in particular is highly unlikely to change.,neutral
airbnb/javascript,eslint,2016-10-06T14:36:03Z,is there an eslint rule that could enforce this? if not should it be part of core eslint or eslint-plugin-import?,neutral
airbnb/javascript,eslint,2016-10-06T16:16:06Z,petersendidit there does not yet appear to be. i think it probably belongs as a core rule. but would be fine in eslint-plugin-import as well.,neutral
airbnb/javascript,eslint,2016-10-09T17:01:19Z,i'd recommend not installing anything globally - if you do. i think you'd need to manually cd into the global location where `eslint-config-airbnb` is installed. and manually install the peer dependencies.it's best to install everything locally. only.,neutral
airbnb/javascript,eslint,2016-10-09T17:04:25Z,is there a way to install it locally and use eslint for atom. sublime text? i'm using the airbnb standard for color linting in gui editors.,neutral
airbnb/javascript,eslint,2016-10-09T17:30:28Z,if i understand. i should install airbnb standard inside one of my projects. then i set the eslint executible path to this local install in sublime text / atom?maybe i just create a new node project which contains all of the eslint. airbnb standard related stuff and i set this eslint's path to the gui editors? kinda like a .dotfiles repo. but only for local installs for gui editor dependencies?,negative
airbnb/javascript,eslint,2016-10-10T12:41:55Z,ljharb i'm with dlwalsh and i've come here just to find an issue or create one xdi don't know what does the parens have to do with the curly brackets here. they serve different purposes and they are **independent** from each other.the only thing that depends on parens vs no-parens **is the number of arguments**. if 0 or >1. required. else nope. please. it doesn't matter if there is a return or a block. **that doesn't have anything to do with the number of arguments!**this is more like... if you want parens because of readability. because not everyone is haskell programmer (this is a bad argument). because of easy refactoring. etc... just use parens everywhere no matter what! but why create this rule so special? it makes no sense.,negative
chaijs/chai,mocha,2013-07-02T11:36:10Z,if i may pitch in on this last message. specifically the part about decorating the `chai` object:a official way to access an exported value of each plugins from within the test suites. like `chai.plugins.myplugin.<..>` would be nice for programmability.also an export of the various utils. something like `chai.util.inspect()`. this could also hold helpers like `isarray`. `objectdiff` etc so we can use them when debugging failing tests instead of carting them around ourselves (and without dual import issues when writing cross node/browser tests). and maybe it's interesting to think about the ideal way to present a custom multi-line error message. its easy to just pass it in as the regular message but this does clutter reporter 'spec' or 'list': you'd want a single-line in the spec-tree-structure and a detailed report below (like the way the string-diffs and stack trace show up). i'm not sure if this is possible with the current mocha though: i tried mashing things in the actual / expected values and disabling `showdiff` but mocha will always diff strings.,positive
liferay/clay,eslint,2018-06-25T13:34:44Z,updates .eslint to forbid for of loops | fixes #1031,neutral
liferay/clay,eslint,2018-06-29T09:01:57Z,just started reviewing :) <br><br>:octocat: *sent from [gh]().*,positive
velesin/jasmine-jquery,jasmine,2014-02-23T00:31:53Z,that isn't from jasmine-jquery,neutral
velesin/jasmine-jquery,jasmine,2014-02-23T08:34:48Z,sorry. was node-jasmine-jquery...  (installing jasmine-jquery from node turned up that one instead)that project looks abandoned. is there a better suggestion for running headless with e.g. jsdom?thanks :),negative
velesin/jasmine-jquery,jasmine,2014-03-03T21:35:57Z,release on npm. it would be nice if jasmine-jquery was available over npm. currently only some old fork is available there.,positive
velesin/jasmine-jquery,jasmine,2014-03-04T15:45:30Z,second that. i've just wasted 10 min of trying to use `getjsonfixture` with old fork from npm.,negative
videojs/video.js,standard,2017-02-01T20:23:20Z,should we expose the ability to deregister a component/tech?. ## proposalwe have a method to deregister a `plugin` called `deregisterplugin`. is there any reason not to have something similar for `component`'s and `tech`'s. i think that these methods would be:* `component.deregistercomponent`* `tech.deregistertech`### pro's* some unit tests will be easier* more standard api* there doesn't seem to be any good reason that `component`'s/`tech`'s should not be deregistered### con's * more code to support* may not be used by anyone outside of the video.js organization,negative
videojs/video.js,standard,2017-02-01T21:56:35Z,nope. it'll just override what's currently registered.,neutral
videojs/video.js,standard,2017-02-01T22:14:41Z,in `tech`'s case it will also re-add that same component to `defaulttechorder_` twice. not sure if that will cause issues or not. seems like a major edge case bug.,negative
videojs/video.js,standard,2017-02-01T23:40:37Z,the example it tests does follow accessibility guidelines - it's just that automatic testing can't distinguish when one thing is turned off by javascript. and another thing is turned on. so it thinks the two elements overlay each other. that's why it's flagged as a warning. not an error - it's recommending that this issue is checked manually. there isn't a standard way to flag to the checker that this is okay. and shouldn't cause a warning. so the easiest thing is to turn off that warning. alternatively we could turn off all warnings. and just look for errors. but this gives better coverage than that approach.,negative
sitespeedio/browsertime,selenium,2015-08-28T16:07:45Z,soulgalore thanks for looking into this. i will try your suggestion when i get a chance. i thought that using seleniumserver parameter would disable browsermobproxy. would installing browsermobproxy on the selenium hub and nodes fix this?once again awesome job guys! :)warm regardschris,positive
prettier/prettier,eslint,2017-10-22T12:57:38Z,so what if i don't want to use eslint? i think should be an option to insert that newlines,neutral
prettier/prettier,eslint,2017-10-22T15:23:37Z,i got prettier working for `<script>` tags in my `.vue` files using the following setup:packages:```eslint eslint-plugin-htmleslint-plugin-prettiereslint-config-prettier```eslint config:```json  "eslintconfig": {    "extends": [      "eslint:recommended".      "prettier"    ].    "plugins": [      "prettier".      "html"    ].    "rules": {      "prettier/prettier": [        "error".        {          "printwidth": 90.          "semi": false.          "trailingcomma": "es5".          "bracketspacing": false.          "singlequote": true        }      ].      "camelcase": [        "error".        {          "properties": "never"        }      ]    }  }```run using:```basheslint --ext .js..vue src --fix```,neutral
prettier/prettier,eslint,2017-10-23T08:17:16Z,> i'm surprised to hear you say that about those coming from the airbnb config.it's kind of all-or-nothing with compatibility. this option is not 100% compliant with airbnb style and therefore people running that eslint config will report issues.,neutral
prettier/prettier,eslint,2017-10-23T10:27:46Z,great flybayer but `eslint-plugin-html` is not compatible (anymore) with `eslint-plugin-vue`.,positive
prettier/prettier,eslint,2017-10-30T17:19:10Z,if you're trying to get this to work with the vue cli. just add this line as one of the rules in the .eslintrc.js file in the root folder...`'space-before-function-paren': 0`,neutral
prettier/prettier,eslint,2017-11-03T13:26:39Z,let me try to shred some light on this.in vscode i started to experience the following message from prettier when i saved my nodejs project:> importdeclaration should appear when the mode is es6 and in the module context.it only happend in my nodejs project. using webpack. typescript and the import syntax - not in react with the same tech. the reason for this was the following setting:   > "prettier.eslintintegration": true.if it's changed to false the message will "go away". so something with eslint is conflicting here.,negative
prettier/prettier,eslint,2017-11-07T08:36:12Z,im not using eslint anymore. so it was more of an info to anyone experiencing thise,neutral
prettier/prettier,eslint,2017-11-09T23:35:17Z,docs: eslint config is orthogonal to plugin,neutral
