prettier/prettier,eslint,2017-11-10T05:15:58Z,i just edited the text a bit because there are stylistic rules prettier doesn't care about (like `camelcase`).anyway. this is a great improvement to the docs. thank you very much!,positive
prettier/prettier,eslint,2017-11-10T17:30:28Z,for typescript. i think we can use `typescriptnext` directly. which is the daily build from ts master. but i guess we'll have to get updates from `typescript-eslint-parser` first.,neutral
ocombe/ocLazyLoad,karma,2015-04-09T23:31:07Z,yeah. the router will definitely get hit in e2e tests.it may be true that we simply shouldn't try to test the router from the jasmine / karma tests. however. i like doing as much as possible from them because they're so much faster and reliable compared to protractor / selenium tests.,positive
sroze/ngInfiniteScroll,selenium,2015-10-26T14:25:23Z,looks like the build failed due to a timeout issue with saucelabs selenium server. is this something you are interested in merging into your branch? i'm also about to check-in a bug fix against this. $interval only runs once in firefox when the delay argument is not provided.,negative
bencevans/node-sonos,standard,2015-09-11T15:21:41Z,i had this same problem. changing the broadcast address did not work. the solution: remove my 'sonos bridge' from the sonos system. and either: connect ethernet directly to a speaker. or use standard wifi setup with the sonos. i went with the latter as sonos themselves have now deprecated the bridge device. the bridge must be blocking/dropping the broadcasts from getting onto the sonos-net where the speakers are (?). i didn't check this with wireshark though. so i might be wrong.,negative
ariatemplates/hashspace,sauce,2014-06-19T09:28:27Z,chore: print out sauce connect logs only after failrue. tiny pr to only print out souce labs logs if things go bad and avoid spamming travisci output when things are in order.,negative
ariatemplates/hashspace,sauce,2014-06-19T09:47:01Z,:+1:,neutral
ariatemplates/hashspace,karma,2014-06-23T08:16:09Z,well benouat mentions the playground - whereas i am here interested in the tdd task (i know there is also a karma:tdd task. but i personally prefer the tddrt which i find more comfortable).so i will ineed move the renderer import inside the express function (will do this tonight) - thx.,negative
nightwatchjs/nightwatch,mocha,2016-02-18T20:37:17Z,allow colored/chalked output from tests. i'm in the process of porting my tests from mocha to nightwatch. and discovered that any output written to `console.*` or `process.std*` by my code (not nightwatch itself) is stripped of colors before it reaches my terminal. i tried explicitly setting `disable_colors` to false. but it had no effect.,negative
nightwatchjs/nightwatch,mocha,2016-02-21T13:00:01Z,can you provide an example?,neutral
nightwatchjs/nightwatch,mocha,2016-02-22T16:44:01Z,``` jsconst chalk = require('chalk');module.exports = {  'test1': function() {    console.log(chalk.red('hello') + chalk.blue('world'));  }};```digging through the chalk docs. i found that i could run `force_color=1 nightwatch` and get the expected output. so at least there's a workaround.,neutral
Dash-Industry-Forum/dash.js,mocha,2016-07-19T10:42:02Z,i checked the output of the build process and everything seems to work as expected which is great.unfortunately two things are still broken: - the tests still don't run under grunt.- no coverage information is collected.to get the test running again:- in gruntfile.js change `mochaoptions: ['--compilers'. 'js:babel/register'].` to `mochaoptions: ['--compilers'. 'js:babel-register'].`- create `.babelrc` in project root with following contents```{  "presets": [ "es2015" ]}```i have no idea why converage information is not collected.,negative
Dash-Industry-Forum/dash.js,mocha,2016-07-19T11:02:28Z,ah. i didn't run `grunt test` is isolation. i've updated the gruntfile to use the same configuration file as the other tests use (the `mochahook.js`). i'll look into why coverage is failing.,negative
FezVrasta/popper.js,sauce,2017-06-29T12:11:56Z,okay. saucelabs doesn't work that way :),neutral
FezVrasta/popper.js,sauce,2017-06-29T12:23:56Z,oh. okay. i never used saucelabs before. so i naively tried :)hmm. travis doesn't re-run after my change. how can i trigger it manually ?,negative
FezVrasta/popper.js,eslint,2017-06-17T20:00:35Z,hey hey hey... looks like i managed to break codeclimate and bithound in a single shot! they both don't support local lerna packages like my `eslint-config-popper` for eslint,positive
adamgruber/mochawesome,mocha,2015-07-23T05:47:51Z,reset total test counter in reporter init. when using mochawesome multiple times in one process - for example tests are executed on web server. then total tests counter is not reseted before each run. first run has correct count of tests. but second round is starting when previous ended - which means statistic is broken.i am a newbie in forks and pull requests. maybe something important is missing now..,negative
adamgruber/mochawesome,mocha,2015-07-24T13:41:09Z,can you explain your use case a little more?,neutral
adamgruber/mochawesome,mocha,2015-07-27T06:42:05Z,yes.i have written simple http server in node. this server executing mocha tests (tests are part of server code) and collecting mocha results. for test reports. there is mochawesome.but there is a problem. when mocha tests are executed in same process as server. it looks like there is only one counter init / reset - at the server start and total test counter is increasing from this point. what i need is reset this counter for each mocha run in one process. and maybe there should be someone else in future. for who it should be useful too.,positive
adamgruber/mochawesome,mocha,2015-07-31T17:14:33Z,if you are running these tests in a server process aren't the other metrics incorrect as well?,positive
adamgruber/mochawesome,mocha,2015-08-03T06:33:51Z,total tests. totally passed percentage. totally failed percentage. totally skipped tests.but with reseting counter in init. all these metrics looks good.,positive
Hacker0x01/react-datepicker,eslint,2018-05-03T02:26:06Z,fix-unsafe-lifecycles. - change componentwillreceiveprops to componentdidupdate- update .eslintrc,neutral
optimizely/nuclear-js,karma,2015-11-01T19:28:44Z,lyonlai i checked out your branch and couldn't get tests to pass using `grunt karma:chrome` and running them in debug mode.  i had initially tried an approach where the observermap was using a getter by reference as a key. however i couldn't get it it to pass tests.if you are able to get tests to pass i'm happy to include.,positive
optimizely/nuclear-js,karma,2015-11-01T19:47:11Z,jordangarcia while you are doing that i'll run karma manually to see if i can get the test running.,neutral
optimizely/nuclear-js,karma,2015-11-01T19:52:22Z,lyonlai it's working for me. not sure if it's becuase i have a globally installed module that maybe you don't have.do you have karma install globally?are you running on osx?,neutral
webpack/webpack,standard,2017-02-26T21:22:31Z,arceglos isn't `process.node_env === 'production'` the de facto standard way to go?,neutral
webpack/webpack,uglify,2018-07-09T10:05:53Z,this worked for me```js{  optimization: {    minimizer: [      new uglifyjsplugin({        uglifyoptions: {          output: {            comments: false          }        }      })    ]  }}```,neutral
webpack/webpack,uglify,2018-07-17T19:55:21Z,you could also use uglify to extract the licenses to another file.,neutral
webpack/webpack,uglify,2018-07-19T14:24:42Z,uglifyjs-webpack-plugin with terser will be release on next week/cc sokra i think we can update plugin in webpack4. because it is fork of uglify-es and contains only fixes,neutral
webpack/webpack,uglify,2018-07-20T07:33:23Z,> i think we can update plugin in webpack4. because it is fork of uglify-es and contains only fixeskzc could you confirm that uglify-es to terser is not a breaking change upgrade?,neutral
webpack/webpack,uglify,2018-07-20T12:54:31Z,> could you confirm that uglify-es to terser is not a breaking change upgrade?terser is a superset of and drop in replacement for `uglify-es`. like any open source project by unpaid volunteers there is no guarantee. as was the case with `uglify-es`. every point release can potentially introduce errors. although there's an extensive test suite with close to 2000 tests. you'd be well advised to test it with your project as you would with any library. feel free to check the terser open issues and commit log.,negative
webpack/webpack,uglify,2018-07-20T19:23:50Z,sounds good to me. in my opinion uglifyjs-webpack-plugin could upgrade...,positive
webpack/webpack,uglify,2018-07-23T10:22:23Z,hi guys. sorry for coming back to this topic. but i have tried a billion ways now to get the uglyjsplugin running. all i get i the same error over and over again. any thoughts what i might be doing wrong here?const uglifyjsplugin = require("uglifyjs-webpack-plugin");module.exports = {  mode: "production".  optimization: {    minimizer: [      new uglifyjsplugin({        sourcemap: true.        ecma: 5.        warnings: false.        ie8: false.        safari10: false.        dead_code: true.        comments: false.        uglifyoptions: {          compress: {            inline: false          }        }      })    ]  }....};,negative
webpack/webpack,uglify,2018-07-23T10:42:03Z,you need add `const uglifyjsplugin = require('uglifyjs-webpack-plugin')` in your config file,neutral
webpack/webpack,uglify,2018-07-23T11:16:00Z,d19cannon seriously? you use `const uglifyjsplugin = require('uglifyjs-webpack-plugin')` in top. but in `minimizer` option you use `uglifyjsplugin`. look on `s` in plugin  name (first example with lowercase. second in uppercase),neutral
bertho-zero/react-redux-universal-hot-example,uglify,2018-01-28T14:08:16Z,i upgraded uglifyjsplugin.,neutral
JustinTulloss/zeromq.node,mocha,2015-01-21T02:35:49Z,cool. thanks :)we'll deal with the customfds later. i guess (or mocha will?),positive
acuminous/yadda,mocha,2016-01-04T17:18:11Z,that's how mocha works unfortunately.,neutral
acuminous/yadda,karma,2016-09-01T00:21:19Z,cressie176 nothing works here. i just tested it with a simple `throw new error("xxx")`. what is interesting. that this is a node.js only issue. by using karma + browserify i got the stack.,negative
prebid/Prebid.js,standard,2018-05-28T06:59:57Z,polapi prebid.js consentmanagement module does not generate consent strings. neither implements any vendor-specific allowences. it's a proxy. which looks for standard *__cmp()* function. gets encoded data. and passes it over for adapters.what i see as a possibility for prebid.js is instead of querying *__cmp()* function. it can accept config value (let's say. `pbjs.setconfig(consentstring:'xxxxx'`) and carry it through.,negative
prebid/Prebid.js,sauce,2016-10-24T20:45:59Z,mkendall07 should be good now.  saucelabs didn't like my mocked `window.screen` so i just replaced that with a regexp check and it seems to be happy now.,positive
johntitus/node-horseman,mocha,2016-02-25T20:05:26Z,switch tests to promises. mocha has [support for promises]( i need to go through all the tests and return the horseman chain rather than using the `done` callback.,positive
johntitus/node-horseman,mocha,2016-03-04T00:06:57Z,i have done this. because i am neurotic.,negative
babel/babylon,codecov,2016-12-16T09:15:51Z,danez i squashed my pr. adding tests. apparently codecov does not update its review.the tests are in the `test/expressions` directory. i added an `esprima` test set based on the expressions test i could find in `fixtures/esprima`  (keeping the licence file i found in this dir). and an `is-babylon-expression` dir with the tests that were in this module.you will see i added a new `denylinecomment` option (defaults to false) to babylon.this was a trade-off that i measured via benchmarks to keep a feature that was in `is-babylon-expression`. raising an exception for expressions that finish with a linecomment.timothygu. note that i reversed the default behavior of `is-babylon-expression` to avoid having a different default for `parse` and `parseexpression` so `linecomment: true` is not necessary anymore. and all other cases need a `denylinecomment: true`tell me what you think and if we agree on this. i will then add documentation on the readme regarding the new option and `parseexpression` api.thanks,negative
babel/babylon,codecov,2017-01-02T09:36:32Z,could you please rebase the commit on current master? the commit it is currently based on seems to be broken. that's why codecov is not updating.,positive
sasstools/sass-lint,eslint,2016-02-11T10:41:39Z,it's because we're extending the eslint formatters to output formatted results. looks like they've got links in them which obviously wouldn't link up to our rules.definite oversight on our part!,positive
sasstools/sass-lint,eslint,2016-03-02T07:18:06Z,> a 1 usually represents true. so if you haven't read through the docs. this looks like you want a space after a bang and before a colon. or perhaps even looks like you're setting the number of spaces. what do you think of this format?:glen-84 looks like they are just copying eslint's config format.,neutral
sasstools/sass-lint,eslint,2016-03-07T09:47:16Z,it would be nice to update to use this yes. internally though eslint is just transforming them back to 0. 1. 2 so it's just an abstraction. no reason we couldn't move to this model though.,positive
ipfs/js-ipfs-api,mocha,2015-11-06T23:35:57Z,auto generate api.md using mocha. found a nice way to generate docs from tests. maybe we can combine this with #104,neutral
ipfs/js-ipfs-api,mocha,2015-11-06T23:40:20Z,cc victorbjelkholm richardlitt,neutral
ipfs/js-ipfs-api,mocha,2015-11-06T23:56:38Z,oh. that does sound awesome! so we can have really clear and focused tests (better for development) that we also can use to generate the api.md? sounds to good to be true! :),positive
ipfs/js-ipfs-api,mocha,2015-11-07T00:13:49Z,so very excellent :+1:,positive
ipfs/js-ipfs-api,mocha,2015-11-07T00:20:53Z,this looks pretty awesome! this just grabs it from the tests file?,positive
ipfs/js-ipfs-api,mocha,2015-11-18T14:40:46Z,how do i access this file: `test/tmp-disposable-nodes-addrs.json`?,neutral
ipfs/js-ipfs-api,mocha,2015-11-18T14:56:46Z,richardlitt not sure what you mean with "access",neutral
ipfs/js-ipfs-api,mocha,2015-11-21T21:26:28Z,dignifiedquire i updated with your requests. for multiple test files i parse the karma config's files for the mocha task. let me know if you want that handled differently,neutral
san650/ember-cli-page-object,coveralls,2017-10-15T22:17:08Z,seems like coveralls code coverage got completely broken,negative
react-materialize/react-materialize,eslint,2016-05-09T08:46:34Z,`eslint` is not happy :(,negative
pouchdb/pouchdb,mocha,2014-08-08T14:51:21Z,it's mocha. throws an error if you pass anything other than an `error` object to `done`.i'll give it a try. cheers.,positive
pouchdb/pouchdb,selenium,2014-06-12T20:30:13Z,test in node-webkit. because why not. although i don't think selenium will be possible.,neutral
pouchdb/pouchdb,selenium,2014-06-12T21:36:46Z,man. that's so cool.  there are leveldb files in the `indexeddb` folder. websql databases in the `databases` folder. and sqlite databases for localstorage in the `local storage` folder. never knew webkit used sqlite for localstorage.,neutral
pouchdb/pouchdb,jshint,2014-05-25T07:02:35Z,this needs to be squashed into a single commit. and i'm not sure why the gitignore and jshintrc changes. but other than that. it should be good.,neutral
pouchdb/pouchdb,jshint,2014-05-25T12:09:00Z,it's the jshintignore that was added,neutral
pouchdb/pouchdb,jshint,2014-05-26T16:16:31Z,this pr is a :+1: from me; i know we do a similar test in websql.js and idb.js. and i could have sworn we were doing it in leveldb.js.however. davedoesdev. you seem to have a whitespace error. so jshint is failing.,negative
pouchdb/pouchdb,jshint,2014-05-30T22:55:14Z,(#2326) - ignore cordova/www in jshint. otherwise the files in deps/ are throwingerrors and annoying me.,negative
pouchdb/pouchdb,jshint,2014-06-02T14:35:43Z,1586a42f845eb48bb6eb29e6d477e745e5e7afd0,neutral
pouchdb/pouchdb,sauce,2013-07-15T05:51:26Z,i could try doing a grunt --verbose to see wat is going on ... this is weird - could be saucelabs misbehaving .,neutral
vlucas/frisby,jasmine,2014-06-10T16:04:15Z,i've got the impression that when i have sequential tests in one file they are executed in expected order. how many tests do you have in each of your files?,neutral
vlucas/frisby,jasmine,2014-06-10T16:21:14Z,please don't rely on the sequential order of tests in a file. as it's not reliable. they generally do execute in order because of the way the file is read top to bottom. but the order in which the tests run is definitely not guaranteed. and can sometimes be surprising. if you need to run one test after another. use the `after` and `afterjson` callbacks to nest your tests.,neutral
vlucas/frisby,jasmine,2014-06-10T19:28:02Z,yeah. i understand the issue here - i was mainly replying to marcin-wosinek's comment about sequential tests in a single file.what you need is some sort of `before` and `after` block. as well as some sort of suite grouping concept. i don't think i will ever be able to guarantee the order in which files are run (that is the `jasmine-node` test runner). but what i _can_ build into frisby is the concept of test suite groups and before/after callbacks. would that be sufficient to solve your issue?,negative
vlucas/frisby,jasmine,2014-06-10T19:31:00Z,vlucas thanks for the tip:) i've read other issues and just got the feeling that my configuration isn't reliable.pigulla sounds like in this configuration you cannot have any tests run in parallel. maybe you can run them one-by-one from some starter script:```node-jasmine testa.spec.jsnode-jasmine testb.spec.js```,positive
vlucas/frisby,jasmine,2014-06-22T07:06:00Z,test suite definition like jasmine. hi.i'm fan of `jasmine-node` and used it frequently. i came around to `frisby` to test my newly written rest api. i'm trying to figure out any `grouping` method like `jasmine`. we used to write something like this in `jasmine`:``` javascriptdescribe("/users endpoint test suite". function() {   it("should login the user". function(done) {               ....   });});```here. we're using `describe` to group all `it`. is it possible to do something similar with `frisby`?,negative
vlucas/frisby,jasmine,2014-06-28T09:58:52Z,use local jasmine node. i would suggest moving jasmine-node global dependency for frisby itself. so that it's `npm i` and `npm test` only needed to get up and running with modifying frisby.,neutral
vlucas/frisby,jasmine,2014-06-29T20:28:02Z,good idea. :+1:,positive
vlucas/frisby,jasmine,2014-07-01T14:44:15Z,support for reporters?. does frisby support jasmine reporters?   i need to be able to output the results in a junit format.  also i do apologize if this is a naive question. i'm guessing there is a jump down to jasmine type of solution.  but i'm not sure what would be the intended way of doing that.,negative
vlucas/frisby,jasmine,2014-07-01T17:25:11Z,sorry not ont he readme page but on the web site:  jasmine-node spec/api/ --junitreport,neutral
vlucas/frisby,jasmine,2014-07-04T19:04:32Z,travis cli build failed due to an error with the latest jasmine-nodeissue: larrymyers/jasmine-reporters#63,negative
angular/protractor,jasmine,2016-09-01T01:39:55Z,json test report should include jasmine describe in test name. when using the json output file that's enabled with the resultjsonoutputfile config property. i am only getting the spec portion of the test description but i should also get the suite portion for the report to be really useful with jasmine.most runners either: nest the spec's within a suite. using the respective description strings; prepend the suite description to the spec description.,positive
angular/protractor,jasmine,2016-09-06T17:35:43Z,fix(jasmine): pass controlflow to jasminewd. fixes #3505. which is caused by jasminewd and protractor using different controlflow instances.,neutral
angular/protractor,jasmine,2016-09-06T21:50:07Z,tymurphy551.thanks for the reply. i was able to fix this issue by upgrading nodejs. protractor and jasmine.josh,neutral
angular/protractor,jasmine,2016-09-07T00:28:09Z,fix(jasmine): pass control flow to jasminewd. fixes #3505 and #2790. which is caused by jasminewd and protractor using differentcontrolflow instances,neutral
angular/protractor,jasmine,2016-09-07T00:35:02Z,lgtm once travis is happy,positive
angular/protractor,jasmine,2016-09-07T18:47:47Z,deps(outdated): update types/q and jasmine,neutral
angular/protractor,jasmine,2016-09-08T21:11:30Z,fix(types): remove relative path used for types/node and types/jasmine. closes #3533,neutral
angular/protractor,selenium,2015-08-19T06:42:08Z,sjelin is this really a documentation issue?typical scenario: i run protractor locally or from a ci provider ('host c') via saucelabs ('host b') against our staging site ('host a'). for us. this is key for testing internet explorer. if it's a documentation issue. then you're saying that the above shouldn't work and there's no solution to our issue? (other than manual testing?)else it's actually a bug either in selenium or in webdriver. but having read through a number of issues here. i'm unclear as to whether that bug has been raised in an appropriate manner (such that it's still on the radar for someone to fix :)),positive
angular/protractor,selenium,2015-08-19T13:05:31Z,the benefit (as i understand it) is not needing to spin up a selenium server to run your tests. that means anywhere from a 10 to 40 second savings for me depending on the machine. i think it shines for quick local testing. feel free to open a pr with clarification in the documentation if you want.,neutral
angular/protractor,selenium,2015-08-19T19:04:08Z,yeah. i've just confirmed that the same things happens with directconnect and standalone selenium.,neutral
angular/protractor,selenium,2015-08-28T10:43:26Z,tried to solve the problem with a firefox profile but it didn't work.  i might be misusing the feature though - i'm not sure.  nothing more i can do until the selenium people come through.,negative
angular/protractor,sauce,2014-06-21T00:29:08Z,i think qidonna's solution should fix this. closing.if there is another problem with saucelabs and proxies. please open a new issue and include the error you are getting.,positive
angular/protractor,sauce,2014-06-21T22:34:12Z,caitp thank you so much for the fast reponse. test suite pass. you've made my day! i will start implementing saucelab integration.,positive
angular/protractor,sauce,2014-06-23T22:32:00Z,tests can be broken up by files and run in parallel (both locally and on saucelabs) as such:```  multicapabilities: [{    'browsername': 'chrome'.    shardtestfiles: true.    maxinstances: 10.  }].```can we close this issue? (i don't see the need to break up by individual tests but definitely argue against this if there are reasons)well. let me know if there's something missing; otherwise i'll close this issue in a few days.,negative
angular/protractor,sauce,2014-07-09T08:02:14Z,allow for custom server addresses when running against saucelabs.. sauce connect can tunnel selenium traffic. not just browser traffic.  this is often used in restricted networking environments.this is supported by running sauce connect. then pointing your remote webdriver to the sauce connect machine rather then `ondemand.saucelabs.com`.this pr lets you specify a seleniumaddress as well as a sauceuser and saucekey. and still use sauce with job status updating et al.,negative
angular/protractor,sauce,2014-07-09T09:05:10Z,it didn't look like that build failure was due to this pr;  i'm not entirely sure. js isn't my native programming language:p,negative
ripple/ripple-lib,eslint,2015-08-12T07:12:41Z,this is going to be an eslint moan fest!,negative
agco/harvesterjs,coveralls,2015-08-12T12:05:45Z,hey! it wasn't me :)> regarding the coveralls,positive
tapjs/node-tap,coveralls,2015-10-20T18:11:40Z,any interest in adding codecov.io in addition to coveralls?. i'd be happy to do the legwork to make it happen. just wanted to make sure you were open to adding it before doing so.,neutral
tapjs/node-tap,coveralls,2015-10-20T21:22:43Z,yeah. that'd be great!,positive
balderdashy/sails,mocha,2013-11-14T13:51:09Z,sails leaking globals. running my mocha tests it detected multiple leaks: error: global leaks detected: config. hook. moment. user. project. _. async. sails. both user & project are models and should be "leaked". same goes for sails.  but the rest shouldn't be leaked right?,negative
balderdashy/sails,mocha,2013-12-05T19:48:25Z,use sails.log instead of console.log(). it would be great if we could replace this `console.log()` with a `sails.log`. in my integration tests this `console.log` call messes up the output of the mocha reporter by printing new lines to the console. if its replaces with a `sails.log` i can disable these newlines along with other log output by setting the log level to `error`. thanks.,negative
skulpt/skulpt,jshint,2015-01-05T08:11:00Z,very cool thanks! i added a few comments. there are some more coding style issues. that i think should have been caught with jshint. i'm going to check why that didn't happen :smile:,positive
restify/plugins,mocha,2017-01-19T15:51:55Z,now i see this is not bug restify-plugin or mocha. but script is failed and test not show this.,negative
