tapjs/node-tap,coveralls,2016-01-07T22:36:51Z,there's basically no downside to uploading to coveralls from ci.the hazard i could see would be if a repo isn't set up with coveralls. what will the failure look like?,negative
jquense/yup,eslint,2018-05-02T10:22:52Z,jquense your solution does not seem to work for me as there are no arguments passed to the function.,neutral
benbria/coffee-coverage,istanbul,2015-12-11T23:34:50Z,yeah. i discovered some of the same stuff shortly after submitting this! at least. that `istanbul` very-usefully already supports multiple `coverage.json` files.i'm going to make a go of it later on. and i'll get back to you as to whether i was able to do it _usefully_ without writing javascript glue.,positive
balderdashy/sails,mocha,2014-01-13T13:30:24Z,validating should return an instance of error object. returning an instance of an error object in the validation callback makes it more aligned with the whole node ecosystem.for example. when running mocha tests like this:``` javascriptmodel.validate(function(err) {  if (err) return done(err);  done();});```the simple error object will trigger an error with mocha itself: `error: done() invoked with non-error: [object object]`,neutral
balderdashy/sails,mocha,2014-01-13T22:09:36Z,just fyi. if you do something like this instead``` javascriptmodel.validate(function (err) {  should.not.exist(err);  done();});```you get a more reasonable error message. i.e.```assertionerror: expected { object (validationerror) } to not exist```,neutral
balderdashy/sails,mocha,2014-01-27T12:22:34Z,set-cookie  for session for unlogged users.. hi.i like so much sails and i decided to use it. and cooperate in its evolution. congratulations!.i am using sails.js with passport.js with passport-local strategy. and use supergagent with mocha and chai for tdd.i expect the session cookie must be setted only on ok login api call.but it is setted on ok and wrong login api call. and on other apicalls that need to satisfy isauthenticated police when i send wrong session cookies. on apicalls sent with good session cookies. the session cookie isn't setted. it's ok for me.tests:1 ) if in the api call to login i send good credentials. the session cookie is setted ok. and works for api calls that need isauthenticated police. it's good.2 ) if in the api call to login i send wrong credentials. the session cookie is setted ( i expect no set-cookie for the session in this situation. ). but this session is wrong. and don't work for api calls that need isauthenticated police. it's so so.3 ) if i send wrong session cookie in the api calls that need isautheticated police. the session cookie is setted ( i expect no set-cookie for the session in this situation. ). but don't work if i use it in other api call that needs isauthenticated police ( i must add this additional test because the unspected set-cookie for session in unathorized apicalls )4 ) if i send ok session cookie ( obtained with a ok login prior api call ). the session cookie isn' t set ( it's ok ). and it works ok in futures api calls that need isauthenticated police. it's good.,positive
ioBroker/ioBroker,mocha,2018-09-05T18:36:05Z,the failure comes from windows/nodejs 10. where the installation of `request mocha chai` for the tests complains about a missing module - i cannot reproduce this on my local machine.everything else is looking good. i'm going to change the paths for the release now. so the following build will most likely fail.,negative
KeitIG/museeks,eslint,2017-02-20T08:49:13Z,comma-dangle: ["error". "always-multiline"]. we should respect this rule with eslint.,positive
cerebral/cerebral,coveralls,2017-05-17T23:23:46Z,that is why i marked it as wip and said that it is only a first step.my concerns was not only about publishing process.you may take a note that this approach doesn't involve long cross linking process that was happen with lerna bootstrap. here we have native module resolution mechanism.script to run tests was removed only because it was used lerna to run and coveralls is not. tests itself not gone. of course tests must be restored.i will prepare a list on what must be restored and improved. and i hope you guys could help with it. really i see a big improvements we can get with this approach.,positive
purifycss/purifycss,eslint,2016-09-30T12:28:55Z,selector regex fix. this fix solves the following:1) eslint octal errors (should be in separate branch really. but i couldn't run the tests without it)2) faulty selector regex - previously limited to only lowercase letters. now includes all valid css classnamesnote: i didn't do negative testing. so these changes _might_ mean that some other errant selector passes the new regex pattern and gets included when it shouldn't. but i don't think that likely.edit: hmm. apparently it now allows certain selectors when it shouldn't. gonna fix that and reopen the pr after i make the changes.,negative
purifycss/purifycss,eslint,2016-09-30T14:39:46Z,ok. i've added a commit that fixes that problem. unfortunately. this breaks one of the existing tests. i'm afraid i don't have the time to hunt down this bug as well. i suspect that with the new regexp. the "join" glue is captured (which probably suggests that there might be more false positives).,negative
keystonejs/keystone,eslint,2015-11-11T18:03:18Z,i'm all for adding both "one var per line" and "require dangling commas" to the linting rules. they both makes is easier to add/remove/reorder rows in arrays and objects and as you say doesn't break in any environments anymore.regarding how to best transition to new conventions; why not just edit `.eslintrc` and let the new rules trigger errors all over the place? whenever you work in an old file that uses the old conventions you probably feel like cleaning it up to get rid of the linting errors. and after a while the whole code base has been transitioned. ;)i think i prefer that than to have different conventions in different files and they all pass the linting rules.,neutral
keystonejs/keystone,eslint,2015-11-16T08:21:57Z,fix eslint error for double quotes,neutral
keystonejs/keystone,eslint,2015-12-10T00:07:13Z,review eslint. - remove nonexistant gulp task from package.json- change various eslint rules- enable recommended ruleset,neutral
keystonejs/keystone,eslint,2015-12-10T02:02:53Z,i like the rules. but definitely feel that the errors need to be addressed before merging this change. don't break the ci checks. =),positive
keystonejs/keystone,sauce,2016-09-28T10:15:55Z,jedwatson tests are only failing because of saucelabs. the push one passes. so if saucelabs wasn't erroring (too many active tunnels) then we'd be passing. can you merge this please?,negative
keystonejs/keystone,sauce,2016-09-29T12:29:39Z,build errors are just saucelabs failing. so i'm going to merge it,negative
keystonejs/keystone,mocha,2014-12-27T01:44:15Z,last time i looked at the mongoose source. i believe it exported a singleton. combined with node's caching of require calls and running `mocha -r test`. i'm sure there is a recipe for disaster in there somewhere.,negative
keystonejs/keystone,mocha,2015-01-05T20:37:02Z,closed due to - not an issue,neutral
rwjblue/ember-template-lint,eslint,2018-06-14T02:00:59Z,only report errors / hide warnings. is it possible to only report errors / hide warnings for the cli? something like the "--quiet" option in eslint?i was looking to integrate this in a ci setup with the "pending" config so my team could start using it. but i found out pretty quick that if there are errors. it also shows all other warnings too! so finding the error in the thousands of warnings doesn't really work. i played around with the code a bit and was able to make such an option. so i could take a crack at making a pr if you guys are open to it?,negative
rwjblue/ember-template-lint,eslint,2018-06-15T03:13:27Z,ya. definitely happy for a pr here...,positive
rwjblue/ember-template-lint,eslint,2018-06-17T23:48:22Z,ignore warnings / only report errors with "--quiet" option. resolves #428 if you pass "--quiet" to the cli. it will now remove warnings from the console output. i also updated the console output to show the number of warnings. like how eslint does:eg: ✖ 3 problems (2 errors. 1 warnings)i understand this may not be desirable in this pr. as each pr should probably implement one feature. so feel free to tell me that. i'm also new to nodejs (but not javascript) and tests in general. so constructive feedback is welcome!,positive
rwjblue/ember-template-lint,eslint,2018-06-18T20:38:40Z,prettier!. - [ ] stand alone `.prettierrc.js`- [ ] plug into eslint,positive
rwjblue/ember-template-lint,eslint,2018-06-18T20:41:54Z,add eslint plugin esque documentation grid to readme.. * list all rules* separate stylistic from rules from safety/error related rules* show which are in the recommended config,neutral
rwjblue/ember-template-lint,eslint,2018-06-18T23:52:44Z,oh! i completely forgot about `--json`. will do!,neutral
rwjblue/ember-template-lint,eslint,2018-06-19T01:57:29Z,rwjblue i have made the requested changes. please review.,positive
rwjblue/ember-template-lint,eslint,2018-06-20T02:25:07Z,rwjblue okay. take another look when you have some time. edit: whoops. accidentally clicked "close" lol.,negative
rwjblue/ember-template-lint,eslint,2018-06-22T00:35:20Z,absolutely!,neutral
rwjblue/ember-template-lint,eslint,2018-06-22T00:48:49Z,i've updated the readme. i think in the future it would be nice to have a section for the arguments you can pass. instead of just throwing more examples to the list  hehe. also. would you like me to rebase onto master?,positive
rwjblue/ember-template-lint,eslint,2018-06-22T00:54:02Z,thank you! i’ll try to get this released in the am (feel free to ping me if i forget )...,positive
rwjblue/ember-template-lint,eslint,2018-06-22T01:16:19Z,you're welcome. and thank-you for the feedback. sir!,positive
nodegit/nodegit,jshint,2015-02-27T18:46:29Z,oh. i didn't run `jshint lib test/tests examples lifecyclescripts`,neutral
haraka/Haraka,eslint,2017-09-02T23:07:16Z,eslint no-useless-escape. a recent release of eslint added `no-useless-escape` to the recommended ruleset. i reduced the severity of it to a warning for now.todo:* [ ] go through the list of warnings and fix them.* [ ] remove the rule from .eslint.json,neutral
haraka/Haraka,eslint,2017-09-02T23:28:26Z,> wow! it wasn't as bad as i thought. the first couple commits were `eslint --fix`. which caught the majority of cases. i didn't see a single error made by `--fix`. what it did do is leave behind quite a few manual changes. but they were straight forward: either hoist the const/let or add block scope to a switch/case with `{}`.,negative
haraka/Haraka,eslint,2017-09-03T01:35:28Z,so what i would like to do. if you agree. is push a quick point release for the outbound fixes before merging this. thoughts?> on sep 2. 2017. at 7:28 pm. matt simerson <notificationsgithub.com> wrote:> > wow!> > > > it wasn't as bad as i thought. the first couple commits were eslint --fix. which caught the majority of cases. i didn't see a single error made by --fix. what it did do is leave behind quite a few manual changes. but they were straight forward: either hoist the const/let or add block scope to a switch/case with {}.> > —> you are receiving this because you are subscribed to this thread.> reply to this email directly. view it on github. or mute the thread.>,negative
haraka/Haraka,eslint,2017-09-03T22:56:31Z,> the only thing i'd be adamant on is putting the eslint-disable comments at the top of the filei strongly disagree. putting them inside the scope they effect limits them to only the section of code that needs the exception. as well as making it way more obvious **why** they are needed. (hey ya'll. this chunk of code right here is an exception to the rule). it's no matter though. because i've removed them all as they were only needed before i found and set prefer-const's ignorereadbeforeassign option.,negative
jakubpawlowicz/clean-css,jshint,2013-08-16T06:47:05Z,update .npmignore.. remove the now removed .jshintrc and add .npmignore.,neutral
jakubpawlowicz/clean-css,jshint,2013-08-16T06:53:41Z,goalsmashers: which of the two ways do you prefer?,neutral
jakubpawlowicz/clean-css,jshint,2013-08-16T21:04:20Z,whitelisting is nicer so the `package.json` way seems better. could you merge both commits?,positive
jakubpawlowicz/clean-css,jshint,2013-08-17T05:44:06Z,done.,neutral
jakubpawlowicz/clean-css,jshint,2013-08-17T08:22:35Z,cool. just to be sure. `package.json` is included by default. right?,positive
jakubpawlowicz/clean-css,jshint,2013-08-17T08:26:53Z,```c:\users\xmr\appdata\roaming\npm\node_modules\clean-css>dir /bbinhistory.mdindex.jsliblicensenode_modulespackage.jsonreadme.md```,neutral
jakubpawlowicz/clean-css,jshint,2013-08-17T08:30:12Z,fair enough.,neutral
bitpay/bitcore,mocha,2014-11-21T13:18:01Z,code: ackmocha: 3194 passingindex.html: passes: 3166,neutral
bitpay/bitcore,mocha,2014-11-25T14:08:03Z,mocha tests: 245 passingcode: ack,neutral
bitpay/bitcore,coveralls,2015-01-23T02:23:53Z,change coveralls token,neutral
bitpay/bitcore,coveralls,2015-02-06T14:23:49Z,lgtm. waiting for coveralls,neutral
admc/wd,selenium,2015-01-20T20:53:53Z,add info about selenium server to docs. re: #266,neutral
admc/wd,selenium,2015-01-21T17:46:47Z,looks like you guys need to fix the build..,positive
admc/wd,selenium,2015-01-23T10:23:48Z,is there any possibility to get text from ui like gettext() command in selenium?,neutral
admc/wd,selenium,2015-01-23T12:52:06Z,it is a selenium client.,neutral
admc/wd,selenium,2015-01-30T02:01:36Z,check the selenium log. maybe it's some backlash missing in your binary path.,neutral
admc/wd,sauce,2013-10-08T02:35:10Z,wd doesn't support the sauce 'tunnel-identifier' desiredcapability. this is useful if you are running multiple tunnels and want to specify the one you want.,positive
admc/wd,sauce,2013-10-08T09:10:36Z,what does `wd` need to do? had a quick look at the doc. looks like passing it as desired parameter in `init`. and starting `sauce connect` with a special parameter should work.,neutral
admc/wd,sauce,2013-10-10T03:37:31Z,we are using this feature with intern and it works fine.,positive
admc/wd,sauce,2013-10-10T06:49:12Z,confirmed to work here too.make sure you pass the option as part of the desiredcapabilities hash. at the same level as "browsername" etc.le 10 oct. 2013 à 05:37. colin snover notificationsgithub.com a écrit :> we are using this feature with intern and it works fine.> > —> reply to this email directly or view it on github.,positive
angular-ui/bootstrap,karma,2013-11-25T19:52:29Z,run tests on both jqlite and jquery. from what i understand ui bootstrap is supposed to work without jquery. i suggest that we run jqlite tests as well.the specs would be able to run both with and without jquery. and karma should have two configurations (jquery and jqlite).i'll need to see how difficult this is. one way is to transition slowly by only adding the specs that are compatible with the jqlite testing in the jqlite karma config file.,negative
angular-ui/bootstrap,karma,2013-11-25T19:59:03Z,chrisirhc good idea. i was already beaten once or twice by different behaviors of jquery and jqlite. the real issue. though. is that we are using jquery selectors to use dom-based testing and replacing it would be rather hard. maybe the following trick would work: we should load jquery _after_ angularjs (so it is using jqlite) and explicitly use `jquery` when needed. but it all would require a bit of gymnastic so i'm not sure it is worth it in the end. feel free to play with the code to see what you can come up with.we could easily have a separate karma config for ci. this is not an issue.,negative
angular-ui/bootstrap,karma,2013-11-25T21:30:23Z,pkozlowski-opensource just wrap them:```  function contents() {    return $(elm).find('div.tab-content div.tab-pane');  }```,neutral
angular-ui/bootstrap,karma,2013-11-28T07:32:56Z,pkozlowski-opensource i started pr #1318 refactoring specs (only typeahead for now) to be able to run tests based with jquery/jqlite. let me know your opinion,neutral
pypyjs/pypyjs,selenium,2015-12-17T06:48:15Z,oh. gotcha. i didn't know about `exec`. thanks for the help. it's working just fine now.,positive
angular/angular-cli,jasmine,2017-05-04T13:46:28Z,most of these are karma / jasmine issues rather than cli issues.at the moment the cli is committed to only supporting one test tooling chain. which is karma and jasmine. since there cannot be hidden 100% like a bundler is (because you use the test framework apis in your tests). the choice is also exposed to the users. this has nice side effects like:- you can easily add / replace karma reports in karma config- you have full control over the `test.ts` file used to run the testsalso. if you agree to give up calling `ng test` (replacing it with a `test` npm script for example. so you just run `npm test`). you can easily move away to jest if you prefer to. i have tried it myself in a medium size real project and found it pretty easy.it's worth mentioning that the built in jasmine html reporter does allow you to click on a single test or suite of tests and only have these run. and the cli itself supports a watch mode (enabled by default actually. and can be changed either per cli call. or by changing the default in karma config). it's not a jest-style watch for changed files only. but that's because it's simply not jest. it's karma + jasmine.,positive
angular/angular-cli,jasmine,2017-05-08T13:13:56Z,it is really odd issue. it seems after i disabled the karma-jasmine-html-reporter. and ran several cases. and then enabled karma-jasmine-html-reporter again. it suddenly works.,negative
angular/angular-cli,jasmine,2017-05-09T02:32:42Z,filipesilva i can reproduce this on a new machine. just follow the steps wind13 gave. although i got my macbook work. today i ran into this on a linux machine as well. and it seems it did not get around this by disabling and enabling karma-jasmine-html-reporter.,neutral
angular/angular-cli,uglify,2018-04-23T13:38:26Z,+1,neutral
kirjs/react-highcharts,mocha,2016-03-25T19:13:17Z,running without webpack. i am having a problem with importing highcharts/highstock without webpack.i am importing highstock like this```import reacthighstock from 'react-highcharts/bundle/reacthighstock.src';```and then using it like this (amongst other ways)```reacthighstock.highcharts.setoptions(theme);```this works correctly when bundled with webpack.when ran without it. via mocha. everything still works except the shown import. which does now equal some webpack object.i really need to run my tests directly without first running through webpack. how can i do that?,neutral
kirjs/react-highcharts,mocha,2016-03-28T17:27:22Z,try require maybe instead of import?,neutral
kirjs/react-highcharts,mocha,2016-03-28T19:33:20Z,oh. i forgot to mention it but i also tried require and it seems it worked exactly as 'import'. no difference whatsoever.it took me some time to figure it out. but it is definitely very weird. no other component in a big project exhibited such behavior.,negative
cssinjs/jss,codecov,2016-12-13T23:37:37Z,maybe it would be much simpler to just add coverage for jss itself here and for all other repositories separately in the corresponding repository the same way. should be easy. right?,neutral
bbc/bbc-a11y,standard,2017-11-15T15:39:01Z,i'm happy to change the wording. but there are many other instances of 'standard' in the code. so i would argue this makes the language _less_ consistent without a lot more replacement. do you think there any cases where the word 'standard' is correct. or can we replace all cases?,negative
bbc/bbc-a11y,standard,2017-11-15T15:47:43Z,hi josh.i think we need to change all occurrences of "standard" for "guideline". once the new team site goes live (soon!) then the html v2 standards will be going away and becoming a guide.long term we'll have "guides and guidelines" where the guides are all platform specific guides to how to confirm to the guidelines. hope that helps.jamie + lion,positive
bbc/bbc-a11y,standard,2017-11-15T16:21:52Z,agree that referring to the guidelines as standards needs to be changed. i'm always wary of sweeping find-all-and-replace. however. as they sometimes pick up uses of a word that are correct and should not be changed.,neutral
bbc/bbc-a11y,standard,2017-12-01T14:32:47Z,move minimum text size under content resizing for now(and update manual testing questions - e),neutral
bbc/bbc-a11y,standard,2017-12-01T14:34:42Z,review docs,neutral
bbc/bbc-a11y,standard,2017-12-01T15:04:23Z,fantastic work josh! it's really taking shape well. last few points to wrap up and this should be good to merge. make the repo public again. and get the pre-release created.,positive
onsip/SIP.js,eslint,2018-07-12T16:00:18Z,travis is reporting it can't find "eslint" on node 6. but it worked on previous passes. i recently saw this on another project and the fix was clear travis's cache.could someone clear out the travis cache for this pr please?,positive
gatsbyjs/gatsby,eslint,2016-07-26T16:38:23Z,oh so sorry about this... we'd run across this same problem elsewhere but missed fixing this one :-( thanks for the pr! i'm sure it'll save a lot of other people trouble.the pr looks great other than an eslint error. if you could fix that. i'll get this merged and cut a new release.,positive
mcollina/mosca,mocha,2014-06-27T07:18:38Z,that's harder than i thought. as i'm using random to generate a disambiguation id for the message. causing the fact that we may have messages delivered not in order.the 'stop the world' thing you are seeing is mocha trying to calculate the diff between two 16kb buffers.skip that test. i'll work on it.,neutral
pghalliday/grunt-mocha-test,mocha,2013-12-18T14:52:45Z,nested grunt configuration blocks do not work. when i configure grunt-mocha-test using``` javascriptmochatest: {  foo: {    options: [ … ].    src: [ … ]  }}```everything works fine. especially. i am able to run it by calling:```$ grunt mochatest:foo```if i now start to nest things. it doesn't work any more. e.g.. if i use``` javascriptmochatest: {  foo: {    bar: {      options: [ … ].      src: [ … ]    }  }}```and try to run it using```$ grunt mochatest:foo:bar```it does not work. it basically looks as if there were no tests defined. if you run grunt in `--verbose` mode you see that it only looks for `mochatest.foo`. and does not dive down into recursion.is this by design. or is this a bug? either way: how could i accomplish this?,negative
pghalliday/grunt-mocha-test,mocha,2013-12-18T16:40:18Z,no problem. thanks for closing ;),positive
Project-OSRM/osrm-backend,codecov,2017-02-02T08:54:48Z,seems like travis is on its feet again - is there anything to do with regards to the codecov results? (we merely reduced complexity. but it had a side effect on coverage),neutral
photonstorm/phaser,jshint,2014-11-19T23:46:39Z,scalemanager + dom - window constraint updates. scalemanager.windowcontraints now allows specifing 'visual' or 'layout' asthe constraint. using the 'layout' constraint should prevent a mobiledevice from trying to resize the game when zooming.including the the new changes the defaults have been changed to   windowcontraints = { right: 'layout'. bottom: '' }this changes the current scaling behavior as seen in "game scaling" (as itwill only scale for the right edge) but also prevents such scaling fromgoing wonkers in some mobile environtments like the newer android browser.(automatic scroll-to-top. albeit configurable. enabled for non-desktop bydefault is not a fun situation here.)to obtain the current semantics on a desktop the bottom should be changedto 'layout'; although this will result in different behavior depending onmobile device. to make the sizing also follow mobile zooming they shouldbe changed to 'visual'.also added temp rectangle re-used for various internal calculations.---phaser.dom now also special-cases desktops to align the layout boundscorrectly (this may disagree with css breakpoints but it aligns the withactual css width). without applying a window height/width expansion asrequired on mobile browsers.(and the jshint error isn't mine..),neutral
npm/npm,standard,2016-01-25T13:07:40Z,discuss npm install behaviour: do not install locally if available globally. i would like to discuss here this feature.if approved. i could try to implement it. it does not look so complex.if i do `npm install` and a package. for instance _standard_. is in my devdependencies. but it is available globally. it would be nice if npm skips the local installation (which takes time) since the _standard_ package is already available globally.this could be governed by a flag. something like `npm install --skip-packages-available-globally` which is too verbose by now. just to have an idea.,neutral
npm/npm,standard,2016-01-25T22:36:16Z,for the case of libraries -- node does not have a global search path. for the case of a command line tool like this. there may be a use case. but it seems too narrow to really save any time on the larger scale. since even some of those prefer to be installed locally per project.the use-case is even narrower when you take into account semver compatibility -- you might end up with a subset of subset of projects that are actually able to use this. and the optimization from having npm3's flattening already does a ton to easy this (along with our local caching).all-in-all. i can see the intent of this feature and really appreciate it. but it's very likely not something that would make it into the cli as far as my understanding of it goes. thanks for taking the time to write up the feature. as that is already appreciated <3,positive
