reactivestack/cookies,sauce,2017-11-15T14:08:22Z,yes. the errors say that the account has no permission to start the sauce tests (```{"message": "not authorized"}```).likely the repo owner has not renewed their plan at saucelabs and this why (all of) the saucelabs tests are failing.,negative
reactivestack/cookies,sauce,2017-11-23T02:23:42Z,open source projects are free with saucelabs so the plan should not be an issue. i'll take a look. this is anoying i agree.,negative
docpad/docpad,standard,2014-12-11T04:01:29Z,+1 for this. ready to merge. providing `--no-color` is implemented?,neutral
sequelize/sequelize,mocha,2014-03-21T00:33:42Z,i'll mess around with it a bit more to see if i can give a bit more info.. i've not done much testing yet as far as tdd/bdd goes (getting started with it using mocha/chai).,neutral
sequelize/sequelize,eslint,2017-11-25T07:12:12Z,release: missing eslint rules around spacing. <!-- thanks for wanting to fix something on sequelize - we already love you long time!please fill in the template below.if unsure about something. just do as best as you're able.if your pr only contains changes to documentation. you may skip the template below.-->### pull request check-list_please make sure to review and check all of these items:_- [ ] does `npm run test` or `npm run test-dialect` pass with this change (including linting)?- [ ] does the description below contain a link to an existing issue (closes #[issue]) or a description of the issue you are solving?- [ ] have you added new tests to prevent regressions?- [ ] is a documentation update included (if this change modifies existing apis. or introduces new ones)?- [ ] did you follow the commit message conventions explained in [contributing.md](../contributing.md)?<!-- note: these things are not required to open a pr and can be done afterwards / while the pr is open. -->### description of change<!-- please provide a description of the change here. -->,neutral
TryGhost/Ghost,mocha,2015-02-18T19:08:01Z,> in theory it would be better from ember-cli's perspective if the tests were in the "normal" locationi know we had this discussion a few months back regarding the location of ember tests. and i was in favor of the path of least resistance then (i.e.. locating them under `/client`). and i have to say that after working with ember-cli that i'm _really_ in favor of doing it now.i was able to get all the client tests running (and passing!) via `ember test` in like 20 minutes using ember-cli-mocha and ember-mocha.  i wasted that much time just trying to guess what to change in our current customized setup (and didn't get anything close to working).**edit**also. that weird problem i've been having where i can't test the rendered output of a component is gone when running the tests under ember-cli.,negative
workshopper/learnyounode,standard,2017-06-02T05:05:27Z,ok. it looks like it is now failing on the official node.js document generator api that is part of the offline document api. otherwise it seems to be working as intended. i could go through those files. and change them all to standard if needed. and it should remove any of the ci errors.actually. going to check out this eexists issue first.,positive
workshopper/learnyounode,standard,2017-06-02T05:12:31Z,ok. i see now. it is catching the fs.stat error which isn't an actual error. let me quiet that down. and see if it will ignore the standard on the official after that. fix coming up.,negative
caolan/async,mocha,2016-02-17T00:08:11Z,we test `lib/` with nodeunit and mocha using babel to compile the es modules.  we have a simple smoke-test for the compiled output (cjs. umd. and es formats).,neutral
caolan/async,mocha,2016-02-24T00:43:28Z,modularization is now on master. so no weird branch to consider now!,negative
caolan/async,mocha,2016-02-24T08:56:56Z,thanks for the heads up. i will submit a new pr soon.,positive
caolan/async,mocha,2016-02-24T12:04:09Z,cool jorgebay. by the way. it might make sense to implement this via `async.some` as you can accomplish the same result with `some`,neutral
caolan/async,mocha,2016-02-24T23:39:26Z,yeah. but heads up. we also want to change the arguments for `some` and family to take an error in the callback. #118,neutral
caolan/async,mocha,2016-02-26T11:15:30Z,async.race module. based on the discussion from #568 .contains mocha-based tests and readme update.same as #1018 but using modules.,neutral
caolan/async,mocha,2016-03-06T22:42:48Z,i'm still :100: on this. but master has changed significantly.  can you re-do the work?  it also would be nice if you added a `mocha_test` too.,positive
caolan/async,mocha,2016-03-06T22:44:38Z,sure. i'll redo this and add a mocha test as well :+1:,positive
caolan/async,mocha,2016-03-07T04:14:10Z,re-did this to support the new master and added a mocha test. i did some refactoring as well to the original code to make it clearer.,neutral
gaearon/react-hot-loader,mocha,2017-09-16T20:55:47Z,thelordhighexecutioner thanks but we will update all dependencies. not just mocha.,positive
JedWatson/react-select,eslint,2018-04-20T12:56:02Z,welp. i'm pretty sure i didn't `npm uninstall eslint`. so not sure what's up with travis :/,negative
smartsheet-platform/smartsheet-javascript-sdk,mocha,2018-06-08T19:08:23Z,cve-2017-16042 - fix growl vulnerability. updates the `mocha` and `gulp-mocha` packages.  watch the build to ensure nothing's been broken elsewhere.,negative
nightwatchjs/nightwatch,mocha,2016-04-05T09:16:01Z,question: tags & mocha runner. is it possible to use nightwatch tags with the mocha test runner? if so. how?,neutral
nightwatchjs/nightwatch,mocha,2016-04-05T10:31:16Z,not at the moment.,neutral
buildo/react-components,eslint,2016-09-10T17:15:23Z,replace ad-hoc eslint globals with jest env. as per title## test planci passes,neutral
videojs/videojs-youtube,sauce,2014-12-20T12:30:19Z,the saucelabs tests are now working fine. no need to rewrite everything.,positive
angular-fullstack/generator-angular-fullstack,karma,2015-03-05T02:13:59Z,add an injector target to inject bower components file into karma.conf. this will bring convenience instead of adding js file to karma.conf manually. but it also will bring an new issue of not ensuring all required files is added. and unnecessary css files is added in.,neutral
alexa-js/alexa-app,mocha,2016-12-16T20:47:50Z,gurpreetatwal would love to see a pr. you got my attention now.,positive
alexa-js/alexa-app,mocha,2016-12-16T23:31:08Z,i'll start working on it in about a week. are you taking over the maintenance of this repo now? i'd love to help with that if you like,positive
alexa-js/alexa-app,mocha,2016-12-17T00:08:28Z,thanks. i'm just helping out. i do have committer rights and such. i know matt-kruse is considering making an org and expanding the circle of friends. so looking forward!,positive
alexa-js/alexa-app,mocha,2017-01-02T19:40:53Z,i agree. these are mine.  out of curiosity do these reproduce for you locally?  i do not get them running mocha on my box (obviously or i wouldn't have put this up for pr to begin with).  i'm trying to decide if this is a build script issue. or my box issue and then a general code issue.,neutral
cure53/DOMPurify,karma,2016-05-03T08:20:28Z,run tests using jsdom on travis and the local-test script. also see #149 perhaps you could push this branch as a branch on cure53/dompurify to make sure that travis succeeds? this pr will of course also trigger a travis run. but without the karma tests.,positive
cure53/DOMPurify,karma,2016-05-03T09:52:54Z,awesome. checking now!,positive
cure53/DOMPurify,karma,2016-05-03T14:30:07Z,cool!,positive
zeromq/zeromq.js,mocha,2016-09-16T08:52:07Z,reduce mocha timeout. we could even go with a shorter timeout since we use `travis/appveyor_retry`.,neutral
Hacker0x01/react-datepicker,eslint,2018-06-19T13:11:20Z,is there any update on the status of this pr?,neutral
Hacker0x01/react-datepicker,eslint,2018-06-21T19:48:36Z,colinrcummings friendly poke for update on this pr,positive
Hacker0x01/react-datepicker,eslint,2018-06-21T20:42:25Z,cc aij,neutral
Hacker0x01/react-datepicker,eslint,2018-06-22T14:32:23Z,sorry. didn't catch this as it was failing some checks. merged it now!,negative
webpack/webpack,standard,2017-05-11T03:54:34Z,kevinokerlund. the problem with this plugin is that it modifies the behavior of es modules in a non standard way.also. because webpack ends up consuming commonjs modules. it cannot perform tree-shaking optimizations anymore (even though tree-shaking is only partially working so far)..,negative
webpack/webpack,uglify,2018-09-10T13:08:17Z,yep these warnings are pre-existing in `next`. they are from the uglifyjs-webpack-plugin (`--trace-deprecation` if you want details). it doesn't support webpack 5 yet. which deprecates some stuff.,neutral
webpack/webpack,uglify,2018-09-10T13:09:33Z,not sure if it makes sense to fix it in `uglifyjs-webpack-plugin` since it should be replaced anyway (which this issue is actually about).,neutral
webpack/webpack,uglify,2018-09-24T15:19:51Z,i really like google closure compiler and rollup approach that just create local variables and just rename variables as necessary to avoid collision. i know that just encapsulating every module in its own function is easier but it comes with a cost.when every export is just a variable declaration. a lot of tools like uglify will just strip unused variables. eliminating a whole bunch of unused modules.,negative
socketstream/socketstream,mocha,2015-06-01T18:24:16Z,kulicuu isn't that something mocha has documented?,neutral
metarhia/impress,eslint,2017-09-07T02:08:55Z,update eslint config. ###### first committhis commit removes rules from `.eslintrc.yml` in favor of using the`eslint-config-metarhia` package.  three rules are turned off for now.because they trigger lots of linter errors: - `arrow-parens` — forces consistent parens usage in arrow functions - `comma-dangle` — forces vcs- and diff-friendly comma usage - `handle-callback-err` — ensures the errors are handled instead of   being silently ignoredhow these exceptions are handled further is outside the scope of thiscommit/pull request.  former two of them are purely stylistic. but thelatter one points at legitimate potential bugs.`eslint` package has been updated to match what `peerdependencies` of`eslint-config-metarhia` require. and `eslint-plugin-import`. which isalso a part of the config's `peerdependencies`. has been installed.consequently. `eslint-plugin-impress` has been updated too. so that npmdoes not complain at unmet peer dependencies (technically. it isn'tstrongly connected with this patch. since eslint4 has already been usedon `master`. so it must have been complaining already. but given thatthe whole eslint infra is updated here. it kind of fits and is in spiritof the changes).###### second committake it or drop it. it doesn't really matter. similar changes in otherrepos involved migration to json for eslint configuration files. so ihave done it here too.,negative
metarhia/impress,eslint,2017-09-13T01:02:35Z,landed in 6a13521,neutral
acuminous/yadda,mocha,2016-02-19T15:17:55Z,that's a fun one. made more difficult because i took a shortcut with the jasmine plugin. it's really just the mocha plugin since their apis are so similar.a solution for now would be to set the default jasmine timeout to something much larger.going forward what to you think about specifying the timeout with an annotation at scenario level?```step-timeout=5000scenario: etc etc```this timeout would be applied to all steps. not perfect. but better than a global and without doing something crazy with the individual steps.,negative
prebid/Prebid.js,sauce,2016-12-15T13:39:29Z,kumasauce we are not using it at the moment (for completely unrelated reasons that are temporary) - but yes. we used it for months with no change in cpms. and we were happy with how much it reduced the amount of requests and bandwidth consumed.,neutral
canjs/canjs,sauce,2017-05-08T22:59:43Z,sorry morrme. the canjs builds are blocked because of the saucelabs configuration we're using for appium is no longer available. so this became higher priority. i look forward to your future contributions.,negative
tjunnone/npm-check-updates,eslint,2016-02-28T09:02:46Z,provide option to print upgradable packages as a simple list separated by spaces. especially for use with the global (`-g`) option. it would be useful if `ncu` was able to print the upgradable packages as a simple list of package names. separated by spaces. (eg. `babel-eslint eslint grunt-cli jshint jslint`) so that it could be copied and pasted (and manually edited) to be used in an `npm install -g babel-eslint grunt-cli jshint jslint` command (note that `eslint` was removed. as it must not be upgraded).,neutral
tjunnone/npm-check-updates,eslint,2016-02-28T09:14:11Z,btw. currently. i'm using the following. but it's a bit messy.`ncu -g | cut -d' ' -f2 | tr '\n' ' '`,neutral
tjunnone/npm-check-updates,eslint,2016-02-28T15:16:49Z,i just tried that. but the command `ncu -g --jsonall` doesn't output anything.,neutral
tjunnone/npm-check-updates,eslint,2016-02-28T17:25:44Z,yeah. we should fix that.,neutral
nodejs/citgm,eslint,2016-11-23T00:05:19Z,chore: do not double declare eslint. this is being included in both deps and dev-deps,negative
nodejs/citgm,eslint,2016-11-23T00:05:57Z,merging as this change is non controversial,negative
babel/babylon,eslint,2017-06-04T19:41:31Z,personally. i think more smaller projects is much better than one large. bloated. multipurpose project.separately. eslint is useful even when not using babel. and not everyone using babel uses eslint.,positive
babel/babylon,eslint,2017-06-04T20:04:52Z,thanks for your replies.as i understand. technically both `eslint` and `babel` developers can unite efforts to contributing of `acorn`. imho. if several projects use the same piece of software. they should unify it's interface and contribute to it together together.from developer point of view. work can be represented as stream from* compiling from `es6/7/etc` to `es5` according to `babel-env`* linting. static analysis (`eslint`)* minifying (`babili`)so. all tasks can be implemented as `acorn` plugins. isn't it?and. ljharb. management of big "bloated" project is not a problem with proper people.,negative
sasstools/sass-lint,eslint,2016-04-13T07:45:43Z,a question on how to disable a specific rule for a line or a block of lines. in eslint it is possible to disable a rule for a specific line in the following way:var unused; // eslint-disable-line no-unused-varsis there something similar in sass-lint ?also is there a way to disable a rule for a block of lines ?,neutral
sasstools/sass-lint,eslint,2016-04-13T08:03:05Z,not at the moment. please follow #402,neutral
rdf-ext/rdf-ext,mocha,2016-03-06T15:28:14Z,done. but i'd like to check if the test is working fine... the test package lacks of documentation. could you give me a quick hint how to execute the tests? something like `mocha rdf-test-graph/spec.js rdf-graph-array/index.js` i guess? i get a `typeerror: rdf.namednode is not a function`. so the rdf-graph-array implementation is not specified correctly...br.,negative
Automattic/mongoose,mocha,2014-05-31T09:59:45Z,the goal was to 'nodify' all the overheads of testing so you could just run `mocha` and the tests will run.,neutral
pouchdb/pouchdb,uglify,2015-01-10T15:53:14Z,(#3374) - fix some uglify warnings,neutral
pouchdb/pouchdb,uglify,2015-01-10T15:54:43Z,just some unused vars from the output of uglify. the rest are browser browserify and may take a look at fixing,neutral
pouchdb/pouchdb,uglify,2015-01-10T17:56:58Z,looks good. :+1: when green. :),positive
pouchdb/pouchdb,coveralls,2016-04-06T03:31:39Z,lol go home coveralls you so drunk,positive
pouchdb/pouchdb,selenium,2014-07-23T16:07:16Z,(#2519) - increase selenium timeout. default is 60 seconds; maybe 180 will give us more breathing room. especially with saucelabs.,neutral
pouchdb/pouchdb,selenium,2014-08-04T01:55:55Z,bower package way too huge. currently `bower install` grabs the `selenium-server-standalone` as well. which is way too huge for a normal frontend package. is it ok to get rid of it in `bower.json`?imho bower is for end users rather than developers. basically what the end users really uses are those in the `dist` directory. as for developers. they would use `npm` anyway.,negative
pouchdb/pouchdb,jshint,2014-08-12T04:13:47Z,(#2586) - add performance-bundle.js to jshintignore. forgot to do this when i moved it to the tests directory.,neutral
pouchdb/pouchdb,jshint,2014-08-12T22:51:40Z,f678c186813bac3b24df61d41b6f47ef5e7a5de0,neutral
vlucas/frisby,jasmine,2014-08-29T16:10:12Z,dsawardekar vlucas are you implementing this or is this an issue that is still unresolved?,neutral
vlucas/frisby,jasmine,2014-08-30T09:41:31Z,diablomarcus it's resolved for me at the moment. i ended up not needing single runs for the project i was working on at the time.,positive
angular/protractor,jasmine,2016-10-19T20:55:53Z,fix(config): add jasmine option to clear reporters. this adds an option in jasminenodeopts to clear all reportersbefore protractor registers it's own lifecycle reporter.this addresses an issue where the default jasminereporter conflicts with user registered reporters#3609,neutral
angular/protractor,jasmine,2016-10-19T21:00:20Z,we found a contributor license agreement for you (the sender of this pull request). but were unable to find agreements for the commit author(s).  if you authored these. maybe you used a different email address in the git commits than was used to sign the cla ([login here]( to double check)?  if these were authored by someone else. then they will need to sign a cla as well. and confirm that they're okay with these being contributed to google.<!-- need_author_cla -->,neutral
angular/protractor,jasmine,2016-10-19T21:03:06Z,commit was updated with the correct email address for cla.  commit author is the same in both cases.,neutral
angular/protractor,jasmine,2016-10-20T00:04:25Z,hi sakovias. i am having the same issue on with using --grep. did you happen to find any solution to skip beforeall for spec that does not match the grep value?,neutral
angular/protractor,jasmine,2016-10-26T13:46:26Z,awesome! thank you for looking into this. let me know if you would like me to test the fix for you.,positive
angular/protractor,jasmine,2016-10-26T17:57:38Z,dvanderb you'll need to respond with `i signed it!` for googlebot to check your cla,neutral
angular/protractor,jasmine,2016-11-10T13:07:20Z,for #3726 to fix this. we need to modify jasminewd a bit.,neutral
angular/protractor,selenium,2015-10-16T13:24:55Z,auto starting selenium server does not work with vpn. if we remove seleniumaddress in conf file. it should automatically start selenium server.however. i have been noticing that it doesn't work with vpn.  it stuck at starting server and it eventually time out.  does anyone experience the same?,neutral
angular/protractor,selenium,2015-10-16T14:26:04Z,there's nothing reproducible or actionable in your issue (i use protractor and selenium behind a vpn without problems). i think these sorts of things are best handled outside of the issues queue until we can actually isolate what the issue is.please feel free to update your issue with more details and an isolated problem. but try to keep debugging/discovery questions in more productive channels. keeping the issue queue clean makes it easier to actually solve problems once we know what they are. hopefully that makes sense. i don't mean to come off as dismissive or harsh; i'm just trying to get you help in the most productive way :),positive
angular/protractor,selenium,2015-10-19T16:25:41Z,fwiw. i am experiencing the same issue - i'd happily help try and identify the underlying problem (in the appropriate channel of course :wink: ).,positive
angular/protractor,selenium,2015-10-19T17:27:05Z,i can use protractor. with vpn too. it seems to me that it could be some wrong configuration in your vpn somewhere or in your firewall.,negative
angular/protractor,selenium,2015-10-20T07:22:17Z,as nick said. we're able to run on vpn fine. we can't reproduce this to investigate. i'm going to close this particular issue. but rbirbeck jlin412 if you have a set of steps we can use to repro on a particular vpn. please go ahead and open a new issue listing those. thanks!!,positive
angular/protractor,selenium,2015-10-22T18:55:44Z,the code is evaluated on the selenium server. not within protractor's codebase.,neutral
angular/protractor,selenium,2015-10-23T06:53:35Z,`process.stdin.on('data'. function(chunk) {` - it is nodejs code... webdriver-manager file in protractor's repository... so why it is evaluated on the selenium server?,negative
angular/protractor,selenium,2015-10-23T07:10:01Z,i mean i am wondering how and when 'data' event for `process.stdin` is generated. why does not it wait for receiving of the whole data and shuts down the selenium server by any chunk?,neutral
angular/protractor,selenium,2015-10-23T13:37:11Z,docs(readme): add instructions for starting selenium. trying to contribute something for the first time it wasn't completely obvious how to start a selenium server for running the tests.,neutral
angular/protractor,selenium,2015-10-26T21:23:52Z,merged in at f2371ef,neutral
angular/protractor,selenium,2015-10-28T18:21:46Z,can you explain how this helps. since reading the spec file should tell you the same thing.,neutral
angular/protractor,selenium,2015-10-28T18:33:14Z,this came up in a discussion with some cloud team members. the problem is that when you have a bunch of helper files and page objects. it can be a bit of a pain to find the list of commands that webdriver is seeing.this would be super easy to output if we had a webdriver proxy.,negative
angular/protractor,selenium,2015-10-29T17:20:26Z,nevermind. it was a problem with my selenium-server which was not updated.,neutral
angular/protractor,selenium,2015-11-09T15:04:39Z,its working fine when i use same xpath with my selenium script ..,positive
angular/protractor,selenium,2015-11-10T21:25:02Z,but. you still have to tell them to set the environment variable! i think the better way to solve this is:```  "config": {    "webdriver_manager_selenium_dir": "/abc/def/ghi"  }.  "scripts": {    "pretest":"webdriver-manager update --standalone --out_dir=$npm_package_config_webdriver_manager_selenium_dir"  }```,neutral
angular/protractor,sauce,2014-08-18T21:45:48Z,can i encrypt my saucekey?. i don't want to expose my `saucekey` to the world. is there any way to encrypt it?,negative
angular/protractor,sauce,2014-08-18T21:48:42Z,protractor doesn't support encryption of the key itself. you'll have to do it in some other way and then pass the string in to protractor - you can use the command line args: `--saucekey=$my_encrypted_key`,neutral
angular/protractor,sauce,2014-08-20T23:22:47Z,this isn't strictly true - you only need a tunnel identifier if you are using sauce connect. i think the method of using these is fairly well documented on sauce labs. so i'm not sure the documentation belongs here.,positive
appium/appium-uiautomator2-driver,eslint,2017-04-27T11:46:44Z,can you run the linter and fix the issues?```gulp eslint```,neutral
uber/tchannel-node,standard,2016-06-09T21:14:18Z,using host names as well as ipv4 addresses. right now tchannel accepts only ipv4 addresses to create socket. tchannel uses standard node 'net' module which accepts host names and ipv4 addresses. i believe we should allow users use any format which they want.,neutral
tapjs/node-tap,coveralls,2015-12-23T18:39:43Z,should running tests with coverage fail if coveralls command fails?. i have run into issues today where my tests pass. but coveralls is down. should this actually fail the build or is there a better way of handling an issue such as this?,negative
tapjs/node-tap,coveralls,2015-12-23T23:04:20Z,that's an interesting question.i'm not sure of the answer.  my general tendency is to favor failing if anything didn't go as expected. since otherwise you'll probably not notice. and then be surprised later.you can always re-try the build later when coveralls comes back. right?  maybe this could be a cli option or something?,negative
tapjs/node-tap,coveralls,2015-12-23T23:24:27Z,sure. retrying is no problem and i guess every developer will have his or her own preference on it? was just curious. i may take a look into adding an option in the future. but see no reason for this to stay open. thanks for your response!,positive
tapjs/node-tap,coveralls,2016-01-07T18:18:51Z,wait. so. coveralls can figure out the location without the `coveralls_repo_token`??  that's awesome. i had no idea!is it enough to check if `process.env.travis === '1'` then?  how does it figure it out?,positive
tapjs/node-tap,coveralls,2016-01-07T20:01:53Z,> i still find the coveralls_repo_token support usefulyeah. sure. it's presence should indicate you want it to upload. but it would be nice if that wasn't the only way to trigger it. use cases to cover:- the build is running on travis. but they don't want coverage uploaded (i.e. not using coveralls).- the build is not on travis. but they do want coverage uploaded. the presence of `coveralls_repo _token` is sufficient here.ideally you could reuse the same test script on travis and local dev machines. i've never had a use for uploading to travis from my local machine. so i definitely want `tap` to detect the environment. perhaps the best way to handle this would be to add a `--coveralls-if=travis` (a string flag that conditionally uploads if the specified environment variable is set). `coveralls_repo_token` continues to automatically trigger an upload.> i thought that travis always ran tests with the environment vars you set?"secure" environment variables are not available to pr's. otherwise i could just submit a pr with `console.log(process.env.xxx)` to get your token,neutral
