xtuple/xtuple-extensions,mocha,2014-08-18T13:50:58Z,fix bi mocha test timeout,neutral
moment/moment,coveralls,2016-02-12T18:37:32Z,bump.despite #2778. coveralls is still not working.,neutral
walmartlabs/eslint-config-defaults,eslint,2016-08-22T20:07:51Z,deprecation notice. this project has been replaced by `eslint-config-walmart`. maintaining copies of other people's config is neither useful or helpful at this point.ryan-roemer kenwheeler jchip,positive
walmartlabs/eslint-config-defaults,eslint,2016-08-22T20:08:41Z,.,neutral
walmartlabs/eslint-config-defaults,eslint,2016-08-22T21:49:41Z,:+1:,neutral
react-boilerplate/react-boilerplate,karma,2016-12-25T10:35:22Z,debug karma tests in webstorm. hiis anybody was successful to debug karma tests in webstorm?i successfully run karma tests in webstorm but breakpoints do not work in usual way. i mean debug which is described in docs/general/faq.md,positive
react-boilerplate/react-boilerplate,coveralls,2016-09-22T22:41:04Z,mxstbr no problem. excited for the move to jest/enzyme!,positive
OpenZeppelin/zeppelin-solidity,eslint,2018-07-26T15:40:53Z,woot. moving towards a more consistent coding style always makes me happy. thanks justuswilhelm!could you add the relevant [eslint]( rules to the `.eslintrc` file? i think some of them are missing at the moment. like the newline at eof one.,neutral
OpenZeppelin/zeppelin-solidity,eslint,2018-07-27T02:33:46Z,nventuro i've checked and made the eslint rules a tiny bit more specific :) we should be all good now.,positive
stripe/stripe-node,eslint,2018-05-31T18:32:08Z,brandur-stripe apparently i had no idea how eslint actually worked. :joy:,positive
stripe/stripe-node,eslint,2018-05-31T22:31:38Z,> brandur-stripe apparently i had no idea how eslint actually worked. haha. you and me both!ptal jlomas-stripe,positive
bbyars/mountebank,coveralls,2016-05-08T05:52:33Z,hmm. looks like coveralls isn't picking up the error handling code as being covered. probably because it is throwing an exception. not sure how to work around that.,negative
bbyars/mountebank,coveralls,2016-05-09T00:03:09Z,don't worry about coveralls. you provided plenty of test coverage - the fact that you figured out how to add the the documentation test is impressive. coveralls is just looking at unit test coverage which isn't necessarily the most important to me.,negative
vvo/selenium-standalone,selenium,2015-04-03T23:23:20Z,after installing `xvfb` and `selenium-standalone` and run the command above. i get this error:```$ xvfb-run --server-args="-screen 0. 1366x768x24" selenium-standalone startexecvp(): no such file or directoryevents.js:72        throw er; // unhandled 'error' event              ^error: spawn enoent    at errnoexception (child_process.js:980:11)    at process.childprocess._handle.onexit (child_process.js:771:34)```looks like `selenium-standalone start` is the problem. i have already done `selenium-standalone install` successfully.,negative
vvo/selenium-standalone,selenium,2015-04-06T15:30:35Z,correct. when i run `selenium-standalone start` on my ubuntu server i get this:```$ selenium-standalone startexecvp(): no such file or directoryevents.js:72        throw er; // unhandled 'error' event              ^error: spawn enoent    at errnoexception (child_process.js:980:11)    at process.childprocess._handle.onexit (child_process.js:771:34)```,negative
vvo/selenium-standalone,selenium,2015-04-07T07:45:49Z,great answer for future reference,positive
vvo/selenium-standalone,selenium,2015-04-15T12:49:12Z,i get a similare issue when calling this code:``` jsvar selenium = require('selenium-standalone');selenium.start({spawnoptions: {stdio: 'inherit'}}. function(err. child) {     // code section never called...});```callback never called...,neutral
vvo/selenium-standalone,selenium,2015-04-16T14:28:47Z,gghez can you open a separate issue? did you `selenium-standalone install` or install via programmatic api before trying to start? let me know in a separate issue,neutral
vvo/selenium-standalone,selenium,2015-04-17T12:49:09Z,programmatic .start() does not resolve. i get an issue when calling this code:``` jsvar selenium = require('selenium-standalone');selenium.start({spawnoptions: {stdio: 'inherit'}}. function(err. child) {     // code section never called...});```callback never called... i'm currently forced to use `selenium-standalone start` command which works fine (but i then need to encapsulate in a `spawn` call :()i try this code after either calling `.install()` or executing `selenium-standalone install`.,negative
vvo/selenium-standalone,selenium,2015-04-17T21:11:54Z,my reasoning is probably a unique case.  basically. my selenium hub is a separate docker container. linked to the nodes in the form of add'l docker containers.  (so the grid itself will fail if selenium hub doesn't start appropriately.)  i've reverted that last commit and kept my changes as just the check-started.js change + unit tests... with your approval we can merge.,negative
vvo/selenium-standalone,selenium,2015-04-22T13:23:41Z,here's how i did it. if anyone is interested:``` js  before(function (done) {    selenium.install({      logger: function (message) { console.log(message); }    }. function () {      selenium.start(function (err. child) {        if (err) { throw (err); }        selenium.child = child;        client = webdriverio.remote(clientoptions)          .init()          .url(':9000'. done);      });    });  });```(this is mocha + webdriverio + selenium-standalone.),negative
vvo/selenium-standalone,selenium,2015-04-24T14:44:13Z,gghez can you create a github repo where i could easily reproduce the behavior? thanks,positive
vvo/selenium-standalone,selenium,2015-04-25T13:39:29Z,> it should not complain about it since by default we pass a noop if no logger givenit's complaining if no argument is passed. but passes if i pass it an empty object.``` jsrequire('selenium-standalone').install({});```,negative
vvo/selenium-standalone,selenium,2015-04-25T16:13:46Z,add integration example gulp + webdriverio + mocha. selenium-standalone was a missing ingredient in my workflow. so i wrote a post about integrating it with webdriverio + gulp + mocha.at first i was struggling a bit because the recommended usage seemed to be installing and running it globally. and i wanted to run it programmatically to minimize any global deps. finally. i came up this and it seems to work very well.if you don't think it's useful. feel free to close :wink:,negative
vvo/selenium-standalone,selenium,2015-04-26T08:32:24Z,this is great. thanks a lot :),positive
vvo/selenium-standalone,selenium,2015-04-26T08:37:31Z,binarykitchen if you run the program that's using selenium.start() using xvfb it should work. otherwise reopen,neutral
vvo/selenium-standalone,selenium,2015-04-27T10:24:06Z,as soon as i get time to envolve myself. unfortunately not for the moment.,negative
vvo/selenium-standalone,selenium,2015-04-27T16:18:45Z,programmatically and headlessly. hey there.```xvfb-run --server-args="-screen 0. 1366x768x24" selenium-standalone start```works fantastic on my linux server. however. i'd like to now use the programattic api on my linux server. is there a way to do that?i currently have ```selenium.install({    logger: function (message) {        console.log('log:'. message);    }}. function (err) {    selenium.start(function (err. child) {        selenium.child = child;    });});```but i know i probably need to use `xvfb-run` somehow. i'm just not sure how. any ideas?,negative
vvo/selenium-standalone,selenium,2015-04-27T18:43:10Z,shtirlits. vvo did anyone ever solve this? i'm having the same issue where my local ip is not being proxied even then i passed the proxy arguments via `seleniumargs`. could the chrome driver just be ignoring the arguments and using the machine's ip?,negative
vvo/selenium-standalone,mocha,2015-04-08T20:00:16Z,seems fine. what do you mean by > would like to also wrap unit tests around the getseleniumhub function in check-started.js but need a little help getting my understanding of mocha kickstarted...? programmatic usage seems to be fine. you did not break anything. wonder how we could add a unit test for this.,positive
TypeStrong/ts-loader,mocha,2016-02-26T15:36:27Z,unfortunately i don't personally use any of those technologies (angular. karma. ~~mocha~~ (doh)). i'll leave this open in case anybody else can help and i'll try to take a deeper look at some point but i'm not sure how much help i can be.,negative
oliviertassinari/babel-plugin-transform-react-remove-prop-types,eslint,2016-11-11T21:45:25Z,shouldn't this be a eslint plugin ?. excuse me if i'm completely missing the point here. but. this seems like a bit of an after the fact solution. in one way you could almost says it promotes not cleaning up your code. if your declare a proptype and then don't use it in your compoment. essentially it's an unused param. and it should be highlighted or removed from the code trough eslint.,negative
oliviertassinari/babel-plugin-transform-react-remove-prop-types,eslint,2016-11-11T22:08:39Z,> excuse me if i'm completely missing the point herei think you do miss it  .the point is to have an eslint rule enforcing the use of `proptypes`.you want to do it as `proptypes` are defining a clear api of your isolated component.the thing is this code is only useful in development. it doesn't worth anything in production.and worth. it's costing you bandwidth. parsing and evaluation time.i'm gonna refer to the readme:> ### the problem solved> > remove unnecessary react proptypes from the production build. you can save **bandwidth** by removing them.,negative
oliviertassinari/babel-plugin-transform-react-remove-prop-types,eslint,2016-11-11T22:11:54Z,oliviertassinari but in the example in the readme you show a compoment that does not use the foo proptype ( meaning is essentially an unused prop ). my argument is that you shouldn't have written the foo proptype in the first place ( or remove it ).is this a bad example then ?``` jsxconst baz = () => (  <div />);baz.proptypes = {  foo: react.proptypes.string};```,neutral
oliviertassinari/babel-plugin-transform-react-remove-prop-types,eslint,2016-11-11T22:13:19Z,helmus oh right. it's not a great example!,positive
oliviertassinari/babel-plugin-transform-react-remove-prop-types,eslint,2016-11-11T22:15:22Z,thanks. i have updated the readme.,positive
nathanboktae/mocha-phantomjs,mocha,2016-02-17T22:59:23Z,ok so when you say "you write browser tests in mocha" you would just in your mocha tests work with the dom (window. ect). not the phantomjs page object?  yea i'm probably needing casper or zombie...,neutral
nathanboktae/mocha-phantomjs,mocha,2016-02-17T23:07:29Z,i think it would be very helpful to have more of an intro on your mocha-phantomjs page.  for someone new to this. you just dive into getting it installed and really don't explain the use case for using it or use cases.  i get that it allows you to run mocha tests in the browser. ok fine but then what's the use case around that with tests.  i think it would be helpful to show examples of mocha tests.  the tests that are core to moch-phantomjs lib doesn't work with any dom elements. etc. because it's core code. so having some additional test examples using mocha running in the .html would be nice.  just a suggestion,positive
nathanboktae/mocha-phantomjs,mocha,2016-02-25T12:17:00Z,there is another point i forgot to mention - when i run the tests in browser (using mocha.run) it works fine. the stats on top of the html update fine. the problem appears only with running tests using command line - mochaphantomjs.run()i can safely say that there is no infinite loop. because commenting out any random test seems to get it working.also. the ci system killing is not a problem because i get the same problem when running it from command line.i will be looking to possibly debug this. any pointers in that direction will be very helpful.thanks!,positive
nathanboktae/mocha-phantomjs,mocha,2016-02-29T03:19:26Z,edit package.json nocha -> mocha. fixing a minor typo in the package.json description.,neutral
nathanboktae/mocha-phantomjs,mocha,2016-03-01T07:45:53Z,yes it is.,neutral
firebase/emberfire,mocha,2015-02-27T16:18:59Z,we now use `ember-cli-mocha`,neutral
typicode/husky,standard,2017-09-05T16:29:34Z,i think pr must be closed :) just realized that `scope feature` is usable only for pre-commit case and can be implemented much more simpler way:```    // package.json    ...    "precommit": "npm run -s is_changed && lint-staged || true".    "is_changed": "[ $((git diff head --name-only; git ls-files -o --exclude-standard --modified) | grep '^src' | wc -l) -ne 0 ]".    ...```,neutral
nteract/nteract,mocha,2016-09-05T05:25:41Z,not quite. i ended up resorting to switching to electron-mocha which breaks coverage reporting.,neutral
andyearnshaw/Intl.js,sauce,2014-09-05T22:56:14Z,travis is failing due to saucelab for what i can tell. need a hand on that!,negative
andyearnshaw/Intl.js,sauce,2014-09-05T22:58:31Z,> travis is failing due to saucelab for what i can tell. need a hand on that!saucelabs + travis doesn't work on prs because of the credential issues.,negative
hoodiehq/hoodie,sauce,2014-07-02T14:43:02Z,i believe that's an internal error. will check logs at saucelabs.,negative
cucumber/cucumber-js,jasmine,2013-09-06T20:27:05Z,thank you for this pr. we definitely need to be able to attach listeners from inside support code and probably hooks as well. however. i'm not convinced we should expose the runtime instance to the end users; this is internal stuff. what about exposing another method on the support code helper (i.e. the object holding definestep(). given(). world. etc.)? ```this.registerlistener(mylistener);this.before(...```it would be more consistent with the rest of the api. imo.  wdyt?,negative
cucumber/cucumber-js,jasmine,2013-09-06T22:55:51Z,thanks for your feedback.  i understand your argument for appropriately restricting the api.  if i understand your suggestion. support code with this.registerlistener(mylistener) would have a listener registered.  as a user would i add this to a step definition?it may be a bit odd if users commingle their registerlistener functionality with step definitions.  cucumber-js may want to encourage the use of a common.js. listeners.js. or similar pattern.  and if i understand the world constructor correctly (that the last this.world assignment wins) it may be useful to put the world constructor there as well.i'd also like to add a list of event name strings to listeners.event (e.g. listeners.event.beforescenerio = 'beforescenerio') to assist in code completion and prevent typo frustration.let me know what you think.  i'm ready to move forward w/ the discussed code changes.,positive
vector-im/riot-web,standard,2017-03-21T17:22:44Z,check for updates feature for electron app. would be nice if the app automatically checked for updates and had the standard menu item option for checking for updates so users don't have to follow the project on github or twitter to know when new releases are available.,positive
vector-im/riot-web,standard,2017-03-22T14:26:24Z,i thought it diddbkr ?,neutral
vector-im/riot-web,standard,2017-03-22T18:11:03Z,triaged as a: - bug (because it's a bug if as suspected this is an established feature that's not working) - p2 (because not picking up changes is something we should definitely fix soon if it's really happening) - major (because the whole 'feature' of detecting updates is broken. even if the desktop riot is still quite usable despite the failure)from the conversation above it _sounds_ like maybe everything's fine. but waiting on dbkr to verify that this is a feature that should exist before then spending any time checking if there's been a regression.,negative
vector-im/riot-web,standard,2017-04-06T13:09:18Z,how necessary will this be once rte is standard?,neutral
appium/appium,selenium,2014-12-15T14:32:48Z,hi paymand thanks for the suggestion – just tried. i believe that the method is setvalue in java. but it's giving me an error that the method is not yet implemented...i'm casting the webelement to a mobileelement which apparently is necessary. jlipps can you assist? i'm not really a selenium expert. apologies if it's a dumb question with an obvious answer.i should mention though that i'm using a real android device. if that makes a difference...,negative
appium/appium,selenium,2014-12-17T16:13:27Z,hi jlipps . i just got the same error on our system.we are running with selenium grid.could you guide me what information do you need on triaging the problem?thanks!,neutral
appium/appium,selenium,2015-01-05T05:59:25Z,javascriptexecutor not working for android application testing (appium). hi .i'm working on testing an android app.i can't find any important parameters to find elements.it contains only class name and index .i tried xpath also but wasn't work so i'm trying it to execute it from javascriptexecutor...code is..```if (appiumdriver instanceof javascriptexecutor) {    js = (javascriptexecutor)appiumdriver;     system.out.println("instance found");}js.executescript("var list = document.getelementsbyclassname(\"android.view.view\");         list[5].click(); ");```when i run this code an error occurred said .error message: org.openqa.selenium.webdriverexception: not yet implemented. please help us:  (warning: the server did not provide any stack trace information)i google it but some blogs said i can't use js in appium(android),negative
appium/appium,selenium,2015-01-07T08:50:44Z,you can simply do this by using the following command driver.navigate().back();,neutral
appium/appium,selenium,2015-01-07T09:08:17Z,failed searching element on android by id. hii am trying to use the findelementbyid or findelementbyandroiduiautomator methods of appiumdriver while searching for an element with it's given id taken from ui automator viewer. the field id is taken from resource-id selector but it keep failingis there a way to search by this selector? is it possible to search by id as in the regular  web driver of selenium ?,neutral
appium/appium,selenium,2015-01-09T21:03:12Z,get the ipad safari browser cookies in java/js. hi.can anyone let me know how i can get the ipad safari browser cookies when running the selenium tests in ipad using appium safari launcher and ios-webkit-debug-proxy. i'm running the tests on ipad using intellij on mac.thank you.srujan.,neutral
appium/appium,mocha,2014-12-26T00:05:53Z,hi. guys!it took long time as i needed to wait for next release of opera for android.now the 'opera' device can be tested with tests for 'chrome' device with the following command:device=android browser_name=opera mocha test/functional/android/chromejlipps would you find some time to review this? :),neutral
brunch/brunch,eslint,2016-07-30T07:49:04Z,fix eslint errors (tests). our lint tests weren't passing.this lines of code had the wrong indentation.,negative
brunch/brunch,eslint,2016-07-30T16:05:04Z,shvaikalesh   i've removed the extra braces,neutral
brunch/brunch,eslint,2016-07-30T19:46:01Z,awesome! herenow. thanks for the contribution.,positive
agda/agda-stdlib,standard,2018-07-25T07:50:44Z,wasn't there something about not using the `fromnat` class in the standard library? i can't find any existing instances of `fromnat` anywhere in the current standard library. so while adding one is tempting. i think it might not be taken well?,negative
agda/agda-stdlib,standard,2018-07-25T13:11:24Z,gallais so. including something like the following. with the appropriate imports?```agdalevelnat : number levellevelnat .number.constraint _ = ⊤levelnat .number.fromnat    n = # n```andreasabel i vaguely remember you being opposed to using `agda.builtin.fromnat` in the standard library. could you let me know if and if so why this is the case?,negative
agda/agda-stdlib,standard,2018-07-25T13:36:30Z,you can import the "instance" and then assign it to a proper instance yourself. i.e.```agdaimport level.literalsinstance levelnat = level.literals.levelnat```as far as i know. this is the recommended practice. if you search the standard library. then you will not find a single instance declaration anywhere.,neutral
agda/agda-stdlib,standard,2018-07-25T19:12:25Z,> you can import the "instance" and then assign it to a proper instance yourself>....> as far as i know. this is the recommended practice. if you search the standard library. then you will not find a single instance declaration anywhere.this is indeed the current policy (see #33).  it might well be a throwback to the when the instance feature wasn't well developed. however i've encouraged it on the grounds that the standard library tries to keep proofs as explicit as possible. the overhead of `instance levelnat = level.literals.levelnat` probably isn't that great. and at least warns the reader that there is some instance magic about to happen...,positive
agda/agda-stdlib,standard,2018-07-28T12:59:10Z,after merging. i've renamed `levelnat` to `levelℕ` as i've just remembered we don't tend to use `nat` much in the standard library.,negative
agda/agda-stdlib,standard,2018-08-05T08:30:02Z,in my mind `coinduction` corresponded to `codata.thunk`. but it's true that there is also thedefinition of `rec` in there. not sure if it's worth having tbh: it's not standard to encode datatypesas a coinductive definition by enabling `--guardedness-preserving-type-constructors`.and there does not seem to be any results available. just the raw definition.,neutral
ExactTarget/fuelux,sauce,2014-04-25T18:57:55Z,travis sauce badges. making status badges work for sauce and travisci in readme.md,neutral
alphagov/govuk_elements,standard,2017-03-28T14:58:38Z,accessiblewebuk sorry - missed it. so that sounds like something we could consider recommending? 19px bold or 24px standard at minimum,negative
simov/grant,coveralls,2015-08-24T13:47:43Z,added some tests to comfort coveralls.,positive
jshint/jshint,jshint,2013-08-19T09:32:51Z,i don't know is this can ever happen. as the "bad or evil" licence is the original software licence for jslint.,negative
jshint/jshint,jshint,2013-08-19T14:57:50Z,interesting.. adding `/* jshint unused:true */` at the top of the file makes the problem go away. same if i put that setting in .jshintrc. docs say that unsued: true is default. so it feels wrong somehow.,negative
jshint/jshint,jshint,2013-08-22T09:47:18Z,i'd also like to be able to disable the check for trailing unused function arguments.,neutral
jshint/jshint,jshint,2013-08-22T20:53:26Z,this isn't possible without removing all crockford code from jshint. it can definitely happen though.,neutral
jshint/jshint,jshint,2013-08-22T21:00:43Z,i need input from someone who understands legal. (i don't),neutral
jshint/jshint,jshint,2013-08-22T21:02:04Z,i'm pretty sure goatslacker is correct. you could ask crockford to change his license :),positive
jshint/jshint,jshint,2013-08-22T21:05:00Z,goatslacker where can i find a reference to all the code written by crockford part of this repository?,neutral
jshint/jshint,jshint,2013-08-22T21:05:50Z,hellais you can run a diff against the first commit to jshint (which would have been where the fork started). to the current head,neutral
jshint/jshint,jshint,2013-08-22T21:28:58Z,antonkovalyov i think a regular diff will not work either because the code structure has drastically changed. i am looking into a possible way of determining which portions of the code are from the original author.exploring possibilities such as simian or checkstyle,neutral
jshint/jshint,jshint,2013-08-22T22:19:08Z,btw those are 195 lines of code in a project that has over 9000 lines of code.,neutral
jshint/jshint,jshint,2013-08-22T22:19:59Z,i may have no idea what's going on here. but i can't imagine that jshint rewrote 8800 lines of jslint,negative
jshint/jshint,jshint,2013-08-22T22:31:28Z,i re-ran simian with a threshold of 2 (this means blocks of fewer similar lines will also be displayed) and i got 708 duplicate lines.dcramer what would you suggest doing regarding refactoring out crockford's code from jshint or getting the license changed?,negative
jshint/jshint,jshint,2013-08-22T23:25:38Z,hellais i'd suggest talking to a lawyer as i think anything else is likely to be pointing a gun squarely at some feet.,neutral
jshint/jshint,jshint,2013-08-23T00:01:20Z,the easy answer to this is that we would need to move away from the pratt parser to esprima.,neutral
jshint/jshint,jshint,2013-08-23T10:04:25Z,douglascrockford why not put that last bit in license instead; "...this software may not be used in the investigation. torture. and murder of patriots who dare to resist tyrants." <- from a shared  form me!,negative
jshint/jshint,jshint,2013-08-23T17:38:28Z,douglascrockford have you actually ever tried suing somebody that has used your software for evil?i bet the nsa uses jshint for their javascript projects and i think they are doing quite an amount of evil. it seems like your license has not been very effective at stopping them from doing so though...,positive
jshint/jshint,jshint,2013-08-23T18:57:01Z,soxofaan what you said is correct. but i think you missed what orangedog was talking about. yes the jshint output is correct with the options and switches but the checkstyle reporter is not. in orangedog example he (and i for that matter) believe that the error in the xml output should not be there as he has not used the --show-non-errors option. it seems it should either not be present or be something other than a warning. maybe info?,neutral
jshint/jshint,jshint,2013-08-23T19:10:57Z,>  the easy answer to this is that we would need to move away from the pratt parser to esprima.at this point jshint covers more javascript (stable parts of es6. mozilla-specific extensions) and is more fail tolerant than esprima so the switch isn't going to happen in near future.> i bet the nsa uses jshint for their javascript projects:-),negative
