mochajs/mocha,mocha,2013-10-15T05:16:38Z,implementation details aside (plenty options there). i must say i'm warming to the separate method pattern: i think it has some practical benefits; like being able to assert if your promise-producing code is not accidentally returning undefined's instead of the expected promises (how would you catch this early in the 'overloaded' method?).as experiment i converted some of my code to this `it.promised()` decorator hack and it looks just as tidy as the mocha-as-promised based originals (little more explicit).another question: what would be needed of mocha would later support generator-based async? i have no idea about how it'd work. but maybe we should keep it in mind.if it requires custom code that doesn't mix with the regular code. old browsers or this promise code we can opt to also put it in its own method. like `it.awaits()` .it'll be extremely visible which case is running which async pattern (as no doubt people will mix).,negative
mochajs/mocha,mocha,2013-10-15T05:48:48Z,many applications of promise-producing test cases involve situations where you will _definitely_ get a promise and not an `undefined`. for instance. all uses of chai as promised:``` javascriptreturn thing.should.become("awesome");return list.should.eventually.contain("pie");```it's certainly true that at times you might get an `undefined` slipping under the radar. though. so you've a point there. whether or not `it.promised()` suites are as clean as overloaded-`it()` ones is pretty much entirely opinion; i think it's unnecessary overhead. personally. and currently with mocha-as-promised i use promise-returning suites almost exclusively so requiring a more complicated specification for promised test cases would be frustrating.also. "it will do the thing" is grammatical and "it promised will do the thing" is not. it feels kind of anti-bdd to mess up the sentence structure like that. especially for a modifier that certain codebases will be using _a lot_. something like `it.promises_that_it()` (or `it.promises.that.it()`) would preserve the sentence structure but also be even more annoyingly long.currently generator async schemes require a wrapper around the generator function. like `q.async()`; if that wrapper continues to be used for general generator-async use. then generators will work just fine with a promise-supporting mocha. if we (the js community) happen to shift to passing around generators directly instead of promises. there may need to be changes.,positive
mochajs/mocha,mocha,2013-10-15T13:12:06Z,i personally don't use chai as promised so much as it will replace the detailed assertionerrors that might get thrown in the various callbacks with it's own generic 'expected xyz to resolve' message. i'd rather assert more specific stuff on the actual values and get the nice diffs and all. i only use chai as promised to assert exact rejection reasons (even then usually not. because it limits flexibly in making assertions).i don't think we can proscribe specific usage patterns. assume exclusive promise-returning suites or have mocha make the assumption there will be a promise as expected: we need to be pragmatic and support any usage style.if the name of the method in bdd is a blocking issue then it becomes a simple linguistic problem. i think i"ll borrow `eventually`:```it.eventually("returns a valid document". () => {    return testapi.request(args).then((res) => {        //assert fields and/or chain    });});```and `eventually` even works well as the alternative for `test` in the tdd interface.,positive
mochajs/mocha,mocha,2013-10-15T13:29:17Z,> i personally don't use chai as promised so much as it will replace the detailed assertionerrors that might get thrown in the various callbacks with it's own generic 'expected xyz to resolve' message.> i'd rather assert more specific stuff on the actual values and get the nice diffs and all. i only use chai as promised to assert exact rejection reasons (even then usually not. because it limits flexibly in making assertions).you _can_ assert specific stuff on the actual values while using chai as promised. using `.eventually.` or more simply `.become()`. though. i recognise that `.should.resolve` assertions produce a generic and not exactly useful result. but those assertions are not really the main draw of the plugin anyway!> i don't think we can proscribe specific usage patterns. assume exclusive promise-returning suites or have mocha make the assumption there will be a promise as expected: we need to be pragmatic and support any usage style.i'm a little confused by this part. how is mocha making the assumption that there will be a promise. under the mocha-as-promised style? isn't it making _more_ of an assumption when you use something that makes it specifically expect a promise. like `it.eventually()`? and if we're going to support any usage style. why not support them implicitly if we can? we need an explicit `(done)` parameter for callback-based async. since otherwise the test case can't actually _call_ `done()`; we don't _need_ an explicit handling of promises. since mocha can quite easily detect that it got a promise as return value and handle it appropriately.if we really must use an explicit notation for promise cases. `it.eventually()` scans okay for me. certainly a much better sentence structure than `it.promised()` produces.the other problem i have with `it.eventually()` over the implicit mocha-as-promised method. though. is that a test case using promises is an implementation detail and not an external property of the test case. `it.only()` is a modifier that applies to mocha's external handling of the test case. as is `it.skip()`. `it.eventually()` instead signifies that the case internally operates differently; as such. i think that makes it worse than using a wrapper `it("does thing". promised(testcasefunc))`. since there is nothing externally fundamentally different between a case:``` javascriptit("does a thing". function(done) {  dothething().then(function() {done();}. done);});```and a case:``` javascriptit("does a thing". function() {  return dothething();});```,negative
mochajs/mocha,mocha,2013-10-15T15:49:01Z,domenic good to know! from design perspective. it's still an assertion library's job. the real problem is mocha does not publicly expose the hook?,positive
mochajs/mocha,mocha,2013-10-16T00:30:19Z,00davo well. you can argue this 'test case' vs 'function that tests case' difference if you really must. but i think it is academic and i doubt regular users will care for this distinction as long as they get proper promise support soon (which is what this whole discussion is all about).i really can't understand how `it.eventually()` could be considered so _dramatically_ ugly.it is almost identical as with mocha-as-promised you so admire. except it has just this simple injection of `.eventually` in the code (no hairy quotes. no long-range braces. no indents. no fancy syntax. just a dot and a identifier). regular `it()` is not happening and there is not a lot of alternative or boilerplate syntax that is cleaner then this approach.so let's stop arguing api uix concerns. they are not the main problem in getting promise support: it is policy and implementation technicalities that blocked the `it()` pull-request for 2 years (and gave us mocha-as-promised as desperation solution). and these are what my proposal could offer to solve in a slick and expressive way.i'll leave this as my attempt to get this rolling. awaiting alternate feedback.,negative
mochajs/mocha,mocha,2013-10-16T02:14:08Z,i'm -1 for more method names personally. that would complicate things more than the `return` duck-typing. especially since mocha usually doesn't do anything with return values from the `it` callbacks.,negative
mochajs/mocha,mocha,2013-10-17T14:23:57Z,reporter-specific options and support for the xunit reporter to output to a file. this is a less pervasive change to accomplish the same goal as #897 -- i.e. to have a way of separating the xunit reporter output from stdout so that it can be used in a ci system.in this approach i changed the mocha core to pass a set of reporter-specific options to the reporter class. as well as to call the reporter's done() method to give it a chance to clean things up.then the xunit reporter supports an output option to specify a filename. and flushes the file in done().,neutral
mochajs/mocha,mocha,2013-10-17T19:22:12Z,whoaa512 so what you want is a step further in the direction this code takes us..here is an example:you have tests:a. b. c and dtest a is a success test b fails on suitesetup (before). what i would expect is test c and d will continue to run so i can see the results of those files (each test should be isolated by suite). in reality what happens is mocha "end"(s) after b and no further tests are run. in the past there was a reporter bug that made it appear like those tests actually ran but they do not.does that clear it up?,negative
mochajs/mocha,mocha,2013-10-19T07:38:07Z,maybe something along the line:`it.if(condition. 'should do magic'. function()...)``it.skipif(condition. 'should do magic'. function()...)``skip(condition).it(..)`where `condition` is a boolean value. or a function returning true or false.,neutral
mochajs/mocha,mocha,2013-10-19T11:00:22Z,if you want environment or otherwise specific tests. you create those suits in different files / folders. so you can run them separately.,neutral
mochajs/mocha,mocha,2013-10-19T11:20:37Z,hallas i have a suite of tests that run in browsers. i'd like to skip tests when some features are missing (for example. xhr level 2. or indexeddb). my tests are grouped by the features they cover in my library. and i'd really like to have the feature detection (and therefore skipping decision) right next to the test code.,negative
mochajs/mocha,mocha,2013-10-19T11:23:47Z,alright i hear you. let's see what happens,neutral
mochajs/mocha,mocha,2013-10-19T21:53:56Z,run multiple tests in parallel. i am using mocha/supertest/chai to test an entire api framework. each time i run a full test (which includes about 40 '_mocha.js' test files)it take roughly 5 minutes to complete.  it would be far more efficient to run tests in parallel completing in roughly 30 seconds.  other testing frameworks i have used in the past are able to do this and have been great!  so question is. is it possible for mocha to also run tests in parallel?,positive
mochajs/mocha,mocha,2013-10-19T22:09:51Z,not currently possible and no plans at the moment. in lots of cases async tests end up slower. you can always make your own tests faster.,neutral
mochajs/mocha,mocha,2013-10-20T00:38:30Z,travisjeffery that is not the behavior i have locally when i revert the changeset but that is on mocha as of a month~ ago when i submitted the patch... i will rebase and see what is going wrong.,negative
mochajs/mocha,mocha,2013-10-21T04:20:35Z,adding test-integration is fine. but look at how the other test-\* (e.g. test-unit. test-compiler. test-requires) execute mocha from the makefile. where as your test-integration executes a node script and that executes mocha. so it'd be nice if test-integration was implemented as `.bin/mocha ...` rather than as it is now: `test/integration/hook_fail_before_each.js`,negative
mochajs/mocha,mocha,2013-10-21T14:57:14Z,visionmedia does this look okay to you? is there anything else i can do to help get it merged?,neutral
mochajs/mocha,mocha,2013-10-23T07:08:55Z,we also encounter these when we're using mocha for integration tests for deployed webapps.  i agree with jlipps that beforeeach() should be attempted again if your dealing with let's say a flaky api endpoint.jlipps  do you mind sharing. how are you currently getting around this mocha limitation in your apps?,neutral
mochajs/mocha,mocha,2013-10-23T16:23:46Z,although actually. you could just do:```beforeeach(function(done){  mystuffwithretrieshere(done)})```so it could be left out of mocha. or maybe we devise a little plugin thing so that this stuff can be easily altered from the outside,neutral
mochajs/mocha,mocha,2013-10-23T16:36:34Z,hmm mocha should be catching those with uncaughtexception and mapping them to the correct test case,neutral
mochajs/mocha,mocha,2013-10-26T18:21:00Z,ooohhh i lke this a lot! i'm with tj on this... i forked mocha planning on breaking it up into smaller modules but stopped because of priorities. tj have you thought about making mocha into a github organization? that might be useful to help achieve your goals (simplification / maintenance) and then a lot of the mocha related packages could be put there.,positive
mochajs/mocha,mocha,2013-10-27T04:34:44Z,visionmedia i hadn't realized that mocha could be extended in this manner. i'll try to convert this to an npm module instead.jprichardson i think rspec does this too. the core is split into different projects inside an rspec organization. etc.,neutral
mochajs/mocha,mocha,2013-10-29T03:20:22Z,how to stress test mocha unit tests?. is there a trick or a way to tell mocha to run lots of same tests in parallel for a longer time? something like a stress test?,negative
mochajs/mocha,mocha,2013-10-29T04:31:19Z,no tricks up mocha's sleeves for that.,negative
mochajs/mocha,mocha,2013-10-29T04:33:00Z,thx for that. does anybody else knows a recommended stress tool?,negative
mochajs/mocha,mocha,2013-10-31T05:20:32Z,i totally understand why this exists. and for the 90% case i agree it's the absolutely the way to go in mocha to let it `process.exit()`.  i was just wondering if there was interest in making it _optional_ to skip this feature via a command line flag similar to how `--bail` will make the suite exit after the first test.  i apologize for probably being a bit vague in my first post.you're right most node libraries don't clean up connections & timers and all that and it _is indeed_ a huge burden to have to do that in tests.  i'm probably not a normal case in that i'd really like to use mocha to test node-postgres. but one of the things i need is deterministic proof the process exited cleanly on it's own.  since i'm responsible for writing the code that does the actual cleaning up of database connections and connection pools and streams and all that crap i need to know it's working.  so the burden is on me to make sure things exit cleanly in my tests.  which means i'd really love it if i could tell mocha "nah. it's okay. i don't want you to exit for me.  if the test hangs i'll consider it an error."  mostly because node-postgres is so freakin' old i wrote it before mocha existed and it's just a `makefile` that runs individual `*-test.js` test files...every time i look at upgrading some of the tests to mocha i get stuck on the issue of mocha doing a `process.exit()` with no way to circumvent that behavior.i do see the other side that maybe some lower level libraries should use a lower level testing method...i've just become spoiled on the niceness of mocha in all my apps for testing & would love to use it _everywhere._ :smile: either way thank you & the team & contributors for a great testing lib. :+1: an example would be like...``` bash$  mocha test/ --no-exit```to tell the suite explicitly "do not call process.exit under any circumstances",negative
mochajs/mocha,mocha,2013-10-31T09:56:45Z,i hope that this pr would be merged.i can fix our a few codes to suppress stdout as you say easily.but i think that. if mocha has a "format" option. to output a valid report (regardless of the test-case) would be a responsibility.,positive
mochajs/mocha,mocha,2013-11-02T14:06:23Z,can we have it merged? i want to use a custom interface which wraps `it` blocks in fibers. `mocha --require ./fiber-ui --ui fiber-ui` doesn't work (i update `mocha.interfaces` inside `./fiber-ui.js` but it seems to get the wrong instance of `mocha` module).,negative
mochajs/mocha,mocha,2013-11-02T14:17:43Z,not sure though if it should mutate `exports.interfaces` global. maybe just setting `this._ui`?,neutral
mochajs/mocha,mocha,2013-11-02T14:44:16Z,itaylor see #1022 — it appears requires processed after setting an ui so even if i get right `mocha` instance this won't work,neutral
mochajs/mocha,mocha,2013-11-03T00:18:57Z,gonna go with #1022,neutral
mochajs/mocha,sauce,2017-01-17T15:10:44Z,actually i think it would be better to split the execution of the saucelabs test up so they are separate on travis. i'll make that change and update the pr.,neutral
mochajs/mocha,sauce,2017-01-18T08:58:58Z,come on saucelabs! i've been restarting this job at least 5 times now :(,neutral
mochajs/mocha,sauce,2017-01-24T05:41:26Z,> actually i think it would be better to split the execution of the saucelabs test up so they are separate on travis. i'll make that change and update the pr.if they are separate. how can we guarantee we don't run over the concurrency limit?,neutral
mochajs/mocha,karma,2017-01-24T20:35:57Z,using karma as a test runner and all the associated plugins to deal with webpack. for starters.,neutral
mochajs/mocha,karma,2017-01-25T12:40:48Z,getting there. i've updated karma-sauce-launcher (which has not been updated for a while). to support retries. because still sometimes browsers won't launch. karma-runner/karma-sauce-launcher#106,neutral
casperjs/casperjs,jshint,2013-09-27T22:27:36Z,fixed jshint errors and now the 190. 191. and 192 builds are now passing.,negative
casperjs/casperjs,jshint,2013-10-01T23:57:46Z,```jshint .modules/casper.js: line 1496. col 44. this function has too many statements. (21)modules/casper.js: line 1496. col 44. this function's cyclomatic complexity is too high. (9)modules/casper.js: line 1705. col 38. this function has too many statements. (17)3 errorsmake: *** [jshint] error 2```,negative
casperjs/casperjs,jshint,2013-10-02T00:17:28Z,aha - many thanks.  just installing rhino. jshint and xcode command line tools (for make) to run this myself.,positive
casperjs/casperjs,jshint,2013-10-06T08:18:48Z,looks good until minor bits are addressed and jshint not complains anymore so the build turns green :),positive
casperjs/casperjs,eslint,2015-12-01T17:54:19Z,please rebase your pr against current master. build failures seem to be spurious eslint problems and a "chainable" `fillform` is nice to have.,positive
casperjs/casperjs,eslint,2015-12-01T18:04:46Z,please rebase your pr against the current master. failing tests were due to spurious eslint issues. thanks.,positive
dfahlander/Dexie.js,karma,2016-12-21T13:57:37Z,rfc: split dexie.synable into multiple modules. i think that it would be a good idea to split dexie.syncable into multiple smaller modules. with multiple modules it will be easier to write isolated unit tests for the various functions. i believe that it will be easier to get dexie.syncable out of alpha if we have isolated unit tests for its functions. i personally also find multiple smaller modules to be more readable and easier to understand than one large module.from what i have seen. the build process can handle multiple modules so we shouldn't have an issue there.challenges:* many functions access variables which are global to the module or the parent function. this makes it harder to have those functions in their own module. we would have to pass all global variables as separate parameters or as options object* i'm currently not sure how easy it will be to actually write isolated unit tests since dexie.syncable does not seem to use karma and the dexie karma configuration only references the dexie file in the dist folder and not each individual file in the src directory. from what i can tell we would need to add a karma config which can reference the individual files,negative
dfahlander/Dexie.js,karma,2016-12-21T15:45:57Z,you're 100% right. should identify the private state vars and make them available somehow to splitted modules. either via the db.syncable property. or some other strategy. whatever seems most natural and easy to understand. could use es6 classes or even typescript if we would benefit from that.want to do the same for dexie.js as well. at least cutting out collection. table and whereclause for a start.,neutral
dfahlander/Dexie.js,karma,2016-12-21T18:47:50Z,that would be awesome. dexie.syncable / dexie.observable is a mess right now ;),positive
dfahlander/Dexie.js,karma,2016-12-28T13:41:09Z,pr was merged. closing this issue.,neutral
dfahlander/Dexie.js,karma,2016-12-28T19:48:59Z,refactor dexie.syncable tests and add new ones. move the client partials tests out of tests-syncable and intotests-syncable-partials (contains client/server partial tests for pollsynchronization).move the partialsthreshold test out of tests-syncable and intotests-syncable-partials.add delete(url) test in tests-syncable.add server partials tests in tests-syncable-partials.add tests-syncable-partials to karma config and test-syncable.html.,neutral
Jimdo/grunt-angular-toolbox,karma,2015-09-02T13:00:09Z,split into suites. in the past we learned that most projects require a bit more flexibility that what we can provide here.for example: - no e2e tests in angular- e2e tests in jquery- no test at all- only jshint / jscs- no styling the fact that we support sass **and** less is another indicator of this.i still want to keep the ootb. style but simultaneously provide more pluggabilityi think this modules would make sence:- **base**  provide project structure. demo. release and build tasks with webpack and a interface where other modules can plug in- **style-(less | sass)**  add css capabilities to demos and build tasks- **test-static**  add jshint and jscs tests - **test-unit**  add karma tests- **test-protractor**  add e2e tests for angular- **test-nightwatch**  add e2e test for others,positive
karma-runner/karma-sauce-launcher,sauce,2014-11-18T02:08:04Z,kimmobrunfeldt this doesn't actually flag the browser as having failed in `saucelabs`. did you manage to do anything further to get that to work?,neutral
karma-runner/karma-sauce-launcher,karma,2014-11-20T18:49:30Z,+1. the issue is very unfortunate because it costs money. it currently takes 15 minutes until sl shuts down the session when this happens. which means 14 paid minutes wasted.,negative
wix/detox,mocha,2017-08-17T19:18:56Z,you can skip usage in detox-cli and use mocha directly.i think node 6 is the minimum even if you babel your code. since we use `require('url').url`,neutral
ipfs/js-ipfs,mocha,2016-08-01T08:01:47Z,chore: remove unused devdependency: mocha,negative
ipfs/js-ipfs,uglify,2018-07-11T19:25:56Z,has anyone else been able to follow the notes here and get uglify to work ? adding```const uglifyjsplugin = require('uglifyjs-webpack-plugin');...    plugins: [        new uglifyjsplugin({            compress: {                unused: false            }        })    ]```to webpack.config results in```uglifyjs plugin invalid optionsoptions['compress'] is an invalid additional propertyvalidationerror: uglifyjs plugin invalid options```,neutral
ipfs/js-ipfs,uglify,2018-07-12T09:48:07Z,try:```jsconst uglifyjsplugin = require('uglifyjs-webpack-plugin');...    plugins: [        new uglifyjsplugin({            uglifyoptions: {              compress: {                  unused: false              }            }        })    ]```,neutral
ipfs/js-ipfs,uglify,2018-07-16T09:34:15Z,it would be better if ipfs just worked<sup>tm</sup> with uglify defaults.,neutral
ipfs/js-ipfs,sauce,2017-08-25T16:31:52Z,kappabooom i think you are trying multiple cases there and finding a couple of caveats.js-ipfs doesn't run the dht by default. the dht is the secret sauce that enables ipfs to find content on the network seamlessly.js-ipfs will try to find other nodes and will connect to the gateways. so any content that is on the gateway is discoverable.for example. if you boot 2 js-ipfs nodes in the browser. you will be able to exchange data between them because will discover each other and dial through webrtc. follow the dht pr for more updates :),neutral
google/closure-library,sauce,2016-05-27T16:01:36Z,ignore it. it's a sauce labs bug.,negative
chentsulin/electron-react-boilerplate,mocha,2016-08-03T04:51:51Z,could we somehow remove `co-mocha` from devdependencies? jhen0409,neutral
chentsulin/electron-react-boilerplate,mocha,2016-08-03T05:47:12Z,> could we somehow remove co-mocha from devdependencies?we can remove it. it looks unnecessary for now.,neutral
chentsulin/electron-react-boilerplate,eslint,2016-08-13T21:40:43Z,aj-ptw i merged in xwartz changes that appear to fix the issue with the package script. i'll also merged in the changes from the master. i ran into an eslint issue with the ci. but was able to solve it by updating the ignore - not sure if that is correct thing to do or not.in my opinion all modules that aren't for development should be in the "app package.json (./static/package.json) it's not currently that way. but i believe all native module will absolutely need to be in the app package.json for electron-builder to build them correctly.,neutral
pinterest/esprint,eslint,2018-03-29T23:30:47Z,add max-warnings option. the eslint cli has a `--max-warnings` option which allows a user tospecify the maximun number of warnings after which the lint shouldfail. this adds this same feature to esprint.,neutral
GoogleCloudPlatform/nodejs-docs-samples,jshint,2016-04-29T20:07:02Z,fixed jshint errors.,negative
vatesfr/xen-orchestra,standard,2016-05-27T17:24:47Z,you are not missing something simple because this issue is far from being simple. the http lib in xenserver is quite not standard for various reasons. but we'll dedicate some time to improve what we could on our side indeed.,neutral
vatesfr/xen-orchestra,standard,2016-06-01T08:52:00Z,this pr also shipped a `renderxoitem(item)` function which returns a component displaying an xo item in a standard way to use in a list or in a select.there is also `renderxoitemfromid(itemid)` which does the same thing but fetches the item from the store.,neutral
