ramda/ramda,mocha,2015-02-17T20:52:02Z,hi rrrene looks interesting! at present it is parsing things like `mocha.js` and `ie8-shim.js` which should really be excluded from the evaluation. how would we configure that if we were to add this badge?,positive
ramda/ramda,mocha,2015-03-06T01:10:24Z,note. the mocha tests pass. but it is failing on creation of `index.js` ... i still need to look into this.  if anybody could offer any pointers. it would be appreciated.,positive
ramda/ramda,sauce,2015-06-03T12:07:31Z,benjycui we have a sauce suite. we just have to get it running again. the problem was it was running _too much_ (and timing out). anyways. ramda should be es3-compatible. for better or worse.,negative
ramda/ramda,eslint,2016-09-08T21:48:37Z,good stuff. thanks. (gotta fix the eslint error as well.),positive
ramda/ramda,jshint,2015-12-22T01:24:26Z,gilligan. can we remove **.jscsrc**. **.jshintignore**. and **.jshintrc**?,neutral
ramda/ramda,jshint,2015-12-22T08:50:45Z,remove jshint/jscsrc leftovers. remove config files and jshint switches inthe sources.,neutral
ramda/ramda,jshint,2015-12-22T08:52:42Z,davidchambers #1559 i just now realised that there were also still plenty of jshint switches across various test files ;(the pr removes all of them.,neutral
node-inspector/node-inspector,mocha,2014-03-13T12:59:00Z,error debugging mocha on windows. i'm trying to debug my tests but get the following output and was wondering if someone could point me in the right direction```$ node-debug _mocha mmsprocessortests.jsnode inspector is now available from :8080/debug?port=5858debugging `_mocha`debugger listening on port 5858c:\users\jonathanchannon\appdata\roaming\npm\_mocha.cmd:1(function (exports. require. module. __filename. __dirname) { if exist "%~dp0                                                              ^syntaxerror: unexpected token illegal    at module._compile (module.js:439:25)    at object.module._extensions..js (module.js:474:10)    at module.load (module.js:356:32)    at function.module._load (module.js:312:12)    at module.runmain [as _ontimeout] (module.js:497:10)    at timer.listontimeout [as ontimeout] (timers.js:110:15)```,negative
node-inspector/node-inspector,mocha,2014-03-13T14:05:09Z,you trying to debug `_mocha.cmd`.try set a valid path to `mocha.js` file.,neutral
node-inspector/node-inspector,mocha,2014-03-13T14:11:36Z,please see [how to debug node apps with node inspector]( last part of this video contains information about debugging mocha tests.,neutral
node-inspector/node-inspector,mocha,2014-03-13T14:12:17Z,bajtos. how about add `.cmd` execution to node-debug?,neutral
node-inspector/node-inspector,mocha,2014-03-13T14:13:32Z,bajtos . l189 of node-debug.js is a typo?,neutral
cssinjs/react-jss,karma,2018-07-10T09:26:16Z,felthy let's move the repo for now. we are planning to move to jest anyway and only use karma when needed.kof i assume we are also going to merge `react-jss` into the monorepo as well?,positive
electron-userland/electron-download,standard,2016-12-12T20:28:51Z,think `env-paths` is a better fit because it's used in more modules which has multiple advantages. also a module to only return a path to the cache directory is a bit too minimal for my taste. thanks for the heads-up though! 2016-12-31 is almost there! :-),neutral
electron-userland/electron-download,standard,2016-12-24T00:14:26Z,that's my plan. unless one of the other maintainers has concerns.,neutral
Zarel/Pokemon-Showdown,mocha,2015-11-01T12:10:55Z,fix repl not being able to unlinksync files under mocha. no idea why it happened. but `unlinksync` returned without actually unlinking the file. so it sent repl into an infinite loop,neutral
elastic/kibana,selenium,2016-06-16T21:38:59Z,epixa i did an experiment by adding the `visualregression` task to `test:ui`:```grunt.registertask('test:ui'. [  'esvm:ui'.  'run:testuiserver'.  'downloadselenium'.  'run:seleniumserver'.  'clean:screenshots'.  'intern:dev'.  'test:visualregression'.  'esvm_shutdown:ui'.  'stop:seleniumserver'.  'stop:testuiserver']);```i then hard-coded a test to fail and tried running `grunt test`. the `intern:dev` completes and reports the failure. but then grunt exits without running `test:visualregression` and subsequent tasks.,negative
elastic/kibana,selenium,2016-06-17T22:35:04Z,switch from firefox to chrome. manual backport of pr 7442 switching the browser for functional tests from firefox to chrome.  the latest update to firefox 47 broke selenium and we wanted to switch to chrome anyway.,neutral
elastic/kibana,selenium,2016-06-20T18:20:08Z,here's the last 4 builds all successful;success > console output#4​27​5 jun 20. 2016 8:05 pm pr #7502: ​switch ​from ​firefox ​to ​chromesuccess > console output#4​27​4 jun 20. 2016 7:47 pm pr #7502: ​switch ​from ​firefox ​to ​chromesuccess > console output#4​27​2 jun 20. 2016 7:11 pm pr #7502: ​switch ​from ​firefox ​to ​chromesuccess > console output#4​27​1 jun 20. 2016 6:55 pm pr #7502: ​switch ​from ​firefox ​to ​chrome,positive
elastic/kibana,selenium,2016-06-20T18:21:58Z,tagging #7442,neutral
elastic/kibana,selenium,2016-06-20T18:22:54Z,lgtm,neutral
elastic/kibana,selenium,2016-07-07T05:25:50Z,last run    elastic+kibana+master+multijob-pr-selenium  build #36   ( 12 min ) passed,neutral
elastic/kibana,selenium,2016-07-07T14:55:18Z,re-summarizing the changes;1). i've added getspinnerdone in 3 places where we've had test failures like staleelementreference (means the page changed between finding an element and performing some action with it).2). some clean-up.  removed a reference to a selenium we're not using.  and removed some unnecessary promise nesting.,negative
hollandben/grunt-cache-bust,standard,2016-11-05T18:46:09Z,replace file paths in files that exist in outputdir i.e. css and js. i have a project that i am working on that i would like to use the the outputdir.  my project is a fairly standard single page application.  the css and js contain paths that need to be rewritten. but when using the outputdir. the original assets are rewritten instead of the assets that are hashed and copied to the outputdir.,neutral
hollandben/grunt-cache-bust,standard,2016-11-17T20:56:50Z,i don't think this applies to when only the ouputdir is used. i tried it today without using outputdir and had the same issue. it would update the unhashed one. but not the hashed one.,neutral
hollandben/grunt-cache-bust,standard,2016-11-17T21:06:35Z,bytesnipe did you try my pr?  did it fix your issue?,neutral
hollandben/grunt-cache-bust,standard,2016-11-17T22:13:01Z,thanks for taking a look.,positive
airbnb/javascript,eslint,2016-12-14T19:27:08Z,at some point. certainly. is there a reason that you need v3 of eslint-plugin-jsx-a11y right now?,neutral
airbnb/javascript,eslint,2016-12-15T07:02:02Z,added flowtype linting support through the use of a new package. i use flowtype on all my personal projects. it gets pretty tiring to repeat the same setup across all projects. so i thought it would be best to standardize this through a new official airbnb eslint package.i wasn't sure what to call this package. so i called it "eslint-config-airbnb-next". as it implies it's the next stage / future support (and follows the naming of esnext). furthermore. it inherits from "eslint-config-airbnb". so includes react. a11y. and import support automatically. not sure if this is wanted. but it avoids the following 4 packages: base. react. flow. react+flow. but i can switch to that too if need be.also didn't modify the readme as i'm not sure how to phrase it.,negative
airbnb/javascript,eslint,2016-12-15T07:17:40Z,thank you. but airbnb officially does not use flow at this time. so this is very premature on the public repo.,negative
airbnb/javascript,eslint,2016-12-16T15:31:55Z,lint throw an "error". hey guys. when i try to exec a simple lint i receive that message:``` configuration for rule "jsx-a11y/anchor-has-content" is invalid:value "" is the wrong type.```my `.eslintrc.yml` :```yamlextends: airbnbplugins:  - react  - jsx-a11y  - import```edit: i was look at file and saw the modifications like `['']` to `{components: ['']}` done. but the module that i installed using `yarn` hasn't this modifications :/,negative
airbnb/javascript,eslint,2016-12-16T17:00:48Z,see #1207,neutral
airbnb/javascript,eslint,2016-12-16T18:46:09Z,right - but every `if` branch is another thing it's doing - so from the outside. your function is doing one thing. but inside it. it's doing many things. and it would be good to make each of *those* be a function that does one thing.at any rate. please feel free to file an upstream issue on eslint requesting that option. and we can consider enabling it if/once it's released.,positive
airbnb/javascript,eslint,2016-12-16T19:05:19Z,all code is style. including architecture choices.nothing is restricted because every eslint rule is configurable - go nuts and use whatever you like.generators and `for..of` are not something i consider a good idea regardless. but there's no point having that discussion when it's not tenable to use them in production with a reasonable supported browser list. at that time. we can certainly discuss that more fully. and flesh out the guide's description of why to use. or not use. these features.,negative
airbnb/javascript,eslint,2016-12-21T02:03:02Z,julesmoretti jshint? this is for eslint. what other problems do you have that need a solution? `no-use-before-define`. for example. is a legit error.,negative
airbnb/javascript,eslint,2016-12-21T06:51:55Z,ljharb - how would you still write the component using `export default class hello extends react.component {` or better. in order to maintain functionalities like componentdidmount and yet have the lint pass the test?is there an equivalent to `/* eslint-disable global-require */` but for pure functions? or a way to write it better? an example would be most welcome.,neutral
airbnb/javascript,eslint,2016-12-21T07:10:04Z,perfect! i updated the .eslintrc and added the no-console: 0```{  "extends": "airbnb".  "rules": {    "react/jsx-filename-extension": ["error". { "extensions": [".js". ".jsx"] }].    "no-console": 0.  }}```thank you!,positive
airbnb/javascript,eslint,2016-12-25T03:28:11Z,fix package name in eslint-config-airbnb-base,neutral
airbnb/javascript,eslint,2016-12-27T05:48:22Z,(the question's answered. but reopening to track the eslint rule change),neutral
airbnb/javascript,eslint,2016-12-28T19:57:20Z,updates peerdependencies for eslint-config-airbnb. updates peerdependencies for eslint-config-airbnb.also since the last npm release has a severely outdated peerdependency for eslint-plugin-jsx-a11y. can we please get a new npm release with this update?thanks!,positive
airbnb/javascript,eslint,2016-12-28T21:58:13Z,v2 to v3 of eslint-plugin-jsx-a11y is not "severely" outdated; if you read the changelog you'll see the differences are minor.it is explicitly intentional to not yet have released an update of `eslint-config-airbnb` that supports v3 of `eslint-plugin-jsx-a11y`. and i will release an update when it is ready.thanks for the contribution; i'll rebase it down to one commit with the desired commit message convention. and merge it in.,negative
airbnb/javascript,eslint,2016-12-29T08:56:08Z,a better solution imo is to never globally install anything. especially a linter. which should always only be installed per-project :-),neutral
airbnb/javascript,eslint,2016-12-29T18:54:57Z,that's definitely not the proper solution - if you have only a local eslint installed. and atom is configured to use it. and you've restarted atom after any node_modules or eslint config change. it should work properly.,neutral
airbnb/javascript,eslint,2016-12-30T00:35:26Z,i agree that is an option.  it is definitely a pain in the ass when it comes to ide setup.  webstorm in particular is not smart enough to say... 'lets find the project root directory. lets find the rc file. then lets find node_modules. then lets find eslint'.you are right though. just need to manually set it up. sigh.,negative
airbnb/javascript,eslint,2016-12-30T17:56:00Z,yes. but `"props": true` is something that should be strictly enforced everywhere. *except* where a framework requires it. like express. the `eslint` rule change would be for `"props": true`. but with exceptions for `req`. etc.,negative
airbnb/javascript,eslint,2017-01-05T00:15:38Z,zachlysobey the readme is also available on npm itself -,neutral
airbnb/javascript,eslint,2017-01-06T05:01:03Z,that sounds much better - the usage i'd want to recommend then is `install-peerdeps --dev eslint-config-airbnb`.,neutral
airbnb/javascript,eslint,2017-01-08T01:13:31Z,simenb  if you omit the ```sh at the start of the block it'll disable the syntax highlighting:with ```sh```shnpm install --save-dev eslint-config-airbnb eslint^#.#.# eslint-plugin-jsx-a11y^#.#.# eslint-plugin-import^#.#.# eslint-plugin-react^#.#.#```without ```sh```npm install --save-dev eslint-config-airbnb eslint^#.#.# eslint-plugin-jsx-a11y^#.#.# eslint-plugin-import^#.#.# eslint-plugin-react^#.#.#```do you want to submit a pr for that?,neutral
airbnb/javascript,eslint,2017-01-08T11:34:51Z,i ran the install command from the airbnb readme and this problem remains in the atom eslinter.- are the packages in that command currently working?- could my problem be because of some global npm install. how is that removed?fixed my problem by removing all rules from node_modules/eslint-config-airbnb/rules/react-a11y.js (rules: {}).this is not a proper solution but it seems to fix my problem. (i'm a beginner in node usage.),negative
airbnb/javascript,eslint,2017-01-08T18:00:08Z,colsson22 you need to restart atom after any node_modules changes.,neutral
airbnb/javascript,eslint,2017-01-08T19:21:04Z,ljharb i did restart atom several times. but that seems like a probable explanation. thank you for answering me,positive
airbnb/javascript,eslint,2017-01-09T06:04:55Z,thanks for filing this - i am indeed following that eslint issue but i didn't realize we weren't using the object form of the config.what would be ideal is a pr that converts to the identical object form first. but with a todo comment marked "semver-minor" to enable the new warnings.,neutral
airbnb/javascript,eslint,2017-01-10T18:53:57Z,indeed that would fix it; but we haven't defined `no-empty-label` since before we split the rules into `eslint-config-airbnb-base`. are you sure you have the latest config installed on disk? what does `npm ls --depth=0` tell you?,neutral
airbnb/javascript,eslint,2017-01-10T21:42:17Z,wagerfield how does this work in a repo with multiple nested eslintrc files?is there any chance your tool could be used to report when a non-top-level config override isn't needed? (ie. when if removed. additional warnings wouldn't appear),neutral
airbnb/javascript,eslint,2017-01-10T22:36:35Z,oh my... please forgive my stupidity... i did not notice that somehow (bad drag and drop?) i had in one of the parent folders i had another `.eslintrc` where this rule was turned on... thank you for your help!,negative
airbnb/javascript,eslint,2017-01-10T23:25:09Z,(also node 5 is eol'd so you want to be on 4. 6. or 7. but that's also unrelated)ok. all that looks good.what happens if you specify "parser" *after* specifying "extends"?also. instead of running a command inside node_modules directly. what if you use an npm run-script to run `eslint`?,neutral
airbnb/javascript,eslint,2017-01-10T23:38:15Z,same behavior - when extending i get no `react/jsx-no-bind` errors. but when i remove the extend i get the errors. just to make sure i follow. you meant to change the order so that *extends* is first and *parser* follows in the `.eslintrc` file?,negative
paulmillr/es6-shim,mocha,2014-03-20T16:25:18Z,mocha requires `es5-sham`. so it's not really an option.,neutral
paulmillr/es6-shim,mocha,2014-03-20T21:21:12Z,great. i'd actually really love to get rid of mocha anyways in favor of tape :-),positive
jxnblk/rebass,standard,2016-11-07T18:42:44Z,what appears to be a simple solution (at least for the `classname` usecase) is to just append the classname prop that gets passed in to every component.  instead of `classname='breadcrumbs'`. maybe just ```classname={`breadcrumbs ${props.classname}`}```or just allow the classname to be overridden completely with the standard `classname` prop. radium is a little different because it uses `style` and actually modifies how the style prop works in terms of merging. etc.,neutral
angular/angular-phonecat,selenium,2016-03-07T20:42:19Z,tintin34 or now valsouche solution worked for me. tried almost every other solution but without luck.if you dont have selenium folder under protractor(like me). then create a folder with that name and paste chromedriver in there. try this solution before others. it will save your time. belive me.,positive
groupe-sii/sonar-web-frontend-reporters,eslint,2017-08-08T10:02:59Z,allow to use eslint-import. eslint-import needs to be used with all files at 1 time. but not 1 time for every file. this commit allow to use this plugin without extra errors. also this commit add eslint ignore to usage.,negative
groupe-sii/sonar-web-frontend-reporters,eslint,2017-08-08T10:37:57Z,thanks for the pr :),positive
velesin/jasmine-jquery,jasmine,2014-06-04T21:52:08Z,i doubt the lib would work as is. so there'd be some code that would need writing. i wouldn't use this. if someone wants to actually submit a pr. i'd take a look.,negative
meanjs/generator-meanjs,mocha,2016-05-15T20:24:34Z,'missingschemaerror: schema hasn't been registered for model "user".'. i installed a fresh clone of this repo. but when i try to run`grunt mochatest`mocha literally explodes.i am on mac. which informations would you like me to provide in order to assess the issue?,neutral
meanjs/generator-meanjs,mocha,2016-06-03T07:00:47Z,did you do `npm install` first?,neutral
videojs/video.js,karma,2014-05-05T18:11:38Z,currently. i haven't configured other browsers. though. you could do it manually via the karma cli rather than the grunt task.`grunt watch` wasn't updated to use karma. and yes. i do want to ditch phantom if we have a real browser available.,neutral
videojs/video.js,karma,2014-05-14T03:31:21Z,i updated to allow running the tests in more browsers via the test task. i also consolidated the `karma.conf` and the `localkarma.conf`.,neutral
videojs/video.js,karma,2014-05-14T03:51:42Z,so. for `watch`. the config has which task to run. we could set it to `karma:dev` which runs karma in firefox. chrome. and safari or just set it to chrome.however. karma has some built-in `watch` capabilities that is separate from what grunt-watch provides.probably the correct solution is investigate karma's watch and use that (in addition?) to grunt-watch. but for now we should change the task that grunt-watch runs to something like `test`.,negative
videojs/video.js,karma,2014-05-16T22:09:49Z,localsauce karma. this adds an _untested_ local ability to run tests on saucelabs.you run it in one of two ways:``` sh# assuming you already have a connection to saucelabsgrunt saucelabs# if you want grunt to run sauce_connect for you and then run the taskgrunt saucelabs:connect```,neutral
videojs/video.js,karma,2014-05-19T20:48:25Z,what does someone need to do to add their own auth credentials to make this work?,neutral
videojs/video.js,karma,2014-05-19T21:47:46Z,ah. right. you just need to set `sauce_username` and `sauce_access_key` as shell variables.,neutral
videojs/video.js,karma,2014-05-19T22:29:16Z,do you think it's worth adding something to contributing.md that tells people how to do that?,neutral
videojs/video.js,karma,2014-05-19T23:14:18Z,assuming that you've been able to run this task and it works. i've yet to test it.also. we do need to update contributing.md with how to use the `test` task.,neutral
videojs/video.js,karma,2014-05-19T23:17:18Z,haven't had a chance to try the creds yet. but yeah. after that updating the doc with the test task would be great.,positive
videojs/video.js,karma,2014-05-23T22:58:14Z,we also do have the tests running in karma and saucelabs now.one thing we should do in change the tests so that they don't use the 'mediafaker' tech but rather the actual techs when it runs in real browsers as opposed to phantomjs.,neutral
jupyterlab/jupyterlab,istanbul,2018-10-05T09:42:43Z,upgrade istanbul. this hopefully fixes the `metrics.isempty is not a function` issue we're seeing in tests.,neutral
jupyterlab/jupyterlab,istanbul,2018-10-05T11:19:14Z,thanks!,positive
babel/babel-loader,eslint,2017-06-16T15:32:18Z,add prettier eslint plugin,positive
babel/babel-loader,eslint,2017-06-20T08:38:57Z,i have the same problem.i think it do'nt use babel-loader before execute eslint.,neutral
babel/babel-loader,codecov,2017-04-21T18:49:41Z,use bash codecov,neutral
freyproject/frey,eslint,2016-10-12T19:29:29Z,add missing dependency. i needed to install `eslint-plugin-promise` by hand. i guess this shouldn't be the case.,neutral
freyproject/frey,eslint,2016-10-13T07:29:31Z,hm that's odd. i guess this is why facebook just launched yarn   i'll merge this though as it seems to solve your problem - thanks!,positive
freyproject/frey,eslint,2016-10-31T20:15:30Z,> i guess this is why facebook just launched yarn > indeed...,neutral
EvanHahn/HumanizeDuration.js,jshint,2015-03-25T19:15:48Z,looks good.could you remove `dojo: true` to `.jshintrc` and move `define` to `predef`?,neutral
prettier/prettier,codecov,2018-03-27T06:46:45Z,should i worry about the codecov/project check?,neutral
prettier/prettier,eslint,2018-01-12T11:21:50Z,doesn't prettier already break things like `// eslint-disable-line` when it adds line breaks?,positive
prettier/prettier,eslint,2018-01-13T03:00:18Z,no. because it requires `eslint-plugin-react`. which isn’t installed by default.,negative
prettier/prettier,eslint,2018-01-16T00:08:48Z,not sure if it has been said before. but just use prettier-eslint. prettier will run first. and eslint second (with —fix). don’t forget the prettier config for eslint to disable rules in conflict with prettier though. and manually activate what you want to enforce!,positive
prettier/prettier,eslint,2018-01-16T17:12:23Z,zephir77167 . thanks for the tip! but it is so simpler to just use eslint. which i see no sense in using prettier-eslint.,positive
prettier/prettier,eslint,2018-01-16T17:17:58Z,paulocoghi because eslint and prettier are tools with different purposes :) eslint won't format your code like prettier. prettier can't be configured as much like eslint. some people have found a sweet stop with `prettier-eslint`. which lets prettier do the heavy formatting and then just fix the nits you want with `eslint --fix`.,positive
prettier/prettier,eslint,2018-01-17T16:06:50Z,i am using `create-react-app-typescript` and i was getting the same error in vscode. i had `prettier.eslintintegration` enabled globally and after turning it off. it's indeed working. however. there is no eslint installed within that boilerplate so it's rather shocking how it can be relevant :),negative
prettier/prettier,eslint,2018-01-20T03:00:27Z,`/* eslint yoda: "error" */`,negative
prettier/prettier,eslint,2018-01-22T13:18:52Z,azz this kind of things is actually the purpose of formatters. so if they don't format things the way i want. i can't use them.  i'll take a look at `prettier-eslint`. but we are using `tslint` as we are working with typescript. so i am not sure. how well it works.,negative
prettier/prettier,eslint,2018-01-23T20:46:19Z,lydell done. maybe new eslint rule will allow to catch this stuff,neutral
prettier/prettier,eslint,2018-01-31T23:33:25Z,yeah i thought the community was moving toward project configurations inside `package.json` because the dot files at the project directory were getting out of hand.  i don't remember reading any functional constraints. more a community wide preference.  but i've seen it plenty other places than just eslint take adoption.,negative
prettier/prettier,eslint,2018-02-01T12:07:38Z,coolemur this would not end all your "wars" in those discussions. it is start wars. add one prefer option. other people will start own prefer options. you can don't change default lint options. just use `prettier-eslint` and all.,negative
prettier/prettier,eslint,2018-02-06T21:20:56Z,is there any way to desactivate this behaviour ?i'm struggling in making prettier fix styling issue before eslint in vscode ...,positive
prettier/prettier,eslint,2018-02-07T09:43:16Z,lydell i use eslint-config-prettier already...could not be possible to add an option in the .prettierrc so this specific behavior is ignored ?my codebase massively relies on conditionnal rendering and my code is so ugly now... everything else is perfectly formatted :/,negative
prettier/prettier,eslint,2018-02-07T20:20:39Z,i don't think there's an eslint rule that will undo the formatting in the way you want.,neutral
prettier/prettier,eslint,2018-02-08T16:36:27Z,you could also create your own eslint plugin with a copy of the sort-keys rule that has a fix function and use that rule instead of the builtin one.,neutral
TryGhost/Ghost,mocha,2015-04-08T19:05:24Z,normalize settings payloads in client serializer. closes #5117... gave up on writing tests for this so i could unblock acburdine. once i understand how ember-mocha works i'll do another pr with tests,neutral
